rank,sn,cihui,pinyin,ref_hanzi,ref_pinyin,pos,definition,example
53421,1,液氮,yèdàn,,,名,液体状态的氮。可用作冷冻剂,
53422,1,贬谪,biǎnzhé,,,动,古代指官员被降职到边远地区任职,
53423,1,训诲,xùnhuì,,,动,教导（多用于上级对下级、长辈对晚辈）,承蒙多次训诲，得益不浅。
53424,1,肺脏,fèizàng,,,名,肺,
53425,1,纸版,zhǐbǎn,,,名,纸型,
53427,1,泼皮,pōpí,,,名,流氓；无赖,
53430,1,躬耕,gōnggēng,,,动,亲自种田,躬耕乐道
53431,1,飞转,fēizhuàn,,,动,飞快地转动,车轮飞转
53433,1,缺勤,quēqín,,,动,在规定的上班时间内没有来上班,
53436,1,冰片,bīngpiàn,,,名,中药，龙脑树干分泌的油脂蒸馏后的结晶。洁白透明，气味芳香，有通窍散郁、散热止痛的功效,
53437,1,路条,lùtiáo,,,名,一种简易的道路通行证,
53440,1,杂家,zájiā,,,名,战国末期到西汉初期，兼容儒、墨、名、法各家学说的一个学派。代表作有《吕氏春秋》《淮南子》等,
53440,2,杂家,zájiā,,,名,指对多种学科都有一定了解，知识面较宽的人,
53441,1,跨年度,kuàniándù,,,,（任务、计划、预算等）突破年度界限，从一个年度延续到下一个年度,经费可以跨年度使用。
53442,1,跳神,tiàoshén,,,动,一种迷信活动，巫师装出鬼神附体的样子，胡说乱舞，妄称能驱魔治病,
53444,1,继业,jìyè,,,动,继承前人的事业；继承先人的业绩,承师继业
53446,1,驱策,qūcè,,,动,用鞭子赶；比喻吩咐、使唤,无人可供驱策
53448,1,竹筏,zhúfá,,,名,用粗竹竿编扎的水上交通工具,
53449,1,酵母菌,jiàomǔjūn,,,名,真菌，单细胞，圆形或卵形。是重要的发酵微生物，可用来发面、酿酒、制酱等。简称酵母,
53450,1,呱呱叫,guāguājiào,,,形,形容非常好,响当当的连队呱呱叫的兵｜她的舞姿呱呱叫
53451,1,粗笨,cūbèn,,,形,（器具等）粗大笨重,粗笨的家具
53451,2,粗笨,cūbèn,,,形,（身材、举止等）笨拙；不灵巧,粗笨的体态｜动作显得很粗笨
53452,1,闹笑话,nàoxiàohua,,,,因为缺少知识和经验或粗心大意而做出可笑的事,
53453,1,协理员,xiélǐyuán,,,名,协助处理某项事务的人员,
53453,2,协理员,xiélǐyuán,,,名,政治协理员的简称，是中国人民解放军上级政治机关派到团以上单位或部门协助党组织和首长做好政治思想工作的干部,
53454,1,干瞪眼,gāndèngyǎn,,,,面对某种不利的情况只是着急而毫无办法,赛前没准备，临场干瞪眼。
53455,1,便帽,biànmào,,,名,平时戴的帽子（跟“礼帽”相区别）,
53457,1,打哈哈,dǎhāha,,,,开玩笑,别净打哈哈，耽误了正事。
53457,2,打哈哈,dǎhāha,,,,敷衍搪塞,这事得认真办，别打哈哈。
53458,1,鼓书,gǔshū,,,名,【大鼓】一种曲艺，流行于北方。用韵文演唱故事，穿插少量说白，用鼓、板、三弦等伴奏。如京韵大鼓、京东大鼓等,
53459,1,通关节,tōngguānjié,,,,指暗中送钱物托人情，以求得到权势者的关照,
53460,1,商港,shānggǎng,,,名,供商船停泊办理客货运输业务的港口,
53461,1,过山车,guòshānchē,,,名,一种大型电动游乐设施。人坐在特制的椅子中，在起伏很大的环形轨道上作高速旋转运行，有翻山越岭的惊险感受,
53463,1,扣帽子,kòumàozi,,,,比喻把不好的名目强加于人,乱扣帽子，乱打棍子。
53464,1,走形式,zǒuxíngshì,,,,不讲求实际效果，只在表面上做做样子,
53467,1,票额,piào'é,,,名,票面上标定的数额,
53468,1,背运,bèiyùn,,,形,运气不济,真背运，干什么都不顺利。
53468,2,背运,bèiyùn,,,名,不好的运气,走背运
53470,1,摇篮曲,yáolánqǔ,,,名,催婴儿入睡时哼唱的小调；也指由这种曲调发展而成的乐曲,
53472,1,保育员,bǎoyùyuán,,,名,托儿所、幼儿园里负责照管并教育婴幼儿的人员,
53474,1,伸懒腰,shēnlǎnyāo,,,,人感到困倦时伸展腰部和上肢,
53475,1,热带鱼,rèdàiyú,,,名,分布于热带、亚热带海中的鱼类。种类很多，大多体小活泼，色泽艳丽，可供观赏,
53476,1,愚人节,yúrénjié,,,名,"西方风俗,4月1日为愚人节。这一天可以做各种各样愚弄人的游戏",
53478,1,阴惨,yīncǎn,,,形,阴森凄惨,阴惨的古庙｜阴惨惨的坟地
53478,2,阴惨,yīncǎn,,,形,悲伤凄惨,脸色阴惨｜阴惨的哭声
53479,1,指骨,zhǐgǔ,,,名,构成手指的小型长骨。人体除拇指为两节外，其余各指都是三节,
53485,1,老汤,lǎotāng,,,名,炖过多次鸡、鸭、肉等的汤汁,
53485,2,老汤,lǎotāng,,,名,多次腌制咸菜、泡菜等的陈汤,
53494,1,参透,cāntòu,,,动,彻底领悟；看透,参透玄机｜参透其中奥秘
53496,1,内外交困,nèiwài-jiāokùn,,,,内部与外部都处在艰难困苦之中（交：一齐；同时）；形容处境十分困难,当时国家处于内外交困的境地。
53501,1,马尾松,mǎwěisōng,,,名,常绿乔木，高可达40米，针叶丛生如马尾，细长柔软。生长快，木材富有油脂，用途广，是荒山造林树种,
53503,1,水轮机,shuǐlúnjī,,,名,利用水流冲力转动叶轮的涡轮发动机。是水力发电的主要动力装置，也可以带动其他机械,
53505,1,公使馆,gōngshǐguǎn,,,名,一国派驻另一国的常驻办事机构。最高长官是公使，级别低于大使馆,
53508,1,珞巴族,luòbāzú,,,名,我国少数民族之一。主要分布在西藏,
53512,1,千刀万剐,qiāndāo-wànguǎ,,,,本指凌迟酷刑，后多用于愤怒咒骂罪大恶极的人,
53513,1,星火燎原,xīnghuǒ-liáoyuán,,,,星星之火，可以燎原,
53514,1,京族,jīngzú,,,名,我国少数民族之一。主要分布在广西,
53514,2,京族,jīngzú,,,名,越南人数最多的民族,
53517,1,离情,líqíng,,,名,别离的情思,离情绵绵
53518,1,穴头,xuétóu,,,名,组织和介绍演员自行外出表演的经纪人,
53519,1,一文不名,yīwén-bùmíng,,,,不名一文,
53520,1,来日方长,láirì-fāngcháng,,,,未来的时日还很长。表示日后必有所作为或劝人不必急于做某事,
53523,1,颠三倒四,diānsān-dǎosì,,,形,形容说话、做事没有次序，颠倒错乱,
53524,1,大寒,dàhán,,,名,二十四节气之一，在公历每年1月21日前后。大寒时节是我国大部分地区一年中最冷的时候,
53526,1,硕果仅存,shuòguǒ-jǐncún,,,,唯一留下来的大果子。比喻唯一留存下来的稀有可贵的人或事物,
53527,1,铁板一块,tiěbǎn-yīkuài,,,,比喻整体结合很紧，难以分割,敌人不是铁板一块，可以分化瓦解。
53529,1,隔靴搔痒,géxuē-sāoyǎng,,,,隔着靴子挠痒痒。比喻说话、做事没有抓住要害，不解决问题,
53531,1,草木皆兵,cǎomù-jiēbīng,,,,公元383年，前秦苻坚带兵进攻东晋，行至淝水，北望八公山，见山上草木皆像人形，疑为晋军，非常害怕。后用“草木皆兵”形容极度惊恐疑惧的心理,
53532,1,奇装异服,qízhuāng-yìfú,,,,式样奇特、与众不同的服装（多含贬义）,学生别穿奇装异服。
53533,1,欺人太甚,qīrén-tàishèn,,,,欺负人太过分,
53536,1,浑水摸鱼,húnshuǐ-mōyú,,,,比喻趁混乱的机会捞取好处,
53538,1,导轨,dǎoguǐ,,,名,用来限定某种设备运行路线的轨道,电梯导轨
53539,1,好好先生,hǎohǎo-xiānsheng,,,,一团和气，只求息事宁人，不问是非曲直的人,
53540,1,成年累月,chéngnián-lěiyuè,,,,长年累月,
53542,1,没话找话,méihuà-zhǎohuà,,,,本来没话说，却故意找话题活跃气氛以打破尴尬场面,
53545,1,天造地设,tiānzào-dìshè,,,形,形容美妙的事物如自然形成，恰到好处，无需人工修饰,漓江景致，天造地设｜他俩十分般配，真是天造地设的一对儿。
53546,1,私心杂念,sīxīn-zániàn,,,,计较个人利害得失，为自己打算的各种想法,
53548,1,焚书坑儒,fénshū-kēngrú,,,,指秦始皇焚烧古代典籍和坑杀方士、儒生两件事情。后用来指破坏文化，摧残知识分子,
53549,1,满腹经纶,mǎnfù-jīnglún,,,,比喻富有政治才能或很有学问（经纶：整理过的蚕丝；比喻政治才能）,
53551,1,脂油,zhīyóu,,,名,板油,脂油饼
53552,1,驳杂,bózá,,,形,混杂不一,内容驳杂｜色彩驳杂
53553,1,丹桂,dānguì,,,名,桂花的一种,
53555,1,沙眼,shāyǎn,,,名,由沙眼衣原体引起的慢性传染性结膜炎。患者睑结膜上出现灰白色颗粒，逐渐形成瘢痕，引起眼睑内翻倒睫，严重影响视力,
53556,1,问诊,wènzhěn,,,动,泛指看病,各科医生前来义务问诊｜求医问诊
53556,2,问诊,wènzhěn,,,动,中医诊断疾病的常用方法之一,
53558,1,华族,huázú,,,名,名门贵族,出身华族
53560,1,后景,hòujǐng,,,名,画面或舞台上在主体后面起衬托作用的景物,照片的后景是一片新绿｜舞台的后景太杂乱。
53562,1,出奔,chūbēn,,,动,（为逃避某事而）出走,出奔异邦
53563,1,对换,duìhuàn,,,动,互相交换；调换,两家对换了住房
53564,1,失准,shīzhǔn,,,动,（仪器等）失去准确性,市场公平秤不能失准。
53564,2,失准,shīzhǔn,,,动,未能显示出应有水平,王老师在公开课中有些失准。
53565,1,画匠,huàjiàng,,,名,【画工】以绘画为职业的工匠,
53565,2,画匠,huàjiàng,,,名,贬称缺乏艺术创造力的画家,
53566,1,卓见,zhuójiàn,,,名,高明的见解,聆听先生的卓见很受教益。
53567,1,落聘,luòpìn,,,动,应聘时未被聘任,
53568,1,招集,zhāojí,,,动,招募集合,招集了一批民工
53569,1,兄嫂,xiōngsǎo,,,名,哥哥和嫂子；也指嫂子,
53570,1,花斑,huābān,,,名,某些动物皮毛上不同颜色的斑点。如豹子背部的棕色、褐色斑,
53571,1,蛇形,shéxíng,,,名,像爬行的蛇一样弯曲的形状,蛇形管道
53572,1,败军,bàijūn,,,名,打了败仗的军队；泛指失败的一方,他成了败军之将
53572,2,败军,bàijūn,,,动,〈文〉使军队打败仗,败军亡国
53574,1,羽化,yǔhuà,,,动,昆虫由若虫或蛹变为成虫,
53574,2,羽化,yǔhuà,,,动,古人指人升天成仙,
53574,3,羽化,yǔhuà,,,动,婉词，指道士死亡,
53575,1,诱拐,yòuguǎi,,,动,用诱骗的手段拐走,诱拐妇女
53576,1,袭用,xíyòng,,,动,沿袭采用（旧有的事物）,不能袭用老一套
53580,1,无所不用其极,wúsuǒ bù yòng qí jí,,,,《礼记·大学》：“是故君子无所不用其极。”原指无处不用尽心力。现多指坏事做尽或什么卑鄙的手段都使出来,
53581,1,围猎,wéiliè,,,动,从四周包围起来捕猎,
53584,1,仇外,chóuwài,,,动,仇视外国的人或事物,盲目仇外，不是正确的态度。
53585,1,钟鼎,zhōngdǐng,,,名,古代用作打击乐器的钟和煮东西的鼎；泛指古代青铜器,
53587,1,桥栏,qiáolán,,,名,桥面两侧的栏杆,
53588,1,溶血,róngxuè,,,动,红细胞破裂，血红蛋白从细胞内逸出,
53589,1,荆条,jīngtiáo,,,名,荆的枝条。长而柔韧，可以编制筐、篮、篱笆等,
53592,1,爽利,shuǎnglì,,,形,爽快利索,干活儿挺爽利
53593,1,硬顶,yìngdǐng,,,动,用强硬态度顶撞或对抗,有话好说，不要老是硬顶｜上面三令五申，他就是硬顶着不办。
53593,2,硬顶,yìngdǐng,,,动,顽强地支撑着,他烧到38℃，还硬顶着不肯休息。
53594,1,酬报,chóubào,,,动,用财物或行动表示回报,酬报外婆的养育之恩。
53594,2,酬报,chóubào,,,名,报酬,他给农民看病，从不接受酬报。
53595,1,单名,dānmíng,,,名,除姓外，只有一个字的名字。如孔丘、诸葛亮,
53596,1,青果,qīngguǒ,,,名,橄榄树的果实,
53598,1,西菜,xīcài,,,名,西式菜肴,
53599,1,枭雄,xiāoxióng,,,名,指强横而野心勃勃的人物；也指有抱负的英雄豪杰,
53600,1,码子,mǎzi,,,名,〈口〉记录数目的符号,过秤后记个码子｜洋码子（指阿拉伯数字）。
53600,2,码子,mǎzi,,,名,圆形的筹码,
53601,1,骄矜,jiāojīn,,,形,傲慢自负,骄矜不群
53603,1,敷药,fūyào,,,动,将药物涂搽在伤口上,每天给他喂汤、敷药。
53604,1,失盗,shīdào,,,动,被盗,
53605,1,烟霞,yānxiá,,,名,雾气和云霞,烟霞迷蒙
53611,1,再议,zàiyì,,,动,另行商议；重新讨论,这几个问题，待调查核实后再议。
53612,1,飞吻,fēiwěn,,,动,先吻自己的手，然后做一个抛掷给对方的手势，表示亲吻对方,
53614,1,标量,biāoliàng,,,名,物理学上指有大小而没有方向的量（跟“矢量”相区别）。如功、体积、温度等,
53615,1,氧吧,yǎngbā,,,名,备有输氧装置专供人吸氧休闲的营业性场所（吧：英语bar音译）,
53616,1,凄迷,qīmí,,,形,（景物）凄凉迷茫,烟雨凄迷
53616,2,凄迷,qīmí,,,形,悲哀惆怅,
53617,1,松脆,sōngcuì,,,形,膨松酥脆,松脆可口
53618,1,灭门,mièmén,,,动,杀尽全家人,灭门之罪
53622,1,翻斗,fāndǒu,,,名,能翻转卸物的斗形车厢,
53623,1,护持,hùchí,,,动,保护维持；爱护扶持,小区的安全靠大家来护持｜刚栽的树苗要有人护持。
53625,1,撑死,chēngsǐ,,,动,因吃的过多而致死（多为夸张的说法）,
53625,2,撑死,chēngsǐ,,,动,达到极限,这件衬衫撑死也不值200元。
53625,3,撑死,chēngsǐ,,,动,比喻最大限度地得到好处,他认为股市这东西就是撑死胆大的，饿死胆小的。
53626,1,官运亨通,guānyùn-hēngtōng,,,,做官的运气好，仕途顺利（含贬义）,
53627,1,趋时,qūshí,,,动,追求时髦；迎合时尚,趋时应景
53629,1,独吞,dútūn,,,动,独自吞占（本该多人分享的财产、利益等）,独吞祖上遗产｜独吞红利
53631,1,数理统计,shùlǐ tǒngjì,,,,数学的分支学科，以概率论为理论根据，对观察或试验所得的数据进行分析研究，以作出判断；也研究搜集数据的方法，如怎样抽样才能得出足够可靠的数据等,
53632,1,笑纳,xiàonà,,,动,客套话，用于请对方接受赠物,这点儿薄礼请先生笑纳。
53634,1,合辙,hézhé,,,动,车轮的印痕与路上已有的车辙相合。比喻想法等一致或性情合得来,他们几个挺合辙的。
53634,2,合辙,hézhé,,,动,（戏曲、小调等的唱词）押韵,这快板不合辙，拗口。
53635,1,宽窄,kuānzhǎi,,,名,面积、范围的大小,客厅的宽窄正合适。
53635,2,宽窄,kuānzhǎi,,,名,宽度,量量布的宽窄
53636,1,猪崽,zhūzǎi,,,名,某些地区指小猪,
53637,1,中文信息处理,zhōngwén xìnxī chǔlǐ,,,,用电子计算机对中文信息（如字、词、短语、句、篇章等）进行识别、输入、输出、存储、编辑、检索、生成等；也指中文信息处理这一学科,
53640,1,跑冒滴漏,pǎo-mào-dī-lòu,,,,指液体、气体等各种形式的泄漏；比喻财产物资的各种非正常流失,严格财务管理，防止跑冒滴漏。
53641,1,歪打正着,wāidǎ-zhèngzháo,,,,无意中打中目标。比喻意外地获得满意的结果,
53642,1,美言,měiyán,,,动,替人说好话,帮我美言几句
53642,2,美言,měiyán,,,名,美好的言辞,不为美言所惑
53645,1,噼里啪啦,pīlipālā,,,拟声,模拟连续不断的爆裂声或拍打声,冰雹噼里啪啦地打下来｜噼里啪啦的掌声
53646,1,认生,rènshēng,,,形,（小孩子）见生人害怕,这孩子见了我还有点儿认生。
53647,1,酥软,sūruǎn,,,形,（身体）软弱无力,浑身酥软
53651,1,朴质,pǔzhì,,,形,朴实纯真，不加任何修饰,心灵纯洁而又朴质。
53652,1,大马哈鱼,dàmǎhāyú,,,名,大麻哈鱼的通称。鱼，体长约0.6—1.0米，银灰色，嘴大牙尖。捕食小鱼。刺少，肉味鲜美，为名贵经济鱼类之一,
53653,1,初会,chūhuì,,,动,初次见面,我们虽是初会，但一见如故。
53655,1,赘肉,zhuìròu,,,名,（人发胖时生出的）多余的肉,
53659,1,红杏出墙,hóngxìng-chūqiáng,,,,宋·叶绍翁《游小园不值》：“春色满园关不住，一枝红杏出墙来。”形容春意盎然；现多用来比喻已婚女子另有情人；也比喻名声在外,
53664,1,名利场,mínglìchǎng,,,名,追逐名利的场所,
53668,1,大票,dàpiào,,,名,大钞,
53671,1,脑电图,nǎodiàntú,,,名,用特殊电子仪器扫描记录下来的脑部生物电的曲线图。可据以诊断脑部疾病,
53672,1,救火车,jiùhuǒchē,,,名,消防车的通称,
53673,1,台柱子,táizhùzi,,,名,支撑戏台一类建筑物的柱子。比喻戏班中的主要演员；泛指集体中的骨干力量,
53676,1,坝地,bàdì,,,名,山沟里筑坝，拦截流失的泥土而淤积成的田地,
53677,1,超豪华,chāoháohuá,,,形,极端豪华,超豪华宾馆
53679,1,安歇,ānxiē,,,动,睡觉；休息,今晚早点安歇，明天还要赶路呢｜人困马乏的，先找个地方安歇一下。
53681,1,两点论,liǎngdiǎnlùn,,,名,唯物辩证法的思想方法，即用对立统一观点全面地分析事物。既要看到正面，又要看到反面；既要看到共性，又要看到个性；既要看到事物的现状，又要看到矛盾的双方经过斗争在一定条件下可以互相转化,
53682,1,刨花板,bàohuābǎn,,,名,用刨花和碎木拌以胶合剂压制成的板材,
53684,1,彩纸,cǎizhǐ,,,名,彩色的纸,
53684,2,彩纸,cǎizhǐ,,,名,洗印彩照用的纸,
53686,1,大换血,dàhuànxiě,,,,比喻大量更换人员或设备等,
53689,1,刻毒,kèdú,,,形,刻薄狠毒,心肠刻毒
53692,1,嫩滑,nènhuá,,,形,细嫩润滑,肌肤嫩滑细腻｜蟹肉嫩滑鲜美
53697,1,幽闭,yōubì,,,动,囚禁；软禁,幽闭于囹圄
53697,2,幽闭,yōubì,,,动,封闭；特指深居家中不外出,心灵幽闭｜幽闭闺阁，难得出门。
53697,3,幽闭,yōubì,,,动,毁坏妇女的生殖器官，使不能生育。古代一种酷刑,
53698,1,初晴,chūqíng,,,动,刚刚放晴,雨后初晴
53699,1,相悦,xiāngyuè,,,动,彼此喜欢、爱恋,两情相悦，生死不渝。
53700,1,反照,fǎnzhào,,,动,反衬；对照,对比他人，反照自己。
53701,1,有始有终,yǒushǐ-yǒuzhōng,,,,指做事有头有尾，能坚持到底,
53703,1,鱼肚白,yúdùbái,,,名,像鱼肚子那样白里带青的颜色（多指黎明时光）,天空泛起了鱼肚白。
53704,1,五里雾,wǔlǐwù,,,名,《后汉书·张楷传》：“张楷字公超，性好道术，能作五里雾。”原指道士作的法术。后用以比喻迷离恍惚，难明真相的情景,如堕五里雾中
53706,1,训示,xùnshì,,,动,训导指示（多用于上级对下级、长辈对晚辈）,训示了一番｜请首长训示
53707,1,肥缺,féiquē,,,名,指待遇优厚、额外收入多的职位（缺：职务的空额，借指职位）,
53710,1,探病,tànbìng,,,动,探望病人,
53711,1,祸心,huòxīn,,,名,作恶害人的心思,包藏祸心
53712,1,土包子,tǔbāozi,,,名,对土生土长、没见过世面的人的称呼（含讥讽意）,
53713,1,温控,wēnkòng,,,动,通过温度变化进行控制,
53714,1,斜照,xiézhào,,,名,〈文〉傍晚斜射的阳光,斜照临窗
53714,2,斜照,xiézhào,,,动,光线从侧面照射,夕阳斜照｜新月斜照
53716,1,飞沙走石,fēishā-zǒushí,,,,沙土飞扬，碎石翻滚。形容风势迅猛,
53717,1,碰钉子,pèngdīngzi,,,,比喻遇到挫折、遭到拒绝或受到斥责,找他走后门儿，准得碰钉子。
53721,1,出栏率,chūlánlǜ,,,名,出栏牲畜在原存栏牲畜中所占的比率。通常按照年度以百分比计算,
53724,1,未老先衰,wèilǎo-xiānshuāi,,,,年纪还不老，但身体或精神就先衰颓了,
53725,1,草民,cǎomín,,,名,百姓（含轻贱意）,
53729,1,讹误,éwù,,,名,文字方面的错误,所记都是事实，绝无讹误。
53731,1,冲凉,chōngliáng,,,动,某些地区指洗澡,
53733,1,太息,tàixī,,,动,叹息,
53735,1,干结,gānjié,,,动,含水少，发硬,土壤干结
53736,1,巡检,xúnjiǎn,,,动,巡视检查,定期巡检
53739,1,惨笑,cǎnxiào,,,动,心里悲痛而强作笑容,
53740,1,魔方,mófāng,,,名,一种智力玩具，由可以转动的若干块小正方体和中心轴组成大正方体。它的六个平面颜色各异。游戏时，扭转小方块，使六面颜色混杂，然后用最短的时间把每个平面的颜色复原,
53742,1,钢锭,gāngdìng,,,名,用钢水浇铸成型的钢块，是轧制钢材的原料,
53743,1,小偷小摸,xiǎotōu-xiǎomō,,,,小规模偷窃；也指小规模偷窃的人,
53746,1,余烬,yújìn,,,名,物体燃烧后剩下的东西,要尽快清除余烬，防止死灰复燃。
53746,2,余烬,yújìn,,,名,比喻战争或其他灾难后残留的东西,灾后余烬
53747,1,降尘,jiàngchén,,,名,指空气中的粉尘颗粒。颗粒较大，可以自然降沉到地面，故称,
53747,2,降尘,jiàngchén,,,动,空气中的粉尘颗粒降到地面,大面积地降尘
53747,3,降尘,jiàngchén,,,动,使空气中的粉尘颗粒降到地面,人工增雨降尘
53751,1,彻查,chèchá,,,动,彻底清查或调查,彻查案情
53752,1,烈风,lièfēng,,,名,猛烈的风；气象学上指9级风,
53754,1,翠鸟,cuìniǎo,,,名,鸟，头大体小尾短，嘴长而直，羽毛以苍翠、暗绿为主。生活在水边，吃鱼虾等,
53756,1,趣话,qùhuà,,,名,有趣的话语；有趣的故事,关于这件事当年还有一段趣话｜梨园趣话
53756,2,趣话,qùhuà,,,动,有趣地讲述,趣话京城往事
53758,1,停学,tíngxué,,,动,停止上学,因病停学一年
53759,1,发窘,fājiǒng,,,动,觉得难堪,他的话使我发窘
53761,1,嫡传,díchuán,,,动,嫡派相传；通常指武术、学术、技艺等的流派一代代直接传授,嫡传弟子
53762,1,趾甲,zhǐjiǎ,,,名,脚指甲,
53764,1,上款,shàngkuǎn,,,名,在信件、礼品或为人创作的书画作品的上端题写的对方的名字、称呼等,
53765,1,斥力,chìlì,,,名,物体之间相互排斥的力。带同性电荷的物体之间、同性磁极之间都有斥力（跟“引力”相区别）,
53769,1,事过境迁,shìguò-jìngqiān,,,,事情过去了，情况也发生了变化,
53773,1,哀怜,āilián,,,动,怜悯；同情,哀怜他的不幸
53777,1,春装,chūnzhuāng,,,名,春季穿的服装,
53778,1,外路,wàilù,,,形,从外地来的,外路吃法
53779,1,汽缸,qìgāng,,,名,往复式发动机或压气机中的圆筒状构件，有活塞在其中活动。燃气在汽缸内燃烧膨胀，推动活塞做功,
53780,1,线呢,xiànní,,,名,用有颜色的线或纱按不同花型织成的棉布，较普通棉布厚实，有弹性，类似毛呢,
53781,1,功败垂成,gōngbài-chuíchéng,,,,事情在将近成功的时候遭到失败（垂：接近）,
53783,1,深耕,shēngēng,,,动,土壤耕作中增加深度。适当深耕可以改良土壤，提高地力，增加产量,
53784,1,筋脉,jīnmài,,,名,指静脉管,
53784,2,筋脉,jīnmài,,,名,比喻文章的线索、条理,文章筋脉清晰
53787,1,冰花,bīnghuā,,,名,凝结成花纹状的薄冰层,玻璃窗上结了一层冰花。
53787,2,冰花,bīnghuā,,,名,雾凇,
53787,3,冰花,bīnghuā,,,名,把花卉等实物用水冻结后制成的冰罩观赏物,
53789,1,主祭,zhǔjì,,,动,主持祭祀,
53793,1,浅析,qiǎnxī,,,动,初步分析；粗浅地分析,浅析中东局势｜《犯罪低龄化现象浅析》。
53795,1,摹写,móxiě,,,动,照原样描写,
53795,2,摹写,móxiě,,,动,描写,
53798,1,推究,tuījiū,,,动,推求和探究,推究原因｜推究推究这个字的本义。
53803,1,毛织品,máozhīpǐn,,,名,用毛线编织的衣物,
53803,2,毛织品,máozhīpǐn,,,名,用兽毛纤维或人造毛等纺织成的料子的统称,
53804,1,射精,shèjīng,,,动,男人或某些雄性动物将精子射出体外,
53808,1,鲜丽,xiānlì,,,形,鲜明艳丽,山茶花鲜丽耀眼
53809,1,闲饭,xiánfàn,,,名,不干活儿白吃的饭,不吃闲饭｜闲饭养闲人
53813,1,波形,bōxíng,,,名,表示某物理量按时间或空间变化的曲线图形。可在示波器上显示,心电图的波形趋于平直时，表明心脏停止跳动。
53815,1,血肿,xuèzhǒng,,,动,因血管壁破裂，血液流出血管聚积在软组织内而使局部发生红肿,
53817,1,设色,shèsè,,,动,（绘画）涂上颜色,分层设色
53821,1,分子式,fēnzǐshì,,,名,表示物质分子中所含化学元素的种类及其原子数目的式子。如水的分子式H2O，表示水分子含氢、氧元素，元素符号右下的数字表示该元素的原子数目,
53822,1,租约,zūyuē,,,名,确立租赁关系时双方签订的契约,
53823,1,突审,tūshěn,,,动,突击审讯,警方将犯罪嫌疑人带回分局连夜突审。
53823,2,突审,tūshěn,,,动,突击审查,经突审，大赛组委会确认这名球员赛前服用了兴奋剂。
53824,1,新异,xīnyì,,,形,新颖奇特,这首诗语言新异
53825,1,氯霉素,lǜméisù,,,名,抗生素，主要用于医治伤寒、斑疹伤寒、支原体肺炎、细菌性痢疾等症,
53826,1,回肠荡气,huícháng-dàngqì,,,,荡气回肠,
53827,1,黄花菜,huánghuācài,,,名,金针菜的一个品种,
53828,1,激变,jībiàn,,,动,迅速而剧烈地变化,战局激变，胜负未卜。
53828,2,激变,jībiàn,,,动,矛盾激化而生变,
53829,1,折光,zhéguāng,,,动,光线发生折射,
53829,2,折光,zhéguāng,,,名,折射出来的光线；比喻间接反映出来的事物的特征,这本书是他心路历程的折光。
53830,1,红缨枪,hóngyīngqiāng,,,名,旧式兵器，长柄，顶端装有很尖的金属枪头，枪头下方装饰红色的穗状缨子,
53833,1,赏脸,shǎngliǎn,,,动,客套话，赏给面子，多用于请对方接受邀请或赠品,请赏脸收下
53835,1,飞红,fēihóng,,,动,脸、颈迅速出现红晕,羞得她满脸飞红
53837,1,舟车,zhōuchē,,,名,船和车的合称；借指旅途,舟车劳顿
