rank,sn,cihui,pinyin,ref_hanzi,ref_pinyin,pos,definition,example
51289,1,叔祖,shūzǔ,,,名,父亲的叔父。某些地区,
51295,1,交班,jiāobān,,,动,把工作交代给下一班,
51297,1,酸麻,suānmá,,,形,酸疼麻木,坐得双腿酸麻
51298,1,汇展,huìzhǎn,,,动,汇集在一起展览,
51300,1,发虚,fāxū,,,动,感到心虚,第一次参加比赛心里有点儿发虚。
51300,2,发虚,fāxū,,,动,感到身体虚弱乏力,经过调养，身体不再发虚了。
51301,1,色狼,sèláng,,,名,指贪婪地追逐女性并凶残地对其进行性侵犯的人,
51303,1,套裙,tàoqún,,,名,下身为裙子的女式套装,
51304,1,星号,xīnghào,,,名,星形的标志符号，形式为“*”。有多种用途，常用来标示注脚或分段,
51305,1,一码事,yīmǎshì,,,名,一回事,
51308,1,唯命是从,wéimìngshìcóng,,,,只听从命令。指绝对服从,
51310,1,愁绪,chóuxù,,,名,忧愁的心情,愁绪满怀
51311,1,削发,xuēfà,,,动,僧尼出家时剃掉头发,
51315,1,树阴,shùyīn,,,名,树木枝叶在阳光下形成的阴影,
51316,1,欧姆,ōumǔ,,,量,电阻法定计量单位，导体上的电压为1伏特、通过的电流为1安培时，电阻为1欧姆。为纪念德国物理学家欧姆而命名。简称欧,
51318,1,十字街头,shízì jiētóu,,,,街道纵横交错、繁华热闹的地方,
51320,1,寄放,jìfàng,,,动,寄存,行李寄放在亲戚家里。
51321,1,渡槽,dùcáo,,,名,输送水流跨越山谷、洼地、道路、河道等的架空水槽，两端连接水渠,
51322,1,无可奉告,wúkěfènggào,,,,没有什么可以告诉的（多用于外交场合）,
51323,1,部类,bùlèi,,,名,概括性较大的类；门类,商品部类齐全｜我军兵器部类完备。
51324,1,底薪,dǐxīn,,,名,旧指计算实际工资的基数。现也指工资中除补贴、津贴及奖励以外的基本部分,
51325,1,生涩,shēngsè,,,形,（言辞、文字等）不流畅，生硬拗口,语句生涩难懂｜文笔生涩
51326,1,惹是生非,rěshì-shēngfēi,,,,惹是非,
51327,1,线衣,xiànyī,,,名,用粗棉线或化纤线织成的上衣,
51331,1,精要,jīngyào,,,名,精粹切要的部分,文章精要
51331,2,精要,jīngyào,,,形,精粹切要,摘取全书精要的章节。
51332,1,特辑,tèjí,,,名,为某一主题或特殊需要而特地编辑的文字资料、报刊或音像制品等,纪念中华人民共和国成立50周年特辑。
51336,1,旧账,jiùzhàng,,,名,以前欠下的账；比喻以往的过失或怨恨,不要老是算旧账，要向前看。
51339,1,清寒,qīnghán,,,形,清朗而略寒,夜色清寒
51339,2,清寒,qīnghán,,,形,贫寒,一生清寒
51341,1,自便,zìbiàn,,,动,按自己的意愿和方便行事,休息时间，行动自便。
51343,1,奸夫,jiānfū,,,名,通奸的男方,奸夫淫妇
51346,1,纲纪,gāngjì,,,名,社会秩序和国家法纪,整饬纲纪
51347,1,翻查,fānchá,,,动,翻动查找,翻查词典｜翻查行李
51348,1,装相,zhuāngxiàng,,,动,假装成某种样子（以取得别人的善待或同情）,
51349,1,五七干校,wǔ-qī gànxiào,,,,“文化大革命”期间干部集中下放劳动改造的场所。以毛泽东1966年5月7日关于下放干部劳动的“五七指示”而得名,
51354,1,北头,běitóu,,,名,南北方向的北面一头,
51356,1,怒号,nùháo,,,动,大声呼号,
51357,1,考期,kǎoqī,,,名,考试的日期；也指考试期间,
51363,1,内出血,nèichūxuè,,,动,身体内血管破裂流出的血液进入体腔或组织内。如脑出血、肾上腺出血等,
51364,1,屠户,túhù,,,名,以宰杀牲畜为业的人家,
51365,1,偶或,ǒuhuò,,,副,【偶尔】间或；有时候。表示某种情况发生的次数不是很多,
51369,1,崩盘,bēngpán,,,动,指股票市场、期货市场等因行情大跌而彻底崩溃,
51370,1,龙虎斗,lónghǔdòu,,,,比喻实力相当的对手激烈争斗,这两款车之间势必要龙虎斗。
51371,1,富国强兵,fùguó-qiángbīng,,,,使国家富足，兵力强大,
51373,1,面议,miànyì,,,动,当面商议,工资面议
51374,1,老窝,lǎowō,,,名,鸟兽长期栖息的地方；比喻坏人长期聚居盘踞的地方,直捣贩毒分子的老窝。
51378,1,法场,fǎchǎng,,,名,旧时执行死刑的场所,
51378,2,法场,fǎchǎng,,,名,【道场】僧道诵经做法事的场所,
51379,1,不好惹,bùhǎorě,,,,招惹不起,这个无赖可不好惹!
51382,1,接缝,jiēfèng,,,名,物体接合处,裤腿的接缝开线了｜焊得不牢，接缝容易开裂。
51383,1,麦芽糖,màiyátáng,,,名,一种糖，白色晶体，能分解成单糖。可用来制糖果，工业上用作糖化剂,
51387,1,瘤子,liúzi,,,名,肿瘤,
51389,1,胡搅,hújiǎo,,,动,胡闹；捣乱,要不是他在这儿胡搅，事情早干完了。
51389,2,胡搅,hújiǎo,,,动,强词夺理；狡辩,别胡搅了，情况并不像你说的那样。
51391,1,黄酱,huángjiàng,,,名,黄豆、面粉等发酵后加食盐制成的糊状调味品，呈黄色或棕红色,
51392,1,尸骸,shīhái,,,名,尸骨,
51393,1,椰枣,yēzǎo,,,名,海枣,
51397,1,乖僻,guāipì,,,形,（性情）乖张孤僻,生性乖僻
51398,1,送气,sòngqì,,,动,语音学指发辅音时吐出较强气流。普通话塞音、塞擦音声母有送气和不送气之分，如b、d、g、z、zh、j是不送气音，p、t、k、c、ch、q是送气音,
51398,2,送气,sòngqì,,,动,指送暖气供暖；输送燃气,
51399,1,讽喻,fěngyù,,,名,修辞手法，用说故事、打比方等方法，含蓄而有启发性地说明道理,
51400,1,插科打诨,chākē-dǎhùn,,,,指戏曲演员在演出中插入滑稽的动作和诙谐的台词引观众发笑（科：戏曲演员的动作；诨：开玩笑的话）,
51403,1,密码箱,mìmǎxiāng,,,名,安装有密码锁的箱子,
51404,1,线团,xiàntuán,,,名,用线缠成的球状物,
51406,1,感慨系之,gǎnkǎi-xìzhī,,,,联系当时触及的情景，引起无限感慨（系：联系）。形容对当时的情景感触很深,情随事迁，感慨系之。
51408,1,安全门,ānquánmén,,,名,太平门、防火门、防盗门等的统称,
51409,1,洋洋大观,yángyáng-dàguān,,,形,形容事物或景象丰富多彩，盛大壮观,
51410,1,批条子,pītiáozi,,,,领导在便条上作非正式的批示,
51411,1,预产期,yùchǎnqī,,,名,预先计算的胎儿产出的日期。计算方法为最后一次月经的第一天之后的9个月加7天,
51412,1,喇嘛教,lǎmajiào,,,名,藏传佛教,
51413,1,游医,yóuyī,,,名,指没有固定诊所、走街串巷的行医人员,
51418,1,脚腕,jiǎowàn,,,名,脚和小腿连接的部位,
51419,1,醉眼,zuìyǎn,,,名,酒醉后模糊失神的眼睛,醉眼蒙眬
51420,1,投缘,tóuyuán,,,形,合得来；有缘分,两人很投缘
51421,1,常春藤,chángchūnténg,,,名,常绿藤本植物，靠气根攀缘墙壁或树干向上生长，叶子卵圆形，老叶未掉，新叶已生。根、茎可以做药材。,
51423,1,江河日下,jiānghé-rìxià,,,,江河的水天天往下流。比喻景况一天不如一天,
51424,1,拼合,pīnhé,,,动,把拆开的或零散的东西合成整体,用积木拼合成小房子。
51427,1,常礼,chánglǐ,,,名,通常的礼节,按常礼，你应该亲自去机场迎接才对。
51428,1,谷雨,gǔyǔ,,,名,二十四节气之一，在公历每年4月20日前后。谷雨时节，我国大部分地区雨量增加，北方地区开始播种,
51429,1,选收,xuǎnshōu,,,动,选择收录,选收优秀杂文
51430,1,衬里,chènlǐ,,,名,里子,
51432,1,下脚料,xiàjiǎoliào,,,名,原材料加工时，切除或剔除出来的零碎余料或废料,
51433,1,夏布,xiàbù,,,名,用苎麻纤维织成的平纹布，轻薄凉爽，洗后易干，适于制作夏装,
51434,1,系铃人,xìlíngrén,,,名,原指往老虎脖子上系挂金铃的人。后比喻惹出麻烦的人,
51439,1,忠烈,zhōngliè,,,名,忠诚于国家而壮烈牺牲的人,满门忠烈
51439,2,忠烈,zhōngliè,,,形,忠诚于国家而壮烈牺牲的,忠烈之士
51440,1,兵卒,bīngzú,,,名,旧指士兵,
51443,1,熟菜,shúcài,,,名,经过烹制的菜肴,买点儿熟菜回来下酒。
51445,1,气不过,qìbùguò,,,动,气得受不了,我看着气不过，才上前帮他说话。
51446,1,帅才,shuàicái,,,名,具有帅才的人,
51446,2,帅才,shuàicái,,,名,能统率全军的才能；泛指领导和决策的才能,
51447,1,着慌,zháohuāng,,,动,着急；发慌,
51448,1,备马,bèimǎ,,,动,准备好马匹供人骑乘,
51449,1,片头,piàntóu,,,名,电影、电视片开头的部分，一般用来介绍片名、主演、导演的姓名等,
51450,1,惯犯,guànfàn,,,名,刑法规定的以某种犯罪为常业，或以某种犯罪所得为其生活主要来源，积习不改的犯罪分子,
51452,1,落发,luòfà,,,动,剃掉头发出家当和尚或尼姑,
51454,1,花鼓戏,huāgǔxì,,,名,地方戏曲剧种，流行于湖南、湖北、安徽等地。由花鼓发展而来,
51455,1,标准件,biāozhǔnjiàn,,,名,按统一规定的标准、规格和要求等生产的同一种零部件,
51457,1,劝诱,quànyòu,,,动,劝说并诱导,任凭别人怎样劝诱，他始终不改初衷。
51459,1,圆规,yuánguī,,,名,画圆或弧的绘图仪器，一脚是尖针，另一脚可装上铅笔芯或鸭嘴形笔头儿。以尖针脚为圆心，旋转另一脚就可以画出圆或弧。,
51460,1,恋歌,liàngē,,,名,抒发男女间爱情的歌曲,
51467,1,悼亡,dàowáng,,,动,晋朝文学家潘岳因妻子死去，作《悼亡诗》三首。后称悼念亡妻为悼亡；也指妻子亡故,
51471,1,受冤,shòuyuān,,,动,遭受冤屈,蒙辱受冤
51473,1,胸腺,xiōngxiàn,,,名,胸腔内的淋巴器官。主要由淋巴细胞和上皮性网状细胞构成。后者分泌胸腺素。与机体免疫功能有密切关系,
51476,1,炕席,kàngxí,,,名,炕上铺的席子,
51478,1,各别,gèbié,,,形,各不相同；互有区别,错误性质不同，要各别处理。
51478,2,各别,gèbié,,,形,（性格等）与众不同；特殊（含贬义）,他性格太各别，很难合作共事。
51479,1,打歼灭战,dǎjiānmièzhàn,,,,进行消灭全部或大部分敌人的战役或战斗；比喻集中力量突击完成某一任务,集中全公司主要技术力量打歼灭战，很快就研制出了新的杀病毒软件。
51480,1,助纣为虐,zhùzhòu-wéinüè,,,,南朝·宋·谢灵运《晋书·武帝纪论》：“昔武王伐纣，归倾宫之女，不可助纣为虐。”指帮助商纣王（商朝末代君主）做暴虐无道的事。后用“助纣为虐”比喻帮助坏人做坏事,
51482,1,忧愤,yōufèn,,,形,忧郁愤慨,忧愤成疾
51483,1,佃农,diànnóng,,,名,旧时指自己没有土地，依靠租种他人土地为生的农民。绝大多数是贫农，也有佃中农、佃富农,
51485,1,拉纤,lāqiàn,,,动,人在岸上用纤绳拉着河里的船行进,
51485,2,拉纤,lāqiàn,,,动,比喻替双方牵线、说合并从中取利,说媒拉纤
51486,1,内画,nèihuà,,,名,在透明或半透明器皿的内壁上绘制图画的技艺或作品,
51488,1,国产片,guóchǎnpiàn,,,名,本国生产的电影片、电视片,
51489,1,感恩戴德,gǎn'ēn-dàidé,,,,感激别人给予的恩德（戴：尊奉，推崇）,
51490,1,泡沫塑料,pàomò sùliào,,,,内部有很多小气孔的海绵状塑料。以树脂等原料制成，具有质轻、隔热、防震、耐腐蚀等特点,
51491,1,修读,xiūdú,,,动,进修研读；多指在老师的指导下对某一专业或某一课程进行较深入的钻研,他是学哲学的，又修读了一年的逻辑。
51492,1,洁癖,jiépǐ,,,名,过分追求清洁的习性,
51493,1,僧多粥少,sēngduō-zhōushǎo,,,,比喻人多而东西（或事情）少，不够分配,
51495,1,心肌梗死,xīnjī gěngsǐ,,,,由于心脏的冠状动脉分支急性堵塞，使部分心肌失去血液供应而坏死。发病时，有剧烈而持久的前胸疼痛、心悸、气喘、脉搏微弱、血压降低、休克等症状。简称心梗。旧称心肌梗塞,
51496,1,饮水思源,yǐnshuǐ-sīyuán,,,,喝水时想到水是从哪儿来的。比喻不忘本。,
51500,1,包养,bāoyǎng,,,动,为配偶以外的异性（多是女性）提供房屋、金钱等，与之姘居,包养情妇
51500,2,包养,bāoyǎng,,,动,供养某人或某些人，供自己专用,包养几个三流文人，为自己歌功颂德。
51502,1,嬉笑怒骂,xī-xiào-nù-mà,,,,嬉戏、耍笑、发怒、斥骂。常用来表示写作不拘题材形式，任意发挥,
51504,1,灶王爷,zàowángyé,,,名,灶神,
51505,1,汗腺,hànxiàn,,,名,皮肤中分泌汗液的腺体,
51506,1,俄罗斯族,éluósīzú,,,名,俄罗斯联邦人数最多的民族,
51506,2,俄罗斯族,éluósīzú,,,名,我国少数民族之一。主要分布在新疆和黑龙江,
51508,1,佩刀,pèidāo,,,名,挂在腰间的刀,
51512,1,竖井,shùjǐng,,,名,由地下巷道直接通到地面的垂直井筒，用以提升矿石、送工人上下班以及通风、排水等,
51513,1,碎步,suìbù,,,名,小而快的步子（多用于戏剧表演）,她的碎步功夫很深。
51515,1,萍水相逢,píngshuǐ-xiāngféng,,,,比喻不相识的人偶然走到一起,
51516,1,温酒,wēnjiǔ,,,动,把酒放在热水中烫热,
51516,2,温酒,wēnjiǔ,,,名,温热的酒,
51517,1,电弧,diànhú,,,名,正负两电极接近到一定距离时，因气体放电而形成弧形白光并产生高温和紫外线的现象，可用于照明、焊接和炼钢等,
51518,1,鼻头,bítóu,,,名,鼻尖,鼻头红肿
51518,2,鼻头,bítóu,,,名,〈口〉鼻子,方脸大鼻头
51521,1,追根究底,zhuīgēn-jiūdǐ,,,,刨根问底,
51522,1,酒器,jiǔqì,,,名,盛酒和饮酒的器皿,
51523,1,回马枪,huímǎqiāng,,,名,本为古代长枪的一种枪法，即在佯装败走中突然回头给追击者一击；后也泛指作战中转移兵力，突然掉转方向袭击敌人的战术,
51523,2,回马枪,huímǎqiāng,,,名,比喻同伙改变立场，转过来揭发、攻击原来一方的行为,
51525,1,待考,dàikǎo,,,动,等待以后再查考,现有资料不全，作家的卒年还待考。
51526,1,阴风,yīnfēng,,,名,比喻邪恶的风潮,煽阴风
51526,2,阴风,yīnfēng,,,名,阴冷的风,一阵阴风吹过荒凉的原野。
51527,1,压力锅,yālìguō,,,名,高压锅,
51529,1,钻牛角尖,zuānniújiǎojiān,,,,比喻死抠无法解决或没有价值的问题,
51530,1,笼屉,lóngtì,,,名,蒸食物的厨具，多为圆形，中间有屉，多用竹、木、铝、铁皮等制成,
51534,1,怀乡,huáixiāng,,,动,怀念故乡,
51535,1,匪帮,fěibāng,,,名,盗匪集团；行为像盗匪一样的政治集团,
51536,1,干鲜果品,gān-xiān guǒpǐn,,,,干果和鲜果,
51538,1,褥疮,rùchuāng,,,名,因长期卧床，局部皮肤、肌肉受压迫坏死而导致的溃疡,
51539,1,过礼,guòlǐ,,,动,旧指婚前男女双方互送礼物；特指男方把彩礼送给女方,
51540,1,艄公,shāogōng,,,名,木船上掌舵的人；泛指船夫,
51541,1,海涂,hǎitú,,,名,河流入海处或海岸附近泥沙沉积形成的滩地。可用来养殖或围垦,
51542,1,吃皇粮,chīhuángliáng,,,,比喻在党政机关、军队或靠国家财政发放工资的事业单位工作,
51543,1,采录,cǎilù,,,动,搜集并记录,采录民间故事
51543,2,采录,cǎilù,,,动,采访并录制,电视台来人采录节目。
51546,1,脱臼,tuōjiù,,,动,脱位,
51551,1,陶陶,táotáo,,,形,形容快乐的样子,其乐陶陶
51552,1,归期,guīqī,,,名,回去的日期,归期已近
51553,1,旧宅,jiùzhái,,,名,以前住过的住宅,变卖旧宅｜鲁迅旧宅
51558,1,汉语水平考试,hànyǔ shuǐpíng kǎoshì,,,,为母语非汉语的人（主要是外国人）测试汉语水平而设立的标准化考试。缩写为HSK,
51560,1,正剧,zhèngjù,,,名,戏剧的一种类型。兼有悲剧和喜剧的因素，剧情以表现严肃冲突为主。,
51561,1,粟米,sùmǐ,,,名,粟的籽实,
51561,2,粟米,sùmǐ,,,名,某些地区指玉米的籽实,
51563,1,临空,línkōng,,,动,当空；在天空,烈日临空
51564,1,慈眉善目,címéi-shànmù,,,,慈祥和善的面容,这位老人慈眉善目，和蔼可亲。
51565,1,五谷杂粮,wǔgǔ záliáng,,,,指各种粮食,
51568,1,畏途,wèitú,,,名,艰险可怕的路途；比喻不敢做的事情,视为畏途
51570,1,膨大,péngdà,,,动,体积胀大,干银耳放到水里浸泡，很快便膨大起来。
51571,1,薄饼,báobǐng,,,名,很薄的饼，品种很多；特指用烫面做成的很薄的饼，两张相叠，烙熟后可揭开，把肉、菜等卷在里边吃,
51572,1,晚景,wǎnjǐng,,,名,晚境,
51572,2,晚景,wǎnjǐng,,,名,傍晚的景色,
51573,1,以毒攻毒,yǐdú-gōngdú,,,,用毒性药物攻治毒疮等疾病；比喻针锋相对，以比对方更厉害的手段制服对方,
51574,1,拱顶,gǒngdǐng,,,名,拱券（xuàn）的顶部,
51576,1,血友病,xuèyǒubìng,,,名,一种先天性出血疾病，因血液中缺乏抗血友病球蛋白引起。特征是全身各处都易自发出血，或受轻微损伤后出血不止,
51577,1,塔吊,tǎdiào,,,名,塔式起重机。机身很高，耸立如塔，有伸出的长臂，可以在轨道上移动，把重物转移,
51580,1,息怒,xīnù,,,动,止怒；消除恼怒,请您息怒
51586,1,老本行,lǎoběnháng,,,名,指曾经长期从事并具有丰富经验的行业或工作,教书是他的老本行。
51587,1,人防工程,rénfáng gōngchéng,,,,人民防空工程的简称,
51588,1,论敌,lùndí,,,名,辩论或争论的对手,
51589,1,复业,fùyè,,,动,停业后又恢复营业,
51589,2,复业,fùyè,,,动,改行后又恢复本业,
51590,1,略胜一筹,lüèshèng-yīchóu,,,,两相比较，略微好一点儿（筹：指筹码）,
51592,1,眼袋,yǎndài,,,名,下眼皮下微微凸出的部位（中老年肌肉松弛后特别明显）,
51595,1,意见箱,yìjiànxiāng,,,名,为征求意见而设的小箱子,
51596,1,别有风味,biéyǒu-fēngwèi,,,,另有一番特色或情趣,
51597,1,癞子,làizi,,,名,指头上长黄癣的人,
51597,2,癞子,làizi,,,名,黄癣,
51598,1,金丝雀,jīnsīquè,,,名,鸟，体长12—14厘米，比麻雀瘦小，羽毛颜色多种多样。啼声婉转动听，是一种观赏鸟,
51602,1,哭鼻子,kūbízi,,,,哭的诙谐说法,长大了，不能再哭鼻子了。
51603,1,补遗,bǔyí,,,动,因书籍、文章内容有遗漏而在正文后或另外撰文、著书加以增补,
51607,1,退席,tuìxí,,,动,退出会议、宴席等场所,
51608,1,山毛榉,shānmáojǔ,,,名,落叶乔木，高可达25米，叶卵形，边缘呈疏锯齿状。木材可供建筑、制家具等用,
51609,1,驯兽,xùnshòu,,,动,使野兽驯顺,驯兽员｜在马戏团里驯兽
51609,2,驯兽,xùnshòu,,,名,驯顺的兽类,
51610,1,散佚,sànyì,,,动,（图书、文稿等）散失,几经迁徙，书稿散佚过半。
51611,1,射流,shèliú,,,名,从喷嘴中以一定速度喷射出来的束状的流体,
51613,1,覆舟,fùzhōu,,,动,使船翻覆；比喻使倒台、覆灭,水可载舟，亦可覆舟。
51616,1,原形毕露,yuánxíng-bìlù,,,,本来的样子完全暴露（毕：全部）。指伪装被剥掉，露出真面目,
51617,1,秒表,miǎobiǎo,,,名,测定较短时间间隔的仪表。测量的最小数值可达1/5秒到1/1000秒。广泛用于科学研究、体育运动等方面,
51618,1,别具匠心,biéjù-jiàngxīn,,,,另有一番独特而巧妙的构思,
51619,1,温湿,wēnshī,,,形,温暖潮湿,江南温湿的气候
51621,1,炉台,lútái,,,名,炉子口周围可以放东西的平台,
51622,1,正误,zhèngwù,,,名,正确的和错误的,不辨正误
51622,2,正误,zhèngwù,,,动,纠正（文字）错误,纠错正误
51623,1,血证,xuèzhèng,,,名,带有血迹的杀人证物,
51624,1,顺情,shùnqíng,,,副,顺着别人的情绪、意愿,顺情说好话
51627,1,泥瓦匠,níwǎjiàng,,,名,从事砌砖、盖瓦等工作的手艺人,
51629,1,小葱,xiǎocōng,,,名,葱的一种。分蘖性强，茎、叶较细软，有辛辣香味。是普通蔬菜，多用作佐料,
51630,1,独出心裁,dúchū-xīncái,,,,原指写诗、作画构思独特，不同一般；后泛指想法或办法新颖奇特,
51632,1,奉公守法,fènggōng-shǒufǎ,,,,奉行公事，遵守法令。指以公事为重，不徇私情,
51633,1,恶俗,èsú,,,形,粗野庸俗,语言恶俗
51633,2,恶俗,èsú,,,名,不良的习俗,颓风恶俗
51634,1,舟楫,zhōují,,,名,船和桨；借指船只,仗舟楫，远涉重洋。
51637,1,佝偻病,gōulóubìng,,,名,缺乏维生素D引起的钙、磷代谢障碍性疾病。主要症状为鸡胸、驼背、下肢弯曲等,
51638,1,闭锁,bìsuǒ,,,动,关闭封锁，与外界隔绝,闭锁斗室，冥思苦想｜闭锁装置
51638,2,闭锁,bìsuǒ,,,动,医学上指机体的某些通道严密闭合,小肠闭锁
51639,1,专名,zhuānmíng,,,名,专用于某一特定对象的名称。如人名、地名、机构名、朝代名、年号等,
51640,1,停播,tíngbō,,,动,停止播放,节目因故停播
51641,1,准星,zhǔnxīng,,,名,枪口上端瞄准装置的一部分,
51641,2,准星,zhǔnxīng,,,名,定盘星,
51643,1,星团,xīngtuán,,,名,由十几颗至千万颗恒星组成的，有共同起源、相互间有较强力学联系的天体集团,
51644,1,挨整,áizhěng,,,动,遭受打击迫害,不怕挨整
51645,1,妙招,miàozhāo,,,名,巧妙的手段或计策；高招儿,
51649,1,头重脚轻,tóuzhòng-jiǎoqīng,,,,头部沉重，腿脚发轻；比喻基础不稳固；也比喻事物前后或上下不协调,
51651,1,作践,zuòjian,,,动,糟蹋,别作践自己
51652,1,博雅,bóyǎ,,,形,学问渊博，品行端正,博雅君子
51653,1,清库,qīngkù,,,动,把仓库里的货物出清,服装清库甩卖
51653,2,清库,qīngkù,,,动,【清仓】清理查点仓库中所存的物资,年终清库核对
51653,3,清库,qīngkù,,,动,清理水库,淤积严重，要趁旱季清库。
51653,4,清库,qīngkù,,,动,指删除计算机库存文件中的所有记录,
51654,1,滴水成冰,dīshuǐ-chéngbīng,,,,水一滴下来就结成冰。形容天气非常寒冷,
51655,1,巡夜,xúnyè,,,动,夜间巡逻,厂里每天都有人巡夜。
51657,1,狂涛,kuángtāo,,,名,巨大、凶猛的波涛,狂涛拍打着船舷
51658,1,断根,duàngēn,,,动,彻底根除,这种药能使你的病断根。
51658,2,断根,duàngēn,,,动,没有子孙后代延续,
51659,1,远祖,yuǎnzǔ,,,名,很多代以前的祖先,人类的远祖是类人猿。
51660,1,故伎重演,gùjì-chóngyǎn,,,,再一次玩弄以前惯用的手段,
51661,1,翕动,xīdòng,,,动,（嘴唇等）一开一合或一张一收地动,鼻翼翕动
51662,1,起皱,qǐzhòu,,,动,物体表面因收缩或搓弄而出现皱纹或褶子,皮肤起皱｜衣服揉得起皱了
51663,1,魂不守舍,húnbùshǒushè,,,,灵魂离开了身体。形容神志不清，精神不集中；也形容非常惧怕,
51666,1,冬令营,dōnglìngyíng,,,名,冬季开设的供青少年等短期休息、娱乐和开展各种活动的营地,
51667,1,大智若愚,dàzhì-ruòyú,,,,才智很高却不外露，看上去好像有些愚蠢,
51668,1,麦浪,màilàng,,,名,大片的麦子随风起伏像波浪一样的景象,金黄色的麦浪
51669,1,天条,tiāntiáo,,,名,迷信指天帝所定的法规、律条,犯了天条，打入地狱。
51669,2,天条,tiāntiáo,,,名,指太平天国所定的法律、法规,
51671,1,丑八怪,chǒubāguài,,,名,指长得丑陋的人,
51672,1,散养,sǎnyǎng,,,动,分散养殖或放养（畜禽等）,
51674,1,从一而终,cóngyī'érzhōng,,,,旧礼教指妇女一生只嫁一个丈夫，丈夫死了也不再嫁；也比喻忠臣不事二主,
51676,1,廊子,lángzi,,,名,有顶的过道。有的在屋檐下，有的独立建在室外,
51677,1,灯市,dēngshì,,,名,元宵节前后出售花灯的集市或悬挂花灯的街市,
51679,1,深仇大恨,shēnchóu-dàhèn,,,,非常深非常大的仇恨,
51680,1,地方主义,dìfāng zhǔyì,,,,片面强调地方局部利益而不顾国家和别地利益的错误思想和行为,
51681,1,矫捷,jiǎojié,,,形,矫健敏捷,身手矫捷
51683,1,退走,tuìzǒu,,,动,向后退去,洪水已经退走
51683,2,退走,tuìzǒu,,,动,败退,关羽退走麦城
51685,1,举兵,jǔbīng,,,动,兴兵；起兵,敌人举兵犯境｜举兵东进
51688,1,昏乱,hūnluàn,,,形,（头脑、神志）昏沉迷乱,脑子里一片昏乱
51688,2,昏乱,hūnluàn,,,形,〈文〉政治黑暗，社会混乱,
51690,1,归依,guīyī,,,动,投靠；依附,身心有所归依
51693,-1,春宫,chūngōng,,,名,封建社会皇太子所住的宫室,
51693,-1,春宫,chūngōng,,,名,借指性活动,春宫图
51698,1,嫩黄,nènhuáng,,,形,浅黄,小鸡毛色嫩黄，惹人喜爱。
51701,1,冰镇,bīngzhèn,,,动,把食物、饮料等放到冰块或冰箱、冰柜中使变凉,把啤酒冰镇起来｜冰镇饮料
51702,1,电力线,diànlìxiàn,,,名,输送电力的导线,
51703,1,臂力,bìlì,,,名,臂膀的力量,
51705,1,挺括,tǐngkuò,,,形,（服装、面料、纸张等）直挺平整，没有皱褶（zhě）,这套西装很挺括
51707,1,天王星,tiānwángxīng,,,名,太阳系八大行星之一，按距离太阳由近及远的次序排为第七颗,
51708,1,橡皮筋,xiàngpíjīn,,,名,用橡胶制成的线状或环状物品，有弹性，多用来捆扎东西,
51709,1,窖藏,jiàocáng,,,动,在地窖里储藏,窖藏大白菜
51711,1,超低温,chāodīwēn,,,名,物理学上指低于272.15℃的温度,
51714,1,活见鬼,huójiànguǐ,,,形,形容对事物的发生感到不可思议,刚出门就摔了一跤，这不是活见鬼吗!
51715,1,家天下,jiātiānxià,,,,指帝王把国家作为自己一家的私产而世代相传的制度,
51716,1,诊断书,zhěnduànshū,,,名,医生根据对病症的判断写出的书面报告,
51717,1,官能症,guānnéngzhèng,,,名,生物体器官出现的生理功能障碍，属非器质性症状。如神经官能症,
