rank,sn,cihui,pinyin,ref_hanzi,ref_pinyin,pos,definition,example
72804,1,熟手,shúshǒu,,,名,对某项工作或技巧熟悉的人,修理手表，他是熟手。
72806,1,旱井,hànjǐng,,,名,为了积蓄雨水而挖的井，口小膛大，比水井浅，多见于水源缺少的地区,
72806,2,旱井,hànjǐng,,,名,用于贮藏蔬菜、薯类等的井式地窖,
72807,1,伴郎,bànláng,,,名,举行婚礼时陪伴新郎的男子,
72814,1,嚅动,rúdòng,,,动,因想说话而嘴唇微动,急得他嚅动着嘴巴却说不出话来
72815,1,水葱,shuǐcōng,,,名,多年生草本植物，根状茎粗壮，匍匐，秆圆柱形，叶片条形，夏季开花。生于湖边或浅水中。秆可以编席或作造纸原料，根可以做药材,
72819,1,摸彩,mōcǎi,,,动,在博彩活动中，用手从许多彩券中摸出一张，根据券面所示确定是否中彩。,
72831,1,投药,tóuyào,,,动,投放药物,在老鼠出没的地方投药｜鱼塘要定时投药消毒。
72832,1,眼跳,yǎntiào,,,动,眼皮跳动，多由眼睛疲劳引起。迷信认为是某种预兆,
72834,1,财礼,cáilǐ,,,名,彩礼,
72835,1,旋绕,xuánrào,,,动,环绕；缠绕,小狗旋绕着我撒欢儿｜这个小装饰是用彩线一圈圈旋绕成的。
72836,1,义冢,yìzhǒng,,,名,埋葬无主尸骨的坟墓,
72842,1,麂子,jǐzi,,,名,麂的通称,
72844,1,侦听,zhēntīng,,,动,为侦察对方的活动而暗中监听,
72846,1,竹帛,zhúbó,,,名,竹简和丝绢。古代用来书写文字；也借指典籍,
72848,1,舒筋活血,shūjīn-huóxuè,,,,使筋骨舒展自如，使血液循环畅通,
72849,1,浮漂,fúpiāo,,,动,【漂浮】漂,木板在水上浮漂着。
72849,2,浮漂,fúpiāo,,,名,渔漂,
72849,3,浮漂,fúpiāo,,,形,比喻做事不踏实，不深入,工作切忌浮漂
72852,1,超俗,chāosú,,,动,摆脱世俗的束缚；不落俗套,言行超俗
72854,1,哀泣,āiqì,,,动,悲哀地哭泣,孤苦无依，哀泣不止。
72855,1,彩门,cǎimén,,,名,用彩绸、花卉等装饰的门。多用于喜庆、纪念等活动,
72856,1,承做,chéngzuò,,,动,承接制作,承做各类广告
72857,1,外径,wàijìng,,,名,外圆的直径（跟“内径”相区别）,
72858,1,傻瓜相机,shǎguā xiàngjī,,,,自动或半自动照相机的俗称。照相时操作简单，一般不需要调焦距、选择光圈和测算曝光时间等。因易于操作，几乎连傻瓜都会用，故称,
72860,1,催芽,cuīyá,,,动,用温水浸泡、药剂处理等人工方法促使种子、薯块、枝条等提前发芽,
72862,1,惹气,rěqì,,,动,招致生气或不快,何苦为这点小事惹气。
72863,1,电烫,diàntàng,,,动,利用电热烤烫头发，使形成一定的发型,
72864,1,脱卸,tuōxiè,,,动,拆开取下,这种轮椅的扶手可以脱卸。
72864,2,脱卸,tuōxiè,,,动,开脱推卸,责任分明，不可脱卸。
72866,1,装裹,zhuāngguo,,,名,给死人穿戴的衣物,
72866,2,装裹,zhuāngguo,,,动,给死人穿戴衣帽等物,
72870,1,发糕,fāgāo,,,名,用米粉、面粉、玉米面等经发酵蒸成的松软的糕,
72871,1,兵蚁,bīngyǐ,,,名,蚂蚁中的一类。头大体壮，无翅。守卫蚁巢并与敌蚁进行战斗,
72872,1,雨意,yǔyì,,,名,要下雨的征候,雨意正浓
72877,1,面斥,miànchì,,,动,当面训斥,面斥不良行为
72881,1,筋道,jīndao,,,形,〈口〉形容食物有韧性，有嚼头,刀削面吃起来筋道，就是不易消化。
72881,2,筋道,jīndao,,,形,〈口〉身体硬朗,老人身体筋道着呢。
72885,1,失脚,shījiǎo,,,动,走路不小心跌倒,
72892,1,庭训,tíngxùn,,,动,父亲的教诲；泛指长辈或上级的教育劝导,幼承庭训
72897,1,幽寂,yōujì,,,形,幽静寂寞,幽寂的古庙
72898,1,顶角,dǐngjiǎo,,,名,数学上指三角形中跟底边相对的角；锥体中跟底面相对的立体角,
72907,1,坐夜,zuòyè,,,动,坐着守夜,坐夜看护
72911,1,怡悦,yíyuè,,,形,愉快喜悦,怡悦的心情
72916,1,垂吊,chuídiào,,,动,悬挂,宫灯垂吊两旁
72920,1,凭仗,píngzhàng,,,动,凭借；依仗,凭仗质优取胜
72922,1,闲云野鹤,xiányún-yěhè,,,,像天空中随意飘动的云彩，山野中自由自在的仙鹤。旧时比喻不受世事拘束的隐士、出家人等；现多比喻潇洒自在、无拘无束的人,
72933,1,电烙铁,diànlàotie,,,名,小型电焊工具，由电热丝、烙铁头和手柄组成。通电后电热丝发热，传导到烙铁头，用以熔化焊料，进行焊接,
72934,1,湘妃竹,xiāngfēizhú,,,名,斑竹。相传帝舜南巡苍梧而死，他的两个妃子娥皇、女英在湘水上望着苍梧山哭泣，眼泪洒在竹子上，成了斑点，故称,
72935,1,赶得及,gǎndejí,,,动,来得及,火车7点钟开，抓紧点儿还赶得及。
72936,1,吃偏饭,chīpiānfàn,,,,比喻享受特殊待遇或照顾,
72936,2,吃偏饭,chīpiānfàn,,,,在共同生活中搞特殊，吃高于一般标准的饭食,
72941,1,闽方言,mǐnfāngyán,,,名,汉语七大方言之一，包括闽北和闽南方言。闽北方言主要分布在福建北部地区，闽南方言主要分布在福建南部、广东东部、海南一部分和台湾大部分地区,
72951,1,坐机关,zuòjīguān,,,,指在机关里工作,毕业后没有坐机关，而是下了生产第一线。
72953,1,八字脚,bāzìjiǎo,,,名,行走时两脚向内或向外成“八”字形的脚,
72954,1,转关系,zhuǎnguānxi,,,,调动工作时把党派或团体的组织关系转移到新的单位,
72955,1,打秋风,dǎqiūfēng,,,,旧时指找借口向别人索取钱物,
72958,1,大概其,dàgàiqí,,,副,【大概】表示估计,
72958,2,大概其,dàgàiqí,,,形,【大概】区别不很准确或不很详尽的,
72958,3,大概其,dàgàiqí,,,名,【大概】大体情况；大致内容,
72960,1,信号枪,xìnhàoqiāng,,,名,发射信号弹用的枪,
72961,1,刘海儿,liúhǎir,,,名,传说中的仙童。他前额垂着短发，骑在蟾蜍上，手舞钱串子；后借指妇女或儿童披在前额的整齐短发,
72969,1,一程子,yīchéngzi,,,,一些日子；一段时间,这一程子身体不太好。
72970,1,流失生,liúshīshēng,,,名,指义务教育阶段中途辍学的学生,要让流失生尽快复学。
72971,1,鼠标器,shǔbiāoqì,,,名,电子计算机的一种信息输入设备，有导线和主机相连，由手掌半握着在桌面上移动以调控显示器上的光标。外形像拖着长尾巴的老鼠，故称。简称鼠标,
72972,1,出门子,chūménzi,,,动,出嫁,
72978,1,无可讳言,wúkěhuìyán,,,,没有什么不可以直说的（讳言：因忌讳或有顾虑而有话不说）。表示可以坦率地说出来,
72979,1,吃馆子,chīguǎnzi,,,,在饭馆里就餐,
72984,1,夙兴夜寐,sùxīng-yèmèi,,,,早起晚睡。形容勤奋不懈,
72989,1,小而言之,xiǎo'éryánzhī,,,,从小的方面来说,
72995,1,仁义之师,rényìzhīshī,,,,为仁爱和正义而战斗的军队,
72997,1,东郭先生,dōngguō xiānsheng,,,,明·马中锡《中山狼传》记载：东郭先生曾想方设法救助一只被人追逐的中山狼，结果险些被狼吃掉。后用“东郭先生”借指对坏人讲仁慈的糊涂人,
73006,1,淡妆浓抹,dànzhuāng-nóngmǒ,,,,宋·苏轼《饮湖上初晴后雨》：“欲把西湖比西子，淡妆浓抹总相宜。”意思是西湖就像西施一样，无论打扮得素雅还是浓艳都很漂亮。后用“淡妆浓抹”形容人的不同打扮,
73023,1,无妄之灾,wúwàngzhīzāi,,,,无缘无故遭受的灾祸,
73039,1,尖嘴猴腮,jiānzuǐ-hóusāi,,,,尖嘴巴，瘦面颊。形容人脸庞瘦削，相貌丑陋,
73044,1,派不是,pàibùshi,,,,指责别人不对,自己不干，还老派别人的不是，这怎么行?
73045,1,内掌柜,nèizhǎngguì,,,名,指掌柜（商店老板）的妻子；泛指主妇（含谐谑意）,
73049,1,送话器,sònghuàqì,,,名,电话机等的传声器。能把话音转换为声频电信号，传送到对方的受话器中,
73051,1,瞌睡虫,kēshuìchóng,,,名,指经常打瞌睡的人（含讥讽意）,
73051,2,瞌睡虫,kēshuìchóng,,,名,神话中指能使人打瞌睡的虫子,
73066,1,下三烂,xiàsānlàn,,,形,下流，不自重，没出息,一副下三烂的样子。
73066,2,下三烂,xiàsānlàn,,,名,指下三烂的人,
73072,1,麦秋,màiqiū,,,名,麦子成熟和收割的季节，一般在夏季（秋：指庄稼成熟的季节）,
73076,1,扳子,bānzi,,,名,【扳手】用来拧紧或旋松螺钉、螺母等的工具,
73080,1,稗草,bàicǎo,,,名,稗子,
73084,1,破陋,pòlòu,,,形,残破简陋,小屋破陋不堪
73085,1,蛇足,shézú,,,名,蛇本没有足，有人画蛇时硬添上足。比喻多余无用的事物,蛇足宜删
73088,1,抓壮丁,zhuāzhuàngdīng,,,,旧时官府强行抓青壮年男子去当兵,
73090,1,台秤,táichèng,,,名,用金属制成，有固定的承重底座作为放置被称物的一种秤,
73090,2,台秤,táichèng,,,名,案秤,
73091,1,诬害,wūhài,,,动,捏造罪名陷害他人,受人诬害
73093,1,槽钢,cáogāng,,,名,横断面呈凹字形的长条钢材,
73094,1,草标,cǎobiāo,,,名,旧时集市上插在物品上的草束，作为出售的标志；也插在人身上作为卖身的标志,
73100,1,典册,diǎncè,,,名,典籍,
73101,1,被絮,bèixù,,,名,夹在被面和被里之间的胎，多用棉花、丝绵、腈纶棉、太空棉等制成,
73103,1,凋萎,diāowěi,,,动,凋零枯萎,
73105,1,忙音,mángyīn,,,名,电话拨号后发出的连续而短促的嘟嘟声。表示线路被占，暂时无法通话,
73112,1,群魔乱舞,qúnmó-luànwǔ,,,,各种妖魔鬼怪胡蹦乱跳。比喻一群坏人猖狂活动,
73113,1,蟒袍,mǎngpáo,,,名,传统戏曲中帝王将相、后妃等角色的袍服，绣有金色的蟒纹,
73113,2,蟒袍,mǎngpáo,,,名,明清两代大臣的礼服，袍上绣有金色的蟒纹,
73114,1,高八度,gāobādù,,,形,形容说话人的嗓门儿高,她常以高八度的嗓门说话。
73118,1,绢本,juànběn,,,名,写或画在绢上的字画,珍藏著名书法家的绢本｜绢本花卉
73124,1,温吞水,wēntunshuǐ,,,名,比喻不爽利的性格、作风等；也比喻没有达到应有程度的事物,他是个温吞水，干活儿拖拖拉拉的｜这场球简直踢成了温吞水。
73124,2,温吞水,wēntunshuǐ,,,名,不冷不热的水,
73125,1,打不住,dǎbuzhù,,,,不止（某一数量）,这筐苹果50斤打不住。
73125,2,打不住,dǎbuzhù,,,,不够用,这么多人吃饭，10斤米怕打不住。
73129,1,外姓人,wàixìngrén,,,名,本姓氏以外的人,
73131,1,堵心,dǔxīn,,,形,心里憋得慌,别提多堵心啦!
73132,1,担担面,dàndànmiàn,,,名,四川风味的面食，在煮熟的面条中放入葱花、姜末、川冬菜、花椒、辣椒油等调料。因旧时多沿街挑担叫卖，故称,
73138,1,凶年,xiōngnián,,,名,因灾害多而农作物收成很坏的年份,
73143,1,扶掖,fúyè,,,动,扶助；帮助（多用于上级对下级，长辈对晚辈）,扶掖后进
73143,2,扶掖,fúyè,,,动,搀扶,
73153,1,笆斗,bādǒu,,,名,用柳条或竹篾等编成的形状像斗的容器，用于装东西。,（也说栲栳。）
73156,1,贼眉鼠眼,zéiméi-shǔyǎn,,,形,形容鬼鬼祟祟或邪恶不正的样子,
73166,1,销子,xiāozi,,,名,形状像钉子的圆棍，用来插在两个部件中使连接或固定（也说销钉）。,
73172,1,肚带,dùdài,,,名,系在马、骡等肚子上的皮带，用来将鞍子等固定在背上,
73178,1,泛酸,fànsuān,,,动,胃酸上涌,吃凉白薯容易泛酸。
73179,1,棋具,qíjù,,,名,下棋的用具，包括棋盘、棋子等,
73180,1,反噬,fǎnshì,,,动,反咬,盗窃者反噬他人为盗。
73186,1,心心相连,xīnxīn-xiānglián,,,,彼此心意相通，思想一致，感情相投,
73187,1,门匾,ménbiǎn,,,名,挂在门额上的匾,
73188,1,黑货,hēihuò,,,名,指偷漏税款或违犯禁令的货物,查抄黑货｜偷运黑货
73188,2,黑货,hēihuò,,,名,比喻反动腐朽的思想、文化等,贩卖封建主义的黑货。
73190,1,缠磨,chánmo,,,动,纠缠不休,孩子缠磨着妈妈要买玩具。
73191,1,缠扰,chánrǎo,,,动,纠缠；搅扰,各种不顺心的事缠扰着他。
73195,1,舞迷,wǔmí,,,名,对跳舞特别迷恋的人,
73197,1,搭帮,dābāng,,,动,结为同伴；合伙,咱们俩人搭帮开个饭馆吧。
73199,1,支子,zhīzi,,,名,支架,车支子
73199,2,支子,zhīzi,,,名,架在火上烤肉用的有腿的箅（bì）子,
73200,1,焦枯,jiāokū,,,形,（植物）干燥枯萎,焦枯的秧苗
73204,1,盟书,méngshū,,,名,古代举行歃血盟礼时定下的誓约；后泛指誓约文书,
73207,1,猛男,měngnán,,,名,指身体强壮且具有阳刚之气的男子,他堪称猛男
73211,1,茕茕孑立,qióngqióng-jiélì,,,文,孤孤单单地站在那儿。形容无依无靠,
73212,1,覆水难收,fùshuǐ-nánshōu,,,,泼在地上的水难以收回。比喻事情已成定局，无法挽回,
73217,1,心中有鬼,xīnzhōng-yǒuguǐ,,,,比喻心里有不可告人的打算或秘密,
73218,1,交寄,jiāojì,,,动,交付邮局寄出,交寄信件
73231,1,风灯,fēngdēng,,,名,一种有罩的、可以防风雨的油灯,
73235,1,土名,tǔmíng,,,名,某个地区使用的名称,
73239,1,小广播,xiǎoguǎngbō,,,名,指私下传播的消息或私下传播消息的人,
73239,2,小广播,xiǎoguǎngbō,,,名,传播范围小的有线广播,
73251,1,四方步,sìfāngbù,,,名,指斯斯文文、悠闲稳重的步子,迈着四方步
73253,1,便宜行事,biànyí-xíngshì,,,,可以根据具体情况自行处理事务,授权他便宜行事
73254,1,白蒙蒙,báiméngméng,,,形,形容水汽、烟雾等弥漫四周，眼前一片白，看不清楚,
73257,1,分式,fēnshì,,,名,除法运算中除式里含有字母的有理代数式。如1/x，a/b,
73258,1,虎踞龙盘,hǔjù-lóngpán,,,,像虎一样蹲着，像龙一样盘着。形容地势雄伟险要,
73261,1,追叙,zhuīxù,,,名,一种写作手法，先展示结局或矛盾斗争最尖锐、最突出的部分，然后再回过头来叙述经过,
73261,2,追叙,zhuīxù,,,动,追忆叙述,
73262,1,河南梆子,hénán bāngzi,,,,豫剧,
73266,1,惠赠,huìzèng,,,动,敬词，用于指别人赠送给自己（物品）,砚台为恩师惠赠，珍藏至今。
73269,1,征聘,zhēngpìn,,,动,招聘,征聘高级技工
73277,1,七零八碎,qīlíng-bāsuì,,,,零七八碎,
73282,1,简省,jiǎnshěng,,,动,把繁琐的、不必要的省去,简省手续｜简省程序
73294,1,凝冻,níngdòng,,,动,凝聚冻结,
73296,1,莫此为甚,mòcǐwéishèn,,,,没有比这更严重的了。形容程度严重到了极点,
73298,1,窗机,chuāngjī,,,名,窗式空调机,
73301,1,襄理,xiānglǐ,,,名,银行或较大的企业中，协助经理工作的人,
73301,2,襄理,xiānglǐ,,,动,〈文〉协助办理,
73302,1,继室,jìshì,,,名,原配妻子死后续娶的妻子,
73303,1,抵交,dǐjiāo,,,动,用别的东西代替需要交纳的钱或物；抵偿交付,以劳务抵交欠款
73304,1,澳抗,àokàng,,,名,人体感染乙型肝炎病毒后产生的抗体。因科学家最先从一位澳大利亚土著人的血液中发现，故称,
73309,1,暗线,ànxiàn,,,名,秘密为己方侦察或做内应的人,
73309,2,暗线,ànxiàn,,,名,文学作品中没有直接描写人物活动或事件进展，而是间接显示出来的故事线索,小说篇幅虽短，但明线与暗线交错，内容十分丰富。
73312,1,漏光,lòuguāng,,,动,胶片等感光材料因封闭不严而感光,
73313,1,急湍,jítuān,,,名,急流,急湍飞瀑，气象万千。
73314,1,出将入相,chūjiàng-rùxiàng,,,,出战可以领兵为将，入朝可以理政为相。形容人文武双全；也指出任高官要职,
73317,1,炎暑,yánshǔ,,,名,酷热的暑天,去海滨避炎暑
73317,2,炎暑,yánshǔ,,,名,炎热的暑气,马路上炎暑难当
73325,1,极昼,jízhòu,,,名,极圈以内地区，每年夏季有一段时间每天24小时都是白天，这种现象叫做极昼,
73328,1,颠茄,diānqié,,,名,多年生草本植物，有毒，叶和根含有莨菪（làngdàng）碱，可制成浸膏和酊剂，供药用,
73330,1,随大溜,suídàliù,,,,按照多数人的观点说话或行事（溜：急速的水流）,
73337,1,薄荷脑,bòhenǎo,,,名,一种芳香清凉剂。可从薄荷油中分离而得，也可用化学方法合成，用于制作牙膏、食品等，也供药用,
73339,1,款步,kuǎnbù,,,动,缓慢行走,款步林间小路
73340,1,混声,hùnshēng,,,名,合唱的一种形式，男女声混合共同演唱同一乐曲。如混声四部合唱，包括女高音、女低音、男高音、男低音四个声部,
73341,1,停妥,tíngtuǒ,,,形,停当；妥帖,安置停妥
73349,1,抛离,pāolí,,,动,丢下不管而离去,抛离妻儿，远走他乡。
73351,1,接茬儿,jiēchár,,,动,接着别人的话茬儿说下去,我还没说完呢，你少接茬儿!
73351,2,接茬儿,jiēchár,,,动,继续做已经在做的事或紧接着做另一件事,我先接个电话，然后咱们再接茬儿聊｜上午上课，下午接茬儿又去搞实验
73360,1,续假,xùjià,,,动,在原定假期之后继续请假,因事续假三天
73368,1,干松,gānsong,,,形,干燥蓬松,被子晒一晒就干松了。
73368,2,干松,gānsong,,,形,（土地、道路等）不潮湿,土质太干松，影响作物根系生长。
73369,1,呈子,chéngzi,,,名,旧时称老百姓呈递给官府的文书,
73372,1,排卵期,páiluǎnqī,,,名,从排卵开始到排卵结束的一段时间,
73373,1,煞尾,shāwěi,,,动,结束；收尾,工程进入煞尾阶段。
73373,2,煞尾,shāwěi,,,名,文章或事情的末尾部分,文章的煞尾意味深长。
73375,1,碑额,bēi'é,,,名,碑的上部。上面常刻有图案或题字,
73384,1,皮带轮,pídàilún,,,名,机器上安装传动带的轮子,
73385,1,抽换,chōuhuàn,,,动,把某物从中取出并换上另外的东西；调换,我想抽换这篇文章。
73391,1,知人之明,zhīrénzhīmíng,,,,识别人品德、才能高下的眼力（明：眼力）,
73392,1,削铁如泥,xuētiě-rúní,,,,切削铁器就如同削泥土一样。形容兵刃极其锋利,
73395,1,爆破筒,bàopòtǒng,,,名,用于爆破的筒状器物，在钢管内装有炸药、雷管等,
73398,1,炭画,tànhuà,,,名,用炭笔或炭粉等绘成的画,
73412,1,无所措手足,wúsuǒ cuò shǒuzú,,,,手脚不知放在什么地方才合适。形容不知如何是好,
73420,1,雪冤,xuěyuān,,,动,洗刷冤屈,
73428,1,难上难,nánshàngnán,,,形,形容非常困难,
73435,1,穿心莲,chuānxīnlián,,,名,一年生草本植物，茎直立，四棱形，多分枝，叶对生，椭圆形或披针形，花白色或淡紫色。全草可以做药材,
73445,1,物阜民丰,wùfù-mínfēng,,,,物产丰盛，人民富足（阜：盛多）,政通人和，物阜民丰。
73452,1,印子钱,yìnziqián,,,名,旧时的一种高利贷，借贷人按放贷人的苛刻要求分期偿还贷款，每偿还一次都在折子上盖一个印作为凭证,
73453,1,借花献佛,jièhuā-xiànfó,,,,比喻用别人的东西做人情,
73457,1,拒人千里,jùrén-qiānlǐ,,,,把人挡在千里之外。形容对人态度非常傲慢，不愿与人接触或商谈,
73458,1,狗胆,gǒudǎn,,,名,用于贬称人干坏事的胆量,
73460,1,妻舅,qījiù,,,名,妻子的弟兄,
73462,1,演期,yǎnqī,,,名,演出日期或期限,抓紧排练，别耽误了演期︱演期延长三天。
73463,1,戎机,róngjī,,,名,军事机宜；战争,万里赴戎机
73463,2,戎机,róngjī,,,名,战斗的时机,戎机不可失
73466,1,核垄断,hélǒngduàn,,,动,控制和垄断核武器，不让其他国家拥有,
73467,1,防滑链,fánghuáliàn,,,名,用铁链制成的链网，套在汽车车轮上，防止通过泥泞或冰雪路面时车轮打滑,
73468,1,拾人牙慧,shírényáhuì,,,,比喻抄袭或因袭别人的言论或观点，没有自己的独立见解,
73473,1,诟骂,gòumà,,,动,辱骂,相互诟骂
73479,1,咕叽,gūjī,,,拟声,模拟液体受压向外排出的声音,靴子里进了水，走起路来咕叽咕叽地响。
73479,2,咕叽,gūji,,,动,小声交谈或自言自语,俩人在屋里咕叽了好半天。
73480,1,鱼鳞坑,yúlínkēng,,,名,在山坡上挖的交错排列成鱼鳞状的坑，用以蓄水或植树,
73482,1,吃白饭,chībáifàn,,,,比喻光拿报酬而不做事,一些单位人浮于事，正经干活儿的人不多，吃白饭的倒不少。
73482,2,吃白饭,chībáifàn,,,,吃白食,
73482,3,吃白饭,chībáifàn,,,,只吃饭不就菜,
73484,1,众寡悬殊,zhòngguǎ-xuánshū,,,,双方数量的多少、力量的大小相差很远,
73488,1,薄葬,bózàng,,,动,从简办丧事（跟“厚葬”相对）,
73489,1,穿堂风,chuāntángfēng,,,名,穿过相对的门窗或过道的自然风,
73499,1,上账,shàngzhàng,,,动,记入账簿,收支款项都要及时上账。
73500,1,笃深,dǔshēn,,,形,（感情）深厚,
73502,1,请假条,qǐngjiàtiáo,,,名,为请假而写的便条,
73507,1,魅人,mèirén,,,形,迷人；吸引人,才艺魅人
73509,1,兰花指,lánhuāzhǐ,,,名,拇指和中指向掌内弯曲、其余三指翘起的手势，状似兰花。多运用于传统戏曲旦角的表演,
73510,1,下箸,xiàzhù,,,动,用筷子夹食物（吃）,
73518,1,顺脚,shùnjiǎo,,,副,顺便,你坐车，顺脚把行李带过去。
73518,2,顺脚,shùnjiǎo,,,副,【顺路】表示顺着要去某处的路线（到另一处去）,
73518,3,顺脚,shùnjiǎo,,,形,【顺路】不绕道；方便,
73519,1,瓜蔓,guāwàn,,,名,瓜类植物的茎蔓,
73521,1,打嗝儿,dǎgér,,,动,嗳气的俗称,
73529,1,倒找,dàozhǎo,,,动,该收对方的钱不收，反而拿钱付给对方,这种货，就是倒找我也不要!
73534,1,统舱,tǒngcāng,,,名,客轮底层的大舱。一般不分隔成房间，也无固定的铺位，能容纳较多旅客,
73535,1,倒休,dǎoxiū,,,动,倒换休息的时间,倒休了几个双休日，回老家看看。
73540,1,艳诗,yànshī,,,名,表现男女情爱的诗,
73542,1,兵灾,bīngzāi,,,名,战争造成的灾难,
73547,1,存案,cún'àn,,,动,登记备案,存案备查
73548,1,打滚儿,dǎgǔnr,,,动,躺着来回滚动,疼得直打滚儿｜在地上打滚儿耍赖。
73548,2,打滚儿,dǎgǔnr,,,动,比喻长期处在某种艰难困苦的环境中,他是在那个小山村里打滚儿长大的。
73549,1,倒阁,dǎogé,,,动,一些国家中反对派利用合法手段推翻当权内阁,
73550,1,疑阵,yízhèn,,,名,为迷惑对方而布置的阵势,布下疑阵，只等对方上钩。
73551,1,奋勉,fènmiǎn,,,动,振作勉力,
73555,1,吊钩,diàogōu,,,名,用来吊起物品的钩子,
73561,1,捶击,chuíjī,,,动,用力捶打,
73567,1,汽锤,qìchuí,,,名,蒸汽锤,
73568,1,飘曳,piāoyè,,,动,飘动摇曳,长裙飘曳
73579,1,会账,huìzhàng,,,动,付账（多用于在饭店请人吃饭等）,
73581,1,铆工,mǎogōng,,,名,从事铆接工作的工人,
73581,2,铆工,mǎogōng,,,名,铆接金属的工种,
73582,1,台盘,táipán,,,名,大桌面；席面,台盘上摆满佳肴
73582,2,台盘,táipán,,,名,借指交际应酬或公开的场合,
73583,1,锅饼,guōbǐng,,,名,用含水较少的面团在平底锅里烙成的又厚又硬的大饼,
73589,1,靛青,diànqīng,,,形,深蓝,
73591,1,误期,wùqī,,,动,延误期限,工程误期
73603,1,抢墒,qiǎngshāng,,,动,趁着土壤湿润抢时间播种,
73609,1,启行,qǐxíng,,,动,动身；出发,队伍即刻启行
73610,1,清馨,qīngxīn,,,形,清香,兰花散发清馨的气息。
73621,1,诬指,wūzhǐ,,,动,诬告指控；诬蔑指责,对方倒打一耙，诬指我方挑起事端。
73622,1,坤表,kūnbiǎo,,,名,女式手表,
73626,1,蕴意,yùnyì,,,名,蕴含的意义,蕴意深刻
73627,1,送灶,sòngzào,,,动,旧俗认为农历腊月二十四日为灶君升天奏事的日子，家家户户在前一天的晚上上供祭送灶君,
73631,1,附寄,fùjì,,,动,附带寄送,附寄照片一张
73634,1,蚁后,yǐhòu,,,名,雌蚁,
73638,1,官迷,guānmí,,,名,对当官着迷的人,
73640,1,附载,fùzǎi,,,动,附带记载；附带登录,大会文件汇编附载社论、报道5篇。
73641,1,开冻,kāidòng,,,动,江河湖海解冻；冻土融解,
73642,1,柑子,gānzi,,,名,柑树的果实,
73649,1,木栓,mùshuān,,,名,栓皮栎等树干上的厚栓皮层，可加工成软木，有广泛用途,
73652,1,陪住,péizhù,,,动,陪伴病人住院并负责照料,母亲病重，他在医院陪住一个月。
73652,2,陪住,péizhù,,,动,陪着在一起居住,她胆子小，让我去陪住。
73656,1,重起炉灶,chóngqǐ-lúzào,,,,另起炉灶,
73657,1,黄鼬,huángyòu,,,名,哺乳动物，体型细长，四肢较短，背部棕灰色，胸腹淡黄褐色。肛门旁有臭腺一对，能释放臭气，用以自卫。昼伏夜出，以鼠类等为食，有时也吃家禽。通称黄鼠狼,
73664,1,绣房,xiùfáng,,,名,旧指青年女子的居室,
73668,1,丑星,chǒuxīng,,,名,相貌较丑而演技出众的著名演员；也指著名的丑角演员,
73680,1,铁树开花,tiěshù-kāihuā,,,,铁树（指苏铁）原生长在热带、亚热带，花不常开，移植北方后，多年才开一次；比喻事情特别罕见或极难实现,
73684,1,窗沿,chuāngyán,,,名,窗台,
73685,1,福至心灵,fúzhì-xīnlíng,,,,指人交上好运时，心思也灵巧起来,
73688,1,麻酥酥,másūsū,,,形,形容轻微麻木的感觉,两手冻得麻酥酥的｜吃了颗花椒，舌头麻酥酥的。
73692,1,耆老,qílǎo,,,名,老年人；特指有一定声望的老年人,探访独居耆老
73694,1,蜡丸,làwán,,,名,用蜡皮包裹的丸药,
73694,2,蜡丸,làwán,,,名,用蜡做成的空心球，古代用以封存机密文件，有防潮、防泄露等作用,
73696,1,奇光异彩,qíguāng-yìcǎi,,,,奇异的光亮和色彩,
73703,1,正凶,zhèngxiōng,,,名,凶杀案件中的主要凶手,
