rank,sn,cihui,pinyin,ref_hanzi,ref_pinyin,pos,definition,example
48563,1,累犯,lěifàn,,,动,多次犯罪,
48563,2,累犯,lěifàn,,,名,被判处有期徒刑以上刑罚，服刑完毕或被赦免后，在五年内又犯应判处有期徒刑以上刑罚之罪的罪犯,
48567,1,花插,huāchā,,,名,可放在浅水盆里的插花用的底座,
48567,2,花插,huāchā,,,名,供插花用的瓶子,
48567,3,花插,huāchā,,,动,〈口〉交错；夹杂（后面常跟“着”）,男生和女生花插着坐在观众席上。
48568,1,白炽灯,báichìdēng,,,名,一种电灯。在灯泡内装上灯丝，抽去空气或充入稀有气体，通电时发出白炽光,
48569,1,接线员,jiēxiànyuán,,,名,话务员,
48573,1,撺掇,cuānduo,,,动,鼓动别人（做某事）；怂恿,他一再撺掇我买股票。
48574,1,供桌,gòngzhuō,,,名,供奉神佛、祖先时摆放供品的桌子,
48579,1,双眼皮,shuāngyǎnpí,,,名,沿着眼皮下缘有一条褶儿，看似双层的上眼皮（跟“单眼皮”相区别）,
48580,1,寒星,hánxīng,,,名,冬夜的星星,寒星冷月
48581,1,避重就轻,bìzhòng-jiùqīng,,,,避开困难的而拣容易的事来做；也指回避主要的方面，只谈次要的方面,
48582,1,飞沫,fēimò,,,名,喷出或溅起的小水珠；特指喷在空气中的唾沫,飞沫四溅｜飞沫传染
48583,1,蒲团,pútuán,,,名,用蒲草等编成的圆形坐垫,
48585,1,信天游,xìntiānyóu,,,名,流行于陕北地区的民歌，曲调高亢、悠长。歌词常为两句一段。短的一曲一段；长的可达数十段，用同一曲调反复演唱，有时稍加变化,
48586,1,对台戏,duìtáixì,,,名,两个戏班子为竞争而在相近地点同时演出的相同或相近的戏；现多比喻为反对对方而采取的对抗和竞争行动,大家不要唱对台戏，要团结一致向前看。
48588,1,仪表堂堂,yíbiǎo-tángtáng,,,形,形容人容貌端庄、举止大方、风度不凡,
48589,1,藤条,téngtiáo,,,名,木质藤本植物的茎,
48591,1,说长道短,shuōcháng-dàoduǎn,,,,议论别人的是非好坏,不要在背后对人说长道短。
48592,1,声名鹊起,shēngmíng-quèqǐ,,,形,形容名望迅速提高（鹊起：像喜鹊一样飞起）,
48593,1,身价百倍,shēnjià-bǎibèi,,,,指一个人的声望和地位一下子提高了很多；也指某物价值突然提高,
48594,1,家奴,jiānú,,,名,封建社会被卖到达官贵人或富豪人家当奴仆的人,
48595,1,接访,jiēfǎng,,,动,（领导或上级主管机关）接待群众上访,领导干部既要接访，又要走访｜一定要完善领导机关的接访制度。
48596,1,碑亭,bēitíng,,,名,为保护石碑而建的亭子,
48597,1,吃拿卡要,chī-ná-qiǎ-yào,,,,指凭借职权而吃请、贪占、刁难、索要等不正之风和违法行为,
48598,1,偏旁,piānpáng,,,名,"构成汉字形体的某些基本组成部分。如“忆”中的“忄”和“乙”,“问”中的“门”和“口”",
48600,1,百家姓,bǎijiāxìng,,,名,旧时流行的一种启蒙读本。北宋时编。书中将中国常见的四百余个单姓和复姓编为易读易记的四言韵文,
48601,1,好事多磨,hǎoshì-duōmó,,,,好事情的实现往往要经历许多波折,
48602,1,肌腱,jījiàn,,,名,腱,
48603,1,聚积,jùjī,,,动,逐步地聚集累积起来,坑里聚积了很多水。
48606,1,装神弄鬼,zhuāngshén-nòngguǐ,,,,假装鬼神附体；比喻故弄玄虚，借以骗人,
48607,1,抛却,pāoquè,,,动,扔掉；丢开,抛却杂念
48608,1,飘拂,piāofú,,,动,轻柔地飘动,柳絮随风飘拂
48609,1,面黄肌瘦,miànhuáng-jīshòu,,,,脸色发黄，身体消瘦。形容身体有病或营养不良的样子,
48610,1,说媒,shuōméi,,,动,替人介绍婚姻,
48612,1,畅达,chàngdá,,,形,（交通等）通行无阻,交通畅达｜销路畅达
48612,2,畅达,chàngdá,,,形,（语言或文章）通畅明白,行文畅达｜词意畅达
48614,1,佛龛,fókān,,,名,供奉佛像的小阁子或小石室,
48616,1,监外执行,jiānwài zhíxíng,,,,执行刑罚时，对于被判处有期徒刑或拘役的罪犯，经有关司法部门批准，可在监狱外由罪犯居住地公安机关监管。监外执行须有下列法定情形之一：（1）有严重疾病需要保外就医的；（2）怀孕或正在哺乳期的。如果监外执行的条件消失而罪犯刑期未满，仍应收监执行。监外执行的时间计入刑期,
48617,1,马号,mǎhào,,,名,旧时官府或大户人家养马的地方,
48617,2,马号,mǎhào,,,名,骑兵用的细长形军号,
48622,1,禁果,jìnguǒ,,,名,《圣经》中说上帝禁止亚当和夏娃采食“知善恶树”上的果子，亚当、夏娃吃了这种果子，被逐出伊甸园。后用“禁果”比喻不准接触的事物,
48626,1,班房,bānfáng,,,名,旧时官衙里差役值班的地方,
48626,2,班房,bānfáng,,,名,俗指监狱或拘留所,坐班房
48630,1,邮筒,yóutǒng,,,名,信筒,
48635,1,溃逃,kuìtáo,,,动,溃败逃窜,
48636,1,婚检,hūnjiǎn,,,动,婚前检查身体,
48637,1,嗟叹,jiētàn,,,动,感叹,睹此惨状，莫不嗟叹。
48638,1,利爪,lìzhǎo,,,名,（某些鸟兽）锋利的爪子,老鹰用利爪抓住了一只野兔。
48640,1,开屏,kāipíng,,,动,指雄性孔雀尾巴展开呈扇状，并不断抖动作响,
48641,1,矿渣,kuàngzhā,,,名,矿山开采、选矿以及冶炼过程中产生的废渣,
48642,1,蜷伏,quánfú,,,动,弯曲身体卧着,他蜷伏在床上
48644,1,发木,fāmù,,,动,发麻,冻得两脚发木
48644,2,发木,fāmù,,,形,显得迟钝,这些天他总是发木。
48645,1,灌肠,guàncháng,,,动,为了清洗肠道或治疗疾病，从肛门把水、药液等灌入肠内。,
48645,2,灌肠,guànchang,,,名,把肉末儿和淀粉等灌入肠衣内制成的食品；也有用淀粉制成肠状物的，削成片，用油煎熟吃。,
48647,1,放债,fàngzhài,,,动,借钱给人以收取利息,
48648,1,说亲,shuōqīn,,,动,说媒,
48650,1,嘴硬,zuǐyìng,,,形,明知理亏，口头上却不肯认错,他虽然嘴硬，可心里早服了。
48653,1,夫婿,fūxù,,,名,妻子对丈夫的称呼,
48654,1,舱室,cāngshì,,,名,舱,
48655,1,声东击西,shēngdōng-jīxī,,,,表面上说要攻击东面，实际却是攻击西面。是作战时一种迷惑敌人以攻其不备的策略,
48657,1,成癖,chéngpǐ,,,动,积习很久，成为癖好（多含贬义）,长期吸烟，已经成癖。
48660,1,孤家寡人,gūjiā-guǎrén,,,,“孤”和“寡人”都是古代君主的自称。现用“孤家寡人”比喻脱离群众、孤立无助的人,
48662,1,正犯,zhèngfàn,,,名,共同犯罪中直接实施犯罪行为的人,
48663,1,白板,báibǎn,,,名,不上漆或尚未上漆的木板,
48665,1,网络电话,wǎngluò diànhuà,,,,通过因特网接通的电话,
48665,2,网络电话,wǎngluò diànhuà,,,,指网际协议电话。用普通电话通过电话网，再利用因特网实现远距离通话,
48666,1,钢缆,gānglǎn,,,名,用多股钢丝绞成的粗钢绳,
48667,1,过秤,guòchèng,,,动,用秤称重量,
48668,1,手柄,shǒubǐng,,,名,操作机器时供手握持的把柄,
48671,1,言归正传,yánguī-zhèngzhuàn,,,,把话转回到正题上来（章回小说、话本的常用套语）,
48672,1,邀功,yāogōng,,,动,求取功赏,胜不邀功，败不避罪。
48672,2,邀功,yāogōng,,,动,骗取或抢占别人的功劳,弄虚作假，谄媚邀功。
48673,1,麻纱,máshā,,,名,用麻的细纤维纺成的纱,
48673,2,麻纱,máshā,,,名,用细棉纱或棉麻混纺织成的平纹布，表面有纵向的凸纹，质地轻薄,
48674,1,缉获,jīhuò,,,动,查获；捕获,缉获毒品｜缉获逃犯
48676,1,潮气,cháoqì,,,名,含水分较多的空气,潮气太重，衣服都有些发霉了。
48677,1,可巧,kěqiǎo,,,副,表示几件事同时发生，相当于“恰好”、“碰巧”,可巧你也在这里
48678,1,恶仗,èzhàng,,,名,恶战,
48679,1,杏红,xìnghóng,,,形,形容颜色比杏黄稍红,
48680,1,坏水,huàishuǐ,,,名,坏心眼儿、坏主意。,这人一肚子坏水，跟他交往可得小心点儿。
48681,1,媚眼,mèiyǎn,,,名,娇美动人的眼睛或眼神,
48682,1,铜壶,tónghú,,,名,古代铜制的壶形计时器,
48682,2,铜壶,tónghú,,,名,铜制的盛水容器,龙嘴大铜壶
48684,1,熔点,róngdiǎn,,,名,晶体物质熔化时的温度，即该物质的液态和固态可以平衡共存的温度。各种晶体物质熔点不同，同一晶体物质的熔点又与所受的压强有关,
48685,1,一扫而空,yīsǎo'érkōng,,,,一扫而光,
48688,1,黑麦,hēimài,,,名,一年或二年生草本植物，叶子细长而尖，花穗跟小麦相似，抗寒和抗旱能力很强。籽实可食用或做饲料。我国东北、西北一带均有种植,
48689,1,性腺,xìngxiàn,,,名,生殖腺,
48690,1,养气,yǎngqì,,,动,修养良好的品德和气质,正心养气
48690,2,养气,yǎngqì,,,动,道家指静心修炼,
48691,1,潮位,cháowèi,,,名,潮水涨落的水位,今年的潮位高于去年。
48692,1,除湿,chúshī,,,动,消除潮湿和水气,除湿机｜精密仪器室应该经常除湿除尘。
48693,1,合击,héjī,,,动,（几路部队）从不同的方向攻击同一个目标,我军从四面合击敌人据点。
48694,1,悸动,jìdòng,,,动,因惊恐而心跳加快,事故过去这么久，心里还时时悸动不安。
48695,1,浮泛,fúfàn,,,动,〈文〉在水面漂荡,
48695,2,浮泛,fúfàn,,,形,表面的；不深入的,浮泛之论｜交情浮泛
48698,1,尝鲜,chángxiān,,,动,品尝时鲜,这是刚捕的螃蟹，请你尝鲜｜来尝个鲜吧
48699,1,绫子,língzi,,,名,一种丝织品。质地轻薄，光滑柔软，有花纹,
48700,1,梗死,gěngsǐ,,,动,局部组织因血流阻断而引起坏死,心肌梗死｜脑血管梗死
48704,1,二流子,èrliúzi,,,名,指游手好闲、不务正业的人,
48706,1,沙荒,shāhuāng,,,名,沙害形成的荒地,
48708,1,回嘴,huízuǐ,,,动,还嘴；顶嘴,他这么数落我，我都没回嘴。
48710,1,第一性,dì-yīxìng,,,形,首先产生并且起决定作用的,感性认识是第一性的｜要充分重视第一性资料。
48711,1,剪发,jiǎnfà,,,动,修剪头发；理发,
48711,2,剪发,jiǎnfà,,,动,指削发,
48712,1,不痛不痒,bùtòng-bùyǎng,,,,比喻议论、措施等未切中要害，不解决实际问题,
48713,1,铝箔,lǚbó,,,名,铝薄片，多用于包装,
48714,1,歌诀,gējué,,,名,为了好记，把有关内容编成韵文或顺口的语句；口诀,乘法歌诀
48715,1,弃世,qìshì,,,动,离开人世；死去,相继弃世
48716,1,阵式,zhènshì,,,名,队伍排列的形式,为了加强中场力量，客队摆出了“三五二”阵式。
48718,1,老大妈,lǎodàmā,,,名,对女性老年人的尊称,
48720,1,密植,mìzhí,,,动,缩小作物株距和行距，增加单位面积的种植株数,
48725,1,传帮带,chuán-bāng-dài,,,,指老一代的人把好传统、好思想和工作经验、业务知识等传给青年人，帮助他们顺利接班，并用示范的方式带领他们搞好工作,
48726,1,搭界,dājiè,,,动,交界,这是城乡搭界的地方。
48726,2,搭界,dājiè,,,动,某些地区比喻事物之间有一定关联（多用于否定）,这次事故和他不搭界。
48729,1,读秒,dúmiǎo,,,动,围棋比赛中指参赛者自由支配时间用完后，每落一子必须在规定时间里完成（一般为60秒，快棋为30秒或10秒），这时裁判随时报出已用秒数，叫读秒,
48729,2,读秒,dúmiǎo,,,动,倒计时最后读出所剩秒数；比喻事情到了最后的关键性时刻,发射前的读秒阶段。
48730,1,抢白,qiǎngbái,,,动,当面顶撞或讥讽,听他越说越无理，我就抢白了几句
48731,1,燃烧弹,ránshāodàn,,,名,用以引燃并烧毁目标的炸弹或枪弹,
48733,1,太极图,tàijítú,,,名,我国古代说明宇宙现象的图。一个圆内由象征阴阳的两个相对图形组成，外附八卦方位，道教用它作标志,
48735,1,整备,zhěngbèi,,,动,整顿配备,整备武装力量
48735,2,整备,zhěngbèi,,,名,装备；设备,提高列车整备质量。
48736,1,秘而不宣,mì'érbùxuān,,,,保守秘密，不对外宣扬,
48737,1,擅离职守,shànlí-zhíshǒu,,,,不经许可私自离开工作岗位,
48740,1,侨商,qiáoshāng,,,名,经商的侨胞,与侨商洽谈业务
48741,1,条分缕析,tiáofēn-lǚxī,,,,一条一条地详加分析；也形容分析细致并有条理,
48742,1,盯梢,dīngshāo,,,动,暗中尾随别人，监视其行动,甩掉了盯梢的特务。
48743,1,雅座,yǎzuò,,,名,消费、娱乐场所设置的较雅致的座位或小单间,
48744,1,内退,nèituì,,,动,指不到国家规定退休年龄的人，在单位内部提前退休,
48745,1,上呼吸道,shànghūxīdào,,,名,呼吸道的上部，包括鼻腔、咽喉和气管,
48746,1,言之凿凿,yánzhīzáozáo,,,,话说得有根有据，真实可信（凿凿：确切，真实）,
48747,1,粗线条,cūxiàntiáo,,,名,笔道粗的线条；也指用这种线条勾勒出的轮廓,他的画较多使用粗线条。
48747,2,粗线条,cūxiàntiáo,,,形,大致的；简略的,对这段文章的内容有了粗线条的了解。
48747,3,粗线条,cūxiàntiáo,,,形,性格、作风等较为粗疏的,他是个粗线条的人。
48749,1,破冰船,pòbīngchuán,,,名,开辟冰区航路的特种船舶。有较大的马力和特制的船头、船身，能冲破或压碎冰层,
48751,1,秤砣,chèngtuó,,,名,秤锤,
48752,1,划不来,huábulái,,,形,不合算；不值得,花大钱买这东西，真划不来。
48753,1,莴笋,wōsǔn,,,名,茎用莴苣的通称,
48756,1,栽赃,zāizāng,,,动,为了诬陷别人，暗中把赃物或违禁品放在别人处,
48756,2,栽赃,zāizāng,,,动,指把罪名强加到别人头上,栽赃陷害
48757,1,老鸨,lǎobǎo,,,名,鸨母,
48758,1,糙米,cāomǐ,,,名,未经精加工的大米,
48759,1,毒箭,dújiàn,,,名,箭头上涂有毒药的箭；比喻恶毒中伤和攻击的言行,刮阴风，放毒箭
48760,1,姨奶奶,yínǎinai,,,名,祖母的姐妹,
48760,2,姨奶奶,yínǎinai,,,名,姨太太,
48761,1,面筋,miànjīn,,,名,面粉加水搅和，涮去淀粉后剩下的混合蛋白质,
48762,1,鬼魅,guǐmèi,,,名,鬼怪,鬼魅伎俩
48765,1,览胜,lǎnshèng,,,动,观赏或游览胜景、胜地,庐山览胜
48767,1,超值,chāozhí,,,动,实际价值超过所定价格,超值服务｜超值消费
48768,1,宗谱,zōngpǔ,,,名,族谱；家谱,宗谱是一种宝贵的历史资料。
48770,1,墙围,qiángwéi,,,名,在靠近炕或床的墙壁上，用布或纸等做成的长条形隔离层，有防止沾染墙粉及保持墙壁清洁等作用,
48774,1,外扬,wàiyáng,,,动,向外传扬,此事不可外扬
48775,1,秉持,bǐngchí,,,动,掌握；主持,秉持公心
48776,1,匡算,kuāngsuàn,,,动,大概估算,据匡算，今年将增产10％。
48777,1,河港,hégǎng,,,名,江河沿岸供船只停泊的港口,
48778,1,余兴,yúxìng,,,名,未尽的兴致,余兴尚浓
48778,2,余兴,yúxìng,,,名,会议或宴会之后的文娱活动,
48779,1,胆囊炎,dǎnnángyán,,,名,胆囊发炎的病症。多由胆结石、细菌感染或化学性刺激引起。症状为右上腹绞痛、恶心、呕吐等,
48780,1,弧度,húdù,,,量,量角的一种单位。当圆周上某段圆弧的弧长和该圆的半径相等时，它所对应的圆心角就是1弧度角。旧称弪（jìng）。,
48781,1,细粮,xìliáng,,,名,一般指白面、大米等食粮,
48782,1,物尽其用,wùjìnqíyòng,,,,各种物品都充分发挥各自的作用，即不浪费任何东西,
48784,1,咯血,kǎxiě,,,动,指由呼吸道咳出鲜血或痰中夹血。常见于肺部、支气管等较重的疾病,（也说咳血。）
48785,1,道姑,dàogū,,,名,女道士,
48786,1,避世,bìshì,,,动,逃避现实生活，不与外界联系,避世离俗
48788,1,救亡图存,jiùwáng-túcún,,,,把国家从危亡中拯救出来，使民族能够生存下去,
48791,1,打内战,dǎnèizhàn,,,,发生国内战争；比喻单位、系统内部发生争斗,因人事安排打内战。
48792,1,暗喜,ànxǐ,,,动,内心高兴而不表露出来,
48793,1,卑躬屈膝,bēigōng-qūxī,,,,弯腰下跪。形容没有骨气，奉承讨好的丑态,
48795,1,久经沙场,jiǔjīng-shāchǎng,,,,经历过长期的战争考验；比喻具有丰富的阅历和实践经验,
48796,1,纤巧,xiānqiǎo,,,形,细小灵巧,一双纤巧的小手
48796,2,纤巧,xiānqiǎo,,,形,指艺术风格纤细柔弱,纤巧有余，豪放不足。
48798,1,种禽,zhǒngqín,,,名,配种用的家禽，如配种用的公鸡、公鸭,
48799,1,刮痧,guāshā,,,动,用铜钱等蘸上油或水，刮患者的背、颈或胸等部位，使局部皮肤充血，以减轻内部炎症。民间常用以治疗中暑、胃炎、肠炎等疾病,
48800,1,息事宁人,xīshì-níngrén,,,,平息事端、纠纷，使彼此相安,
48802,1,酒令,jiǔlìng,,,名,众人饮酒时为助酒兴而做的一种游戏。大都推一人为令官，其他的人轮流听令行事，不能行事或行事迟延者为输，罚酒,
48803,1,课室,kèshì,,,名,教室,
48804,1,血书,xuèshū,,,名,用自己的鲜血写成的文字，以表示仇大、冤深或志向坚决,咬破手指写血书
48806,1,油矿,yóukuàng,,,名,蕴藏和开采石油的地方,
48806,2,油矿,yóukuàng,,,名,含石油的矿床,
48810,1,曼妙,mànmiào,,,形,柔和美妙,曼妙的舞姿
48812,1,风铃,fēnglíng,,,名,悬挂着的一经风吹就摆动发声的铃,
48814,1,投递员,tóudìyuán,,,名,邮递员；泛指投递公文、信件等的人员,
48816,1,荡妇,dàngfù,,,名,放纵淫荡的女人,
48817,1,回单,huídān,,,名,回条,
48818,1,耀斑,yàobān,,,名,太阳局部区域亮度突增的现象。跟太阳黑子活动有密切关系，能引起磁爆、极光和短波电信中断等现象，所产生的高能粒子辐射和短波辐射对载人宇宙航行有一定的危害,
48819,1,眼馋,yǎnchán,,,动,看到自己喜欢的东西就很想得到,他特别眼馋那几本刚出版的小说。
48821,1,信札,xìnzhá,,,名,书信；信件,
48823,1,顶灯,dǐngdēng,,,名,安装在汽车车顶上的灯。多用来标志车辆用途,
48823,2,顶灯,dǐngdēng,,,名,安装在房间顶部的灯,
48824,1,怯场,qièchǎng,,,动,在参加表演、竞赛、考试等活动时，临场感到紧张和害怕,表演的是熟段子，当然不会怯场。
48825,1,滋扰,zīrǎo,,,动,滋事骚扰,滋扰百姓｜聚众滋扰
48826,1,御医,yùyī,,,名,宫廷里的医生,
48830,1,解愁,jiěchóu,,,动,排除愁闷,借听音乐来解愁
48831,1,套车,tàochē,,,动,把套绳套在拉车的牲口身上,
48832,1,至好,zhìhǎo,,,名,至交,
48833,1,撰述,zhuànshù,,,动,著述；写作,精心撰述
48833,2,撰述,zhuànshù,,,名,撰述的作品,把近年的撰述结集出版。
48834,1,项圈,xiàngquān,,,名,幼童或某些民族的人套在颈项上的环形装饰品,
48836,1,狂傲,kuáng'ào,,,形,狂妄傲慢,一副狂傲的样子
48837,1,将才,jiàngcái,,,名,统率、指挥军队的才能,颇具将才
48837,2,将才,jiàngcái,,,名,具有将才的人,难得的将才
48838,1,辘轳,lùlu,,,名,安在井边绞动绳索汲水的起重装置,摇着辘轳把儿打水。
48838,2,辘轳,lùlu,,,名,指某些机械上的绞盘,
48840,1,电灯泡,diàndēngpào,,,名,白炽电灯的玻璃泡，通常呈梨形，中空，充有惰性气体，装有钨丝，通电后发光,
48845,1,喊冤,hǎnyuān,,,动,大声呼叫冤屈；也指诉说冤屈,击鼓喊冤｜喊冤叫屈
48846,1,篡位,cuànwèi,,,动,篡夺君主的地位,
48848,1,乌金,wūjīn,,,名,煤的美称,
48848,2,乌金,wūjīn,,,名,中医指【墨】写字、绘画等用的黑色块状颜料。传统的墨多用松烟或煤烟制成；也指用墨研成的汁。,
48849,1,半官方,bànguānfāng,,,形,没有官方名义，但在一定程度上能代表官方的,半官方消息
48850,1,会阴,huìyīn,,,名,人体肛门和外生殖器之间的部位,
48851,1,吃官司,chīguānsi,,,,指被告上法庭或被判刑入狱,他吃官司以后，他的工厂就倒闭了。
48852,1,春心,chūnxīn,,,名,比喻男子或女子萌发的情爱欲望,春心萌动
48853,1,唱诗班,chàngshībān,,,名,基督教等在教堂举行宗教仪式时吟唱赞美诗的合唱队,
48855,1,秽语,huìyǔ,,,名,脏话；下流话,污言秽语
48859,1,迎头痛击,yíngtóu-tòngjī,,,,迎面给以狠狠打击,
48860,1,婚变,hūnbiàn,,,动,夫妻离异或婚姻关系发生变化,他俩前年发生婚变，离婚了。
48861,1,负气,fùqì,,,动,赌气,负气辞职
48863,1,照准,zhàozhǔn,,,动,不加改动地批准（下级的请示）,
48863,2,照准,zhàozhǔn,,,动,对准,照准目标射击
48865,1,小日子,xiǎorìzi,,,名,小家庭里的日常生活,他俩的小日子过得很美满。
48866,1,高徒,gāotú,,,名,水平高的徒弟；有成就的学生,名师出高徒
48867,1,合不来,hébulái,,,动,不能友好相处,兄弟俩近两年合不来。
48868,1,挑夫,tiāofū,,,名,以挑运货物谋生的人,
48869,1,持械,chíxiè,,,动,拿着器械,持械行凶
48870,1,高高低低,gāogāo-dīdī,,,形,有高有低，参差错落,高高低低的山坡上披着片片新绿。
48872,1,上半天,shàngbàntiān,,,名,上午,
48873,1,粲然,cànrán,,,形,形容鲜明光亮的样子,星月粲然
48873,2,粲然,cànrán,,,形,形容鲜明显著的样子,是非曲直，粲然分明。
48873,3,粲然,cànrán,,,形,形容露出牙齿笑的样子,粲然一笑
48875,1,鼓胀,gǔzhàng,,,动,膨胀凸起,书包鼓胀起来了
48876,1,真确,zhēnquè,,,形,真实确凿,真确的材料
48876,2,真确,zhēnquè,,,形,【真切】清楚确切,看得真确
48879,1,真凶,zhēnxiōng,,,名,真正的凶手,抓住真凶
48880,1,名扬四海,míngyáng-sìhǎi,,,,名声传播到天下各地,
48881,1,蚕农,cánnóng,,,名,以养蚕为主业的农民,
48883,1,叨念,dāoniàn,,,动,念叨,
48884,1,努嘴,nǔzuǐ,,,动,撅嘴向人示意,你没见她在那里直向你努嘴?
48884,2,努嘴,nǔzuǐ,,,动,比喻种子、草木萌发嫩芽,泡的黄豆已经努嘴了。
48885,1,绞刑架,jiǎoxíngjià,,,名,架子上系有绞索，用以绞死犯人的刑具,
48886,1,田赋,tiánfù,,,名,土地税的旧称,
48887,1,榴莲,liúlián,,,名,常绿乔木，叶子长椭圆形。果实也叫榴莲，球形，表面多有大木质刺，果肉鲜美，为热带著名水果。某些地区也写作“榴梿”,
48888,1,抽油烟机,chōuyóuyānjī,,,,吸收并排放厨房内油烟的设备,
48890,1,殴斗,ōudòu,,,动,（相互）殴打争斗,大街上发生了流氓殴斗事件。
48891,1,外勤,wàiqín,,,名,指在工作地点分内外的单位，在单位外面进行的工作；也指从事外勤工作的人员（跟“内勤”相区别）,外勤人员｜跑外勤
48892,1,言而无信,yán'érwúxìn,,,,说话不讲信用,
48895,1,了账,liǎozhàng,,,动,结清欠账；比喻结束恩怨,谁欠钱谁就去了账｜纠纷尚未了账
48896,1,百尺竿头,bǎichǐ-gāntóu,,,,佛教比喻道行修养达到的极高境界。后用“百尺竿头，更进一步”比喻学业、成就等达到很高的程度后，仍须继续努力，更求上进,
48898,1,秋种,qiūzhòng,,,动,秋季种植农作物,
48899,1,雷场,léichǎng,,,名,埋设大量地雷的地方,
48900,1,赔罪,péizuì,,,动,向被得罪的人赔礼道歉,他知道错了，明天就来向您赔罪。
48901,1,邮车,yóuchē,,,名,运送邮件的车辆,
48902,1,泉眼,quányǎn,,,名,流出泉水的小洞口或缝隙,
48903,1,无伤大雅,wúshāng-dàyǎ,,,,对事物的整体或主要方面没有什么妨害,
48906,1,无牵无挂,wúqiān-wúguà,,,,没有任何牵挂,
48910,1,兵火,bīnghuǒ,,,名,战火,校舍毁于兵火
48912,1,矫形,jiǎoxíng,,,动,通过外科手术使人体畸形部位恢复正常状态,
48913,1,身家性命,shēnjiā-xìngmìng,,,,指自身和全家人的生命（多用于表示危险的境况）,
48914,1,音标,yīnbiāo,,,名,标记语音的符号。如国际音标,
48916,1,萦回,yínghuí,,,动,盘旋往复,山泉萦回｜哀伤之情萦回心头。
48917,1,营寨,yíngzhài,,,名,古时驻兵的地方；军营,
48918,1,抗寒,kànghán,,,动,抵御严寒，避免严寒对人畜和作物等带来的损害,
48919,1,童音,tóngyīn,,,名,童声,童音悦耳
48920,1,翻建,fānjiàn,,,动,翻盖,
48921,1,铺路石,pūlùshí,,,名,铺路用的石块儿,
48921,2,铺路石,pūlùshí,,,名,比喻为他人成长默默奉献的人,我们愿做未来冠军的铺路石。
48922,1,出阁,chūgé,,,动,离开闺房。指出嫁,大姐出阁了
48926,1,三头六臂,sāntóu-liùbì,,,,佛经上说佛的法相有三个头六条臂。后用来比喻神通广大、本领超凡,
48929,1,笔意,bǐyì,,,名,字画、诗文里表现出来的情趣或意境,笔意精到
48933,1,才识,cáishí,,,名,才能和见识,才识不凡
48934,1,激灵,jīling,,,动,因受惊吓或寒冷等刺激，身体猛然抖动,突如其来的吼声吓得她一激灵。
48935,1,主销,zhǔxiāo,,,动,主要销售,这种产品主销欧美市场｜这是近期的主销车型。
48936,1,花簇,huācù,,,名,密集成团的花朵,花簇迎风
48937,1,吊床,diàochuáng,,,名,两头吊在固定物上、中间悬空、可以躺卧的用具。多用绳网或帆布制作,
48938,1,限速,xiànsù,,,动,限制速度,限速行驶
48938,2,限速,xiànsù,,,名,限制的速度,限速为90公里
48940,1,早产儿,zǎochǎn'ér,,,名,早产的婴儿,
48941,1,早茶,zǎochá,,,名,早晨吃的茶点,广东早茶
48943,1,听而不闻,tīng'érbùwén,,,,听了像没听见一样。指不重视或漠不关心,对群众的疾苦决不能视而不见，听而不闻。
48945,1,生字,shēngzì,,,名,没有学过的字,
