rank,sn,cihui,pinyin,ref_hanzi,ref_pinyin,pos,definition,example,definition_en
48814,1,投递员,tóu dì yuán,,,名,邮递员；泛指投递公文、信件等的人员,投递员送来报纸｜他是名投递员,Mail carrier
48816,1,荡妇,dàng fù,,,名,放纵淫荡的女人,她被骂作荡妇｜荡妇名声不好,Loose woman
48817,1,回单,huí dān,,,名,回条,请签收回单｜回单要保存好,Receipt slip
48818,1,耀斑,yào bān,,,名,太阳局部区域亮度突增的现象。跟太阳黑子活动有密切关系，能引起磁爆、极光和短波电信中断等现象，所产生的高能粒子辐射和短波辐射对载人宇宙航行有一定的危害,太阳出现耀斑｜耀斑影响通讯,Solar flare
48819,1,眼馋,yǎn chán,,,动,看到自己喜欢的东西就很想得到,他特别眼馋那几本刚出版的小说。,Covet
48821,1,信札,xìn zhá,,,名,书信；信件,这些是古代信札｜他珍藏朋友信札,Letters
48823,1,顶灯,dǐng dēng,,,名,安装在房间顶部的灯,客厅顶灯很亮｜换了新顶灯,Ceiling lamp
48823,2,顶灯,dǐng dēng,,,名,安装在汽车车顶上的灯。多用来标志车辆用途,警车顶灯闪烁｜出租车有顶灯,Roof light (vehicle)
48824,1,怯场,qiè chǎng,,,动,在参加表演、竞赛、考试等活动时，临场感到紧张和害怕,表演的是熟段子，当然不会怯场。,Stage fright
48825,1,滋扰,zī rǎo,,,动,滋事骚扰,滋扰百姓｜聚众滋扰,Harass
48826,1,御医,yù yī,,,名,宫廷里的医生,御医为皇帝诊病｜他是宫廷御医,Imperial physician
48830,1,解愁,jiě chóu,,,动,排除愁闷,借听音乐来解愁,Dispel sorrow
48831,1,套车,tào chē,,,动,把套绳套在拉车的牲口身上,农民在套车｜套车准备出发,Hitch an animal to a cart
48832,1,至好,zhì hǎo,,,名,至交,我们是至好之交｜他是我的至好,Best friend
48833,1,撰述,zhuàn shù,,,动,著述；写作,精心撰述,Write
48833,2,撰述,zhuàn shù,,,名,撰述的作品,把近年的撰述结集出版。,Written work
48834,1,项圈,xiàng quān,,,名,幼童或某些民族的人套在颈项上的环形装饰品,孩子戴着银项圈｜这项圈很精美,Neck ring
48836,1,狂傲,kuáng ào,,,形,狂妄傲慢,一副狂傲的样子,Arrogant
48837,1,将才,jiàng cái,,,名,统率、指挥军队的才能,颇具将才,Military talent
48837,2,将才,jiàng cái,,,名,具有将才的人,难得的将才,Military talent (person)
48838,1,辘轳,lù lu,,,名,安在井边绞动绳索汲水的起重装置,摇着辘轳把儿打水。,Well windlass
48838,2,辘轳,lù lu,,,名,指某些机械上的绞盘,用辘轳打水｜古老的辘轳,Winch
48840,1,电灯泡,diàn dēng pào,,,名,白炽电灯的玻璃泡，通常呈梨形，中空，充有惰性气体，装有钨丝，通电后发光,电灯泡坏了｜换个新电灯泡,Light bulb
48845,1,喊冤,hǎn yuān,,,动,大声呼叫冤屈；也指诉说冤屈,击鼓喊冤｜喊冤叫屈,Cry injustice
48846,1,篡位,cuàn wèi,,,动,篡夺君主的地位,他妄想篡位｜篡位是大罪,Usurp the throne
48848,1,乌金,wū jīn,,,名,煤的美称,乌金是煤的雅称｜开采乌金,Coal
48848,2,乌金,wū jīn,,,名,中医指【墨】写字、绘画等用的黑色块状颜料。传统的墨多用松烟或煤烟制成；也指用墨研成的汁。,这块乌金墨很好｜乌金研墨,Ink stick
48849,1,半官方,bàn guān fāng,,,形,没有官方名义，但在一定程度上能代表官方的,半官方消息,Semi-official
48850,1,会阴,huì yīn,,,名,人体肛门和外生殖器之间的部位,会阴需要清洁｜会阴部位,Perineum
48851,1,吃官司,chī guān si,,,,指被告上法庭或被判刑入狱,他吃官司以后，他的工厂就倒闭了。,Face a lawsuit
48852,1,春心,chūn xīn,,,名,比喻男子或女子萌发的情爱欲望,春心萌动,Amorous thoughts
48853,1,唱诗班,chàng shī bān,,,名,基督教等在教堂举行宗教仪式时吟唱赞美诗的合唱队,唱诗班在演唱｜教堂唱诗班,Choir
48855,1,秽语,huì yǔ,,,名,脏话；下流话,污言秽语,Obscene language
48859,1,迎头痛击,yíng tóu tòng jī,,,,迎面给以狠狠打击,给敌人迎头痛击｜迎头痛击来犯之敌,Head-on blow
48860,1,婚变,hūn biàn,,,动,夫妻离异或婚姻关系发生变化,他俩前年发生婚变，离婚了。,Marital breakdown
48861,1,负气,fù qì,,,动,赌气,负气辞职,Do something out of spite
48863,1,照准,zhào zhǔn,,,动,对准,照准目标射击,Aim at
48863,2,照准,zhào zhǔn,,,动,不加改动地批准（下级的请示）,申请已照准｜上级照准了,Approve (as submitted)
48865,1,小日子,xiǎo rì zi,,,名,小家庭里的日常生活,他俩的小日子过得很美满。,Daily life of a small family
48866,1,高徒,gāo tú,,,名,水平高的徒弟；有成就的学生,名师出高徒,Outstanding student
48867,1,合不来,hé bu lái,,,动,不能友好相处,兄弟俩近两年合不来。,Incompatible
48868,1,挑夫,tiāo fū,,,名,以挑运货物谋生的人,挑夫扛着货物｜他是名挑夫,Porter
48869,1,持械,chí xiè,,,动,拿着器械,持械行凶,Carry weapons
48870,1,高高低低,gāo gāo dī dī,,,形,有高有低，参差错落,高高低低的山坡上披着片片新绿。,Uneven
48872,1,上半天,shàng bàn tiān,,,名,上午,上半天很忙碌｜上半天开会,Morning
48873,1,粲然,càn rán,,,形,形容露出牙齿笑的样子,粲然一笑,Beaming (smile)
48873,2,粲然,càn rán,,,形,形容鲜明光亮的样子,星月粲然,Bright and shining
48873,3,粲然,càn rán,,,形,形容鲜明显著的样子,是非曲直，粲然分明。,Distinctly clear
48875,1,鼓胀,gǔ zhàng,,,动,膨胀凸起,书包鼓胀起来了,Bulge
48876,1,真确,zhēn què,,,形,真实确凿,真确的材料,True and accurate
48876,2,真确,zhēn què,,,形,【真切】清楚确切,看得真确,Clear and definite
48879,1,真凶,zhēn xiōng,,,名,真正的凶手,抓住真凶,Real murderer
48880,1,名扬四海,míng yáng sì hǎi,,,,名声传播到天下各地,他名扬四海｜作品名扬四海,World-renowned
48881,1,蚕农,cán nóng,,,名,以养蚕为主业的农民,蚕农养蚕为生｜江南多蚕农,Silkworm farmer
48883,1,叨念,dāo niàn,,,动,念叨,老人常叨念儿子｜她叨念着往事,Talk about incessantly
48884,1,努嘴,nǔ zuǐ,,,动,撅嘴向人示意,你没见她在那里直向你努嘴?,Pout as a signal
48884,2,努嘴,nǔ zuǐ,,,动,比喻种子、草木萌发嫩芽,泡的黄豆已经努嘴了。,Sprout (of seeds/plants)
48885,1,绞刑架,jiǎo xíng jià,,,名,架子上系有绞索，用以绞死犯人的刑具,绞刑架很恐怖｜站在绞刑架下,Gallows
48886,1,田赋,tián fù,,,名,土地税的旧称,田赋是古代税种｜缴纳田赋,Land tax
48887,1,榴莲,liú lián,,,名,常绿乔木，叶子长椭圆形。果实也叫榴莲，球形，表面多有大木质刺，果肉鲜美，为热带著名水果。某些地区也写作“榴梿”,榴莲味道独特｜爱吃榴莲,Durian
48888,1,抽油烟机,chōu yóu yān jī,,,,吸收并排放厨房内油烟的设备,厨房装抽油烟机｜抽油烟机坏了,Range hood
48890,1,殴斗,ōu dòu,,,动,（相互）殴打争斗,大街上发生了流氓殴斗事件。,Brawl
48891,1,外勤,wài qín,,,名,指在工作地点分内外的单位，在单位外面进行的工作；也指从事外勤工作的人员（跟“内勤”相区别）,外勤人员｜跑外勤,Fieldwork
48892,1,言而无信,yán ér wú xìn,,,,说话不讲信用,他言而无信｜不要言而无信,Go back on one's word
48895,1,了账,liǎo zhàng,,,动,结清欠账；比喻结束恩怨,谁欠钱谁就去了账｜纠纷尚未了账,Settle accounts
48896,1,百尺竿头,bǎi chǐ gān tóu,,,,佛教比喻道行修养达到的极高境界。后用“百尺竿头，更进一步”比喻学业、成就等达到很高的程度后，仍须继续努力，更求上进,百尺竿头更进一步｜已达百尺竿头,The highest level of achievement
48898,1,秋种,qiū zhòng,,,动,秋季种植农作物,秋种要及时｜忙着秋种,Autumn planting
48899,1,雷场,léi chǎng,,,名,埋设大量地雷的地方,雷场很危险｜排除雷场,Minefield
48900,1,赔罪,péi zuì,,,动,向被得罪的人赔礼道歉,他知道错了，明天就来向您赔罪。,Apologize
48901,1,邮车,yóu chē,,,名,运送邮件的车辆,邮车来了｜绿色邮车,Mail truck
48902,1,泉眼,quán yǎn,,,名,流出泉水的小洞口或缝隙,山中有泉眼｜泉眼冒清泉,Spring orifice
48903,1,无伤大雅,wú shāng dà yǎ,,,,对事物的整体或主要方面没有什么妨害,小错无伤大雅｜无伤大雅的事,Not affect the overall situation
48906,1,无牵无挂,wú qiān wú guà,,,,没有任何牵挂,他无牵无挂｜无牵无挂的生活,Free from care
48910,1,兵火,bīng huǒ,,,名,战火,校舍毁于兵火,Warfire
48912,1,矫形,jiǎo xíng,,,动,通过外科手术使人体畸形部位恢复正常状态,需要矫形手术｜矫形治疗,Orthopedic correction
48913,1,身家性命,shēn jiā xìng mìng,,,,指自身和全家人的生命（多用于表示危险的境况）,赌上身家性命｜身家性命攸关,Life and family safety
48914,1,音标,yīn biāo,,,名,标记语音的符号。如国际音标,学习国际音标｜音标很重要,Phonetic symbol
48916,1,萦回,yíng huí,,,动,盘旋往复,山泉萦回｜哀伤之情萦回心头。,Hover
48917,1,营寨,yíng zhài,,,名,古时驻兵的地方；军营,扎下营寨｜营寨守卫森严,Military camp
48918,1,抗寒,kàng hán,,,动,抵御严寒，避免严寒对人畜和作物等带来的损害,作物要抗寒｜抗寒品种,Cold-resistant
48919,1,童音,tóng yīn,,,名,童声,童音悦耳,Child's voice
48920,1,翻建,fān jiàn,,,动,翻盖,翻建老房子｜翻建工程,Rebuild
48921,1,铺路石,pū lù shí,,,名,铺路用的石块儿,做铺路石｜铺路石很平整,Paving stone
48921,2,铺路石,pū lù shí,,,名,比喻为他人成长默默奉献的人,我们愿做未来冠军的铺路石。,Paving stone; metaphor for a person who selflessly paves the way for others
48922,1,出阁,chū gé,,,动,离开闺房。指出嫁,大姐出阁了,Leave the boudoir; get married
48926,1,三头六臂,sān tóu liù bì,,,,佛经上说佛的法相有三个头六条臂。后用来比喻神通广大、本领超凡,他似有三头六臂｜没有三头六臂,Three heads and six arms; metaphor for extraordinary power or ability
48929,1,笔意,bǐ yì,,,名,字画、诗文里表现出来的情趣或意境,笔意精到,"Artistic conception in calligraphy, painting, or literature"
48933,1,才识,cái shí,,,名,才能和见识,才识不凡,Talent and insight
48934,1,激灵,jī ling,,,动,因受惊吓或寒冷等刺激，身体猛然抖动,突如其来的吼声吓得她一激灵。,Shiver suddenly due to shock or cold
48935,1,主销,zhǔ xiāo,,,动,主要销售,这种产品主销欧美市场｜这是近期的主销车型。,Mainly sell
48936,1,花簇,huā cù,,,名,密集成团的花朵,花簇迎风,Cluster of flowers
48937,1,吊床,diào chuáng,,,名,两头吊在固定物上、中间悬空、可以躺卧的用具。多用绳网或帆布制作,树上挂吊床｜躺在吊床上,Hammock
48938,1,限速,xiàn sù,,,名,限制的速度,限速为90公里,Speed limit
48938,2,限速,xiàn sù,,,动,限制速度,限速行驶,Limit speed
48940,1,早产儿,zǎo chǎn ér,,,名,早产的婴儿,早产儿要特别护理｜她是早产儿,Premature baby
48941,1,早茶,zǎo chá,,,名,早晨吃的茶点,广东早茶,Morning tea and snacks
48943,1,听而不闻,tīng ér bù wén,,,,听了像没听见一样。指不重视或漠不关心,对群众的疾苦决不能视而不见，听而不闻。,Hear but pay no attention; ignore
48945,1,生字,shēng zì,,,名,没有学过的字,学习生字｜认识新生字,Unfamiliar character
48947,1,钦差大臣,qīn chāi dà chén,,,,钦差；现也比喻受上级机关派遣下来工作，自恃握有大权而随便发号施令、指手画脚的人（含讥讽意）,钦差大臣来了｜别学钦差大臣,Imperial commissioner; metaphor for an arrogant official
48948,1,马靴,mǎ xuē,,,名,骑马时穿的长筒靴子；泛指一般的长筒靴子,穿着马靴｜马靴很帅气,Riding boots; long boots
48950,1,歪门邪道,wāi mén xié dào,,,,不正当的门路或手段,不走歪门邪道｜反对歪门邪道,Crooked methods; dishonest practices
48953,1,靠背椅,kào bèi yǐ,,,名,靠背较高的椅子,这把靠背椅很舒服｜旧靠背椅,High-backed chair
48954,1,胫骨,jìng gǔ,,,名,小腿内侧的长骨，两端粗，中间细,胫骨骨折｜保护胫骨,Tibia
48955,1,脚注,jiǎo zhù,,,名,印在书页最下端的注解,看脚注｜脚注解释详细,Footnote
48960,1,奇丽,qí lì,,,形,奇特而美丽,闪烁着奇丽的灯光。,Strange and beautiful
48962,1,智勇双全,zhì yǒng shuāng quán,,,,智谋和勇气二者兼备,他智勇双全｜智勇双全的将领,Both brave and resourceful
48968,1,纳谏,nà jiàn,,,动,古代指君主接受臣下的规劝。现泛指尊长接受意见或建议,君主应纳谏｜纳谏如流,Accept advice
48969,1,一病不起,yī bìng bù qǐ,,,,得病后，就再也没有恢复健康,他一病不起｜老人一病不起,Fall ill and never recover
48971,1,海塘,hǎi táng,,,名,为防御海潮侵袭而筑的堤防、塘坝,修建海塘｜海塘防潮,Seawall
48973,1,欺上瞒下,qī shàng mán xià,,,,欺骗上级，蒙蔽下级和群众,他欺上瞒下｜欺上瞒下可耻,Deceive superiors and subordinates
48974,1,起搏器,qǐ bó qì,,,名,医疗器械，可辅助心脏病患者维持心脏跳动,安装起搏器｜心脏起搏器,Pacemaker
48975,1,作茧自缚,zuò jiǎn zì fù,,,,蚕吐丝作茧，把自己裹在里面。比喻自己使自己陷入困境,这是作茧自缚｜别作茧自缚,Spin a cocoon around oneself; metaphor for creating one's own trouble
48980,1,卧底,wò dǐ,,,动,潜伏在敌方或犯罪团伙内部，暗中侦探或做内应,他在黑帮卧底｜警察卧底,Infiltrate; work undercover
48981,1,扎眼,zhā yǎn,,,形,【刺眼】不顺眼；使人看了不舒服；过于惹人注目（多含贬义）,她的穿着太扎眼了。,Dazzling; unpleasant to the eye
48982,1,小过,xiǎo guò,,,名,小的过错,不要放任小过,Minor fault
48983,1,赋有,fù yǒu,,,动,天生具有（某种性格、品质等）,赋有艺术天才,Endowed with
48984,1,接车,jiē chē,,,动,车站工作人员安排车辆进站、卸载等事宜,接车组到3站台接车。,Receive and arrange trains at a station
48984,2,接车,jiē chē,,,动,接站,去车站接车｜接车的人很多,Meet someone at the station
48984,3,接车,jiē chē,,,动,指购买汽车者按手续到生产厂家或指定地点接收车辆,按计划到年底接车。,Take delivery of a purchased vehicle
48985,1,速溶,sù róng,,,动,快速溶解,速溶食品,Instant-dissolving
48988,1,狂躁,kuáng zào,,,形,极其焦躁,狂躁不安,Irritable and restless
48990,1,鄂温克族,è wēn kè zú,,,名,我国少数民族之一。主要分布在内蒙古和黑龙江,鄂温克族同胞｜鄂温克族文化,Ewenki ethnic group
48992,1,索价,suǒ jià,,,动,要价；卖主提出售价,这部古籍，书商索价1000元。,Ask a price
48994,1,生死与共,shēng sǐ yǔ gòng,,,,生死相依，同生共死。形容情谊深厚或关系密切。,生死与共的战友｜我们生死与共,Share life and death; inseparable through thick and thin
48999,1,文如其人,wén rú qí rén,,,,诗文的风格同作者本人的性格特点相似；现也指文章必然反映作者的思想、立场和世界观,真是文如其人｜文如其人嘛,The writing mirrors the writer
49001,1,娟秀,juān xiù,,,形,美丽而清秀,容貌娟秀,Graceful and delicate
49002,1,陋巷,lòu xiàng,,,名,狭窄的里巷,身处陋巷,Narrow alley
49006,1,标图,biāo tú,,,动,把特定的符号或文字标在有关的专业地图上,在图上标图｜标图作业,Mark on a map
49007,1,正途,zhèng tú,,,名,【正路】为人处事的正当途径,走正途｜回归正途,Right path; proper way
49009,1,拉拉扯扯,lā lā chě chě,,,动,频繁进行不正当交往,不要同不三不四的人拉拉扯扯。,Engage in improper dealings
49009,2,拉拉扯扯,lā lā chě chě,,,动,反复拉扯,两人在院子里拉拉扯扯，险些打起来。,Pull back and forth repeatedly
49009,3,拉拉扯扯,lā lā chě chě,,,动,牵手挽臂，表示亲昵,别拉拉扯扯的，放规矩点儿。,Hold hands and arms intimately
49010,1,高头大马,gāo tóu dà mǎ,,,,体形高大的马；比喻人身材高大魁梧,骑着高头大马｜他是个高头大马,Tall horse; metaphor for a tall and sturdy person
49013,1,情商,qíng shāng,,,名,情感商数的简称。心理学上指人控制自己情感、承受外来压力、把握心理平衡的能力。是重要的心理素质,情商很重要｜提高情商,Emotional quotient (EQ)
49016,1,玩赏,wán shǎng,,,动,观赏；把玩欣赏,玩赏字画,Enjoy; appreciate
49018,1,高山流水,gāo shān liú shuǐ,,,,《列子·汤问》记载：春秋时俞伯牙善弹琴，钟子期善欣赏。俞伯牙弹琴，内心时而向往着高山，时而向往着流水，只有钟子期能理解琴声的含义。后用“高山流水”比喻知音难得或乐曲高妙,高山流水遇知音｜弹奏高山流水,High mountains and flowing water; metaphor for a rare confidant or sublime music
49019,1,多事之秋,duō shì zhī qiū,,,,不断发生变故、事变的时期。多形容时局动荡不定,正值多事之秋｜多事之秋要谨慎,Troubled times
49022,1,不可名状,bù kě míng zhuàng,,,,无法用言语形容（名：说出；状：描述）,美得不可名状｜不可名状的恐惧,Indescribable
49024,1,震响,zhèn xiǎng,,,动,震动而发出大的响声,在耳边震响｜一声震响,Resound loudly
49025,1,风言风语,fēng yán fēng yǔ,,,,私下议论、暗中流传的没有根据的话,别信风言风语｜风言风语很多,Gossip; groundless rumors
49026,1,交通车,jiāo tōng chē,,,名,机关、团体等接送员工上下班的车辆,坐交通车上班｜单位交通车,Shuttle bus for employees
49028,1,归向,guī xiàng,,,动,归依；投向,人心归向,Turn to; lean toward
49034,1,护院,hù yuàn,,,名,守护庭院的人,请了护院｜护院守夜,Courtyard guard
49034,2,护院,hù yuàn,,,动,守护庭院,看家护院,Guard a courtyard
49038,1,外戚,wài qī,,,名,外姓亲戚。古时特指帝王的母亲和妻子的家族,外戚专权,Maternal relatives (of an emperor)
49042,1,会员证,huì yuán zhèng,,,名,某些团体或组织颁发给会员以证明其会员资格的证件,出示会员证｜办理会员证,Membership card
49044,1,谨记,jǐn jì,,,动,敬词，表示对对方的话一定认真记住,老师教诲，学生谨记。,Sincerely remember
49045,1,比翼齐飞,bǐ yì qí fēi,,,,比喻夫妻恩爱，朝夕相伴；也比喻相伴相助，共同前进,夫妻比翼齐飞｜比翼齐飞共进步,Fly wing to wing; metaphor for a loving couple or mutual support
49047,1,气浪,qì làng,,,名,气体受到强大外力推动时所产生的冲击波,一阵气浪打过来，他被掀倒在地。,Blast wave
49048,1,狍子,páo zi,,,名,狍的通称,林中有狍子｜猎到狍子,Roe deer
49049,1,首义,shǒu yì,,,动,最先起义,武昌首义，天下响应。,Initiate an uprising
49051,1,一锅粥,yī guō zhōu,,,名,比喻极其混乱的局面,车间乱成了一锅粥。,A pot of porridge; metaphor for chaos
49052,1,臂肘,bì zhǒu,,,名,胳膊肘儿,碰到臂肘｜臂肘受伤,Elbow
49055,1,顺耳,shùn ěr,,,形,听着合乎心意；听着舒服,顺耳的、逆耳的话都要听｜轻快顺耳的旋律,Pleasant to the ear
49056,1,安设,ān shè,,,动,安装；设置,安设避雷针｜警报装置已经安设停当。,Install; set up
49058,1,舍下,shè xià,,,名,谦词，用于对别人称自己的家,请来舍下一聚｜舍下简陋,My humble home
49059,1,网兜,wǎng dōu,,,名,用线绳、尼龙丝等编成的装东西用的网状兜子,用网兜装水果｜提着网兜,String bag
49060,1,洋装,yáng zhuāng,,,名,旧指西装,他穿着笔挺的洋装出席晚宴｜这件洋装是民国时期的款式,Western-style clothing
49060,2,洋装,yáng zhuāng,,,形,书籍的西式装订方式，即装订线不暴露在书皮外面的,洋装本｜洋装书,Western-style bookbinding
49061,1,水循环,shuǐ xún huán,,,名,指海洋的水体跟陆地、大气之间水分大规模循环交流的现象。水体的蒸汽进入大气，大气把雨雪降到陆地，陆地的水再回到河流海洋,水循环对地球生态至关重要｜通过水循环，雨水滋润了大地,Water cycle
49064,1,小夜曲,xiǎo yè qǔ,,,名,源于欧洲中世纪骑士文学的一种爱情歌曲，流行于西班牙、意大利等国,他在月光下弹奏小夜曲｜这首小夜曲充满浪漫气息,Serenade (song)
49064,2,小夜曲,xiǎo yè qǔ,,,名,一种类似组曲的管弦乐曲，开始出现于18世纪末。如莫扎特的《D大调哈夫纳小夜曲》和柴可夫斯基的《弦乐小夜曲》,乐队演奏了莫扎特的小夜曲｜这首小夜曲旋律优美动听,Serenade (orchestral suite)
49070,1,从良,cóng liáng,,,动,旧指妓女脱离妓院嫁人,她最终选择从良嫁人｜古代妓女从良并非易事,Leave prostitution to marry
49073,1,校场,jiào chǎng,,,名,旧时比武或演练兵马的场地,士兵们在校场上操练｜这座古校场已荒废多年,Drill ground
49074,1,银矿,yín kuàng,,,名,含银的矿石,这座山富含银矿｜工人正在开采银矿,Silver ore
49074,2,银矿,yín kuàng,,,名,蕴藏或开采白银的地方,这个地区以银矿闻名｜他们发现了新的银矿,Silver mine
49076,1,承购,chéng gòu,,,动,承担购买（货物、债券等）,公司承购了大量原材料｜他承购了这批国债,Undertake to purchase
49078,1,堆肥,duī féi,,,名,把落叶、杂草、秸秆、泥土等堆积在一起，再掺入粪尿或污水，经微生物分解发酵而成的有机肥料。常用作底肥,农民用堆肥滋养土地｜这些堆肥效果很好,Compost
49079,1,隆胸,lóng xiōng,,,动,用手术、药物等方法使女性的乳房丰满而隆起,她做了隆胸手术｜隆胸需要谨慎考虑,Breast augmentation (procedure)
49079,2,隆胸,lóng xiōng,,,名,指女性丰满而隆起的乳房,她的隆胸很自然｜隆胸要注意安全,Augmented breasts
49081,1,销差,xiāo chāi,,,动,向上级报告所交付的差事已经完成,回公司销差,Report completion of a task
49081,2,销差,xiāo chāi,,,动,免掉差事,老板找借口把他销差了。,Dismiss from a post
49083,1,铜管乐,tóng guǎn yuè,,,名,用铜管乐器和打击乐器演奏的音乐,铜管乐声音洪亮｜他擅长演奏铜管乐,Brass music
49084,1,悲声,bēi shēng,,,名,悲痛的声音或声调；特指哭声,大放悲声｜灵车过处，悲声四起。,Sound of grief; weeping
49088,1,领章,lǐng zhāng,,,名,佩戴在制服领子上的识别标志,他的领章很醒目｜领章显示了他的军衔,Collar badge
49089,1,惊叹号,jīng tàn hào,,,名,叹号,句子结尾要加惊叹号｜惊叹号表示强烈感情,Exclamation mark
49090,1,桥洞,qiáo dòng,,,名,桥孔,桥洞下很凉爽｜小船穿过桥洞,Bridge opening
49091,1,鲸吞,jīng tūn,,,动,像鲸一样吞食。形容大量吞并土地或贪污财物,鲸吞国家财产,Swallow like a whale; annex or embezzle on a large scale
49094,1,牵累,qiān lěi,,,动,因牵连而受累；连累,这事由我承担责任，不能牵累大家。,Implicate; involve
49094,2,牵累,qiān lěi,,,动,拖累,受儿女们牵累,encumber
49098,1,签收,qiān shōu,,,动,收到公文、信件以后，在送件人指定的单据上签字或盖章，表示已经收到,签收文件｜由主任签收,sign for
49099,1,集日,jí rì,,,名,集市开市的日子,明天是集日｜集日时市场很热闹,market day
49101,1,忘年交,wàng nián jiāo,,,名,年龄或辈分不同的人之间结成的知心朋友,那一老一少成了忘年交。,friendship between generations
49103,1,求诊,qiú zhěn,,,动,求医,四处求诊,seek medical treatment
49104,1,固若金汤,gù ruò jīn tāng,,,形,形容工事坚固，防守严密，难以攻破（金：指金属铸造的城墙；汤：指蓄有沸水的护城河）,这座城堡固若金汤｜防线固若金汤,impregnable
49105,1,香瓜,xiāng guā,,,名,甜瓜的俗称,香瓜很甜｜夏天适合吃香瓜,muskmelon
49107,1,错杂,cuò zá,,,动,交错夹杂在一起,五颜六色的花朵错杂其间，非常好看。,intermingle
49108,1,银杯,yín bēi,,,名,银制的杯,这个银杯很精美｜他收藏古代银杯,silver cup
49108,2,银杯,yín bēi,,,名,体育或其他比赛中颁发给亚军（第二名）的奖杯,他获得了银杯｜银杯是亚军的奖励,runner-up trophy
49109,1,撑竿跳高,chēng gān tiào gāo,,,名,田赛项目，运动员双手持撑竿，经助跑，将撑竿插入插斗内单足起跳。借助撑竿的支撑与弹力，腾身越过横杆,他擅长撑竿跳高｜撑竿跳高需要技巧,pole vault
49112,1,自缢,zì yì,,,动,上吊自杀,自缢身亡,hang oneself
49113,1,内急,nèi jí,,,动,婉词，指急着要大小便,他突然内急｜内急要找厕所,need to relieve oneself
49114,1,啾啾,jiū jiū,,,拟声,模拟鸟、兽、虫等的叫声,黄雀啾啾,chirp
49118,1,口是心非,kǒu shì xīn fēi,,,,嘴里说得很好，心里想的却不是那样。形容心口不一,他口是心非｜不要口是心非,say yes and mean no
49119,1,农民战争,nóng mín zhàn zhēng,,,,封建时代农民阶级反对地主阶级统治的战争,历史上发生过农民战争｜农民战争影响深远,peasant war
