rank,sn,cihui,pinyin,ref_hanzi,ref_pinyin,pos,definition,example,definition_en
47445,1,历书,lì shū,,,名,根据一定历法排列年、月、日并提供有关数据，以备查考的书。我国的历书一般提供公历和农历的日序、干支、星期、节气和纪念日等数据,查看历书选吉日｜历书记载节气,almanac
47446,1,造字,zào zì,,,动,创造文字；设计新的文字符号系统,仓颉造字,create characters
47446,2,造字,zào zì,,,动,在电脑中造出字库没有的字,造字功能很实用｜需要造字输入,create computer font
47446,3,造字,zào zì,,,动,浇铸铅字,印刷厂需要造字｜造字是印刷工序,cast type
47449,1,密实,mì shi,,,形,细密；紧密,这鞋底纳得真密实。,dense
47450,1,残月,cán yuè,,,名,农历临近月底时像钩的月亮,残月挂在天边｜黎明时分见残月,waning moon
47450,2,残月,cán yuè,,,名,快要落下的月亮,残月西斜,setting moon
47452,1,指印,zhǐ yìn,,,名,【指纹】指纹的痕迹。,合同上按了指印｜指印作为证据,fingerprint
47454,1,运动衫,yùn dòng shān,,,名,运动服的上衣；也泛指类似样式的上衣,他穿了件红色运动衫｜运动衫很舒适,sweatshirt
47456,1,脑死亡,nǎo sǐ wáng,,,名,大脑功能永久性丧失，且先于呼吸和心跳停止的死亡。判断依据是：深度昏迷、瞳孔放大、脑干和脊髓反射消失等。一些国家已将其作为死亡认定的依据,脑死亡是不可逆的｜医生判定脑死亡,brain death
47457,1,债款,zhài kuǎn,,,名,借贷的钱,催讨债款,loan
47461,1,天狼星,tiān láng xīng,,,名,天空中最亮的恒星，属于大犬星座，冬季夜间容易见到。古星象家以为天狼星主侵掠，后用来比喻侵略者,天狼星非常明亮｜天狼星在冬季可见,Sirius
47463,1,超低空,chāo dī kōng,,,名,比低空更低的空间,超低空飞行,ultra-low altitude
47465,1,绕口令,rào kǒu lìng,,,名,一种语言游戏，把声母、韵母、声调极为相近的字交错重叠组成非常拗口的句子，要求一口气急速说出,这个绕口令很难念｜练习说绕口令,tongue twister
47466,1,水淋淋,shuǐ lín lín,,,形,形容积聚的水过多而不断下滴的样子,大雨浇得他水淋淋的。,dripping wet
47467,1,蜂窝煤,fēng wō méi,,,名,在煤末中掺进一定数量的石灰或黏土，加水和匀，用模型压制而成的燃料。短圆柱体，有许多贯通上下的孔，略似蜂窝,蜂窝煤很好烧｜买了几块蜂窝煤,honeycomb briquette
47468,1,抵不上,dǐ bu shàng,,,动,比不上；不能相当,他的智力抵不上一个娃娃｜收入抵不上支出,cannot match
47470,1,挂心,guà xīn,,,动,心中挂念；不放心,这孩子太调皮，真叫父母挂心。,worry about
47472,1,窄幅,zhǎi fú,,,形,幅面窄的（布帛、呢绒等）,窄幅的红布,narrow-width
47473,1,河槽,hé cáo,,,名,河床,河槽需要疏浚｜洪水淹没河槽,riverbed
47475,1,招安,zhāo ān,,,动,旧时统治者诱使武装反抗的人或盗匪归降,朝廷招安起义军｜招安政策有争议,offer amnesty
47476,1,熔融,róng róng,,,动,熔解,金属加热至熔融状态｜熔融后浇铸成型,melt
47477,1,恭迎,gōng yíng,,,动,恭敬地迎接,恭迎大驾,respectfully welcome
47479,1,争上游,zhēng shàng yóu,,,,争当先进,学习要争上游｜工作中争上游,strive for the top
47480,1,凌迟,líng chí,,,动,【剐】分解人的肢体，古代一种酷刑,凌迟是古代酷刑｜犯人被判处凌迟,dismember
47481,1,简编,jiǎn biān,,,名,内容简要的著作,《逻辑学简编》,concise edition
47481,2,简编,jiǎn biān,,,名,指简本,《中国通史简编》。,abridged version
47482,1,装配线,zhuāng pèi xiàn,,,名,进行零件或部件装配的生产线,汽车在装配线上生产｜改进装配线效率,assembly line
47484,1,云气,yún qì,,,名,雾气；云雾,夕阳隐没在云气里。,mist
47485,1,推让,tuī ràng,,,动,认为自己不合适而推辞,既然选你，你就不要再推让了。,decline out of modesty
47486,1,天梯,tiān tī,,,名,装置在高大建筑物或设备上的供攀援的设施,消防员爬天梯救援｜大楼外墙有天梯,service ladder
47486,2,天梯,tiān tī,,,名,古人想象中的登天阶梯。比喻险峻的山路,这座山像天梯般陡峭｜天梯难攀登,ladder to heaven
47487,1,兵临城下,bīng lín chéng xià,,,,敌兵已到城下。形容形势十分危急,敌军兵临城下｜兵临城下形势危急,enemy at the gates
47488,1,套数,tào shù,,,名,比喻成套的技巧或手法,他学会了不少魔术套数。,set of techniques
47488,2,套数,tào shù,,,名,戏曲或散曲（小令除外）中，用多种曲调互相连贯、有首有尾、成为一套的曲子,这套套数很完整｜戏曲套数结构严谨,suite of songs
47490,1,小舅子,xiǎo jiù zi,,,名,妻子的弟弟（用于背称）,他小舅子来帮忙｜和小舅子关系很好,brother-in-law
47492,1,黩武,dú wǔ,,,动,滥用武力；好战,穷兵黩武,militaristic
47495,1,斗车,dǒu chē,,,名,矿区或工地使用的一种运输工具，形状像斗，用挂钩连成列，在轨道上行驶,工地使用斗车运输｜斗车装满沙石,tip wagon
47496,1,华年,huá nián,,,名,青少年时代,时值华年，血气方刚。,youth
47499,1,绝育,jué yù,,,动,用结扎输卵管或输精管等办法使不再生育,她做了绝育手术｜绝育是避孕方式,sterilize
47501,1,忠勇,zhōng yǒng,,,形,忠诚勇敢,招募忠勇之士，杀敌报国。,loyal and brave
47506,1,消食,xiāo shí,,,动,帮助消化食物,喝茶能消食,aid digestion
47507,1,水绿,shuǐ lǜ,,,形,浅绿,水绿裙子藕荷袄,light green
47508,1,颌骨,hé gǔ,,,名,口腔上部和下部的骨头,颌骨需要手术｜颌骨支撑面部,jawbone
47509,1,电子表,diàn zǐ biǎo,,,名,采用电子元件，以微型电池为能源的表,电子表很精准｜他戴电子表,electronic watch
47510,1,简体字,jiǎn tǐ zì,,,名,经过简化的汉字,简体字易学易写｜推广使用简体字,simplified Chinese character
47513,1,火暴,huǒ bào,,,形,形容性格暴躁，像火一样暴烈,脾气火暴,fiery-tempered
47515,1,独轮车,dú lún chē,,,名,只有一个轮子的手推车,老人推独轮车｜独轮车运货方便,wheelbarrow
47518,1,魂不附体,hún bù fù tǐ,,,,灵魂不附在躯体上。形容极度惊慌恐惧，神态失常,吓得魂不附体｜恐怖片让他魂不附体,scared out of one's wits
47520,1,壁虎,bì hǔ,,,名,爬行动物，身体扁平，四肢短小，趾上有吸盘，常在墙壁上活动，捕食蚊、蝇、飞蛾等,壁虎在墙上爬｜壁虎吃蚊子,gecko
47521,1,抛洒,pāo sǎ,,,动,洒落；洒出,别把油漆抛洒到地上。,spill
47521,2,抛洒,pāo sǎ,,,动,比喻付出（心血、感情等）,抛洒一腔热血,"devote (effort, emotion)"
47522,1,立夏,lì xià,,,名,二十四节气之一，在公历每年5月6日前后。我国习惯把这一天作为夏季的开始,今日立夏,Start of Summer
47523,1,信息战,xìn xī zhàn,,,名,敌对双方在信息领域的对抗活动。主要是通过争夺信息资源，掌握信息的生产、传递、处理等的主动权，破坏敌方的信息传输，为遏制或打赢战争创造有利条件,现代战争重视信息战｜开展网络信息战,information warfare
47523,2,信息战,xìn xī zhàn,,,名,泛指在经济、科技、文化、外交等各领域对信息优势的争夺,企业间也有信息战｜信息战无处不在,information competition
47524,1,延绵,yán mián,,,动,绵延,中国历史延绵数千年。,stretch continuously
47527,1,调干,diào gàn,,,动,调动干部,调干支援西部建设。,transfer cadres
47529,1,余韵,yú yùn,,,名,遗留下来的韵味,古风余韵,lingering charm
47531,1,斩获,zhǎn huò,,,动,泛指收获或获取；特指在比赛中获奖或夺得好名次,一举斩获三项大奖。,win awards
47531,2,斩获,zhǎn huò,,,动,战争中杀死与俘获（敌人）,我军斩获敌军无数｜比赛中有新斩获,kill and capture
47531,3,斩获,zhǎn huò,,,名,泛指经过斗争得到的收获,打假又有新斩获,gains
47532,1,伪作,wěi zuò,,,名,假托别人名义写作的诗文或制作的艺术品等,别把伪作当真品,forgery
47534,1,便血,biàn xiě,,,动,大便或小便中带血,他便血需要就医｜便血是疾病信号,have blood in one's stool
47535,1,番薯,fān shǔ,,,名,某些地区指甘薯,烤番薯很香甜｜地里种了番薯,sweet potato
47538,1,顶子,dǐng zi,,,名,建筑物等的顶部,亭子的顶子很漂亮｜屋顶顶子需维修,top
47538,2,顶子,dǐng zi,,,名,顶珠,官帽顶子显示品级｜顶子用宝石制成,hat finial
47539,1,胆大包天,dǎn dà bāo tiān,,,形,形容胆量极大，什么坏事都敢干,他胆大包天敢犯罪｜胆大包天的行为,audacious
47540,1,气象万千,qì xiàng wàn qiān,,,形,形容景象多姿多彩，千变万化，十分壮观,黄山气象万千｜大海气象万千,spectacular
47541,1,沾光,zhān guāng,,,动,凭借某种关系从别人那里得到好处,孩子有出息了，父母也跟着沾光。,benefit from association
47546,1,自食其果,zì shí qí guǒ,,,,自己吞食自己种出的苦果。比喻做了坏事，结果自己受到惩罚,他最终自食其果｜作恶多端终将自食其果,reap what one sows
47547,1,像模像样,xiàng mú xiàng yàng,,,,够一定水平；符合一定标准；比较体面,这份杂志办得像模像样。,presentable
47548,1,生词,shēng cí,,,名,没有学过的词,这个生词很难记｜我每天学习五个生词,new word
47549,1,植皮,zhí pí,,,动,移植皮肤，将自体、他人或动物的皮肤移植于创面上,医生为他植皮治疗｜烧伤患者需要植皮,skin graft
47550,1,挑拨离间,tiǎo bō lí jiàn,,,,搬弄是非，使彼此不和,他喜欢挑拨离间｜不要听信挑拨离间的话,sow discord
47551,1,小班,xiǎo bān,,,名,幼儿园里最低的班级,我女儿上小班｜小班的孩子很可爱,preschool class
47551,2,小班,xiǎo bān,,,名,人数少的班,分小班上课,small class
47552,1,单口相声,dān kǒu xiàng sheng,,,名,由一个演员表演的相声,他擅长说单口相声｜这场单口相声很精彩,monologue comic talk
47555,1,起吊,qǐ diào,,,动,动用起重机吊起重物移到别处,这套机器整体起吊有困难。,hoist
47556,1,胆气,dǎn qì,,,名,胆量和勇气,胆气冲牛斗,courage
47557,1,保温瓶,bǎo wēn píng,,,名,能使所装物较长时间保持原有温度的瓶状容器,保温瓶能保热｜我买了新保温瓶,thermos
47558,1,抢渡,qiǎng dù,,,动,抢时间急速渡过江河,战士们抢渡长江｜必须抢渡这条河,race to cross a river
47559,1,亢进,kàng jìn,,,形,（生理机能）异常兴奋,甲状腺机能亢进,hyperfunction
47560,1,油层,yóu céng,,,名,储藏石油的岩层,这里油层很厚｜勘探发现了新油层,oil reservoir
47561,1,双人床,shuāng rén chuáng,,,名,供两个人睡觉的宽床,卧室里有张双人床｜双人床很宽敞,double bed
47564,1,钢水,gāng shuǐ,,,名,熔炼成液态的钢,钢水温度很高｜钢水正在浇铸,molten steel
47567,1,奋争,fèn zhēng,,,动,奋力夺取,奋争金牌,strive for
47568,1,素称,sù chēng,,,动,一向被称作,昆明素称春城,traditionally called
47569,1,以诚相待,yǐ chéng xiāng dài,,,,用诚心对待别人,朋友间要以诚相待｜他以诚相待每个人,treat with sincerity
47570,1,窗花,chuāng huā,,,名,贴在窗户上用作装饰的民间工艺剪纸,窗花很漂亮｜奶奶会剪窗花,window paper-cut
47571,1,横遭,hèng zāo,,,动,意外地或无辜地遭到,横遭迫害｜横遭不测,suffer unjustly
47574,1,假条,jià tiáo,,,名,写明请假原因和期限，报请领导或老师批准的便条,他写了张假条｜请假要交假条,leave permit
47576,1,压路机,yā lù jī,,,名,利用重碾子把路面或场地压实碾平的机器,压路机在修路｜这台压路机很大,road roller
47578,1,低血糖,dī xuè táng,,,名,血液中葡萄糖含量低于正常标准的一种病理现象。伴有饥饿、心悸等症状，重者可导致惊厥、昏迷以至死亡,他患有低血糖｜低血糖需要及时治疗,hypoglycemia
47581,1,河心,hé xīn,,,名,河中央,河心水流湍急,midstream
47582,1,龙门阵,lóng mén zhèn,,,名,【闲话】无关紧要的话；正题之外的话；故事（常跟“摆”连用）,家乡的龙门阵摆不完｜科幻龙门阵,chat
47585,1,宗主国,zōng zhǔ guó,,,名,对附庸国拥有宗主权的国家,该国曾是宗主国｜宗主国控制附庸国,suzerain state
47587,1,架子车,jià zi chē,,,名,一种用人力推拉的两轮车,他用架子车运货｜架子车很实用,cart
47588,1,安乐窝,ān lè wō,,,名,指安逸舒适的住所或生活环境,家是他的安乐窝｜布置温馨安乐窝,comfort zone
47591,1,破相,pò xiàng,,,动,指由于脸部受伤而损坏了容貌,车祸让他破相了｜幸好没有破相,disfigure
47593,1,赤心,chì xīn,,,名,赤诚的心,赤心向党,sincere heart
47596,1,洲际导弹,zhōu jì dǎo dàn,,,,射程超过8000千米，可以从一大洲发射到另一大洲的战略性导弹,洲际导弹射程远｜发射洲际导弹,intercontinental missile
47597,1,频段,pín duàn,,,名,无线电波按频率高低不同而分成的段。如低频、中频、高频等,这个频段信号好｜调整到新频段,frequency band
47598,1,打砸抢,dǎ zá qiǎng,,,,指打人、砸东西、抢财物等暴力活动,严打打砸抢行为｜制止打砸抢事件,"beating, smashing and looting"
47600,1,呈递,chéng dì,,,动,恭敬地递交,呈递述职报告,present respectfully
47602,1,号数,hào shù,,,名,标记排号或型号的数字,门牌号数改了｜棉纱线越细，号数就越高。,serial number
47603,1,瞒天过海,mán tiān guò hǎi,,,,比喻采用种种欺骗手段暗中进行活动,他企图瞒天过海｜这招瞒天过海妙,deceive everybody
47604,1,败亡,bài wáng,,,动,失败乃至灭亡,敌军最终败亡了｜避免公司败亡,be defeated and perish
47606,1,个头儿,gè tóu er,,,名,指人的身材或物品的体积,他个头儿很高,size
47609,1,膏肓,gāo huāng,,,名,中国古代医学指膏（心尖脂肪）和肓（心脏与膈膜之间的部分），认为是药力达不到的地方,病入膏肓,vital organs
47611,1,原始林,yuán shǐ lín,,,名,原生林,保护原始林｜原始林很茂密,virgin forest
47612,1,发愿,fā yuàn,,,动,表明心愿,他从小发愿长大要当一名教师。,make a vow
47616,1,避嫌,bì xián,,,动,避开嫌疑；特指为避免嫌疑而采取回避措施,审案时，与当事人关系密切的法官应当避嫌。,avoid suspicion
47620,1,愚钝,yú dùn,,,形,愚笨迟钝,秉性愚钝,slow-witted
47621,1,举火,jǔ huǒ,,,动,点火,昼则举烽，夜则举火。,light a fire
47621,2,举火,jǔ huǒ,,,动,特指烧火做饭,旧俗寒食节三日不举火。,cook a meal
47622,1,变调,biàn diào,,,动,指汉字连读时，某些字的声调发生变化。例如普通话中两个上声字相连时，头一个字变读成阳平,上声字会变调｜学习普通话变调,Tone sandhi; the change of tone when Chinese characters are read in sequence.
47622,2,变调,biàn diào,,,动,转调,这首歌会变调｜音乐中途变调了,Modulation; change of key.
47625,1,胡编乱造,hú biān luàn zào,,,,无根据地随意编造,不要胡编乱造｜他总胡编乱造,Fabricate; make up without basis.
47626,1,思古,sī gǔ,,,动,怀古；怀念往昔,思古怀旧,Cherish the past; think of ancient times or bygone days.
47627,1,大实话,dà shí huà,,,名,非常真实的话；切合实际的话,他说的是大实话｜大实话很中听,Plain truth; very true and practical words.
47628,1,丑剧,chǒu jù,,,名,丑恶的具有戏剧性的事件,这场复辟帝制的丑剧以失败告终。,Farce; a disgraceful and dramatic event.
47629,1,扎针,zhā zhēn,,,动,中医指用特制的金属针刺入一定穴位以治疗疾病,中医正在扎针｜扎针可以治病,"Acupuncture; in traditional Chinese medicine, inserting special metal needles into specific points to treat diseases."
47630,1,腰子,yāo zi,,,名,肾的俗称,买回一副猪腰子,Kidney; common name for the organ.
47631,1,尾数,wěi shù,,,名,小数点后面的数,尾数是0.5｜计算精确到尾数,Decimal places; the numbers after the decimal point.
47631,2,尾数,wěi shù,,,名,多位数字中末尾的一位或几位数字,手机尾数是88｜记住号码尾数,Last digit(s); the final one or several digits in a multi-digit number.
47632,1,挂账,guà zhàng,,,动,【赊账】卖方把应收的货款记在账上，买方延期付款,这次先挂账｜饭店可以挂账,"Charge to an account; seller records receivable on the books, buyer pays later."
47634,1,木樨,mù xi,,,名,桂花,木樨花开很香｜喜欢木樨香味,Osmanthus; sweet olive.
47634,2,木樨,mù xi,,,名,烹调时搅碎的鸡蛋，像黄色的桂花,木樨汤｜木樨肉,Scrambled eggs; beaten eggs cooked to resemble yellow osmanthus flowers.
47635,1,眼高,yǎn gāo,,,形,眼光高；要求高,贵人眼高｜找工作要从实际出发，不能太眼高了。,Have high standards; be demanding or have a discerning eye.
47637,1,三顾茅庐,sān gù máo lú,,,,东汉末年，刘备三次到隆中拜访隐居在茅庐的诸葛亮，请他帮助自己打天下（隆中：今湖北襄阳西）。后用“三顾茅庐”比喻真心实意地再三邀请,刘备三顾茅庐｜诚心三顾茅庐,Make three calls at the thatched cottage; metaphor for repeated and sincere invitations.
47639,1,不拘小节,bù jū xiǎo jié,,,,不为生活中的小事情所约束；现多指不注意生活中的小事情,他不拘小节｜性格不拘小节,Not bother about trifles; not constrained by small matters in life.
47641,1,口译,kǒu yì,,,动,口头翻译（跟“笔译”相区别）,她做口译工作｜需要现场口译,Interpret orally; oral translation (as opposed to written translation).
47645,1,灿然,càn rán,,,形,形容明亮的样子,灿然耀目,Bright; brilliantly shining.
47646,1,兵戎,bīng róng,,,名,战争；战乱,兵戎不起,Warfare; armed conflict.
47646,2,兵戎,bīng róng,,,名,武器,兵戎相见,Weapons; arms.
47647,1,投考,tóu kǎo,,,动,报考,投考大学｜投考公务员,Sign up for an exam; apply to take a test.
47648,1,欲速则不达,yù sù zé bù dá,,,,《论语》：“无欲速，无见小利；欲速则不达，见小利则大事不成。”后用“欲速则不达”指一味求快，反而难以达到目的,欲速则不达｜学习欲速则不达,Haste makes waste; trying to be too fast hinders achieving the goal.
47649,1,拆穿,chāi chuān,,,动,彻底揭穿,拆穿谎言,Expose; lay bare completely.
47650,1,肥田,féi tián,,,名,肥沃的农田,肥田沃土,Fertile field; rich farmland.
47650,2,肥田,féi tián,,,动,使土地肥沃,塘泥可以肥田｜肥田粉,Fertilize the soil; make the land fertile.
47651,1,电耗,diàn hào,,,名,电能的损耗,降低设备电耗｜电耗有点高,Power consumption; loss of electrical energy.
47652,1,高妙,gāo miào,,,形,高超巧妙,医术高妙,Exquisite; highly skillful and clever.
47653,1,金榜题名,jīn bǎng tí míng,,,,科举时代指殿试的录取榜上有自己或某人的名字。被录取者由此就能进入仕途，获取功名利禄；后泛指考试被录取,他金榜题名了｜祝愿金榜题名,Success in imperial exams; later refers to passing any important exam
47654,1,杀价,shā jià,,,动,指买主利用卖主急于售出商品的心理大幅度地压低价格,买家拼命杀价｜学会如何杀价,Bargain down the price; buyer drastically lowers the price knowing the seller is eager to sell.
47655,1,特行,tè háng,,,名,特种行业。指由公安机关实行特殊管理的行业。如旅馆业、刻字业、典当业、信托寄卖业、拍卖业等,旅馆属于特行｜特行需要审批,Special trade; industries under special management by public security organs.
47657,1,异人,yì rén,,,名,与众不同的人；有异才的人,人是异人，文是奇文︱才气纵横，一时惊为异人。,Extraordinary person; someone with unusual talent.
47657,2,异人,yì rén,,,名,通俗小说中指精通法术的人,得异人指点，练就真功。,"Supernatural being; in popular fiction, one skilled in magic."
47658,1,灾年,zāi nián,,,名,农作物绝收或严重歉收的年份,今年是灾年｜灾年粮食短缺,Famine year; year of crop failure or severe harvest shortage.
47660,1,运动健将,yùn dòng jiàn jiàng,,,,在体育运动中成绩突出的运动员；特指符合技术等级标准的运动员的最高称号,他是运动健将｜获得运动健将称号,Master sportsman; top-ranked athlete with outstanding achievements.
47662,1,洋流,yáng liú,,,名,【海流】海洋中沿着一定方向涌流的水,洋流影响气候｜研究海洋洋流,Ocean current; flowing water in the ocean along a certain direction.
47663,1,贬抑,biǎn yì,,,动,贬低并抑制,名声过大，宜稍自贬抑。,Belittle and suppress; disparage and restrain.
47666,1,盥洗室,guàn xǐ shì,,,名,洗漱的专用房间；也借指厕所,盥洗室很干净｜去盥洗室洗手,"Washroom; room for washing, also refers to toilet."
47667,1,娇妻,jiāo qī,,,名,娇美的妻子,他带着娇妻｜娇妻很贤惠,Lovely wife; beautiful and beloved spouse.
47670,1,等次,děng cì,,,名,等级高低的次序,划分等次,Grade; order of rank.
47671,1,混淆视听,hùn xiáo shì tīng,,,,（用谎言或假象）使人们的视听（看到的、听到的）混乱，真假难辨,谣言混淆视听｜不要混淆视听,Confuse public opinion; mislead with lies or false appearances.
47674,1,动嘴,dòng zuǐ,,,动,开口；说话,别光动嘴，快干吧｜老人家您只要动动嘴吩咐一下就行了。,Speak; open one's mouth to talk.
47676,1,待建,dài jiàn,,,动,已被纳入规划等待建造,准备参加待建项目的投标。,Await construction; planned but not yet built.
47678,1,放血,fàng xiě,,,动,比喻不惜血本降价甩卖商品；也比喻花费或损失钱财,割肉放血，价格一降再降｜让他放血请大伙儿吃饭。,Slash prices; also refers to: spend or lose money
47678,2,放血,fàng xiě,,,动,从静脉中放出适量的血液，适用于辅助性治疗脑充血、高血压、中暑等症,医生为他放血｜放血治疗中暑,Bloodletting; drawing blood from a vein for therapeutic purposes.
47680,1,凉粉,liáng fěn,,,名,将绿豆粉等熬成糊状，冷却后凝结成的半透明块状食物。加佐料凉拌着吃,夏天吃凉粉｜凉粉很爽口,"Bean jelly; translucent solid food made from mung bean starch, eaten cold with seasoning."
47681,1,守株待兔,shǒu zhū dài tù,,,,"《韩非子·五蠹》记载：战国时宋国有个农夫，看见一只兔子撞到树桩上死去，从此他就守在树桩旁，想再得到撞死的兔子。后用""守株待兔""比喻心存侥幸，坐等意外收获而不主动努力；也比喻死守狭隘的经验而不知变通",不能守株待兔｜反对守株待兔,Wait for windfalls; trust to chance rather than effort
47682,1,绑票,bǎng piào,,,动,匪徒把人劫走作为人质，强迫被劫者家属、所在团体等用钱或答应某种条件去赎,匪徒绑票勒索｜防止孩子被绑票,Kidnap for ransom; take someone hostage to extort money or conditions.
47684,1,搬用,bān yòng,,,动,不结合具体情况，机械地套用（现成的做法、经验等）,不要盲目搬用｜搬用他人经验,"Apply mechanically; use (methods, experience) without considering specific conditions."
47685,1,卸载,xiè zǎi,,,动,删除电子计算机中已经安装的软件,卸载无用软件｜正在卸载程序,Uninstall; remove installed software from a computer.
47685,2,卸载,xiè zài,,,动,从运输工具上卸下装载的物品,工人卸载货物｜卸载这批建材,Unload; remove goods from a vehicle.
47687,1,求贤若渴,qiú xián ruò kě,,,,寻求贤才，像口渴了急于寻水喝一样。形容求贤的心情十分急迫,他求贤若渴｜公司求贤若渴,Thirst for talents; seek capable people eagerly.
47688,1,脾脏,pí zàng,,,名,脾,脾脏很重要｜检查脾脏健康,Spleen; the organ.
47690,1,猴头,hóu tóu,,,名,猴头菌的简称,猴头是种菌类｜采摘新鲜猴头,Monkey head mushroom; abbreviated name for Hericium erinaceus.
47693,1,探头探脑,tàn tóu tàn nǎo,,,,不时地把脑袋伸出来。多形容人鬼鬼祟祟地张望,树林里有人探头探脑的，不知想干什么。,Peep cautiously; look around furtively.
47695,1,主唱,zhǔ chàng,,,名,担任主要演唱任务的演员,她是本场音乐会的主唱。,Lead singer; performer who sings the main parts.
47695,2,主唱,zhǔ chàng,,,动,担任主要演唱任务,本场音乐会由她主唱。,Sing lead; perform the main vocal parts.
47697,1,松土,sōng tǔ,,,动,翻动土壤使疏松,松土施肥,Loosen the soil; turn the earth to make it loose.
47697,2,松土,sōng tǔ,,,名,疏松的土壤,根部培上松土,Loose soil; soil that is not compacted.
47698,1,含恨,hán hèn,,,动,怀着怨恨,含恨死去,Nurse a grievance; harbor resentment.
47700,1,棒槌,bàng chui,,,名,捶击用的木棒，一端略粗，一端较细，多用于捶洗衣服,用棒槌洗衣服｜棒槌是洗衣工具,"Wooden club; stick used for beating, especially in laundry."
47702,1,战祸,zhàn huò,,,名,战争造成的灾难,战祸频仍,Calamities of war; disasters caused by war.
47703,1,厂纪,chǎng jì,,,名,工厂规定的纪律,严肃厂纪,Factory discipline; rules set by a factory.
