rank,sn,cihui,pinyin,ref_hanzi,ref_pinyin,pos,definition,example,definition_en
46100,1,后肢,hòu zhī,,,名,昆虫及有四肢的脊椎动物靠近身体后部的两条腿,后肢很有力｜动物的后肢,Hind limbs
46101,1,桀骜不驯,jié ào bù xùn,,,,暴躁倔强，不驯顺,他桀骜不驯｜桀骜不驯的性格,Intractable
46104,1,立脚,lì jiǎo,,,动,站住脚；比喻生存、安身,车挤得都没处立脚｜初来乍到，立脚未稳。,Gain foothold
46106,1,福音书,fú yīn shū,,,名,指基督教《圣经·新约全书》中的《马太福音》《马可福音》《路加福音》和《约翰福音》。内容是耶稣的生平事迹和教训,福音书记载耶稣｜读福音书,Gospel
46107,1,去伪存真,qù wěi cún zhēn,,,,把虚假的部分去掉，保留真实的部分,去伪存真很重要｜要善于去伪存真,Eliminate falsehood and retain truth
46108,1,采办,cǎi bàn,,,动,采购,采办一批木料,Procure
46110,1,收罗,shōu luó,,,动,广泛收集人或物,收罗人才｜收罗民间秘方,Collect
46111,1,左右开弓,zuǒ yòu kāi gōng,,,,双手都能拉弓射箭。比喻双手同时操作或左边一下右边一下做同一动作；也比喻同时进行几项工作,他左右开弓｜左右开弓地工作,Shoot with both hands
46112,1,扁圆,biǎn yuán,,,名,圆形而较薄的立体形状,扁圆酒瓶｜果实扁圆,Oblate spheroid
46112,2,扁圆,biǎn yuán,,,名,椭圆,扁圆的形状｜这是个扁圆,Ellipse
46114,1,细弱,xì ruò,,,形,细微柔弱,细弱的声音,Slender and weak
46115,1,水平面,shuǐ píng miàn,,,名,与铅垂线垂直的平面；在地面小范围内静止的水所形成的平面,水面是水平面｜水平面作为基准,Horizontal plane
46116,1,爷们儿,yé men er,,,名,指成年男子,几个爷们儿正在喝酒。,Man
46116,2,爷们儿,yé men er,,,名,男人之间亲昵的互称,咱爷们儿的事，不告诉她们。,Buddy
46116,3,爷们儿,yé men er,,,名,指丈夫,她的爷们儿要跟她离婚。,Husband
46120,1,玉兰片,yù lán piàn,,,名,晒干的嫩笋片。水发后形、色近似玉兰花，故称,玉兰片炒肉｜玉兰片很好吃,Dried bamboo shoots
46124,1,蒸锅,zhēng guō,,,名,用来蒸食品的锅,蒸锅在冒气｜用蒸锅蒸馒头,Steamer
46126,1,走卒,zǒu zú,,,名,旧指差役；现比喻受坏人豢养而帮凶作恶的人,贩夫走卒｜他不过是这个团伙里的走卒。,Lackey
46128,1,病家,bìng jiā,,,名,病人及其家属一方（对医护人员和医院而言）,本院一概拒收病家红包。,Patient's family
46130,1,泼洒,pō sǎ,,,动,把液体泼出使散开,泼洒农药｜小心别泼洒,Splash
46131,1,进兵,jìn bīng,,,动,军队向战斗目的地进发,向大西南进兵,Dispatch troops
46133,1,成眠,chéng mián,,,动,进入睡眠状态；入睡,夜不成眠,Fall asleep
46134,1,目测,mù cè,,,动,用眼睛估测,目测距离｜他善于目测,Visual estimation
46138,1,纺锤,fǎng chuí,,,名,纺纱、纺线用的工具，中间粗两头尖，木制或铁制。旋转纺锤，可把棉絮纺成纱，或把纱纺成线,纺锤在旋转｜古老的纺锤,Spindle
46139,1,合得来,hé de lái,,,动,能友好相处,他们几个脾气相投，挺合得来｜他跟谁都合得来,Get along well
46140,1,夏装,xià zhuāng,,,名,夏天穿的衣服,夏装很凉快｜买新夏装,Summer clothing
46142,1,规整,guī zhěng,,,形,规矩整齐；符合一定标准的,衣物放得规整,Neat
46142,2,规整,guī zhěng,,,动,使规矩整齐；使符合一定标准,把图书规整好｜规整产业格局,Neaten
46143,1,补考,bǔ kǎo,,,动,经批准未参加考试或考试不及格的学生另外进行考试,他需要补考｜补考通过了,Make-up exam
46144,1,赦令,shè lìng,,,名,赦免罪犯的命令,皇帝下赦令｜赦令宽恕罪犯,Amnesty decree
46147,1,顶嘴,dǐng zuǐ,,,动,还嘴；争辩（多指对长辈或上级）,自己没理，还偏要顶嘴。,Talk back
46148,1,螺栓,luó shuān,,,名,跟螺母配套使用的圆杆状零件。杆上带有一段阳螺纹，插入螺母中，与螺母的阴螺纹相啮合，可使被连接的两个零件或构件固定在一起,拧紧螺栓｜螺栓松动了,Bolt
46150,1,小广告,xiǎo guǎng gào,,,名,街头非法张贴或散发的篇幅较小的广告,墙上贴满小广告｜清理小广告,Flyer
46151,1,舒张,shū zhāng,,,动,舒展；张开,刚洗过热水澡，全身毛孔都舒张开了,Dilate
46152,1,弄权,nòng quán,,,动,凭借职位滥用权力,历史上经常可以看到外戚和宦官弄权。,Manipulate power
46153,1,希求,xī qiú,,,动,希望获得（某种事物）,不希求廉价的同情。,Hope to obtain
46153,2,希求,xī qiú,,,名,愿望，要求,她唯一的希求就是儿子能痊愈。,Desire
46154,1,走散,zǒu sàn,,,动,失散,几个人在闹市走散了。,Get separated
46158,1,住院部,zhù yuàn bù,,,名,医院里收留病人住院治疗的部门,住院部在三楼｜去住院部探望,Inpatient department
46159,1,守灵,shǒu líng,,,动,守在灵床、灵柩或灵位旁边,家人为他守灵｜守灵一整夜,Keep vigil
46160,1,承印,chéng yìn,,,动,承担印制任务,承印名片,Undertake printing
46161,1,球路,qiú lù,,,名,球类运动临场所使用的路数（手段、计策）,摸清对方的球路,Game strategy
46163,1,归田,guī tián,,,动,辞职回乡,辞官归田｜告老归田,Retire to countryside
46164,1,轻舟,qīng zhōu,,,名,轻便的小船,一叶轻舟顺流而下｜轻舟已过万重山,Skiff
46165,1,岗楼,gǎng lóu,,,名,一种耸起的碉堡，上有射击孔和瞭望台，可以居高临下向外射击和观察,岗楼上有哨兵｜岗楼很高,Watchtower
46168,1,壳子,ké zi,,,名,壳,报废的汽车壳子,Shell
46169,1,孤芳自赏,gū fāng zì shǎng,,,,自认为是独放的香花而自我欣赏。比喻自命清高,他孤芳自赏｜孤芳自赏不好,Self-admiration
46171,1,家长学校,jiā zhǎng xué xiào,,,,指导学生家长如何更好地抚养教育子女而开办的学校,家长学校开课｜参加家长学校,Parenting school
46172,1,过街老鼠,guò jiē lǎo shǔ,,,,比喻人人痛恨、厌恶的人（常跟“人人喊打”连用）,他像过街老鼠｜过街老鼠人人打,Public enemy
46174,1,树碑立传,shù bēi lì zhuàn,,,,树立碑石，刻下传记，使某人的生平事迹世代流传；现比喻通过某种途径树立个人威望,为他树碑立传｜树碑立传留名,Glorify
46176,1,礼尚往来,lǐ shàng wǎng lái,,,,指在礼节上注重有来有往；也指用对等的方式回报对方,礼尚往来是传统｜要礼尚往来,Reciprocity
46177,1,养精蓄锐,yǎng jīng xù ruì,,,,保养精神，积蓄力量,全体队员正在养精蓄锐，准备参加大赛。,Conserve strength
46178,1,奇谈怪论,qí tán guài lùn,,,,有悖于情理的荒唐言论,散布奇谈怪论,Absurd argument
46180,1,并行不悖,bìng xíng bù bèi,,,,同时进行，互不抵触,语言文字的规范化与现代化并行不悖。,Parallel without conflict
46181,1,大彻大悟,dà chè dà wù,,,,彻底醒悟（彻：通；悟：明白，觉醒）,他终于大彻大悟｜大彻大悟之后,Complete enlightenment
46182,1,趁火打劫,chèn huǒ dǎ jié,,,,趁着人家失火去抢东西；泛指乘人危难时去捞好处,不要趁火打劫｜趁火打劫可耻,Loot a burning house
46183,1,若即若离,ruò jí ruò lí,,,,好像接近，又好像离开。形容与人保持一定距离，既不亲近，又不疏远,若即若离的关系｜她若即若离,neither friendly nor aloof
46184,1,数理逻辑,shù lǐ luó ji,,,,数学的分支学科，用数学方法研究思维的形式结构及其规律,学习数理逻辑｜数理逻辑很难,mathematical logic
46185,1,声名狼藉,shēng míng láng jí,,,形,形容名声极坏,他声名狼藉｜声名狼藉的下场,notorious
46186,1,如坐针毡,rú zuò zhēn zhān,,,,就像坐在有针的毡子上。比喻心神不宁，坐卧不安,他如坐针毡｜等待时如坐针毡,sitting on pins and needles
46187,1,不可理喻,bù kě lǐ yù,,,,不能用道理使他明白。形容愚昧、固执或蛮横,这人不可理喻｜不可理喻的行为,impervious to reason
46192,1,无病呻吟,wú bìng shēn yín,,,,多形容没有痛苦或忧伤却长吁短叹；也比喻文艺作品矫揉造作，缺乏真情实感,不要无病呻吟｜无病呻吟的诗,moaning without being ill
46193,1,随声附和,suí shēng fù hè,,,,别人的话声一出就马上附和。形容没有主见，一味盲从,他总是随声附和｜不要随声附和,echo others' views
46196,1,传送带,chuán sòng dài,,,名,在生产流水线中，由连续输送机串联组成的连续输送物品的设备的总称；特指传送装置上的皮带,传送带在运转｜物品在传送带上,conveyor belt
46198,1,杀人不眨眼,shā rén bù zhǎ yǎn,,,形,形容嗜杀成性，极端残暴,他杀人不眨眼｜杀人不眨眼的魔头,murderous
46201,1,电饭锅,diàn fàn guō,,,名,用电能烹饪食物并具有保温功能的炊具。由锅体、电热元件和温控装置等部分组成,电饭锅煮饭｜新买的电饭锅,electric rice cooker
46203,1,君子兰,jūn zǐ lán,,,名,多年生草本植物，花呈红黄色，像漏斗，花序伞状；叶子宽，带状。可供观赏,君子兰开花了｜养了一盆君子兰,clivia
46207,1,气昂昂,qì áng áng,,,形,形容精神振奋、意气昂扬,雄赳赳，气昂昂,full of mettle
46208,1,铁道兵,tiě dào bīng,,,名,担负铁道工程保障任务的兵种；也指这一兵种的士兵。我国的铁道兵部队于1982年12月集体转业，并入铁道部,铁道兵修铁路｜他是老铁道兵,railway corps
46209,1,肥皂泡,féi zào pào,,,名,肥皂水的泡沫；常用来比喻转眼就消失的事物,他的希望成了肥皂泡。,soap bubble
46210,1,鸣不平,míng bù píng,,,,对不公平的事公开表示不满或反对,为他受到的不公正待遇鸣不平。,cry out against injustice
46212,1,日光浴,rì guāng yù,,,动,裸露身体接受日光照射以健身。适当的日光浴能促进新陈代谢，增强肌体抵抗疾病的能力,在海边日光浴｜喜欢日光浴,sunbathe
46214,1,丽日,lì rì,,,名,明媚的太阳,和风丽日,bright sun
46215,1,寻机,xún jī,,,动,寻找机会,寻机生事,seek an opportunity
46218,1,启封,qǐ fēng,,,动,把封着的东西打开,信刚收到，还没启封。,unseal
46219,1,成服,chéng fú,,,名,【成衣】缝制好了供出售的衣服,买成服很方便｜成服款式多,ready-made clothes
46220,1,代庖,dài páo,,,动,超越范围包办别人的事情,不要越俎代庖｜代庖不合适,do others' work
46221,1,密告,mì gào,,,动,【密报】秘密地向上级或有关部门报告,密告有关部门,secretly report
46225,1,通栏,tōng lán,,,名,书刊报纸上贯通整版不分栏编排的形式；也指这种形式的栏目,通栏标题｜办个有特色的通栏。,full-page column
46226,1,星象,xīng xiàng,,,名,指星体的明暗、位置移动等情况。古人迷信，认为根据星象可以推测人事,观察星象｜星象变化,astrological phenomena
46227,1,冷柜,lěng guì,,,名,电冰柜,冷柜里放饮料｜打开冷柜,refrigerator
46228,1,乞怜,qǐ lián,,,动,乞求怜悯,摇尾乞怜,beg for pity
46231,1,泔水,gān shuǐ,,,名,淘米、洗菜、刷锅、洗碗等用过的脏水,倒掉泔水｜泔水很脏,swill
46232,1,掮客,qián kè,,,名,替人介绍生意，从中赚取佣金的人,他是房产掮客｜掮客赚佣金,broker
46234,1,洞见,dòng jiàn,,,动,清楚地看到,洞见症结,see clearly
46235,1,共勉,gòng miǎn,,,动,互相勉励；共同努力,师生共勉｜同行（xíng）共勉。,mutual encouragement
46237,1,记恨,jì hèn,,,动,心里记着对别人的仇恨,你还真记恨我了｜说开了，就别记恨了。,bear a grudge
46238,1,野趣,yě qù,,,名,野外自然风光、田园风光的情趣,古木参天，野趣横生｜山乡野趣,rustic charm
46239,1,表带,biǎo dài,,,名,手表上的带子。多用金属或皮革制成,表带断了｜换一根表带,watch strap
46242,1,糕饼,gāo bǐng,,,名,糕和饼；泛指糕点,糕饼很好吃｜买些糕饼,cakes and pastries
46243,1,锅灶,guō zào,,,名,锅和灶,锅灶很干净｜修理锅灶,cooking stove
46247,1,基质,jī zhì,,,名,混合物中起溶剂作用的成分,橄榄油是多种护肤膏的基质。,matrix
46247,2,基质,jī zhì,,,名,结缔组织细胞所产生的一种复杂的蛋白质混合物，各种结缔组织的细胞和纤维都包埋在基质内,细胞在基质中｜基质很重要,ground substance
46249,1,停板,tíng bǎn,,,动,股票交易所暂停买卖,股票停板了｜停板一天,trading halt
46252,1,偏转,piān zhuǎn,,,动,指射线、磁针、仪表的指针等受外力作用而改变方向；泛指偏离原来的方向,光线在引力场中会发生偏转｜遇上漩涡，船身向左偏转。,deflect
46253,1,律令,lǜ lìng,,,名,法律条令,遵守律令｜律令严格,laws and decrees
46255,1,严词,yán cí,,,名,严厉的言辞,严词批驳｜严词厉色,strong words
46257,1,怪话,guài huà,,,名,离奇荒诞的话,不能听信这些怪话。,strange talk
46257,2,怪话,guài huà,,,名,牢骚话,不要背后说怪话,complaining words
46258,1,狼烟,láng yān,,,名,燃烧狼粪时升起的烟，传说古代边防用作报警信号；借指战火,狼烟四起,signal fire
46259,1,总合,zǒng hé,,,动,全部合起来,把财力物力总合在一起。,sum up
46260,1,外缘,wài yuán,,,名,外侧的边缘,在外缘行走｜外缘很危险,outer edge
46263,1,黄教,huáng jiào,,,名,喇嘛教（藏传佛教）中“格鲁派”的俗称。14世纪末宗喀巴所创，是喇嘛教中最大的教派。该派喇嘛戴黄色僧帽，故称,黄教是藏传佛教｜黄教历史悠久,Yellow Hat sect
46265,1,合口,hé kǒu,,,形,（食品、菜肴等）适合口味,这几个菜吃起来都很合口。,tasty
46265,2,合口,hé kǒu,,,动,合上嘴巴,笑到几时方合口,close one's mouth
46265,3,合口,hé kǒu,,,动,疮口或伤口愈合,刀伤已合口，很快就可出院。,heal
46266,1,安抵,ān dǐ,,,动,平安到达,飞机已于今晨安抵北京。,arrive safely
46267,1,蛤蜊,gé li,,,名,软体动物，壳卵圆形或三角形。生活在浅海泥沙中。肉鲜美可食,吃蛤蜊｜蛤蜊很鲜美,clam
46268,1,缩微,suō wēi,,,动,缩小、微型化的合称，是一种高密度、长期存贮信息的新技术。即把图书资料用照相法缩小，复制在微型胶片上，以便保存和使用,缩微胶片,microform
46268,2,缩微,suō wēi,,,动,微缩,缩微模型,miniaturize
46269,1,冷泉,lěng quán,,,名,温度比当地年平均气温低的泉水,冷泉很清凉｜喝冷泉水,cold spring
46270,1,茅舍,máo shè,,,名,茅屋,住在茅舍｜茅舍很简陋,thatched cottage
46271,1,灭种,miè zhǒng,,,动,灭绝整个种族,亡国灭种,genocide
46271,2,灭种,miè zhǒng,,,动,绝种,大角鹿已经灭种,become extinct
46272,1,矿坑,kuàng kēng,,,名,为采矿挖掘的坑或坑道,矿坑很深｜下到矿坑,mine pit
46276,1,征象,zhēng xiàng,,,名,征兆,这是好征象｜征象明显,sign
46277,1,明胶,míng jiāo,,,名,用牛、驴等动物的皮、骨和鱼鳔等熬制而成的一种有机化合物。白色或淡黄色，半透明，在热水中容易溶解。工业上多用作黏合剂、彩色感光材料，也可以食用和做药材,用明胶做甜品｜明胶是添加剂,gelatin
46279,1,咎由自取,jiù yóu zì qǔ,,,,罪过或灾祸是由自己招致的,他咎由自取｜这是咎由自取,have only oneself to blame
46280,1,发晕,fā yūn,,,动,感到眩晕,头发晕,feel dizzy
46282,1,归附,guī fù,,,动,归顺依附,各路人马纷纷归附起义军。,submit to authority
46284,1,漏子,lòu zi,,,名,破绽,手脚做得再严密，也会有漏子。,flaw
46284,2,漏子,lòu zi,,,名,漏斗,用漏子灌油｜漏子很好用,funnel
46285,1,背囊,bēi náng,,,名,行军或外出时背（bēi）在背（bèi）上的大口袋,背囊很重｜背上背囊,knapsack
46288,1,冷僻,lěng pì,,,形,不常用的（多指字、名称、典故等）,用词冷僻｜这则典故十分冷僻。,uncommon
46288,2,冷僻,lěng pì,,,形,冷落偏僻；不热闹,地点冷僻，很少有人来。,out-of-the-way
46290,1,图示,tú shì,,,名,显示某种内容的图形,这份是行军路线的图示。,diagram
46290,2,图示,tú shì,,,动,用图形显示,把实验经过图示出来。,illustrate
46291,1,浮光掠影,fú guāng lüè yǐng,,,,水面上的反光，一闪而过的影子。比喻观察不细，印象不深,浮光掠影地看｜只是浮光掠影,cursory observation
46292,1,基线,jī xiàn,,,名,测量时作为基准的线段；比喻某种境况的边缘,划定领海基线｜建立非典预警病例发病数的基线。,baseline
46296,1,纠合,jiū hé,,,动,集合；聚合（现多用于贬义）,纠合流氓，扰乱治安。,gather together
46298,1,忠魂,zhōng hún,,,名,英烈的灵魂、精神,告慰忠魂,loyal soul
46300,1,肝气,gān qì,,,名,中医指肝脏的精气；也指肝气郁结引起的症状，如腹胀、胁痛、嗳气、呕吐等,肝气不舒｜调理肝气,liver qi
46300,2,肝气,gān qì,,,名,指容易发怒的心绪,肝气很旺｜不要动肝气,irritability
46302,1,永诀,yǒng jué,,,动,永别,不想此一去，竟成永诀。,part forever
46303,1,定则,dìng zé,,,名,公认的规定或法则,遵守定则｜这是物理定则,rule
46304,1,炮口,pào kǒu,,,名,火炮的发射口；比喻危险的境地,地下工作，就是在敌人炮口下工作。,gun muzzle
46305,1,棚户区,péng hù qū,,,名,棚户人家集中的地区,改造棚户区｜棚户区很拥挤,shantytown
46306,1,通例,tōng lì,,,名,常规；惯例；普遍的规矩,除夕吃团圆饭是中国人过年的通例。,general rule
46307,1,开笔,kāi bǐ,,,动,开始某项写作,开笔写文章｜今天开笔,start writing
46307,2,开笔,kāi bǐ,,,动,旧指学生开始学作诗文,他读书聪明，开笔比别的孩子早。,begin learning composition
46307,3,开笔,kāi bǐ,,,动,指在新的一年开始写字或写作,新年开笔｜开笔大吉,first writing of the year
46309,1,团子,tuán zi,,,名,团成球形的食品,糯米团子,dumpling
46310,1,筒子楼,tǒng zi lóu,,,名,中间有一条长通道、两边是房间的住宅楼。多用作集体宿舍,住在筒子楼｜筒子楼很旧,tube-shaped apartment building
46311,1,下嫁,xià jià,,,动,旧指帝王的女儿出嫁；泛指富贵人家的女儿嫁给贫穷或地位较低的人家,公主下嫁｜她下嫁平民,marry beneath one
46312,1,大包大揽,dà bāo dà lǎn,,,,全部承担下来，表示有把握，负得起责任,他大包大揽｜不要大包大揽,take on everything
46313,1,唾手可得,tuò shǒu kě dé,,,,往手上吐口唾沫就可以得到。比喻极容易得到,胜利唾手可得｜机会唾手可得,extremely easy to obtain
46316,1,极限运动,jí xiàn yùn dòng,,,,具有很大冒险性和刺激性的、接近或达到身心承受极限的体育运动。如难度攀岩、空中滑板、高山滑翔、蹦极,他喜欢挑战极限运动｜极限运动需要勇气和技巧,extreme sports
46318,1,丰姿,fēng zī,,,名,美好的仪态,迷人的丰姿,graceful bearing
46319,1,深明大义,shēn míng dà yì,,,,很明白立身处世的大原则、大道理,他深明大义，顾全大局｜这位领导深明大义,deeply understand righteousness
46324,1,寝食不安,qǐn shí bù ān,,,,吃饭和睡觉都不安稳；形容十分担心忧虑,他最近寝食不安｜这件事让他寝食不安,too worried to eat or sleep
46325,1,死不瞑目,sǐ bù míng mù,,,,死了也不闭眼。形容人临死前心中有放不下的事，不肯闭眼；现常用来形容不达目的，至死也不甘心,他死不瞑目｜这个心愿未了，他死不瞑目,die with everlasting regret
46327,1,瘸腿,qué tuǐ,,,名,有残疾、行走不便的腿；借指瘸腿的人,他是个瘸腿｜瘸腿走路不便,lame leg
46330,1,苦差,kǔ chāi,,,名,辛苦难办的差事；得不到多少好处的差事,这是个苦差｜他接了个苦差,hard job
46331,1,卖老,mài lǎo,,,动,显示自己资格老,倚老卖老,flaunt one's seniority
46337,1,注目礼,zhù mù lǐ,,,名,一种军礼。行礼者立正，注视首长或国旗、军旗等,他向国旗行注目礼｜士兵行注目礼,salute with eyes
46338,1,听其自然,tīng qí zì rán,,,,任其自然,他听其自然｜我们只能听其自然,let things take their course
46339,1,煤尘,méi chén,,,名,粉尘状的煤末,地上有煤尘｜煤尘很脏,coal dust
46340,1,暮霭,mù ǎi,,,名,傍晚的云气、烟雾,暮霭笼罩,evening mist
46341,1,旷达,kuàng dá,,,形,心胸开阔；达观,性格旷达,broad-minded
46344,1,实职,shí zhí,,,名,有实际责任和权力的职位,他挂名的头衔不少，实职却没有一个。,substantive position
46347,1,警探,jǐng tàn,,,名,从事侦探破案工作的警察,警探在破案｜他是位警探,detective
46352,1,供给制,gōng jǐ zhì,,,名,直接供给生活必需品的一种分配制度。我国老解放区和全国解放初期，对参加革命的工作人员曾实行这一制度。1955年改为工资制。,过去实行供给制｜供给制已取消,supply system
46353,1,坏东西,huài dōng xi,,,名,坏人（骂人的话）,这个坏东西｜他是个坏东西,bad person
46354,1,申说,shēn shuō,,,动,申述（侧重于口头说明）,他申说理由｜他向领导申说,explain
46355,1,结晶体,jié jīng tǐ,,,名,晶体,这是结晶体｜结晶体很漂亮,crystal
46356,1,秋播,qiū bō,,,动,秋季播种。某些农作物，如冬小麦等需要在秋季播种,农民在秋播｜秋播很重要,autumn sowing
46357,1,死对头,sǐ duì tou,,,名,势不两立的仇敌或对手,他们是死对头｜这两人是死对头,sworn enemy
46358,1,笺注,jiān zhù,,,名,给古书作的注释,这本书有笺注｜笺注很详细,annotations
46359,1,划水,huá shuǐ,,,动,拨水前进；游泳,他划水的姿势很优美。,paddle water
46362,1,换季,huàn jì,,,动,更换季节；随季节的更换而更换（衣服等）,换季前后注意预防感冒｜该换季了，把棉衣收起来吧。,change with the season
46363,1,公方,gōng fāng,,,名,指公私合营企业中国家的一方（跟“私方”相区别）,公方代表｜公方参与管理,state side
46363,2,公方,gōng fāng,,,量,体积非法定计量单位，1公方等于1立方米,一公方土｜体积是十公方,cubic meter
46364,1,草包,cǎo bāo,,,名,比喻头脑简单、能力极差的人,什么工作都干不好，真是个草包!,incompetent person
46364,2,草包,cǎo bāo,,,名,用稻草绳等编成的袋子,抗洪急需大量草包。,straw bag
46369,1,喷漆,pēn qī,,,动,（用压缩空气）将稀释的油漆喷成雾状，使均匀地附着（zhuó）在器物上,他在喷漆｜喷漆要小心,spray paint
46369,2,喷漆,pēn qī,,,名,一种人造漆，一般使用喷枪喷在器物表面，有耐水、易干等特点,这是喷漆｜喷漆很均匀,spray paint
46371,1,回执,huí zhí,,,名,向寄件人证明邮件已经递到的凭据，由收件人盖章或签字交邮局寄回寄件人,请签回执｜回执已寄回,receipt
46371,2,回执,huí zhí,,,名,答复会议通知、邀请函等的回条。多由寄件方拟成，由收件方填写，并寄回寄件方,请填回执｜回执要尽快,reply slip
46371,3,回执,huí zhí,,,名,回条,这是回执｜回执在这里,acknowledgment slip
46372,1,残损,cán sǔn,,,动,残缺破损,残损的器皿,damaged
46373,1,搅扰,jiǎo rǎo,,,动,扰乱，使不得安宁,别搅扰病人,disturb
46374,1,千斤顶,qiān jīn dǐng,,,名,一种能将重物顶起的工具，广泛应用于机器修理和安装，有螺旋千斤顶、齿条千斤顶等,用千斤顶｜千斤顶很实用,jack
46378,1,斤两,jīn liǎng,,,名,分量,这菜斤两足｜斤两要称准,weight
46381,1,匡正,kuāng zhèng,,,动,纠正；扶正,错误之处，敬请匡正。,correct
46382,1,过劲儿,guò jìn er,,,形,过度,他累过劲儿了｜药效过劲儿了,excessive
46383,1,鎏金,liú jīn,,,名,成色好的金子,这是鎏金｜鎏金很珍贵,fine gold
46386,1,帮办,bāng bàn,,,动,帮助主要负责人办理公务,帮办政务,assist in handling
46386,2,帮办,bāng bàn,,,名,旧时部门主要负责人的助手,他是帮办｜帮办协助工作,assistant
46387,1,祸及,huò jí,,,动,灾祸牵涉或影响到,污染环境，祸及子孙。,bring disaster to
46388,1,偎依,wēi yī,,,动,紧紧地挨着；亲热地靠着,偎依在祖母的怀里。,snuggle
46389,1,新芽,xīn yá,,,名,新长出的嫩芽,树上长新芽｜新芽很嫩,new bud
46391,1,抚爱,fǔ ài,,,动,悉心照顾；爱护（多用于长辈对晚辈）,对弱智儿童倍加抚爱。,care for lovingly
46393,1,周延,zhōu yán,,,形,形式逻辑上指一个判断的主词或宾词包括了其全部外延,全称判断的主词是周延的。,distributed
46396,1,车架,chē jià,,,名,指自行车的三角架,车架很结实｜自行车车架,bicycle frame
46396,2,车架,chē jià,,,名,汽车上承载车身及其他负荷的支撑在车轮轴上的装置，一般由两根纵梁和几根横梁组成,汽车车架｜车架很重要,vehicle frame
46397,1,遗稿,yí gǎo,,,名,死者遗留下来而未刊行的文稿,这是他的遗稿｜遗稿未出版,posthumous manuscript
46398,1,族类,zú lèi,,,名,同一类别的人或事物,青年人按不同的欣赏兴趣形成不同的族类｜数码相机只是数码产品中的一个族类。,category
46398,2,族类,zú lèi,,,名,同一家族或宗族的人,他们是族类｜族类要团结,clan members
