definition_id,pinyin_id,definition_sn,pos,definition_cn,definition_en
45872,29083,1,名词,有机化合物，白色结晶，有甜味。甘蔗和甜菜里含有丰富的蔗糖,Sucrose
45873,29083,2,名词,特指用甘蔗汁熬成的糖,Cane sugar
45874,29084,1,动词,医学上指供血不足,Ischemia
45875,29085,1,名词,直角三角形以其任意一条直角边为轴，旋转一周所形成的立体,Cone
45876,29086,1,名词,【弧】圆周或曲线（如抛物线）上的任意一段,Arc
45877,29087,1,名词,铜制盘状打击乐器。中心有脐，锣边有二孔，系绳提着击打,Gong
45878,29088,1,动词,随意瞎说,Talk nonsense
45879,29089,1,名词,布设在水中的一种爆炸武器，用来封锁港口、航道或炸毁舰艇,Naval mine
45880,29090,1,动词,事先知道,Foresee
45881,29091,1,名词,一年或二年生草本植物，茎方形中空，花白色或淡紫色，有紫斑，结大而肥厚的蚕形荚果。种子也叫蚕豆，椭圆扁平，可以食用,Broad bean
45882,29092,1,名词,腹部中间脐带脱落后形成的瘢痕,Navel
45883,29093,1,名词,死者生前留下的志愿,Unfulfilled wish
45884,29094,1,动词,消除口渴的感觉；比喻满足要求、解决问题,Quench thirst
45885,29095,1,动词,交换位置；更换角度,Transpose
45886,29096,1,名词,【预兆】事前显示出的某种迹象,Omen
45887,29097,1,名词,按固定航线定时航行的轮船,Liner
45888,29098,1,名词,木管低音乐器，音色丰满有力,Bassoon
45889,29099,1,名词,物体上的线条状纹路,Grain
45890,29100,1,名词,中医指精血或津液亏损的病症。症状是午后潮热、盗汗、颧红、消瘦等,Yin deficiency
45891,29101,1,动词,散发热量,Dissipate heat
45892,29102,1,动词,抒发描写,Express
45893,29103,1,名词,清末指与外国有关的事务；也指学习和仿效外国有关的事务,Foreign affairs
45894,29104,1,名词,居民家庭,Household
45895,29104,2,动词,家住（某处）,Reside
45896,29105,1,动词,夸奖；称赞,Praise
45897,29106,1,名词,司法警察，即在法院和检察院中执行任务的警察。其任务有警卫法庭、维持法庭秩序、押解犯人或犯罪嫌疑人出庭受审、执行法院判决等,Bailiff
45898,29107,1,动词,指火速发出电报,Send urgent telegram
45899,29108,1,形容词,鲜艳明亮；鲜艳漂亮,Bright
45900,29109,1,名词,二十四节气之一，在公历每年12月22日前后。这一天北半球白天最短，夜晚最长。南半球则相反,Winter Solstice
45901,29110,1,名词,领导层的情况和意图,Higher-level situation
45902,29111,1,名词,情爱的缘分,Romantic destiny
45903,29112,1,名词,为高等学校培养合格新生而设置的机构,Preparatory course
45904,29113,1,名词,杰出的人死后的灵魂，用作对死者的敬称,Spirit of the deceased
45905,29114,1,形容词,形容心里一时冲动，突然产生某种念头,Sudden impulse
45906,29115,1,,各种文化层次的人都能欣赏,Appeals to both refined and popular tastes
45907,29116,1,,迷信认为人的生死祸福都是命中预先决定的；借指必然的遭际或前途,Predestined
45908,29117,1,动词,制作淫秽的书刊、录像带、光盘等,Produce pornography
45909,29118,1,动词,挑选聘任,Select and appoint
45910,29119,1,名词,【寨】四周有栅栏或围墙的村子；村子,Village
45911,29119,2,名词,防守用的栅栏、围墙,Stockade
45912,29120,1,动词,拉开电闸，停止供电,Power cut
45913,29121,1,名词,公历没有闰日（即2月只有28天）或农历没有闰月（即1年只有12个月）的年份,Common year
45914,29121,2,名词,农业收成一般的年份（跟“丰年”、“歉年”相区别）,Average year
45915,29122,1,形容词,形容声音突然停止,Abruptly (sound)
45916,29122,2,动词,事情突然停止,Cease abruptly
45917,29122,3,形容词,形容鸟的叫声,Shrill (bird call)
45918,29123,1,形容词,形容行为诡秘，不光明正大,Sneaky
45919,29124,1,名词,种植树木花草的带状区,Green belt
45920,29125,1,名词,依照志愿兵役制或募兵制自愿参军的军人。我国指服役期满后自愿继续服役的士兵,Volunteer soldier
45921,29126,1,名词,大黄鱼和小黄鱼的统称,Yellow croaker
45922,29127,1,名词,桥梁下面用以支承桥身的墩子，用石头或钢筋混凝土等筑成,Bridge pier
45923,29128,1,形容词,娇嫩艳丽,Delicate and beautiful
45924,29129,1,名词,矫健的步伐,Brisk steps
45925,29130,1,名词,霞,Rosy clouds
45926,29131,1,动词,通过广播、电视等手段演出并播放,Broadcast performance
45927,29132,1,名词,极陡峭的山崖,Precipice
45928,29133,1,名词,指可供信号占用的频率范围。如电视广播中图像信号的带宽是6兆赫,Bandwidth
45929,29134,1,名词,昆虫，成虫身体长椭圆形，有翅，灰黑或黄褐色。雄的吸食植物的汁液或花蜜，雌的吸食牛、马等家畜的血液,Horsefly
45930,29135,1,动词,在旱地上种植,Dry farming
45931,29135,2,名词,旱地农作物的简称,Dryland crops
45932,29136,1,,从原料投产到成品出产，按步骤连续地通过各种设备所进行的加工过程,Technological process
45933,29137,1,名词,喀斯特,Karst
45934,29138,1,名词,某些地区对孩子的称呼,Child
45935,29138,2,名词,旧时我国西南凉山等地的少数民族对奴隶的称呼,Slave
45936,29139,1,动词,制造印刷用的底版,Plate making
45937,29140,1,动词,在原定指标之外，增加招收人数,Expand enrollment
45938,29141,1,名词,湖的景色,Lake scenery
45939,29141,2,名词,湖水闪烁的光芒,Lake reflection
45940,29142,1,动词,要求购买；寻求购买,Seek to purchase
45941,29143,1,名词,人们乐于称道的好事或谈话资料,Edifying story
45942,29144,1,,竖起竹竿，在阳光下立刻便能见到竿影。比喻见效快,Get instant results
45943,29145,1,动词,向前倒下,Fall forward
45944,29146,1,,（形势、剧情、文笔等）突然转变并顺势迅速发展下去,Take a sudden turn
45945,29147,1,,指屹立在黄河激流中央的砥柱山（在河南三门峡东）。比喻在危难中能起支柱作用的人或力量,Mainstay
45946,29148,1,副词,表示疑问语气，相当于“是否曾经”,Have...ever
45947,29149,1,名词,外来的祸患；多指外来的侵略,External trouble
45948,29150,1,,不加管束，任凭自然发展（多含贬义）,Laissez-faire
45949,29151,1,形容词,效应神奇,Efficacious
45950,29151,2,形容词,形容预言能够变成现实,Accurate (prediction)
45951,29152,1,名词,经协商确定的共同遵守的规章、条例,Regulation
45952,29153,1,动词,写文章,Write articles
45953,29154,1,动词,睡觉,Retire for the night
45954,29155,1,名词,地处大城市周围的中小城市,Satellite city
45955,29156,1,名词,平坦宽阔的地方,Flatland
45956,29157,1,形容词,符合口味,Palatable
45957,29158,1,名词,在此之前,Prior to this
45958,29159,1,动词,哪里知道。用反问的语气表示不知或没有料想到,How would one know
45959,29160,1,名词,最正确的道理；正常法则,Fundamental truth
45960,29161,1,名词,比喻把人从苦难中拯救出来的个人或团体,Savior
45961,29162,1,动词,吞吃；咽下,Swallow
45962,29163,1,动词,把拍摄完毕的镜头按创作构思的要求进行选择、剪裁、整理、组接、编排成结构完整的影片或电视片,Edit (film)
45963,29163,2,名词,经过剪辑而成的作品,Edited version
45964,29164,1,名词,疗效神奇的药,Miracle drug
45965,29165,1,形容词,缺乏良好的品德。形容品德坏（多用于对人的指责）,Mean
45966,29166,1,副词,逐渐；渐渐,Gradually
45967,29167,1,,农历腊月的最后一天，即春节的前一天,Chinese New Year's Eve
45968,29168,1,,指18世纪法国大革命前法国资产阶级进步思想家反对封建制度和宗教神学的思想革命运动。代表人物有伏尔泰、孟德斯鸠、卢梭、狄德罗等。在政治上主张开明专制或民主政体，为法国资产阶级革命作了舆论准备,Enlightenment (historical)
45969,29168,2,,泛指通过宣传教育，使社会接受新事物而得到进步的运动,Enlightenment movement
45970,29169,1,形容词,多年以前的；年代久的,Aged
45971,29170,1,动词,追忆；思念（多用于对死者）,Commemorate
45972,29171,1,名词,太阳系八大行星之一，按离太阳由近而远的顺序排列是第六颗。位于木星、天王星之间。我国古代也叫“填星”、“镇星”,Saturn
45973,29172,1,动词,随同某一集体（劳动、学习等）,To accompany a group
45974,29172,2,名词,旧指跟随在官员身边供使唤的人,Attendant
45975,29173,1,形容词,瘦而长,Long and thin
45976,29174,1,动词,追捕在逃人员,To pursue fugitives
45977,29175,1,形容词,没有细菌的,Sterile
45978,29176,1,动词,（草木）枯萎零落,(Of plants) to wither and fall
45979,29176,2,动词,凋敝,Decline
45980,29177,1,名词,条状物较细小的一头；较少的部分,Small end; smaller portion
45981,29178,1,动词,声称,To claim
45982,29179,1,,私下里说悄悄话,To whisper privately
45983,29180,1,名词,工作介质的简称。在各种机器或设备中借以完成能量转化的媒介物质。如汽轮机中的蒸汽、制冷机中的氨,Working medium
45984,29181,1,名词,多年生草本植物，叶丛生，开紫色小花。块根略呈纺锤形，可以做药材,Dwarf lilyturf (Ophiopogon japonicus)
45985,29182,1,名词,材料或物体受力时，形变而不断裂的性质,Plasticity
45986,29183,1,,指一国在国际商务活动中给予某国的比其他国家更好的待遇,Preferential treatment
45987,29184,1,名词,指挥交通的信号灯，多设置在市区的交叉路口。红灯表示停止，黄灯表示准备，绿灯表示放行,Traffic light
45988,29185,1,形容词,形容到处都是,Ubiquitous
45989,29185,2,形容词,形容到处跑；到处传播,To run around everywhere; to spread widely
45990,29186,1,,用言论和行为迎合众人，以博取人们的称赞和支持,To curry favor with the public
45991,29187,1,,物美价廉,Inexpensive and of high quality
45992,29188,1,形容词,清静悠闲,Leisurely
45993,29189,1,动词,从垂直于物体轴心线的方向截断,To cut transversely
45994,29190,1,名词,驴,Donkey
45995,29191,1,名词,桥面可以吊起或放下的桥。多建在通航的河道上或护城河上以及军事据点前面,Drawbridge
45996,29191,2,名词,悬索桥,Suspension bridge
45997,29192,1,动词,燃放爆竹,To set off firecrackers
45998,29192,2,动词,比喻发表抨击性的言论,To make critical remarks
45999,29192,3,动词,密闭充气的物体爆裂,To burst
46000,29192,4,动词,点燃火药炸开土石等,To blast
46001,29192,5,动词,发射炮弹,To fire a cannon
46002,29193,1,动词,撒（种子等）,To sow
46003,29194,1,动词,耗费工夫,To be time-consuming
46004,29195,1,名词,人工开掘的排灌水道,Ditches
46005,29196,1,名词,平时穿的服装（跟“礼服”相区别）,Casual clothes
46006,29197,1,动词,取消；除掉,To remove
46007,29198,1,动词,用投票表决的方式对某事作出决定,To decide by vote
46008,29199,1,动词,按照限定数量和价格出售,To ration and sell
46009,29200,1,动词,按照一定的利率和时间计算利息,To calculate interest
46010,29201,1,动词,得不到援助,Unaided
46011,29202,1,动词,借此说彼，暗指某人某事,To allude to
46012,29203,1,名词,某些机械里的弹性钢条，卷紧后产生动力，使齿轮转动。机械钟表和某些玩具里都装有发条,Mainspring
46013,29204,1,名词,威望和名声,Prestige
46014,29205,1,名词,筒状的东西,Tube-shaped object
46015,29205,2,名词,未经缝制的毛皮大衣或上衣的原料,Unsewn fur coat material
46016,29206,1,名词,人与人之间的伦理；特指尊卑、长幼之间的伦理,Human relations; ethics
46017,29207,1,动词,打碎；碰撞成碎片,To smash
46018,29208,1,动词,狠狠地打击,To strike fiercely
46019,29209,1,形容词,呼吸短促,Short of breath
46020,29209,2,形容词,志气消沉,Disheartened
46021,29210,1,名词,片状药物,Tablet (medicine)
46022,29211,1,名词,时间的长度,Duration
46023,29212,1,名词,领养或收养的女儿,Adopted daughter
46024,29213,1,动词,把别人的作品窃为己有,To plagiarize
46025,29214,1,,第一仗就取得了胜利；比喻一开始就完成了任务或取得了成功,To win the first battle; to succeed at the first attempt
46026,29215,1,拟声词,模拟物体猛然断裂的声音,Crack (sound)
46027,29216,1,,原意是一旦失败，就会使肝脑涂地。现多形容失败得十分惨重，不可收拾,To suffer a crushing defeat
46028,29217,1,名词,汽艇,Motorboat
46029,29218,1,名词,由叶面为螺旋面的桨叶与桨毂构成的推进器。在船只、飞机、风车、风扇上使用,Propeller
46030,29219,1,名词,脑膜发炎的病症，由细菌、病毒等引起。常见的有流行性脑膜炎、结核性脑膜炎等，临床上以发热、头痛、呕吐、颈项强直为主要症状，严重时可发生抽搐和昏迷,Meningitis
46031,29220,1,,（给自己或别人）制造麻烦,To look for trouble
46032,29221,1,形容词,又脏又乱,Dirty and messy
46033,29222,1,动词,展览并评比,To exhibit and appraise
46034,29223,1,形容词,（时间）久远,(Of time) remote
46035,29223,2,形容词,（距离）遥远,(Of distance) faraway
46036,29224,1,名词,顽皮的儿童,Mischievous child
46037,29225,1,形容词,形容流泪的样子,Tearful
46038,29226,1,动词,准备好以供挑选,To be on the shortlist
46039,29227,1,动词,安排人力或事物分布到一定位置,
46040,29228,1,动词,断绝后代,To have no descendants
46041,29228,2,动词,军队后撤时，部分人在后面负责掩护或阻击敌人,To cover a retreat
46042,29229,1,名词,指来到内地的香港同胞,Hong Kong visitor
46043,29230,1,名词,面粉烙的大张的圆饼,Large flatbread
46044,29231,1,名词,物体特性的真实感,Texture
46045,29231,2,名词,艺术品所表现的物体特性的真实感,Textural quality (in art)
46046,29232,1,名词,略呈塔形的高层楼房,Tower block
46047,29232,2,名词,建筑物顶部盖的小楼,Turret
46048,29233,1,动词,很多人同时大笑,To roar with laughter
46049,29234,1,动词,任土地荒芜而不耕种,To let land lie waste
46050,29235,1,动词,单位内的成员在元旦或春节时聚会并互相祝贺,Mass New Year greetings
46051,29236,1,形容词,喜欢事事胜过别人,Competitive
46052,29237,1,动词,拒绝纳税,To resist taxation
46053,29238,1,形容词,记忆力差，容易忘事,Forgetful
46054,29239,1,动词,散落得到处都是,To be scattered all over
46055,29240,1,动词,金属表面生成氧化物,To rust
46056,29241,1,名词,旧时对中医医生的称呼,Traditional Chinese doctor
46057,29241,2,名词,古代官名。隋唐以后为六部中各司的长官,Official title (historical)
46058,29242,1,名词,通过电磁波发出的信号,Signal (transmitted by electromagnetic waves)
46059,29242,2,名词,泛指信号,Signal
46060,29243,1,名词,明年,Next year
46061,29244,1,动词,捏造事实，控告别人有罪,To bring a false charge against
46062,29245,1,名词,胜利和失败,Victory and defeat
46063,29246,1,名词,提起并搬移重物的机械设备。形制多样，大都由电力或内燃机驱动,Crane (machine)
46064,29247,1,,上气不接下气，失去常态。形容因恐慌或羞恼而狼狈不堪的样子,Flustered and exasperated
46065,29248,1,动词,投入人工；投入工作日,To contribute labor
46066,29249,1,动词,毫无节制；没有限度,Immoderate
46067,29250,1,动词,突然下降；突然降下,To drop suddenly
46068,29251,1,动词,恐吓；吓（xià）唬,To intimidate
46069,29252,1,,显现出事情的结果,To see the outcome
46070,29253,1,动词,有机体触电时受到电力打击,Electric shock
46071,29254,1,,不很好；没有突出之处,Not very good
46072,29255,1,,无风无浪，水面平静；比喻生活、局势等安定平静,"Calm and tranquil; metaphorically, life or situation is peaceful and stable"
46073,29256,1,,在有限区域内用电缆或光缆传输信号，能自发自收的电视系统,Closed-circuit television
46074,29257,1,名词,为完成危险性大的战斗任务，由敢于牺牲的人组成的精干队伍,Suicide squad
46075,29258,1,名词,受犯罪嫌疑人、被告人及其法定代理人委托或由法院指定，在法庭上依法为犯罪嫌疑人、被告人辩护的人,Defender; counsel
46076,29259,1,,指到雇主家里为学生授课或辅导的人。简称家教,Home tutor
46077,29260,1,名词,用塑料纤维编织成的袋子,Woven bag
46078,29261,1,名词,用隶书记录的儒家经典。汉代人把已经被焚毁的儒家经典，根据宿儒的口授，用隶书记录下来，后人称为今文或今文经,Modern Script; classical texts recorded in clerical script during the Han dynasty
46079,29261,2,名词,汉代称当时通行的隶书,Clerical script (Han dynasty term for the contemporary script)
46080,29262,1,名词,白酒,Distilled spirit; baijiu
46081,29263,1,动词,刻版印刷；泛指书刊印刷,Print and publish
46082,29264,1,名词,指在某一时间股票、期货等的市场面貌或交易情况,"Market situation (stocks, futures, etc.)"
46083,29264,2,名词,指棋盘上的棋势,Board situation (in chess or similar games)
46084,29265,1,名词,用作燃料的木头,Firewood
46085,29266,1,动词,有惭愧之处,Feel ashamed
46086,29267,1,名词,时间计量单位的分和秒；指极短的时间,Minutes and seconds; a very short time
46087,29268,1,名词,【刀刃】刀上用来切削的锋利的一边,Blade edge
46088,29269,1,名词,机件的外表面或内表面上呈螺旋形的凸棱,Thread (on screws or bolts)
46089,29269,2,名词,手指、脚趾上的纹理,Fingerprint; whorl
46090,29270,1,动词,丢人；出丑,Lose face; make a fool of oneself
46091,29271,1,动词,排解烦闷，使心情舒畅,Relax one's mind; relieve boredom
46092,29272,1,名词,语法学指动词性或形容词性短语里的修饰语，其作用是从情态、程度、范围、时间、处所、工具、方式等方面修饰、限制后面的中心语。如“快快地跑”、“很干净”中的“快快”、“很”都是状语,Adverbial modifier (grammar)
46093,29273,1,动词,接受礼品,Accept gifts
46094,29274,1,名词,【正道】正式通行的道路,Main road; proper path
46095,29274,2,名词,为人处事的正当途径,Righteous path; correct way of conduct
46096,29275,1,名词,才能和天分,Talent and innate ability
46097,29276,1,动词,与军队有关的运输,Military transport
46098,29277,1,名词,太阳的光辉,Sunlight; solar brilliance
46099,29277,2,名词,日光穿过云中的水滴或冰粒发生衍射，在太阳周围形成的彩色光环,Solar corona; halo around the sun
46100,29278,1,名词,藏传佛教活佛的继承人。在活佛圆寂后，寺院上层通过占卜、掣签等仪式，从活佛圆寂时出生的若干男婴中选定,Soul boy; reincarnated lama in Tibetan Buddhism
46101,29279,1,名词,眼白因毛细血管充血而出现的红丝,Bloodshot (in eyes)
46102,29279,2,名词,丝状的血,Thread of blood
46103,29280,1,名词,能在预定时间响铃的时钟,Alarm clock
46104,29281,1,名词,尽头；末尾,End; farthest point
46105,29281,2,动词,迎头；当头,Head-on
46106,29282,1,名词,放置扬声器的箱形装置。能提高音响效果,Speaker; loudspeaker box
46107,29283,1,,随着波浪起伏，跟着水流漂荡。比喻没有主见，盲目随大溜,Go with the flow; follow the crowd without independent thought
46108,29284,1,动词,对案件、事件、方案等作出判定或结论,Decide a case; reach a conclusion
46109,29284,2,名词,已作出判定或结论的案件、事件、方案等,Decided case; finalized plan
46110,29285,1,动词,超越世人,Transcend the worldly
46111,29286,1,名词,中医学指妇女白带异常的病,Leukorrhea (in traditional Chinese medicine)
46112,29287,1,动词,演出结束后，演员走到幕前向观众敬礼致意，表示感谢,Take a curtain call
46113,29288,1,名词,人和脊椎动物头部的骨质支架。人的颅骨分脑颅（由8块组成）和面颅（由15块组成）两部分,Skull
46114,29289,1,动词,进入内阁（任职）,Enter the cabinet (assume a ministerial position)
46115,29290,1,名词,草房。古代文人常用来给自己的书房或住所命名，以示高雅或自谦,Thatched cottage; humble study
46116,29291,1,名词,专为某类大型集会或某团体谱写演唱的歌曲。如亚运会会歌,Conference song; anthem for an event
46117,29291,2,动词,会合在一起比赛唱歌,Gather to sing competitively
46118,29292,1,名词,箱子和包的合称,Luggage and bags
46119,29293,1,动词,腹部膨胀。因胃肠充气、腹水、腹内肿块等造成气体或液体压迫内腹壁或腹腔器官而产生,Abdominal distension
46120,29294,1,名词,由黄、红两色合成的颜色,Orange color
46121,29295,1,名词,用于慈善事业的钱款,Charitable funds
46122,29296,1,动词,劝说开导,Advise and guide
46123,29297,1,动词,奸污,Rape; commit adultery
46124,29298,1,名词,迅猛的风；气象学上指7级风,Gale; strong wind
46125,29299,1,名词,捉鸟的罗和捕鱼的网。比喻束缚人的东西,Net; trap
46126,29300,1,动词,最高统治者让位或下台；泛指领导者退出所任职位,Abdicate; step down from a high position
46127,29301,1,形容词,诚朴忠厚,Sincere and honest
46128,29302,1,动词,往前倾斜,Lean forward
46129,29303,1,,愤怒得不能遏制住自己的感情,Unable to contain one's anger
46130,29304,1,,指四面八方，全国各地,All corners of the country; everywhere
46131,29305,1,,通过报刊、广播、电视、互联网等现代传播媒介，向大众提供信息和娱乐节目的过程；也指这些传播媒体,Mass communication
46132,29306,1,动词,闭上眼睛。多指死后没有牵挂,"Close one's eyes (in death, content)"
46133,29307,1,动词,【口服】把药物吃进去（跟“外敷”、“外用”相区别）,Take orally (medicine)
46134,29308,1,名词,有益的朋友,Beneficial friend
46135,29309,1,名词,渔业,Fishery industry
46136,29310,1,名词,特指共用一张课桌的同学,Deskmate
46137,29310,2,动词,同在一张桌子上（活动）,Share a table
46138,29311,1,名词,装有沙子的口袋。用于军事防御、防洪、防火、体育锻炼等,Sandbag
46139,29312,1,动词,（人、车辆、河流等）改变行进路线,Change route; divert
46140,29313,1,动词,（戏剧、电影等）开始演出或放映,Begin performance; start showing
46141,29314,1,动词,提高职务级别,Promotion
46142,29315,1,动词,审查鉴别（真伪、优劣等）,Screen; distinguish
46143,29316,1,名词,懦弱胆怯的人,Coward
46144,29317,1,动词,组织社团,Form an association
46145,29318,1,名词,枪弹的弹头,Bullet
46146,29318,2,名词,比喻狭小的地方,Very small place
46147,29318,3,名词,【弹】用弹弓弹（tán）射的小丸,Pellet (for slingshot)
46148,29319,1,形容词,凉爽舒适,Cool and comfortable
46149,29319,2,动词,使身体凉爽,Cool down
46150,29320,1,,花成团，锦成簇。形容色彩缤纷、繁华绚丽的景象,Bouquets of flowers and piles of brocade—richly decorated and colorful
46151,29321,1,动词,看轻自己的生命。多指自杀,Commit suicide; undervalue life
46152,29322,1,动词,机器检修,Machine repair
46153,29323,1,名词,按一定标准划分出来的句子类型。如根据句子的语气，可以划分为陈述句、疑问句、祈使句、感叹句；根据句子的结构，可以划分为单句和复句,Sentence pattern
46154,29324,1,形容词,手脚勤，爱干活儿。,Diligent; hardworking
46155,29325,1,动词,筹备组建,Prepare and organize
46156,29326,1,名词,不含荤腥的食物,Vegetarian food
46157,29326,2,动词,吃素食,Eat vegetarian food
46158,29327,1,动词,在生产劳动中缺勤或迟到,Be absent or late for work
46159,29327,2,动词,耽误工作进程,Delay work
46160,29328,1,名词,人世间,The human world; mortal realm
46161,29329,1,动词,讲明真相；说破,Reveal the truth; lay bare
46162,29330,1,动词,横亘在天空,Span the sky
46163,29331,1,动词,比喻旧的事物或习俗重新出现,Resurgence (of old things or customs)
46164,29331,2,动词,晒干或烤干的东西又变潮湿,Become damp again
46165,29332,1,,人在实践中认识客观规律并根据客观规律自觉地改造世界和改造人类自身的能力和作用,Subjective initiative
46166,29333,1,,对内实行恐怖统治，对外实行武力侵略和民族压迫的独裁制度和思想体系。第一次世界大战后，意大利独裁者墨索里尼的法西斯党首先提出，第二次世界大战前和大战期间，德国和日本都曾推行法西斯主义,Fascism
46167,29334,1,,每个人都负起自己应负的责任,Each bears their own responsibility
46168,29335,1,,大家都知道的（事）,Common knowledge; known to all
46169,29336,1,动词,试探地询问,Inquire tentatively
46170,29337,1,,一般指新技术革命以前形成的工业部门。如钢铁、纺织、造船、化学等工业。,Traditional industry
46171,29338,1,,以人的健康或寿命为标的的保险种类。分人寿保险、健康保险、人身意外伤害保险等,Life insurance; personal insurance
46172,29339,1,动词,一个个地列举,enumerate one by one
46173,29340,1,动词,增加入选篇目、人员等,co-opt; add through election
46174,29341,1,名词,执行会计制度权责发生制时，反映资产减少和负债及所有者权益增加的科目总称（跟“借方”相对）,credit (in accounting)
46175,29342,1,动词,蒙受侮辱,be insulted
46176,29343,1,动词,毁坏损伤,damage; destroy and impair
46177,29344,1,名词,擅长骑马的人；特指参加马术比赛的运动员,rider; jockey
