definition_id,pinyin_id,definition_sn,pos,definition_cn,definition_en
49022,31736,1,名词,才能和技艺（多指艺术创作或表演方面）,Talent and skill
49023,31737,1,动词,突然发生短时间的意识丧失。多因脑部贫血、供氧不足引起,Faint
49024,31738,1,名词,由多篇论文汇编成的集子（多用于书名）,Collected essays
49025,31739,1,动词,向四外溅落,Splash in all directions
49026,31740,1,名词,专供军队食用的粮食,Army provisions
49027,31741,1,动词,惦记；挂念,Remember with concern
49028,31742,1,拟声词,模拟微风、细雨、落叶等的声音,Patter
49029,31743,1,名词,从海水中提取的盐，是主要的食用盐和重要的工业原料,Sea salt
49030,31744,1,名词,起伏变化的数值中的最大值,Peak value
49031,31745,1,形容词,特别认真,Meticulous
49032,31746,1,动词,不成功,Fail
49033,31746,2,动词,不如愿,Not as wished
49034,31747,1,名词,面积狭小的房间,Small room
49035,31748,1,名词,雪化成的水,Snow water
49036,31749,1,名词,指很小的兵器,Small weapon
49037,31750,1,名词,零散的客户；特指证券交易中资金较少的个体投资者,Retail investor
49038,31751,1,动词,留下名字,Leave one's name
49039,31752,1,名词,经发酵变酸的白菜,Pickled cabbage
49040,31753,1,动词,指演出或比赛结束，观众退场,The performance is over
49041,31754,1,名词,白色的旗子。战争中常用来作为投降或联络的标志,White flag
49042,31755,1,名词,女儿的女儿,Granddaughter
49043,31756,1,名词,表皮；表层,Outer skin
49044,31757,1,名词,军装,Military uniform
49045,31758,1,名词,一种能挡风和小雨的外衣，常在春秋季穿,Windbreaker
49046,31759,1,动词,退后躲避；退出，回避,Withdraw and avoid
49047,31760,1,名词,医疗和防疫相结合的基层卫生机构，规模比卫生院小,Clinic
49048,31761,1,名词,游泳场、剧场等专门用来供人更换衣服的房间,Changing room
49049,31761,2,名词,婉词，指厕所,Restroom
49050,31762,1,动词,转移恋爱的对象,Transfer affection
49051,31762,2,动词,审美活动中审美者把主观感情移入客观事物；文艺创作活动中创作者把主观感情注入客观对象而创造出艺术形象,Empathy
49052,31762,3,动词,改变人的情趣,Change one's mood
49053,31763,1,名词,盛放死者骨灰的盒子,Cinerary casket
49054,31764,1,名词,医学上指治疗牙病的一科,Dentistry
49055,31765,1,动词,出现疼痛的感觉,Feel pain
49056,31766,1,名词,陡峭如墙壁的山岩；山峰的侧面,Cliff
49057,31767,1,名词,群星闪烁的夜晚,Starry night
49058,31768,1,动词,【忌讳】由于习俗或个人原因，禁忌某些言语或举动。如船夫忌讳说“翻”和“沉”；避免使用不吉利的词语,Taboo
49059,31768,2,动词,回避,Avoid
49060,31769,1,动词,避名讳。古人说话或行文时，不直接说出或写出君主、圣贤及尊长的名字,Name avoidance
49061,31770,1,形容词,英俊威武,Heroic
49062,31771,1,名词,乔木主干上部生长的枝、叶所形成的冠状部分,Tree crown
49063,31772,1,名词,字体式样,Typeface
49064,31772,2,名词,体裁格式,Style and format
49065,31773,1,动词,检验查看,Inspect
49066,31774,1,动词,造假；作假,Falsify
49067,31775,1,名词,婚嫁时招待宾客的酒或酒席,Wedding banquet
49068,31776,1,,血比水浓。多用于比喻亲情深厚，非同一般,Blood is thicker than water
49069,31777,1,,实力强大的若干个单位之间实行联合,Alliance of the strong
49070,31778,1,,共同承受忧患和灾难,Share weal and woe
49071,31779,1,,来来去去,coming and going
49072,31780,1,,寻求欢乐，纵情享受,seeking pleasure and making merry
49073,31781,1,,全身粉碎。多指为某一目的而献身,body smashed to pieces; to sacrifice one's life
49074,31782,1,,因激动或得意而忘记了一切,"beside oneself (with excitement, etc.)"
49075,31783,1,,调动兵力，派遣将领；借指调配人力,deploying troops and dispatching generals; to deploy manpower
49076,31784,1,,时间过去了，境况也随之变化了,times change and circumstances alter
49077,31785,1,名词,神秘的感觉,sense of mystery
49078,31786,1,名词,信息集合的储存库；特指在计算机储存器中建立的数据库和资料库,information repository; database
49079,31787,1,动词,对已有的理论或经验重新审视、探索，从而获得更深入或更正确的认识,re-recognize; to re-examine
49080,31788,1,名词,种庄稼的男子,farmer; peasant
49081,31789,1,名词,（行为）有明确的目标的性质,purposefulness; having a clear objective
49082,31790,1,,从播种到上市没有受到污染的蔬菜,pollution-free vegetables
49083,31791,1,名词,君主专制的政体,imperial system; monarchy
49084,31792,1,动词,帮人干活儿,to help with work
49085,31792,2,名词,帮人干活儿的人,helper; hired hand
49086,31793,1,动词,减弱；减退,attenuate; to weaken
49087,31794,1,名词,汇集并解释汉字的形、音、义的书籍。如东汉许慎的《说文解字》,character dictionary; wordbook
49088,31795,1,名词,为庆祝结婚而举办的宴席,wedding banquet
49089,31796,1,动词,原是《诗经·邶风》中的篇名（式：文言语助词；微：衰微）。借指衰微；衰落,decline; to wane
49090,31797,1,动词,把已录在磁带上的录音、录像再录到另一磁带上,transcribe; to copy (recording)
49091,31798,1,名词,作为两国或两地区分界的河流,boundary river
49092,31799,1,名词,一种能吹出像鸟叫声的响器。用金属或塑料制成，多在集合、操练、体育比赛时使用,whistle
49093,31800,1,形容词,哀伤痛苦,grieved; sorrowful
49094,31801,1,动词,大怒；特别生气,to fly into a rage
49095,31802,1,名词,银杏的通称,ginkgo; white nut
49096,31803,1,形容词,弯曲,curly; curled
49097,31804,1,名词,传说中能兴云雨、发洪水的龙,flood dragon; mythical dragon
49098,31805,1,动词,传递感情；表达情意（多指异性之间）,to convey affection
49099,31806,1,名词,轮船船员的职务名称。船长的第二助手，位居大副之下,second mate
49100,31807,1,名词,小孩子或年轻人,child; young person
49101,31808,1,动词,急速行驶,to speed; to drive rapidly
49102,31809,1,动词,用飞机播撒种子,aerial seeding
49103,31810,1,名词,物品中最优等的,highest grade; best quality
49104,31810,2,名词,最高的官阶,highest official rank
49105,31811,1,动词,迟疑；拿不定主意,hesitate; to waver
49106,31811,2,动词,移动不定,move unsteadily; to drift
49107,31812,1,名词,种植桑树的田地；泛指田地,mulberry field; farmland
49108,31813,1,,比喻脱离黑暗，重新见到光明,regain freedom; see the light again
49109,31814,1,名词,党组织对党员和申请入党的人围绕党的纲领、章程等进行教育的课程,Party lecture; Party class
49110,31815,1,名词,缝在衣服、提包等上面，可用来开合的链形金属或塑料制品,zipper
49111,31816,1,形容词,（草、头发等）松散杂乱,dishevelled; tangled
49112,31817,1,动词,报答和补偿,to repay; to compensate
49113,31817,2,名词,给予恩人的报答和补偿,repayment; compensation
49114,31818,1,,一切为国家和公众利益着想而没有私心；也指办事公正，不徇私情,selfless; impartial and fair
49115,31819,1,,传说道家炼丹时，炉中发出纯青的火焰才算成功。比喻学问、技艺等达到精湛完美的境地,reach perfection; consummate skill
49116,31820,1,动词,（以不合要求的人或物）充当,serve as; to act as
49117,31821,1,名词,古代神话、地理著作。作者不详，大约成书于战国时代。书中保存了许多远古的神话,Classic of Mountains and Seas (ancient text)
49118,31821,2,名词,比喻不着边际的闲聊,idle chatter; rambling talk
49119,31822,1,动词,【贯穿】从头到尾地体现,run through; to permeate
49120,31823,1,动词,大量的原子核因放射性而陆续发生转变，使核数目不断减少，最后变成另一种元素，如镭放射出α粒子后变成氡；也指不稳定的粒子自发转变为新粒子,decay (physics)
49121,31824,1,,改变态度，放弃原先的成见或主张,change one's mind; relent
49122,31825,1,形容词,形容老年人精神好，有神采,hale and hearty (of elderly)
49123,31826,1,名词,总的责任；全部的责任,overall responsibility
49124,31827,1,动词,预先设置,preset; to pre-set
49125,31828,1,动词,以“园”命名的单位等正式对外开放,"open to the public (e.g., park)"
49126,31828,2,动词,园里瓜果成熟，开始采摘,"begin harvesting (orchard, etc.)"
49127,31829,1,动词,赞扬,praise; to acclaim
49128,31830,1,,（对该管的不良现象）任其发展而不去管,let things drift; take no action
49129,31831,1,名词,陈列展品的屋子,exhibition room
49130,31832,1,形容词,各个方面或各门功课都优秀,all-around excellent
49131,31832,2,形容词,各个方面、各个环节都优质,all-around high quality
49132,31833,1,,利用电磁力悬浮与导向，由直线电动机推进的一种新型高速列车。无噪声，乘坐快捷舒适,maglev train
49133,31834,1,名词,具有收藏价值的珍贵罕见的图书版本,rare book; treasured edition
49134,31835,1,动词,观赏明月,admire the moon
49135,31836,1,名词,街道拐弯的地方,street corner
49136,31837,1,形容词,使人起劲,exciting; stimulating
49137,31837,2,形容词,起劲,full of enthusiasm
49138,31838,1,动词,编造不真实的情况向上报告,give false information; to lie in a report
49139,31839,1,动词,正常死亡,die of old age
49140,31840,1,名词,摄影机上的照明装置，能在瞬间发出强烈的闪光,flash (photography)
49141,31840,2,名词,航海灯标的主要部分，能发出定时明灭或变换色彩的闪光,flashing light (navigation)
49142,31841,1,动词,打碎；砸得稀烂,smash to pieces
49143,31842,1,名词,火车、轮船、旅馆、集体宿舍等为旅客、住宿者设置的床铺,berth; bunk
49144,31843,1,形容词,简便快捷,simple and fast
49145,31843,2,形容词,（言行）直率，爽快,straightforward; direct
49146,31844,1,名词,四条边相等、四个内角都是直角的四边形。是特殊的矩形,square (shape)
49147,31845,1,名词,旧时一种儿童启蒙课本，为三字一句的韵文，内容包括传统伦理道德和一些自然、历史常识。相传为南宋学者王应麟编著，1928年章炳麟重订,Three Character Classic
49148,31846,1,形容词,形容消沉、萎靡不振的样子,dejected; listless
49149,31846,2,形容词,形容破败的样子,dilapidated; ruined
49150,31847,1,名词,风吹松林时发出的像波涛一样的声响,sound of wind in pines
49151,31848,1,名词,有毒的草,poisonous plant
49152,31848,2,名词,比喻对社会有害的言论、主张和作品等,harmful speech/writing
49153,31849,1,形容词,用麻纤维纺织的,hemp-spinning
49154,31850,1,名词,脱粒后的麦秆,wheat straw
49155,31851,1,,应聘在高校讲学而不在该校正式编制内的教授,visiting professor
49156,31852,1,动词,自称为臣，表示甘心接受对方统治,declare allegiance; to submit
49157,31853,1,名词,呈平面状起遮盖作用的屋顶,roof surface
49158,31854,1,动词,带路,lead the way
49159,31855,1,动词,登山临水或登高临下；泛指游览山水名胜,climb heights for views; visit scenic spots
49160,31856,1,动词,又吹又打，指管乐器、打击乐器之类合奏,play wind and percussion instruments
49161,31856,2,动词,风吹雨打,exposed to elements
49162,31857,1,名词,一年或二年生草本植物，叶子细长，花绿色，小穗有芒。籽实也叫燕麦，可食用,oats
49163,31858,1,名词,以君主为最高统治者或国家元首的政治制度，可分为君主专制和君主立宪制两类（跟“共和制”相区别）,monarchy
49164,31859,1,动词,引起食欲,whet the appetite
49165,31860,1,动词,当陪客,accompany a guest
49166,31861,1,动词,退还预收或多收的钱,refund money
49167,31861,2,名词,退还的预收或多收的钱,refund
49168,31862,1,名词,对有某种技艺的年长者的尊称,master craftsman (respectful)
49169,31863,1,,声音、面容和谈笑的神态,voice and expression
49170,31864,1,,深深地受到某事或某人的祸害,suffer greatly from
49171,31865,1,,突然发生，来不及防备,caught off guard
49172,31866,1,形容词,形容器物小而精巧；也形容女人体态娇小，举止灵巧,small and exquisite
49173,31867,1,,丧失信心，意志消沉（心灰：心如死灰，灰心；冷：比喻消沉、失望）,disheartened
49174,31868,1,,跟着时机的变化而灵活应付,adapt to changing circumstances
49175,31869,1,,神话传说中的八位神仙，即汉钟离、张果老、吕洞宾、铁拐李、韩湘子、曹国舅、蓝采和、何仙姑。过海时不用舟船，各用各的法术。后用“八仙过海，各显其能”（或“各显神通”）比喻各自施展不同的本领，显示自己的才能,Eight Immortals crossing the sea
49176,31870,1,名词,弦乐器，琴面圆形或八角形，琴柄较短。有四根弦或三根弦，用拨子弹奏,yueqin (a stringed instrument)
49177,31871,1,动词,重新播放已经播放过的影视片、录像片的某些镜头或片段,replay
49178,31872,1,名词,像幕布一样笼罩大地的天空,canopy of the sky
49179,31872,2,名词,舞台后方悬挂的大布幔，可配合灯光表现天空的景象,stage backdrop
49180,31873,1,名词,由智囊组成的专门为某些人物或团体出谋献策的群体,think tank
49181,31874,1,动词,指把犯人押送到边远地区服劳役，古代一种刑罚,exile (as punishment)
49182,31875,1,名词,用面粉制成的食品，如馒头、烙饼、面条等,flour-based food
49183,31876,1,动词,把零碎的材料收集起来整理成文（常用于文章标题）,gleanings
49184,31877,1,形容词,十分寒冷,bitterly cold
49185,31877,2,形容词,极其贫寒,extremely poor
49186,31878,1,名词,杰出的名声；美名,illustrious name
49187,31879,1,名词,旧指商行或作坊的业主,shop owner
49188,31880,1,名词,古代一种摔跤竞技活动，秦汉时称角抵，两晋、南北朝至宋元时期称相扑。今日本式摔跤也称相扑,sumo
49189,31881,1,名词,旧俗贴在门扇上的神像，用来驱鬼避邪，保卫门户,door god
49190,31882,1,名词,靠近路口、巷口的地方,entrance of an alley
49191,31883,1,动词,敬词，指到来,arrive (respectful term)
49192,31884,1,形容词,不承担本职工作以外的其他工作的；非兼职的,full-time
49193,31885,1,名词,跳腰鼓舞用的打击乐器，系在腰间，用木槌敲击。鼓身木框，短圆柱形，中间稍粗，两端蒙皮,waist drum (instrument)
49194,31885,2,名词,指腰鼓舞。汉族民间舞蹈。舞者身背腰鼓，双手各执鼓槌，两面击鼓，边击边舞，节奏强烈，动作健美,waist drum dance
49195,31886,1,名词,从事某种农事活动的适当时令,farming season
49196,31887,1,形容词,萎靡不振，情绪低落,dejected
49197,31888,1,名词,某些地区指甘薯,sweet potato
49198,31889,1,名词,古代帝王、诸侯所祭祀的土神（社）和谷神（稷），合称社稷。后借指国家,state; country
49199,31890,1,动词,外界没有声音，而患者感觉耳内有嗡嗡的声音。多由听觉器官或神经系统病变引起,tinnitus
49200,31891,1,形容词,俊俏美丽（多形容女性）,pretty
49201,31892,1,动词,跟随；追随,follow
49202,31893,1,动词,长时间在某地居住,reside long-term
49203,31894,1,名词,某些器物上用脚操纵的装置。如风琴踏板、赛艇踏板等,pedal
49204,31894,2,名词,安放在车沿、船边等处供人上下用的装置（有固定的，也有活动的）,step (for boarding)
49205,31894,3,名词,田径场上供跳远起跳用的板,takeoff board (for long jump)
49206,31894,4,名词,体操器械助跳器的通称,springboard
49207,31894,5,名词,老式床前或桌案下垫脚用的一种附属家具，形状像小几或矮凳,footstool
49208,31895,1,副词,大致；不仔细,roughly
49209,31896,1,名词,负责防守的区域,defense area
49210,31897,1,名词,汉字字体的一种。由隶书演变而来。因形体方正，笔画平直，可作楷模，故称,regular script (calligraphy)
49211,31898,1,动词,待人不尽心或委屈了人,treat unfairly
49212,31899,1,名词,某些地区指饭馆,restaurant
49213,31900,1,动词,休息,rest
49214,31901,1,名词,天空,sky
49215,31901,2,名词,天下；所有的地方,the whole world
49216,31902,1,,《史记·廉颇蔺相如列传》记载：战国时，赵惠文王得到和氏璧，秦昭王表示愿意用十五座城换这块璧（价：价钱；连城：连成一片的多座城池）。后用“价值连城”形容物品特别值钱，十分珍贵,priceless
49217,31903,1,,过分计较微小的利益或琐细的事情（斤斤：过分注重）,haggle over every ounce
49218,31904,1,,不表示同意，也不表示反对。指不明确表态,neither affirm nor deny
49219,31905,1,名词,指讲印欧语系斯拉夫语族诸语言的民族。主要分布在东欧,Slavs
49220,31906,1,,混合成一体,merge into one
49221,31907,1,,以疑难案件的发生和侦破过程为中心情节的小说,detective novel
49222,31908,1,,特指我国在发展高能技术、空间技术初期所研制成功的原子弹、氢弹和人造地球卫星,"Two Bombs, One Satellite"
49223,31909,1,名词,外甥女,niece (sister's daughter)
49224,31910,1,,大的工程或重要任务等宣告完成,be successfully accomplished
49225,31911,1,动词,发生纠纷时，不经过司法手续而私下了结（跟“公了”相对）,settle privately
49226,31912,1,动词,以欺诈等违法手段侵吞、贪污经手的钱物,embezzle
49227,31913,1,名词,意义相同或相近的词。如“西红柿”和“番茄”，“散步”和“溜达”,synonym
49228,31914,1,名词,作抵押用的钱,deposit (as security)
49229,31915,1,名词,18世纪末法国资产阶级革命时期执行刀斩刑罚的台子；泛指处死人的地方,guillotine
49230,31916,1,名词,围绕南极的大陆。位于地球南端，被太平洋、印度洋和大西洋所包围。面积约1410万平方公里。,Antarctica
49231,31917,1,名词,能促进雌性器官成熟和副性征发育并维持其正常功能的激素。卵泡、黄体分泌的激素都属此类,estrogen
49232,31918,1,名词,1906年由美国人安娜·加维丝倡议的纪念母亲、敬爱母亲的节日。时间为每年5月的第二个星期日,Mother's Day
49233,31919,1,名词,冰和霜。多用来形容节操高洁或神情严肃等,ice and frost
49234,31920,1,动词,调查（案情）并寻访（有关人员）,investigate
49235,31921,1,名词,沙皇时代的俄国,Tsarist Russia
49236,31922,1,动词,搜刮（钱财）,amass (wealth)
49237,31922,2,动词,收集（零散东西）,gather (scattered items)
49238,31923,1,名词,街道的景观,street scene
49239,31924,1,动词,指原判决被第二审法院（上级法院）撤销后，发回原审法院重新审理,retrial
49240,31925,1,名词,中医对人体体液的统称；也专指唾液,body fluids (TCM)
49241,31926,1,名词,旧时对外国侵略者的憎称,foreign devil
49242,31927,1,名词,内充热空气使之比周围同体积冷空气轻而能上升的气球。用于大气层取样、边防瞭望、空中摄影、航空运动等,hot-air balloon
49243,31928,1,动词,眨,blink
49244,31929,1,,门口和庭院像集市一样热闹。形容上门交往的人很多,swarming with visitors
49245,31930,1,动词,旧指点上灯；【掌灯】点灯,light the lamp
49246,31931,1,,古书记载：战国时周赧（nǎn）王欠债很多，无法偿还，为了逃债只好躲到一座高台上。后用“债台高筑”形容欠债极多,heavily in debt
49247,31932,1,名词,写有领导批示的便条,note with official instructions
49248,31933,1,动词,【亏】多亏,fortunately
49249,31933,2,动词,【亏】“多亏”的反说，有斥责讥讽的语气,(ironically) it's a pity that
49250,31934,1,名词,中距离赛跑项目。包括男、女800米、1500米，男子3000米等,middle-distance running
49251,31935,1,名词,〈文〉开玩笑的话；随便说说并不认真的话,jest
49252,31935,2,动词,开玩笑说,say in jest
49253,31936,1,名词,指成绩优异超群的学生,outstanding student
49254,31937,1,动词,确定要实施的项目,determine projects
49255,31937,2,名词,已经被确定要实施的项目,determined project
49256,31938,1,名词,本地以外的较大城镇；也泛指外地,other cities
49257,31939,1,名词,月球运行到地球和太阳之间，太阳照射地球的光被月球遮挡的现象。太阳光全部被遮住时叫日全食；部分被遮住时叫日偏食；中心部分被遮住时叫日环食,solar eclipse
49258,31940,1,名词,翠绿的竹子,emerald bamboo
49259,31941,1,名词,好消息,good news
49260,31942,1,,以被报道者支付钱财为条件而刊发的新闻。是严重违反新闻职业道德的行为,paid news
49261,31943,1,名词,一种用手投掷的炸弹，比手榴弹大，爆破力强，多用于反坦克,anti-tank grenade
49262,31944,1,,大规模地进行土木工程建设,build on a large scale
49263,31945,1,,感情真挚，心意恳切,sincere and earnest
49264,31946,1,动词,把东西放在通风而有阳光的地方使干燥,air and sun-dry
49265,31947,1,动词,新产品正式投产前进行试验性生产,trial production (of new product)
49266,31947,2,动词,新建厂矿正式开工生产前进行试验性生产,trial operation (of new factory)
49267,31948,1,,拖了很久没有决定下来,long unresolved
49268,31949,1,,社会经济活动中有机地结合在一起的各个组成部分和环节，通过相互推动和制约而形成的经济运转形式,economic mechanism
49269,31950,1,,原指作战时为了行动方便而不披挂盔甲；现多比喻解除各种思想顾虑，全身心地投入工作,go into battle with a light pack
49270,31951,1,名词,返程,return journey
49271,31952,1,名词,地球上储量很少、开采较难，因而价格昂贵的金属。包括金、银、铂等,precious metal
49272,31953,1,形容词,精致工巧,exquisite workmanship
49273,31954,1,动词,用手捂住脸,cover one's face
49274,31955,1,名词,火锅,hot pot
49275,31955,2,名词,【锅】形状像锅的东西,pot-shaped object
49276,31956,1,动词,开导、解释、劝说，使人解开思想疙瘩,persuade through reasoning
49277,31957,1,动词,恭敬地等候,await respectfully
49278,31958,1,动词,缫,reel silk
49279,31959,1,形容词,细小零碎；细微琐碎,fine and fragmented
49280,31960,1,名词,指人身材的高矮胖瘦,build (of a person)
49281,31961,1,名词,外耳根部,base of the ear
49282,31962,1,名词,旧时称戏曲演员（含轻蔑意）,opera performer (derogatory)
49283,31963,1,名词,平庸而没有作为的人,mediocre person
49284,31964,1,名词,两个或两个以上的主权国家为了某种共同利益而组成的联合体。成员国在军事、外交和经济等方面采取某些联合行动，但仍保留各自的独立主权,confederation
49285,31965,1,名词,【臣】古代官吏对君主的自称,subject (self-reference to monarch)
49286,31966,1,名词,陈旧过时的形式、方法、言辞等,old convention
49287,31967,1,名词,模具,mold
49288,31968,1,名词,牛身上的毛；比喻细密或繁多的事物,Ox hair; numerous as hairs
49289,31969,1,名词,最严厉的刑罚，通常指死刑,capital punishment
49290,31970,1,动词,梳头洗脸,comb hair and wash face
49291,31971,1,名词,词序,word order
49292,31972,1,动词,足球比赛中球员抢占有利射门位置；泛指抢占有利位置,seize advantageous position (sports)
49293,31972,2,动词,火车、汽车等因晚点而加速，争取赶在准点到达,make up for lost time (transportation)
49294,31973,1,名词,家庭举办的宴会,family banquet
49295,31974,1,名词,铜和锌的合金。比铜耐腐蚀，工业上用途很广,brass
49296,31975,1,名词,折扇或团扇的骨架上糊的纸或绢,fan surface
49297,31976,1,名词,规定财产继承关系的法律。《中华人民共和国继承法》于1985年4月10日由第六届全国人大三次会议通过并公布，同年10月1日正式实施,inheritance law
49298,31977,1,形容词,行为越出法度（轨：法度）的；特指搞叛乱活动的,unlawful; rebellious
49299,31978,1,动词,选择搭配,select and match
49300,31978,2,动词,选择配备,select and equip
49301,31978,3,动词,选择优良种畜配种,selective breeding (livestock)
49302,31979,1,动词,分成若干路（活动）；分开各走不同的路,separate and take different routes
49303,31980,1,,人类历史上原始公社解体以后出现的第一个人剥削人的私有制社会。这个社会以奴隶主占有生产资料和奴隶为基础，建立了奴隶主专政的奴隶制国家。社会生产力比原始公社时期有较大的发展，农业、畜牧业和手工业开始分工，城乡以及脑力劳动和体力劳动也开始分离,slave society
49304,31981,1,,对护士的美称,angel in white (nurse)
49305,31982,1,,屏幕上显示的图像只有黑、白颜色的电视机,black-and-white television
49306,31983,1,,因苦闷、忧伤而发出一声声叹息,sigh in despair
49307,31984,1,名词,愚昧无知的人,foolish person
49308,31985,1,动词,比喻获得成功并赢得称誉,gain fame through success
49309,31986,1,动词,像屏风一样遮挡着,shield; block
49310,31986,2,名词,【屏障】像屏风一样起遮蔽作用的东西,protective screen
49311,31987,1,名词,以做鞋或修鞋为职业的人,shoemaker
49312,31988,1,名词,输送高压电流的导线,high-voltage line
