definition_id,pinyin_id,definition_sn,pos,definition_cn,definition_en
47083,30096,1,动词,对别人的文章、作业等进行修改并加批语,correct and comment
47084,30097,1,动词,懂水性；会游泳,know how to swim
47085,30098,1,名词,吉祥的日子,auspicious day
47086,30099,1,动词,用公文向上级报告,submit a report
47087,30100,1,名词,违法贩运或存贮的违禁货物,contraband goods
47088,30100,2,名词,比喻在某种名义掩饰下的不正当行为或错误观点,ulterior motive
47089,30101,1,名词,借指锋利的刀、剑等,sharp blade
47090,30101,2,名词,锋利的刀口或剑刃,sharp edge
47091,30102,1,名词,兴盛和衰败,prosperity and decline
47092,30103,1,名词,声乐中的女子声部，一般分女高音、女中音、女低音,female voice
47093,30104,1,名词,身体的主干，指人体除头部、四肢外的部分,torso
47094,30104,2,名词,泛指事物的主干,main body
47095,30105,1,动词,解除疑惑,dispel doubts
47096,30106,1,名词,用白话写成的文章（跟“文言文”相区别）,vernacular writing
47097,30107,1,名词,利用核反应堆中核燃料裂变或聚变反应产生的热能转变成的动力,nuclear power
47098,30108,1,,比喻通过内部关系或用不正当手段通融，牟取非分利益,go through the back door
47099,30109,1,名词,出售咖啡等饮料供顾客坐饮的厅堂，多附设于宾馆或大的娱乐场所,coffee shop
47100,30110,1,,拍着手喊痛快。多用来形容仇恨得到消除、正义得到伸张或目的得到实现时的痛快心情,clap and cheer
47101,30111,1,名词,我国农历的通称,lunar calendar
47102,30111,2,名词,"太阴历的简称。是根据月球围绕地球运转的周期（约等于29.5天）制定的历法。大月30天，小月29天,12个月为1年,1年354天或355天。伊斯兰教历就是阴历的一种",purely lunar calendar
47103,30112,1,,发自内心的话,words from the heart
47104,30113,1,名词,为获取木材而培植的树林,timber forest
47105,30114,1,名词,花椒、八角、茴香、桂皮、丁香五种有香味的调料,five-spice powder
47106,30115,1,名词,（人或物体）所降落的位置,landing point
47107,30116,1,名词,〈文〉整个天空,the whole sky
47108,30116,2,名词,历法上指环绕天体的大圆周。现代周天分为360°,celestial circle
47109,30117,1,,走路时身子摇来摆去。形容神气活现或傲慢自得的样子,swagger
47110,30118,1,名词,松树的种子；某些地区也指松仁,pine nut
47111,30119,1,动词,（某种商品）购买的人多；畅销,sell well
47112,30120,1,,负责审理刑事案件的法庭。简称刑庭,criminal court
47113,30121,1,形容词,等级优良的,first-class
47114,30122,1,动词,除去纺织纤维及其制品等所含的色素，使变白,bleach
47115,30123,1,动词,遭到劫难,suffer disaster
47116,30124,1,动词,贩卖假冒伪劣产品,traffic in fakes
47117,30125,1,,通过电子计算机网络购买东西,online shopping
47118,30126,1,,原指言谈高明广博，现多指漫无边际地大发议论,talk volubly
47119,30127,1,名词,篇章的标题,chapter title
47120,30127,2,名词,书中篇章标题的目录,table of contents
47121,30128,1,动词,热切盼望,ardently hope
47122,30129,1,动词,头发大量脱落,lose hair
47123,30130,1,动词,比喻居同等地位,be on a par with
47124,30130,2,动词,肩并肩,shoulder to shoulder
47125,30131,1,动词,选拔抽调（人员）,select and transfer
47126,30132,1,动词,刊印发行,publish
47127,30133,1,名词,水边由泥沙淤积而成的田地,sandy field
47128,30134,1,动词,（用凶器）暗杀,assassinate
47129,30135,1,动词,使胆子增大,boost courage
47130,30136,1,拟声词,模拟哀鸣、呼号（háo）的声音,wailing
47131,30137,1,代词,指农历每月上旬不确定的某一天,early days of the month
47132,30137,2,代词,指初级中学不确定的一个年级,junior high grade
47133,30138,1,动词,比喻在诗文中罗列大量华丽而无用的词语等,pile up ornate phrases
47134,30138,2,动词,堆积砖石并用灰浆黏合,pile up and cement
47135,30139,1,动词,宰杀切割；比喻欺凌压榨,dismember and oppress
47136,30140,1,名词,警惕戒备意识,vigilance
47137,30141,1,名词,指男女之间有爱恋之情的人,lovers
47138,30142,1,,趋向有利的一面，避开不利的一面,seek advantage and avoid harm
47139,30143,1,,只能远远地看见前面走的人马带起的尘土，却追赶不上。比喻远远比不上,too far behind to catch up
47140,30144,1,名词,（文章、著作的）中心思想,central idea
47141,30144,2,名词,（地位较高的人或群体的）意愿和要求,intention
47142,30145,1,动词,显现；表露,reveal
47143,30146,1,动词,机体的正常细胞在致癌和促癌因素作用下，转化成为癌细胞,become cancerous
47144,30147,1,名词,降雪量中等的雪。气象学上指24小时内降雪量为2.5—5毫米的雪,moderate snow
47145,30148,1,形容词,坚实；结实,firm and solid
47146,30149,1,名词,儿童服装,children's clothing
47147,30150,1,名词,想睡或刚睡醒时带睡意的眼睛,sleepy eyes
47148,30151,1,动词,超过自己本来的希望；抱有过大的希望,beyond expectation
47149,30152,1,名词,危险的现象,dangerous sign
47150,30153,1,名词,用泥土捏成的人像；也指陶俑,clay figurine
47151,30154,1,名词,竹子的一种。茎高大，茎壁厚，坚韧有弹性，可以做家具、农具，也用于造纸或建筑,moso bamboo
47152,30155,1,动词,发电报或电传等表示祝贺,cable congratulations
47153,30156,1,名词,为建筑或制造作依据而按照一定的规格和要求绘制的图形,design drawing
47154,30157,1,动词,疾病痊愈；康复,recover from illness
47155,30158,1,名词,盛油的箱子；特指飞机、汽车上盛燃料油的装置,fuel tank
47156,30159,1,名词,未经加工的木材,log
47157,30160,1,动词,放牧羊群；比喻对一定的人群不加管理，任其自由行动,herd sheep
47158,30161,1,形容词,顺利,smooth
47159,30162,1,,摇摆晃动，就要掉下去的样子。多形容情势危急或地位不稳,tottering
47160,30163,1,动词,选择配偶,choose a spouse
47161,30164,1,名词,各种农业生产活动,farm work
47162,30165,1,名词,生物繁殖产生的后代，第一代称为子一代，第二代称为子二代，以此类推,filial generation
47163,30166,1,名词,某些地区指出租汽车,taxi
47164,30167,1,动词,指往外借,lend out
47165,30168,1,动词,（工程项目）停止建设,stop construction
47166,30169,1,,简要地说。常用作插入语，引出下文概括性的说明,in short
47167,30170,1,名词,两种或两种以上的物质合成化合物时相互作用的力；泛指能使关系亲密融洽的作用力,affinity
47168,30171,1,名词,指生活懒散、不爱劳动、奢侈挥霍的青年男子,spoiled young man
47169,30171,2,名词,旧时对富贵人家大儿子的尊称,eldest young master
47170,30172,1,名词,指集体所有制,large collective ownership
47171,30173,1,,在雪地上滚动雪球，体积越滚越大；比喻事物越聚越多，越发展越大,Snowball; to snowball
47172,30174,1,名词,《圣经·旧约全书》中称人类始祖亚当、夏娃所居住的乐园；借指人间乐园(伊甸：希伯来语‘Ēden音译),Garden of Eden; paradise
47173,30175,1,名词,为了私利而结合在一起的小团伙,Small clique; exclusive circle
47174,30175,2,名词,狭小闭塞的生活范围,Narrow social circle; limited sphere of life
47175,30176,1,名词,生物对药物的抵抗力。一般指由于常用某种药物而使病菌或害虫对该药产生的抵抗力,Drug resistance
47176,30177,1,名词,基督教指创造万物的上帝,Creator; God
47177,30178,1,名词,一个进行有性生殖的生物群中各成员所共有的全部基因。一个完整的基因库应是一个特定物种所具有的全部遗传信息,Gene pool
47178,30179,1,名词,某些地区小孩子对老年妇女的称呼,Old woman (child's term)
47179,30179,2,名词,某些地区指丈夫的母亲,Mother-in-law (husband's mother)
47180,30180,1,名词,指我国农村中享受五保待遇的家庭或个人,Five-guarantee household
47181,30181,1,名词,由中心点向四周发散的力；比喻某事物向周围扩大其影响的能力,Radiation force; radiating influence
47182,30182,1,名词,指物体承受的压力，如建筑物的自重、桥梁所承受的重量等,Load
47183,30183,1,动词,商议；谋划,To deliberate; to plan
47184,30184,1,,长久兴旺而不衰败,Long-lasting prosperity; enduringly thriving
47185,30185,1,,互联网上用于搜索信息的一种系统。它能将搜索到的信息自动排列成索引方式并存储于大型数据库中,Search engine
47186,30186,1,名词,流亡在外、生活没有着落的灾民,Refugee; displaced person
47187,30187,1,名词,像网一样纵横交错形成的格子,Grid; mesh
47188,30187,2,名词,信息科学上指通过互联网把广泛分布的计算机、存储器、数据库等组合成可以整合多种资源的系统，为用户提供计算、存储、访问等一体化应用服务，充分实现资源共享,Grid computing
47189,30188,1,名词,脖子,Neck
47190,30189,1,动词,征集稿件,To solicit contributions
47191,30190,1,形容词,形容绞尽脑汁，想尽办法（多含贬义）,To rack one's brains (often derogatory)
47192,30191,1,动词,聚集到一起,To gather together
47193,30192,1,名词,船体,Hull (of a ship)
47194,30193,1,名词,子女幼小常偎依在父母跟前，故常用“膝下”借指父母身边。子女给父母或祖父母写信时，常把“膝下”置于开头称呼之后，表示对上辈的尊敬和依恋，如“父母亲大人膝下”,At one's parents' side (in letters)
47195,30194,1,名词,男子竞技体操项目，运动员两手握吊环，身体做出各种动作,Rings (gymnastics event)
47196,30194,2,名词,体操器械，在架子的横杠上吊两条绳，下端各拴一个环,Gymnastic rings (apparatus)
47197,30195,1,名词,指《诗经》《尚书》《礼记》《周易》《春秋》五部儒家经典著作,Five Classics (Confucian texts)
47198,30195,2,名词,中医指《素问》《灵枢》《难经》《金匮要略》《甲乙经》五部医书,Five Classics (traditional Chinese medicine texts)
47199,30196,1,名词,无机化合物，主要成分为硫化汞，红色或棕红色。是炼汞的主要原料，也可以做颜料和药材,Cinnabar
47200,30197,1,名词,鹿的一种。雌雄都有角，角长，分成许多枝杈，蹄宽而大，尾白色，极短。善游泳，性温和。以地衣、谷类和草类等为食。俗称四不像,Reindeer
47201,30197,2,名词,驯养的鹿,Domesticated deer
47202,30198,1,,使人感动得落下眼泪,Tear-jerking; deeply moving
47203,30199,1,动词,接收后转交给相关的人或部门,To receive and transfer
47204,30200,1,动词,产生怀疑,To become suspicious
47205,30201,1,名词,羊头上坚硬弯曲的角；比喻像羊角一样弯曲向上的旋风,Ram's horn; whirlwind
47206,30202,1,名词,弯曲的河段,River bend
47207,30203,1,名词,过道；走廊,Corridor; passageway
47208,30203,2,名词,院落、公园、住宅小区或其他场所中用砖石等砌成的通路,Paved pathway
47209,30204,1,动词,涂上黑色；比喻丑化人或事物的形象,To blacken; to smear
47210,30205,1,动词,媚世,To pander to vulgar tastes
47211,30206,1,动词,伊斯兰教指教徒到圣地朝拜,To make a pilgrimage (Islam)
47212,30206,2,动词,〈文〉拜见君主,To have an audience with a monarch
47213,30207,1,形容词,指印刷用纸中相当于整张纸没有切分的,Full sheet (paper size)
47214,30208,1,名词,骡子和马；泛指大牲口,Mules and horses; draft animals
47215,30209,1,动词,军队出征前主帅向全军宣布作战意义，表示决心，以激励将士英勇作战；泛指为完成某项重要任务集体表示决心,To pledge before a campaign
47216,30210,1,动词,扰乱,To disrupt; to disturb
47217,30211,1,名词,作为团体标志的旗帜；特指中国共产主义青年团的旗帜,League flag (esp. Communist Youth League)
47218,30212,1,名词,心脏活动过程中会产生生物电，用特制的仪器记录这种电流引起的电位变化的线条图形称心电图。它能帮助了解心脏活动情况，诊断心脏疾病,Electrocardiogram
47219,30213,1,名词,指只会死读书、不会联系实际的人；也指只有书本知识，不懂人情世故、不会随机应变的人,Bookworm; pedant
47220,30214,1,名词,运输的路线,Transportation route
47221,30215,1,名词,急性脑血管病，因脑动脉硬化，血液黏稠度高等原因，脑血管中形成血栓，阻碍血流所致。多在休息和睡眠中发病。可出现肢体麻木、失语或偏瘫等,Cerebral thrombosis
47222,30216,1,名词,没有人居住的地区，多指蛮荒地区,Uninhabited area
47223,30217,1,形容词,（景物）明净秀丽,Bright and beautiful
47224,30218,1,连词,连接句子，表示顺承关系，有“既然如此，那么……”的意思,Then; in that case
47225,30219,1,名词,修辞手法，把事物当作人来描写，会像人一样说话和行事,Personification
47226,30220,1,,像又饿又渴的人盼望得到饭和水一样。形容欲望或要求十分迫切,Eagerly; thirstily
47227,30221,1,名词,负责粮食收购、存储、调拨、管理的机构,Grain station
47228,30222,1,,指用征收高额关税来阻止或限制外国某些商品输入的外贸措施,Tariff barrier
47229,30223,1,动词,明白，通达（事理）,To understand thoroughly
47230,30224,1,动词,不管付出多大的代价也不顾惜,To go for broke; to risk everything
47231,30225,1,动词,因时间紧迫而不能等候到,Cannot wait
47232,30226,1,名词,有许多小孔的勺子。多用金属制成，用来从汤或油中捞取食物,Strainer spoon; slotted spoon
47233,30227,1,动词,调动使转换,To transfer; to reassign
47234,30228,1,名词,指祖母、母亲、妻子的娘家及女儿、孙女、姐妹等的婆家,Maternal relatives; relatives by marriage
47235,30229,1,形容词,形容人光艳美丽或事物色彩鲜明,Dazzlingly beautiful
47236,30230,1,动词,（货物）积压在仓库里,To overstock (inventory)
47237,30230,2,动词,压缩库存,To reduce inventory
47238,30231,1,名词,政府机关和执政人员的思想作风、工作作风,Government conduct
47239,30232,1,动词,指婴儿降生,To be born (of a baby)
47240,30232,2,动词,跌落地上,To fall to the ground
47241,30233,1,动词,旧时一种表示敬意的礼节，举双手至胸，抱拳，上身前倾,To make a bow with hands clasped
47242,30234,1,名词,磁场对电流、运动电荷和磁体的作用力,Magnetic force
47243,30235,1,名词,做熟的食品,Cooked food
47244,30236,1,名词,【女巫】指旧时以装神弄鬼、搞迷信活动骗人为职业的妇女,Witch; sorceress
47245,30237,1,动词,零星买油,To buy oil in small quantities
47246,30237,2,动词,（给皮革制品）上油,To oil (leather goods)
47247,30238,1,,没翅膀却飞走了。比喻物品突然不见了；也比喻消息、言论等传播很快,To vanish without trace; to spread like wildfire
47248,30239,1,名词,以前的丈夫（多指再婚女子已经死去或离异的丈夫）,Former husband
47249,30240,1,动词,照实物画；形象地记述,
47250,30241,1,形容词,形容高兴的样子,Happy; contented
47251,30242,1,名词,静脉血管在皮肤表面显现出的青色凸起,Blue vein (visible under skin)
47252,30243,1,动词,怎么可以。用反问的语气表示不可以,"How can...? (rhetorical, implying ""cannot"")"
47253,30244,1,动词,提出质疑,To raise doubts
47254,30245,1,名词,有关集会、会议或某些团体组织的事务,Conference affairs
47255,30246,1,,指以五为单位数数儿，一五，一十，十五，二十……地数下去。形容从头到尾无所遗漏地叙说。,In full detail
47256,30247,1,名词,法律上指公民享有的保持其私生活中的秘密不为他人知晓的权利,Right to privacy
47257,30248,1,名词,把人或事物划分成等级的制度。一般指奴隶制与封建制中按人的社会政治地位的高低划分等级的政治制度。这种等级被法律所确认，通常是世袭的,Hierarchy; caste system
47258,30249,1,,公安局、检察院、法院的合称,"Public security organs, procuratorates and courts"
47259,30250,1,名词,事物本身的美。包括经过人们加工改造的自然对象（如园林）的美和未经人们加工改造的自然对象（如星空、大海）的美,Natural beauty
47260,30251,1,名词,供玩赏的东西,Plaything; object for amusement
47261,30251,2,名词,比喻不受尊重、被当作玩物的人,Plaything (person)
47262,30251,3,动词,沉迷于玩赏所喜好的东西,To indulge in hobbies
47263,30252,1,名词,数学上用来表示两个量或两个表达式相等关系的符号，用“＝”表示,Equals sign
47264,30253,1,形容词,涉及面广，范围大,Broad; wide-ranging
47265,30253,2,形容词,（文章或讲话）过于笼统而不对具体对象作具体分析,Vague; overly general
47266,30254,1,名词,山腰,Mountainside; halfway up a mountain
47267,30255,1,名词,指仪器、设备、试剂或测试方法等的敏感程度。如电表对微弱电流通过的敏感程度等,Sensitivity
47268,30256,1,名词,用一根木头搭成的小桥；比喻狭窄艰难的途径,Single-plank bridge; difficult path
47269,30257,1,形容词,形容细毛又软又密的样子,Furry; hairy
47270,30258,1,形容词,大致可以；凑合,So-so; passable
47271,30258,2,形容词,很马虎；形容做事敷衍草率,careless; describes doing things in a perfunctory or sloppy manner
47272,30259,1,,根据社会发展需要而确立的人才结构、人才培养和人才使用等方面的长远谋划,"talent strategy; long-term planning for talent structure, cultivation, and utilization based on societal development needs"
47273,30260,1,形容词,形容寂静无声或一点儿消息也没有,silent; describes complete silence or having no news at all
47274,30261,1,动词,免于检查或检验,exempt from inspection or testing
47275,30262,1,名词,练习、比赛射击或射箭等的场地,firing range; a venue for practicing or competing in shooting or archery
47276,30263,1,名词,信仰某种宗教的人群,believers; a group of people who believe in a certain religion
47277,30264,1,动词,像喜鹊一样飞起。多比喻名声突然提升,"rise suddenly; like a magpie flying up, often metaphorically for a sudden rise in reputation"
47278,30265,1,动词,胜过,surpass; be better than
47279,30266,1,动词,遮掩隐藏,conceal; cover and hide
47280,30267,1,动词,用外科手术截去坏死或无法治疗的肢体,amputate; surgically remove a necrotic or untreatable limb
47281,30268,1,名词,轻微的波浪形成的水纹,ripple; water patterns formed by slight waves
47282,30269,1,形容词,精深微妙,profound and subtle; deep and intricate
47283,30269,2,名词,指精微之处,subtleties; refers to the minute details
47284,30270,1,名词,有机酸，无色或淡黄色稠厚液体，可溶于水，广泛存在于生物体中。用于食品、制革、纺织、医药等工业,"lactic acid; an organic acid, colorless or pale yellow thick liquid, soluble in water, widely found in living organisms, used in food, leather, textile, pharmaceutical industries, etc."
47285,30271,1,动词,动用军队；起兵,dispatch troops; mobilize the army; raise an army
47286,30272,1,名词,【零花】〈口〉零花钱,pocket money; colloquial for small amounts of money for incidental expenses
47287,30272,2,动词,【零花】零星地花费,spend in small amounts; spend money sporadically
47288,30273,1,名词,红心；赤诚的心,loyal heart; a sincere and devoted heart
47289,30274,1,动词,互相比较,compare with each other; mutually compare
47290,30275,1,量词,英国的辅币单位，100新便士等于1英镑,"penny; a British fractional monetary unit, 100 new pence equal 1 pound"
47291,30276,1,形容词,不是分内的；超越本分的,presumptuous; not within one's due; overstepping one's bounds
47292,30277,1,动词,为弄清前面道路的情况而事先实地察看,scout the path; inspect the road ahead in advance to understand the situation
47293,30278,1,名词,原指香港政府；1997年7月1日香港回归后指香港特别行政区政府，直接隶属于中华人民共和国中央政府,"Hong Kong government; originally referred to the Hong Kong government; after July 1, 1997, refers to the Hong Kong Special Administrative Region Government, directly under the Central Government of the People's Republic of China"
47294,30279,1,名词,古代指儒家学者群体；后泛指知识界,Confucian scholarly circle
47295,30280,1,动词,发出号令,issue orders; give commands
47296,30281,1,动词,特别批准,specially approve; grant special approval
47297,30282,1,动词,知道,know; be aware of
47298,30283,1,,不能放在同一时间里谈论。形容两者之间差别很大，不能相提并论,Not comparable
47299,30284,1,名词,四周的原野,surrounding wilderness; the fields all around
47300,30285,1,名词,泛指物品的质量,Quality
47301,30285,2,名词,金银货币、首饰、器物等所含纯金或纯银的量,"fineness; the amount of pure gold or silver contained in gold/silver currency, jewelry, artifacts, etc."
47302,30286,1,名词,中等师范学校的简称,Secondary normal school
47303,30287,1,动词,内脏出血，由嘴里吐出，一般分为咯血、呕血两种,Vomit blood
47304,30288,1,动词,分兵绕到敌军侧面或背面同时进攻,outflank; divide troops to attack the enemy simultaneously from the sides or rear
47305,30289,1,动词,消除（不好的情绪）,dispel; eliminate (negative emotions)
47306,30290,1,名词,较大的新式澡盆，多用陶瓷、搪瓷或塑料制成,"bathtub; a large modern bathtub, often made of ceramic, enamel, or plastic"
47307,30291,1,动词,由于太阳和月球的引力作用，海洋水面升高,tide rises; the sea level rises due to the gravitational pull of the sun and moon
47308,30292,1,名词,可使乘客中途不转车直接到达目的地的火车或汽车,through train; a train or bus that allows passengers to reach their destination directly without transfers
47309,30292,2,名词,比喻简便快捷的运作方式,direct route; metaphor for a simple and fast operational method
47310,30293,1,动词,正式表演或演出前进行试演,preview; perform a trial run before the official performance or show
47311,30293,2,动词,比喻某项大规模行动开展之前进行试验性行动,rehearse; metaphor for conducting a trial action before a large-scale operation
47312,30294,1,形容词,干瘦；干而收缩，不丰满,"shrivelled; dry and shrunken, not plump"
47313,30294,2,形容词,比喻诗文内容空洞无物，语言枯燥乏味,Dry and dull
47314,30295,1,动词,举办学习班、培训班等,"run a class; organize study classes, training classes, etc."
47315,30296,1,动词,〈文〉积极进取,diligently advance; actively strive to improve
47316,30296,2,动词,向精深的方向前进,progress towards profundity; advance in a deep and refined direction
47317,30297,1,名词,比喻温暖激动的感觉,Warm surge
47318,30297,2,名词,热潮,trend; upsurge
47319,30297,3,名词,物理学上指在导热物体中单位时间内通过垂直于传热方向某一截面积的热量,"heat flow; in physics, the amount of heat passing through a unit area perpendicular to the direction of heat transfer per unit time in a conductive object"
47320,30298,1,名词,寻呼台的简称,Paging station
47321,30299,1,名词,僧道诵经做法事的场所,Taoist/Buddhist ritual site; a place where monks or Taoists chant scriptures and perform rituals
47322,30299,2,名词,指僧道所做的法事,ritual; refers to the religious ceremonies performed by monks or Taoists
47323,30300,1,动词,等候（上级的指示、决定等）,"await; wait for (superior's instructions, decisions, etc.)"
47324,30301,1,动词,胎儿头朝下经母体阴道自然产出（跟“难产”相区别）,"natural childbirth; the fetus is born naturally head-first through the mother's vagina (as opposed to ""difficult labor"")"
47325,30302,1,名词,指离家较远的地方,faraway place; refers to a place far from home
47326,30302,2,形容词,远房,distantly related; not closely related by blood
47327,30303,1,名词,指证人就自己所知道的与案件事实有关的情况向司法人员所作的陈述。一般以口头形式提供，也可亲笔书写,"testimony; a witness's statement to judicial personnel about facts related to the case that they know, usually given orally or in writing"
47328,30304,1,名词,南方少数民族使用的打击乐器，由做炊具的铜釜发展而成。铜身铜面，雕有图案、花纹。是节日、集会和宗教活动中的重要礼器。明清以来，成为一般娱乐乐器,"bronze drum; a percussion instrument used by southern ethnic minorities, developed from bronze cooking pots, with bronze body and surface carved with patterns, important in festivals, gatherings, and religious activities, later became a general entertainment instrument"
47329,30304,2,名词,现代铜管乐队配置的打击乐器，铜身皮面。俗称洋鼓,Field drum
47330,30305,1,名词,路子,method; approach
47331,30305,2,名词,招数；手法,move; technique; method
47332,30305,3,名词,底细,inside story; details; the real situation
47333,30306,1,动词,说破；揭穿,point out bluntly; reveal; expose
47334,30307,1,名词,鱼，银白色，鳞退化，全身光滑，体长而扁，像带子。是我国沿海的主要鱼类之一,Ribbonfish
47335,30308,1,名词,功绩和事业,achievements and endeavors; merits and undertakings
