definition_id,pinyin_id,definition_sn,pos,definition_cn,definition_en
12778,3855,1,叹词,表示应诺,expressing agreement or assent
12779,3856,1,叹词,表示疑问,expressing doubt or questioning
12780,3857,1,叹词,表示不以为然或出乎意料,expressing disapproval or surprise
12781,3858,1,动词,用力把东西从食道或气管里咳出来,to cough up something from the esophagus or trachea
12782,3859,1,,音译用字，用于“吡（bǐ）咯”等,"a character used in transliteration, as in ""pyrrole"""
12783,3860,1,叹词,表示知道,expressing understanding or acknowledgment
12784,3861,1,拟声词,模拟响亮而短促的声音,"onomatopoeia for a loud, short sound"
12785,3862,1,形容词,调皮,mischievous
12786,3862,2,形容词,脾气古怪；乖僻,eccentric; peculiar in temperament
12787,3863,1,名词,生物体的细胞分泌的具有催化能力的蛋白质，可以促进体内的氧化作用、消化作用、发酵等，如蛋白酶、淀粉酶、凝血酶等。酶制剂广泛应用于食品、皮革、纺织、石油等工业以及医药卫生等方面,enzyme
12788,3864,1,,歌词中的衬字。,a filler word in song lyrics
12789,3865,1,,嘿（hēi）,hey (an interjection)
12790,3866,1,拟声词,模拟气或水喷出来的声音,onomatopoeia for the sound of air or water spurting out
12791,3867,1,拟声词,模拟羊叫的声音,onomatopoeia for the bleating of a sheep
12792,3868,1,名词,金属元素，符号U。银白色，有放射性，化学性质活泼。是最基本的核燃料，可用来产生原子能，制造原子弹、建造原子反应堆和核电站,uranium
12793,3869,1,动词,从嘴里慢慢地吐气,to exhale slowly from the mouth
12794,3869,2,拟,声模拟撮口吐气的声音，多用于表示制止,"onomatopoeia for the sound of blowing through pursed lips, often used to signal stopping"
12795,3870,1,叹词,表示制止说话或驱赶家禽,an interjection used to hush someone or shoo poultry
12796,3869,3,动词,蒸汽或热力接触物体引起变化,to cause change in an object through steam or heat contact
12797,3869,4,动词,〈文〉叹气,to sigh (in literary context)
12798,3871,1,拟声词,模拟某些发声器发出的声音,onomatopoeia for sounds made by certain devices
12799,3871,2,动词,〈口〉（嘴巴）向前撅着,to pout (the mouth) forward (colloquial)
12800,3872,1,名词,我国古代北方的一个民族；泛指古代北方各民族,an ancient northern ethnic group in China;refers to ancient northern peoples in general
12801,3873,1,拟声词,模拟重物落下或击鼓、敲门等的声音,"onomatopoeia for the sound of heavy objects falling, drumbeats, or knocking"
12802,3874,1,名词,金属元素，符号：Ba。银白色，有延展性，易氧化。可用作去氧剂，也用于制造合金、焰火等,barium
12803,3875,1,名词,金属元素，符号：Ti。银灰色，质硬而轻，延展性强，熔点较高，耐腐蚀。可用来制造特种合金钢,titanium
12804,3876,1,名词,金属元素，符号：Ni。银白色，质坚韧，有磁性和良好的延展性，在空气中不氧化。用于电镀及制造不锈钢和其他各种精密合金；也用于制造蓄电池和硬币等,nickel
12805,3877,1,名词,〈文〉篱笆,hedge; fence (in literary context)
12806,3878,1,名词,草木的枝茎,branch or stem of plants
12807,3878,2,名词,斧头的柄,handle of an axe
12808,3879,1,副词,〈文〉表示禁止或劝阻，相当于“不要”、“不可”,"do not; must not (in literary context, used for prohibition or dissuasion)"
12809,3880,1,名词,旧时男子除正妻以外另娶的女子,concubine (in historical context)
12810,3880,2,名词,古时女子的谦称,a humble self-reference by women in ancient times
12811,3881,1,名词,金属元素，符号：Ra。银白色，放射性强，具有强大穿透力，并不断大量放热。用于治疗癌症；镭盐和铍粉的混合制剂可以作为中子源，用于地质勘测。,radium
12812,3882,1,动词,目光很快地掠过,to glance quickly
12813,3883,1,名词,甘肃的别称,alternative name for Gansu Province
12814,3883,2,名词,陇山，山名，在甘肃和陕西交界的地方,"Longshan, a mountain name at the border of Gansu and Shaanxi"
12815,3884,1,动词,烹调方法，把食物放在锅里，加少量的水，扣紧锅盖，用文火慢煮，使物熟汤干,to braise (a cooking method)
12816,3885,1,动词,考察；鉴别,to examine; to distinguish
12817,3886,1,名词,旧时作货币用的浇铸成形的金块、银块,"ingot (historically used as currency, made of gold or silver)"
12818,3886,2,名词,锭状的东西（多指金属或药物）,ingot-shaped object (often metal or medicinal)
12819,3886,3,量词,用于锭状物,a measure word for ingot-shaped items
12820,3886,4,名词,纺纱机上绕纱的机件,spindle (on a spinning machine)
12821,3887,1,拟声词,模拟物体碰撞、断裂等的声音,onomatopoeia for the sound of objects colliding or breaking
12822,3888,1,,音译用字，用于“咔叽”、“咔唑”等,"a character used in transliteration, as in ""khaki"" or ""carbazole"""
12823,3889,1,名词,〈口〉女孩子；也用作对女孩子的昵称,girl (colloquial); also a term of endearment for a girl
12824,3890,1,代词,〈文〉指处所或事物，表示疑问，相当于“哪里”、“什么”、“为什么”,"where; what; why (in literary context, interrogative pronoun)"
12825,3891,1,形容词,某些地区指漂亮,pretty (in some dialects)
12826,3892,1,形容词,妆饰艳丽,beautifully adorned; gorgeous
12827,3892,2,动词,妆饰；修饰,to adorn; to decorate
12828,3893,1,动词,用脚掌向外猛然用力,to kick outward with the sole of the foot
12829,3893,2,动词,踩；踏,to step on; to tread
12830,3894,1,名词,去毛后经过熟制的兽皮,tanned leather (after hair removal and processing)
12831,3894,2,名词,皮带；皮绳,leather belt; leather rope
12832,3895,1,形容词,高耸凸出,towering; prominent
12833,3895,2,形容词,光秃,bald; bare
12834,3896,1,动词,〈口〉闲扯；聊天,to chat idly; to gossip (colloquial)
12835,3896,2,动词,用言语戏弄；调笑,to tease with words; to banter
12836,3896,3,形容词,〈文〉理直气壮，从容不迫,confident and composed (in literary context)
12837,3897,1,动词,把东西放在液体、粉状物或糊状物里沾一下就拿出来,"to dip briefly into a liquid, powder, or paste"
12838,3898,1,动词,用刀、斧等向下砍,to chop downward with a knife or axe
12839,3899,1,动词,食物堵塞咽喉；噎,to choke on food; to have food stuck in the throat
12840,3899,2,动词,因感情激动而声气阻塞,to choke up with emotion
12841,3900,1,动词,烹调方法，把食物（多指肉类）用小火煮得烂熟,"to stew (a cooking method, usually for meat)"
12842,3900,2,动词,把盛在容器里的东西连容器一起放在热水里，使变热,to warm something by placing its container in hot water
12843,3901,1,拟声词,模拟猫叫的声音,onomatopoeia for the sound of a cat meowing
12844,3902,1,动词,慢步走；随便走走,to stroll; to walk slowly
12845,3902,2,动词,牵着牲畜或提着鸟笼慢步走,to walk a pet or carry a birdcage slowly
12846,3903,1,形容词,好；善,good; virtuous
12847,3903,2,动词,褒扬；称赞,to praise; to commend
12848,3904,1,动词,蔓延燃烧,to burn and spread
12849,3905,1,动词,靠近火而被烧焦,to be scorched by fire
12850,3904,2,动词,烫,to scald
12851,3906,1,量词,用于叠在一起的纸张等较薄的东西,a measure word for stacks of thin items like paper
12852,3907,1,形容词,重复；繁多,repetitive; numerous
12853,3908,1,动词,紧握,to grip tightly
12854,3909,1,动词,指责；惩罚,to blame; to punish
12855,3909,2,动词,杀死,to kill
12856,3910,1,名词,非金属元素，符号F。浅黄绿色气体，味臭，有毒，腐蚀性极强，是非金属中最活泼的元素。是制造特种塑料、橡胶和冷冻剂的原料,fluorine
12857,3911,1,动词,不经心地放；搁下,to put down carelessly; to set aside
12858,3911,2,动词,扔掉；抛弃,to throw away; to abandon
12859,3911,3,动词,摔倒；弄倒,to knock down; to cause to fall
12860,3912,1,名词,非金属元素，符号：Se。导电能力随光照强度的增减而变化。可用于太阳能电池、整流器、摄像设备、光电管等,selenium
12861,3913,1,动词,应付；敷衍,to cope with; to handle perfunctorily
12862,3913,2,动词,抵挡,to resist; to withstand
12863,3913,3,动词,用泥或涂料涂抹（炉膛或金属坯胎）,to coat (as with mud or paint on a stove or metal base)
12864,3914,1,名词,类似棒子的敲打用具。一般一头较粗或为球形,"mallet; a beating tool, often with one thick or spherical end"
12865,3915,1,拟声词,模拟笑声或撕裂声等,onomatopoeia for laughter or tearing sounds
12866,3916,1,名词,犊子,calf
12867,3917,1,副词,〈文〉一起；共同,together; jointly (in literary context)
12868,3918,1,名词,中医指局部皮肤肿胀坚硬的毒疮,"a type of toxic sore with hard, swollen skin in traditional Chinese medicine"
12869,3919,1,动词,翘起,to stick up; to protrude
12870,3919,2,动词,折断,to break off
12871,3919,3,动词,使人感到为难,to embarrass someone; to make things difficult
12872,3920,1,名词,船、飞机等两侧的边沿部分；也指其两侧,side of a ship or aircraft; also refers to its lateral parts
12873,3921,1,形容词,〈文〉深,deep (in literary context)
12874,3922,1,名词,古代指军粮；后多指军警、政府机关工作人员的薪俸,"military provisions in ancient times; later refers to salaries for military, police, or government staff"
12875,3923,1,动词,〈文〉两手抱拳，置于胸前，一种行礼方式,to bow with hands clasped in front of the chest (a form of greeting in literary context)
12876,3924,1,动词,用铡刀切,to cut with a hay cutter
12877,3924,2,名词,铡刀,hay cutter
12878,3925,1,动词,闪过,flash past
12879,3925,2,动词,拽（zhuài）；拉,pull; tug
12880,3925,3,动词,抽取,draw out
12881,3926,1,名词,没有柄的小杯子,handleless small cup
12882,3927,1,副词,急切地；赶紧,urgently; hastily
12883,3928,1,副词,表示动作行为的多次重复，相当于“屡次”,repeatedly; frequently
12884,3929,1,名词,金属元素，符号：Mg。银白色，燃烧时发出极亮的白光。镁粉可制造焰火、照明弹等，铝镁合金可以制作航空器材,magnesium
12885,3930,1,名词,一种狭长的、垂直悬挂的旗子,long narrow vertical flag
12886,3930,2,名词,旧指引魂幡，出殡时孝子手持的狭长像幡的东西,funerary banner
12887,3931,1,名词,车前部驾牲畜的木杆。先秦时代是一根曲木，在车的中间；汉代以后多是两根直木，在车前两侧,shafts of a cart
12888,3931,2,名词,古代指辕门；后也借指官署,headquarters; government office
12889,3932,1,动词,烹调方法，在烧、炒之前把菜、肉等放到热油中炒到半熟,stir-fry briefly in hot oil
12890,3933,1,动词,买卖货物时延期付款或收款,buy or sell on credit
12891,3934,1,动词,〈文〉闭,close; seal
12892,3934,2,动词,特指为书信封口（常用在信封上寄信人姓名后）,seal (a letter)
12893,3934,3,名词,书信,letter
12894,3935,1,动词,〈文〉用双手捧,hold with both hands
12895,3936,1,形容词,形容能把一种东西粘（zhān）连在另一种东西上的性质,sticky; adhesive
12896,3937,1,动词,把食物放在煲中用小火慢煮或熬,simmer in a pot
12897,3937,2,名词,壁较为陡直呈圆筒状的锅,pot with steep sides
12898,3938,1,动词,积累；储蓄,accumulate; save
12899,3939,1,动词,拼凑；聚集,assemble; gather
12900,3940,1,动词,谋取,seek; obtain
12901,3941,1,,用于地名。如：牟平，在山东；中牟，在河南,used in place names
12902,3942,1,名词,鸟，像鹰而较大，嘴呈钩状，视觉敏锐，善飞翔，性凶猛，捕食鸟兽。种类很多，常见的有秃鹫、兀鹫,vulture
12903,3942,2,名词,〈文〉雕1,eagle
12904,3943,1,名词,套在脚腕上的刑具,fetters
12905,3944,1,形容词,〈文〉盛大,grand; majestic
12906,3945,1,叹词,表示惊讶、惊恐,expressing surprise or alarm
12907,3945,2,叹词,表示突然发现或想起,expressing sudden realization or recall
12908,3946,1,量词,用于字画和照片等，相当于“幅”,classifier for paintings/photos
12909,3946,2,名词,画幅,picture frame
12910,3947,1,动词,吃；吞咽,eat; swallow
12911,3948,1,动词,从井里打水；泛指从下往上打水,draw water
12912,3949,1,动词,欺诈,deceive; cheat
12913,3949,2,动词,料想；猜度（duó）,anticipate; surmise
12914,3949,3,动词,忧虑；担忧,worry; fear
12915,3949,4,名词,传说中上古朝代名，舜所建,Yu dynasty (legendary)
12916,3949,5,名词,周朝诸侯国名，在今山西,Yu state (Zhou dynasty)
12917,3950,1,动词,捋（luō）,stroke; rub
12918,3950,2,动词,训斥,scold; reprimand
12919,3950,3,动词,撤去（职务）,dismiss (from position)
12920,3951,1,动词,用盐、糖等浸渍（食物）,preserve with salt/sugar
12921,3952,1,形容词,肮脏；不干净,dirty; filthy
12922,3952,2,形容词,不顺心；不舒畅,unhappy; depressed
12923,3952,3,动词,使难堪,embarrass
12924,3953,1,动词,放轻脚步，使不出声,walk softly
12925,3953,2,动词,〈文〉踩；登,step on; tread
12926,3953,3,动词,〈文〉追随；追踪,follow; track
12927,3954,1,名词,皮肤或皮下组织化脓性炎症，多发生在颈部或背部，症状是皮肤局部红肿变硬，表面有许多脓疱，有时形成许多筛状小孔，疼痛异常,carbuncle
12928,3955,1,动词,腐烂,rot; decay
12929,3955,2,名词,〈文〉稠粥；像粥的食品,thick congee
12930,3956,1,名词,糜子,broomcorn millet
12931,3957,1,动词,蜂、蝎子等用毒刺刺人或动物,sting (by insects)
12932,3957,2,动词,某些物质刺激皮肤或黏膜，使感觉不适或微痛,irritate (skin/mucous membrane)
12933,3958,1,名词,指海蜇,jellyfish
12934,3959,1,,用于地名。如：祁县，在山西；祁阳，在湖南；祁门，在安徽,used in place names
12935,3960,1,动词,玩弄妓女,visit prostitutes
12936,3961,1,名词,周朝诸侯国名，在今山东滕州一带,Teng state (Zhou dynasty)
12937,3962,1,动词,用微火烘烤,bake over slow fire
12938,3963,1,名词,脊椎动物口腔的上部。分前后两部分：前部分由骨和肌肉构成，称硬腭；后部分由结缔组织和肌肉构成，称软腭。,palate
12939,3964,1,名词,拉丁语[tinctura]音译。指酊剂。,tincture
12940,3965,1,量词,用于清水，相当于“道” “片”,classifier for clear water
12941,3965,2,形容词,水又深又广,deep and wide (water)
12942,3966,1,名词,钢制的手工打磨工具，用来对金属、竹木或皮革等的表面进行加工,file (tool)
12943,3966,2,动词,用锉打磨,file (verb)
12944,3967,1,动词,向四外溅射或爆开,spurt; burst out
12945,3967,2,动词,向外突然发出,emit suddenly
12946,3968,1,形容词,某些地区指怯懦，缺乏勇气,cowardly
12947,3968,2,形容词,某些地区指不好，坏,bad; poor
12948,3969,1,名词,部分水生动物的呼吸器官。用来吸取溶解在水中的氧。形状多样，有片状、束状、丝状和羽毛状等。鱼类的鳃一般有鳃盖保护,gill
12949,3970,1,名词,妓女,prostitute
12950,3971,1,叹词,表示惊异,expressing surprise
12951,3972,1,名词,小腿与脚连接处左右两侧凸起的圆骨,ankle
12952,3973,1,名词,釉子,glaze
12953,3974,1,名词,装刀、剑的硬套,scabbard
12954,3974,2,名词,形状像鞘的东西,sheath-like object
12955,3975,1,名词,鞭鞘，拴在鞭绳末端的细皮条,whip lash
12956,3976,1,动词,用竹篾、金属条、带子等勒紧或套紧,bind with hoop
12957,3976,2,名词,勒在或套在外面的圈状物,hoop; band
12958,3977,1,名词,古书上说的一种香草,aromatic grass (archaic)
12959,3978,1,量词,用于聚集成束的细丝状的东西,lock; strand (of hair)
12960,3979,1,名词,杈子,branch; fork
12961,3980,1,名词,用树杈（chà）加工制成的农具，长柄的一端是两个或两个以上略弯的长齿，可用来叉取柴草等,wooden fork (tool)
12962,3981,1,数词,数目，二十,twenty
12963,3982,1,数词,数字“百”的大写,hundred (formal)
12964,3983,1,名词,护城河,moat
12965,3983,2,名词,沟,ditch
12966,3984,1,名词,皮肤上长的有色斑点或小疙瘩，没有疼痛或刺痒的感觉,mole; nevus
12967,3985,1,名词,中医称中暑、霍乱、肠炎等急性病,acute disease (TCM)
12968,3986,1,名词,流氓；无赖,ruffian
12969,3986,2,名词,痞块,abdominal mass
12970,3987,1,动词,纠正；改正,correct; rectify
12971,3987,2,动词,〈文〉救助；辅助,rescue; assist
12972,3987,3,动词,〈口〉大概估算,estimate roughly
12973,3988,1,动词,中途停止；停止,stop; discontinue
12974,3989,1,副词,〈口〉“不用”的合音，表示用不着，不必,need not
12975,3990,1,动词,畏惧；感到可怕,fear; dread
12976,3990,2,动词,〈文〉警惕,be cautious
12977,3991,1,动词,烹调方法，把菜放在锅里炒后加水烧煮勾芡,braise; cook in sauce
12978,3991,2,动词,烹调方法，把主食和菜或把多种菜混在一起煮,braise; a cooking method of stewing staple food and dishes or multiple dishes together
12979,3992,1,动词,用手掌打；打耳光,slap; to strike with the palm of the hand
12980,3993,1,动词,抿着嘴唇喝一点儿,sip; to drink a little by pursing the lips
12981,3993,2,动词,（嘴、翅膀等）略微闭上,"close slightly; (of mouth, wings, etc.) to shut a little"
12982,3993,3,动词,用小刷子蘸水或油抹（头发等）,"smooth with a small brush; to apply water or oil with a small brush (to hair, etc.)"
12983,3994,1,动词,蛀蚀；侵害,bore through; to eat away or harm
12984,3994,2,名词,蠹虫,moth; insect that bores into wood
12985,3995,1,名词,金属元素，符号：Sb。银灰色，质硬而脆，有冷胀性，有毒。多用在化学工业和医药上，超纯锑是重要的半导体及红外探测器材料，锑的合金可制造铅字、轴承等,"antimony; metallic element, symbol Sb, silver-gray, hard and brittle, expands when cold, toxic, used in chemical industry and medicine, ultra-pure antimony is important for semiconductors and infrared detectors, alloys used for type metal and bearings"
12986,3996,1,动词,身体的某部位跟凸起的或硬的东西接触而感到不适或受到损伤,be pressed uncomfortably; to feel discomfort or injury when a body part contacts a protruding or hard object
12987,3997,1,名词,山上的巨石,large rock on a mountain
12988,3998,1,动词,用烙铁、熨斗等烧热的金属器具烫平（衣物）,iron; to smooth (clothes) with a heated metal tool like an iron
12989,3999,1,形容词,【熨帖(yù tiē)】恰当；妥帖,appropriate; fitting or proper
12990,3999,2,形容词,【熨帖(yù tiē)】心情平静舒畅,calm and comfortable; feeling peaceful and content
12991,4000,1,名词,安在船尾或船边用来摇船前进的工具，比桨长（cháng）大,"scull; a tool longer and larger than an oar, mounted at the stern or side of a boat to propel it"
12992,4000,2,名词,古代作战时用来防身的大盾牌,large shield; a big shield used for protection in ancient warfare
12993,4001,1,名词,一种敞口器皿，像盆而较小较深，多为陶制,"bowl; a wide-mouthed vessel, similar to a basin but smaller and deeper, often made of pottery"
12994,4001,2,名词,梵语音译词“钵多罗（Pātra）”的简称。僧人盛饭的器具，圆而稍扁，底平，口略小,"alms bowl; abbreviation of Sanskrit ""Pātra,"" a monk's bowl for food, round and slightly flat, with a flat bottom and small mouth"
12995,4002,1,名词,疥疮,scabies
12996,4003,1,名词,皮肤上起的水泡状的小疙瘩,blister; a small bubble-like bump on the skin
12997,4004,1,名词,金属元素，符号W。银白色，质硬而脆，熔点高，常温下化学性质稳定。主要用于制造高速切削合金钢、灯丝、火箭喷嘴、太阳能装置等,"tungsten; metallic element, symbol W, silver-white, hard and brittle, high melting point, chemically stable at room temperature, used for high-speed cutting alloy steel, filaments, rocket nozzles, solar devices, etc."
12998,4005,1,名词,古代套在犯人颈项上的刑具,cangue; an ancient punishment device placed around a prisoner's neck
12999,4006,1,名词,豆类等植物的果实,pod; the fruit of legumes and similar plants
13000,4007,1,动词,用刀、铲等挖,"gouge; to dig out with a knife, shovel, etc."
13001,4008,1,叹词,表示鄙视或斥责,bah; an interjection expressing disdain or reprimand
13002,4009,1,动词,用门牙咬有壳的或较硬的东西,crack with teeth; to bite something hard or with a shell using the front teeth
13003,4010,1,动词,拉；拉长,stretch; to pull or lengthen
13004,4011,1,动词,（液体）向下渗漏；过滤,filter; (of liquid) to seep down or through
13005,4012,1,拟声词,模拟摩擦的声音,scratch; onomatopoeia for the sound of friction
13006,4013,1,名词,蟒蛇,python
13007,4013,2,名词,指蟒袍,"python robe; refers to a robe embroidered with pythons, as in official attire"
13008,4014,1,动词,快速向上或向前跳跃,leap quickly; to jump upward or forward rapidly
13009,4014,2,动词,〈口〉往上冒；喷射,spurt; (colloquial) to gush or shoot upward
13010,4015,1,形容词,某些地区指排行最末的,"youngest; in some regions, refers to the last in order of birth"
13011,4015,2,数词,指色（shǎi）子和骨牌里的一点；某些场合读数字时代替“1”,"one; refers to the single dot on dice or dominoes; used to replace ""1"" in some contexts when reading numbers"
13012,4016,1,名词,数学上指一个数自乘若干次的形式。如4个5相乘，写成54，叫做5的4次幂,"power; in mathematics, the form of a number multiplied by itself a certain number of times, e.g., 5 to the 4th power written as 5^4"
13013,4016,2,动词,〈文〉遮盖；笼罩,cover; (literary) to veil or envelop
13014,4016,3,名词,〈文〉遮盖东西的巾类,cloth cover; (literary) a cloth used to cover things
13015,4017,1,名词,鸟，常指斑鸠,"turtledove; bird, often referring to the turtledove"
13016,4017,2,动词,聚集,gather; to assemble or collect
13017,4018,1,名词,两条裤腿间相连的地方,crotch of pants; the part connecting the two legs of trousers
13018,4018,2,名词,两腿之间的部位,crotch; the area between the legs
13019,4019,1,名词,哺乳动物，身体细长，四肢短，尾巴粗，尾毛长而蓬松。种类很多，如紫貂、水貂等,"marten; mammal, slender body, short limbs, thick tail with long, fluffy fur, types include sable, mink, etc."
13020,4020,1,拟声词,模拟物体撞击或鸭子、青蛙等鸣叫的声音。,"quack; onomatopoeia for the sound of objects colliding or ducks, frogs, etc. calling"
13021,4021,1,动词,用话顶撞别人，使人受窘而说不出话来,retort sharply; to speak in a way that embarrasses or silences someone
13022,4021,2,动词,食物等塞住喉咙,"choke; for food, etc., to block the throat"
13023,4021,3,动词,因痛苦、激动或顶风而喘不上气来,"gasp; to have difficulty breathing due to pain, excitement, or wind"
13024,4022,1,名词,指熟睡时粗重的呼吸声,snore; the heavy breathing sound during deep sleep
13025,4023,1,名词,某些地区指集市,"market; in some regions, refers to a rural market"
13026,4024,1,名词,圩堤,dyke; an embankment
13027,4025,1,动词,斜着眼睛看,glance sideways; to look askance
13028,4026,1,,〈口〉“三个”的合音词,"three; (colloquial) combined sound for ""three"""
13029,4027,1,动词,用手指头夹或捏取,pick up with fingers; to take or hold with the fingertips
13030,4028,1,动词,【塞】把东西填入或胡乱放入；塞进衣袋或缝隙等,"tuck; to stuff or randomly put things into pockets, gaps, etc."
13031,4028,2,动词,藏,hide; to conceal
13032,4029,1,动词,〈文〉搀扶人的胳膊；借指扶助或奖励、提拔,"support by the arm; (literary) to assist someone by the arm; metaphorically to aid, reward, or promote"
13033,4030,1,名词,铲东西或挖土用的工具，柄的一端安有用铁板或木板制成的头。,shovel; a tool with a handle and a head made of iron or wood for shoveling or digging soil
13034,4031,1,名词,二年或多年生草本植物，叶子羽状分裂，花小，带有某种特殊气味。常见的有茼蒿、蒌蒿、青蒿、艾蒿等。有的嫩茎叶可以作蔬菜，有的可以驱蚊、做药材,"artemisia; biennial or perennial herb with pinnately divided leaves, small flowers, and a distinct odor, types include crown daisy, wormwood, etc., some used as vegetables, insect repellents, or medicine"
13035,4032,1,量词,用于点着的香,measure word for incense; used for lit sticks of incense
13036,4032,2,动词,〈文〉点燃,light; (literary) to ignite
13037,4032,3,名词,〈文〉灯芯,wick; (literary) lamp wick
13038,4033,1,名词,一种用来盛东西的大腹陶器,urn; a large-bellied pottery vessel for holding things
13039,4034,1,名词,人体腰部两侧到大腿之间的部分,hip; the part of the body from the waist to the thighs on either side
13040,4035,1,助词,用在句中停顿的地方或句末，表示愉快地答应或同意,particle indicating agreement; used in pauses or at the end of sentences to express cheerful consent
13041,4036,1,动词,〈口〉唠叨,nag; (colloquial) to唠叨
13042,4037,1,名词,牡蛎,oyster
13043,4038,1,形容词,某些地区形容撒娇的声音或姿态,coquettish; flirtatious (of a voice or manner)
13044,4039,1,动词,生气；发怒,be angry; to feel or show anger
13045,4039,2,动词,责怪；埋怨,blame; to reproach or complain
