definition_id,hanzi,pinyin,pos,definition_cn,example_1,example_2,DS,QW
56312,费,fèi,动词,消耗钱财,这件事让您费心了。,装修这套房子花费了我们整整三个月的时间。,1,2
56411,局,jú,名词,棋盘,棋局结束后，大家意犹未尽。,围棋高手能在脑海中推演整个棋局的走向。,2,1
56418,局,jú,名词,部分,这个问题只是局部现象，并不普遍。,这个项目的技术难点主要集中在局部的细节处理上。,1,2
56421,局,jú,名词,商店名称,这家书局出售各种类型的书籍。,老字号的茶叶局至今仍保持着传统的制茶工艺。,1,2
56511,派,pài,名词,具有相同立场或风格的群体,不同的党派在议会中展开了激烈的辩论。,学术界分为多个学派，各自持有不同的理论观点。,2,1
58117,阳,yáng,形容词,带正电荷的,物理学中，阳电指正电荷。,在电解实验中，阳极吸引带负电的离子。,1,2
58212,破,pò,动词,损坏,他决定破釜沉舟，背水一战。,孩子们在沙滩上玩耍，用树枝破开椰子取水喝。,1,2
59311,刚,gāng,形容词,坚硬或坚强,他性格刚强，从不轻易屈服。,这把刀的刀刃非常刚硬，可以轻松切开厚木板。,1,2
60328,倒,dào,动词,低价买入高价卖出以牟利；倒买倒卖,非法倒汇行为严重扰乱了金融市场秩序。,警方严厉打击那些倒买倒卖文物的不法分子。,2,1
60331,倒,dào,副词,用于反驳或表示相反意见,"你说得倒容易,可做起来并不容易。",你说他工作不认真？我倒觉得他比谁都勤奋。,2,1
60415,刻,kè,形容词,形容程度极深,这部电影给我留下了深刻的印象。,他对古典音乐有着刻骨铭心的热爱。,2,1
60511,举,jǔ,动词,向上托起物体,举重是一项需要力量与技巧的运动。,运动员高举火炬，象征着光明与希望。,2,1
60512,举,jǔ,名词,具体行为动作,他的义举感动了整个社区。,他这一反常举动引起了在场所有人的注意。,2,1
60513,举,jǔ,动词,发起行动,在古代，农民常常因为不堪压迫而举义反抗。,五四运动举起了反帝反封建的旗帜。,2,1
60516,举,jǔ,名词,科举功名简称,他终于中举，实现了多年的梦想。,明清时期，中举是读书人梦寐以求的荣耀。,2,1
60517,举,jǔ,动词,提出,让我来举例说明这个问题。,老师在课堂上举了很多生动的例子来解释这个理论。,2,1
60623,血,xuè,形容词,〈比喻fig.〉刚强热烈,他是一个有血性的人，从不轻易低头。,这位年轻战士血气方刚，总是冲在最前线。,2,1
60711,故,gù,名词,意外事件,由于突发的变故，他不得不改变计划。,这起交通事故是由于司机疲劳驾驶造成的。,2,1
60712,故,gù,名词,原因,无故缺勤是不负责任的行为。,他无故缺席会议，让领导非常不满。,2,1
60713,故,gù,副词,有意为之,他故作镇静，但眼神中透露出一丝慌乱。,他故意把水洒在地上，想看看谁会滑倒。,2,1
60717,故,gù,动词,死亡,他的祖父因病故去世，全家都沉浸在悲痛之中。,这位著名作家因病逝世，享年八十五岁。,2,1
60912,范,fàn,名词,模范；榜样,他的行为成为了后人学习的典范。,张老师是我们学习的好榜样，大家都敬佩他。,2,1
61012,木,mù,名词,木材,这件家具是用枣木制成的，非常坚固耐用。,这张桌子是用上等木头制作的，非常坚固耐用。,2,1
61013,木,mù,名词,装殓死人的器具,老人去世后，家人用上好的木材制作了一口棺木。,按照传统习俗，他们为老人准备了一口上好的木。,2,1
61111,号,háo,动词,拖长声音大声喊叫,他在暴风雨中大声呼号，希望有人能听到并来救援。,夜深人静时，远处传来狼群的号叫声，令人毛骨悚然。,2,1
61121,号,hào,名词,名称,每个国家都有自己的国号，象征着国家的身份和地位。,这个项目的代号是“曙光”，寓意着希望和新生。,2,1
61127,号,hào,量词,种类,这号人甭理他，省得给自己找麻烦。,这种号的人我见得多了，都是些夸夸其谈之辈。,1,2
61132,号,hào,动词,诊脉,医生正在给病人号脉，以判断病情。,老中医仔细号了脉，然后写下了详细的诊断结果。,2,1
61211,尽,jìn,动词,用完或结束,这里的资源取之不尽，用之不竭。,这瓶水已经喝尽了，我们得再去找些饮用水。,1,2
61413,脸,liǎn,名词,情面或尊严。,他因为犯了错误而感到丢脸。,看在老同学的面子上，你就帮他这一次吧。,1,2
62112,急,jí,动词,使着急,火车快开了，他还不来，实在急人。,你别催他了，越催他越急。,1,2
62211,独,dú,形容词,单一的,他是家里的独子，父母对他寄予厚望。,独木桥横跨在小溪上，走上去摇摇晃晃的。,1,2
62213,独,dú,名词,无子女的老人,鳏寡孤独，皆有所养。,村里对独居的老人给予了特别的照顾。,1,2
62313,剧,jù,形容词,程度严重或强度大,剧烈的疼痛让他无法继续坚持下去。,昨晚的暴风雨来得太剧了，把院子里的树都吹倒了。,1,2
62413,查,chá,动词,翻检着看,遇到不认识的单词时，他习惯查词典。,为了写论文，他每天都要在图书馆翻检大量的资料和文献。,1,2
62919,固,gù,连词,表示让步关系,"坐车固可,坐船亦无不可。",固不可因小失大，但细节也不容忽视。,2,1
63011,害,hài,名词,祸害；不利的因素（与“利”相对）。,这场灾害给当地居民带来了巨大的损失。,吸烟对健康的害处已经得到科学验证。,2,1
63211,续,xù,动词,接连不断,我们需要继续努力才能取得成功。,连续三天的暴雨导致河水暴涨，威胁沿岸居民安全。,2,1
63517,拿,ná,动词,强烈作用导致物体损坏,这块木头让药水拿白了，看起来像新的一样。,连续的高温天气把地里的庄稼都拿坏了。,1,2
64113,曲,qǔ,名词,歌谱,《义勇军进行曲》是聂耳作的曲。,他为这首诗谱写了一首动人的曲子，旋律优美而深情。,1,2
64122,曲,qū,动词,使物体弯曲,他喜欢在草地上曲肱而枕，享受自然风光。,他轻轻曲起手指，展示了一个优雅的手势。,1,2
64123,曲,qū,名词,弯曲的部分或地方,河曲地区风景秀丽，吸引了许多游客前来观光。,这条河流在峡谷中形成了一个美丽的曲。,1,2
64124,曲,qū,形容词,不公正或不合理,是非曲直，自有公论。,法官公正无私，从不曲断任何案件。,1,2
64211,既,jì,副词,已经,事情已经发展到既成事实，无法挽回了。,他既已承诺，就一定会按时完成任务。,1,2
64212,既,jì,连词,既然,既来之，则安之。,既然大家都同意这个方案，我们就开始实施吧。,1,2
64213,既,jì,动词,完成；结束,食既之后，人们开始收拾餐具。,言未既，他突然站起身来离开了会议室。,1,2
64313,春,chūn,名词,男女之间的情爱,少女怀春，总是充满了许多美好的幻想。,这部小说描写了少男少女的怀春之情。,1,2
64314,春,chūn,名词,比喻生命力或活力,医生妙手回春，成功治好了他的病。,改革开放给中国经济带来了新的春天。,1,2
64412,官,guān,形容词,政府所属的,这是一家官办的企业，主要负责公共基础设施的建设。,这栋建筑是官产，不能随意买卖。,1,2
64413,官,guān,形容词,公共性质的,这条路被称为官大道，是古代官员出行的必经之路。,这个公共厕所是官厕，维护得很干净。,1,2
64636,令,lìng,名词,时节,春天的时令水果非常新鲜，大家都喜欢购买。,时令已进入深秋，早晚的天气渐渐转凉了。,1,2
64637,令,lìng,形容词,美好的,他的令德广受赞誉，是大家学习的榜样。,这位姑娘不仅容貌令秀，而且才华横溢。,1,2
64639,令,lìng,名词,短小的词曲名称,宋代词人李清照创作了著名的《如梦令》。,这首小令虽然只有短短几句，却意境深远，耐人寻味。,1,2
64916,简,jiǎn,动词,选拔人才,公司决定从基层员工中简拔优秀人才担任管理职位。,古代科举制度通过考试简拔人才。,1,2
65012,杂,zá,形容词,非正式的，额外的,学校收取了一些杂费用于购买教学设备。,除了基本工资外，他每月还能领到一些杂项补贴。,1,2
65411,司,sī,动词,管理；经营,他是一名经验丰富的司机，驾驶技术一流。,总经理亲自司仪这场重要的签约仪式。,1,2
65521,省,shěng,动词,减少不必要的开支或消耗。,购买大包装的商品可以省钱。,为了省电，她养成了随手关灯的好习惯。,2,1
65524,省,shěng,名词,国家的一级行政区划单位。,河北省是中国的一个重要省份。,浙江省是中国东部沿海的一个经济发达省份。,2,1
65525,省,shěng,名词,省级行政区的政府所在地。,他准备进省城办事。,我们明天要去省城参加一个重要的会议。,2,1
65712,模,mó,动词,仿效,孩子们喜欢模仿大人的行为。,设计师模仿自然界的形态创造出了这个独特的产品。,2,1
65811,试,shì,动词,检验尝试,这项政策将在部分地区试行。,科学家们正在试验一种新型的环保材料。,2,1
65812,试,shì,名词,知识考核,这次考试的试题难度适中。,期末考试前，同学们都在紧张地复习功课。,2,1
65911,绝,jué,动词,切断联系,他们因为意见不合而绝交。,两国断绝外交关系后，贸易往来也随之终止。,2,1
65913,绝,jué,形容词,无路可走,这片绝地几乎没有人能够穿越。,他们走进了一条绝路，前面是陡峭的悬崖。,2,1
65914,绝,jué,动词,死亡,他因心脏病突发而气绝身亡。,医生抢救了三个小时，病人最终还是气绝身亡。,2,1
65917,绝,jué,副词,绝对（用于否定前）,我绝无此意，你误会了。,在没有确凿证据之前，我们绝不能妄下结论。,2,1
66111,谁,shéi,代词,询问对象,你找谁？是来拜访我家人的吗？,门外站着一位陌生人，妈妈问道：“您找谁呀？”,2,1
66113,谁,shéi,代词,泛指某人,我的书不知道被谁拿走了，我找了很久都没找到。,我好像听见谁在敲门，但打开门却发现没人。,2,1
66114,谁,shéi,代词,任指任何人,这件事谁也不知道，只有少数几个人了解内情。,谁要是违反了校规，就要受到相应的处罚。,2,1
66211,继,jì,动词,继续;接续,他是这个职位的继任，接替了前任的工作。,我们要继承和发扬中华民族的优良传统。,2,1
66212,继,jì,副词,继而,初感头晕，继又吐泻，他赶紧去了医院。,他先是愣了一下，继而开怀大笑起来。,2,1
66312,止,zhǐ,动词,阻止进行,这里是禁止吸烟的区域，请遵守规定。,交警站在路中间，挥手示意车辆止步。,2,1
66313,止,zhǐ,动词,到某个时间截止,展览从10月1日起至10月14日止，欢迎大家前来参观。,本次促销活动报名时间截止到本月十五日止。,2,1
66314,止,zhǐ,副词,仅仅,这家餐厅的味道非常好，止此一家，别无分店。,这座古城的历史遗迹止剩下几段残破的城墙。,2,1
66411,喜,xǐ,形容词,快乐；高兴,听到自己中奖的消息，他感到一阵狂喜。,听到儿子考上重点大学的消息，全家人都喜不自胜。,2,1
66415,喜,xǐ,动词,适宜于某种环境或搭配,这种喜光植物需要充足的阳光才能生长得更好。,这种植物喜阴，适合种植在阳光较少的地方。,2,1
66511,优,yōu,形容词,质量或品质好,她的舞姿非常优美，让人不禁为之赞叹。,这家餐厅以优质的食材和出色的服务赢得了顾客的青睐。,2,1
66512,优,yōu,形容词,资源丰富充足,他家境优渥，从小就过着衣食无忧的生活。,他的家境优渥，从小就接受了最好的教育。,2,1
66513,优,yōu,动词,给予特别照顾,拥军优属是我们国家一直以来的优良传统。,政府出台政策，优先优待退伍军人及其家属。,2,1
66514,优,yōu,名词,旧时对演员的称呼,古代的优伶以表演戏曲为生，技艺高超者备受推崇。,旧时戏班里的优伶们常常四处漂泊，生活十分艰辛。,2,1
66711,陈,chén,动词,摆放或展示,博物馆里陈列着许多珍贵的历史文物。,博物馆里陈列着许多珍贵的古代文物，吸引了大批游客。,2,1
66712,陈,chén,动词,详细说明或讲述,他在会议上详细地陈述了自己的观点。,在会议上，他详细陈述了项目进展情况和未来计划。,2,1
66713,陈,chén,形容词,时间久远的；过时的,这瓶陈酒已经存放了数十年，味道格外香醇。,这瓶陈年老酒已经存放了三十年，味道醇厚无比。,2,1
66911,终,zhōng,名词,结束的时刻或状态,经过长途跋涉，我们终于到达了旅程的终点。,经过不懈努力，他终于实现了自己多年来的梦想。,2,1
66912,终,zhōng,动词,指人的死亡,临终（人将死）之际，他留下了最后的遗言。,老人临终前将毕生积蓄都捐给了慈善机构。,2,1
66913,终,zhōng,副词,最终；到底,只要坚持下去，我们的努力终将见效。,谎言终会被揭穿，只有诚实才能赢得他人的信任。,2,1
66914,终,zhōng,名词,从头到尾的整个时间段,他终日忙于工作，几乎没有时间休息。,他终日埋头于实验室，致力于科学研究工作。,2,1
67011,施,shī,动词,实行；实施。,政府决定实施一系列新的经济政策以促进发展。,政府正在实施一项新的环保政策，以减少空气污染。,2,1
67012,施,shī,动词,给予,见到长辈时要主动施礼，这是基本的礼貌。,老师对学生施以耐心的教导，帮助他们克服学习困难。,1,2
67111,晚,wǎn,名词,日落之后到深夜之前的时间；夜间,今晚的月色真美，让人心旷神怡。,每天晚上，我都会在公园里散步半小时，放松心情。,1,2
67114,晚,wǎn,形容词,后来的,这位晚辈非常有礼貌，给长辈们留下了深刻的印象。,晚清时期，中国经历了许多重大的社会变革和历史事件。,1,2
67211,朝,cháo,名词,指君主统治的政府机构,大臣们每天清晨都要上朝，向皇帝汇报国家大事。,在古代，大臣们每天都要上朝向皇帝汇报国家大事。,1,2
67212,朝,cháo,名词,指历史上的统治时期,唐朝是中国历史上一个文化繁荣的朝代。,唐朝是中国历史上一个非常繁荣和开放的朝代。,1,2
67214,朝,cháo,动词,指觐见君主或朝拜圣地,每年穆斯林都要进行一次朝觐，前往麦加圣地。,每年春节，许多海外华人都会回国朝拜祖先，表达敬意。,1,2
67311,含,hán,动词,将东西置于口中不咽下,他含一口水在嘴里，仔细地漱了漱口。,她含着止咳糖浆，等待药效慢慢发挥作用。,1,2
67312,含,hán,动词,藏在里面;包括在内;容纳,她含着眼泪告别了亲人，踏上了远行的列车。,这座博物馆的藏品中，含有多件珍贵的古代文物。,1,2
67411,仍,réng,副词,按照原来的方式或状态继续,尽管时代变迁，这家老店一仍其旧（完全照旧），保持着传统的风味。,他仍依照父亲的教诲，每天坚持早起读书。,1,2
67512,脑,nǎo,名词,指头部。,经过长时间的思考，他终于用脑袋想出了一个绝妙的解决方案。,他摸了摸自己的脑袋，感觉有些头晕。,1,2
67514,脑,nǎo,名词,从物体中提取出的精华部分。,这种药的主要成分是樟脑。,这种药材的脑部提取物具有很高的药用价值。,1,2
67515,脑,nǎo,名词,事物剩余的零碎部分或田地的边角。,她擅长针头线脑的小活计，家里总是被她收拾得井井有条。,收割后的田地里只剩下些稻谷的脑头。,1,2
67811,修,xiū,动词,装饰使美观,这间房子正在装修，预计下个月完工。,她正在梳妆台前精心修饰自己的妆容。,1,2
67813,修,xiū,动词,撰写或编写,我正在修函给远方的朋友，希望他能早日收到。,他正在修一部关于古代历史的著作。,1,2
67816,修,xiū,动词,建造或兴建,政府计划修建一条新的高速公路以缓解交通压力。,政府计划在河边修一座新公园。,1,2
68012,衣,yī,名词,物体外层的包裹物,这门炮需要一个合适的炮衣来保护。,这本书的衣已经破损了，需要重新装订。,1,2
68212,云,yún,助词,古汉语助词,岁云暮矣，他感叹时光飞逝。,"诗经中云：""关关雎鸠，在河之洲""，描绘了一幅美丽的画面。",1,2
68611,征,zhēng,动词,军队长途行军,人生的征途充满了挑战和机遇。,古代将士们常常要长途跋涉去远征。,1,2
68712,错,cuò,动词,物体相互摩擦,上下牙错得很响，让人听得一清二楚。,齿轮之间需要定期润滑，否则会过度摩擦而损坏。,1,2
68719,错,cuò,动词,在凹刻文字或花纹中镶嵌金银等,这件工艺品采用了错金工艺，显得格外精美。,工匠们正在给牌匾上的文字错金，使其更加华丽。,1,2
69213,友,yǒu,形容词,有友好关系的,我与友人一起度过了愉快的周末。,中日两国是一衣带水的友好邻邦，交往历史悠久。,1,2
69313,武,wǔ,形容词,勇猛；强悍,这位将军英武非凡，令人敬佩。,这位将军作战勇武，令敌人闻风丧胆。,2,1
69315,武,wǔ,名词,半步；泛指脚步,他决定踵武前贤，继承家族的传统事业。,他武步稳健地走上台阶，显得十分从容。,1,2
69512,游,yóu,动词,各处从容地行走;闲逛,这次游览让我对这座城市有了更深的了解。,周末我喜欢在城市里四处游荡，发现新的小店。,1,2
69513,游,yóu,动词,与人交往,游牧民族的生活方式独具特色。,他交友广泛，与各界人士都有游。,1,2
69514,游,yóu,形容词,不固定位置的,他们过着传统的游牧生活。,这些游牧民随着季节变化不断迁徙。,2,1
69611,敌,dí,形容词,相互对立的,战士们成功击退了敌人。,两国因为领土问题成为敌对国家。,2,1
69613,敌,dí,动词,抵抗,这支部队所向无敌，战无不胜。,这支军队装备精良，足以敌任何来犯之敌。,1,2
69722,叶,yè,名词,形状像叶子的物体,窗户上安装了百叶窗，可以灵活调节室内光线。,秋天到了，叶开始变黄并纷纷落下。,1,2
70012,否,fǒu,副词,表示不同意，相当于“不”,知其事否? 这件事关系重大，必须谨慎处理。,面对无理要求，他坚决地说了声“否”。,1,2
70013,否,fǒu,助词,句末疑问助词,知其事否? 如果知道，请尽快告诉我详细情况。,你是否愿意和我们一起参加这次活动？,1,2
70014,否,fǒu,助词,构成“是否”等疑问结构,明日能否出发，尚待最后决定。我们需要根据天气状况做出判断。,可否请您再详细解释一下这个方案的细节？,1,2
70111,异,yì,形容词,不相同,大家异口同声地表示支持这个计划，认为它非常有意义。,这两幅画虽然风格迥异，但都很有艺术价值。,1,2
70114,异,yì,形容词,另外的,我们约定在异日再相聚，共同回忆这段美好的时光。,除了主修课程外，他还选修了多门异域语言。,1,2
70212,块,kuài,量词,用于计量块状或片状物品的量词。,我买了两块香皂，准备用来替换家里的旧香皂。,妈妈从市场买回来一块新鲜的豆腐。,2,1
70511,田,tián,名词,耕种的土地（部分地区专指水田）,水田里种满了绿油油的水稻。,农民们在田里辛勤劳作，期待着丰收的季节。,2,1
70512,田,tián,名词,可开采的矿藏地带,这片煤田储量丰富。,这片区域是重要的油田，对国家能源供应至关重要。,2,1
70611,策,cè,名词,古代用于书写的竹木简片。,古代常用简策记录文字。,古代学者常用竹策记录重要的思想和发现。,2,1
70614,策,cè,名词,计谋或方法,采用这种方法是上策。,面对危机，领导者必须迅速制定有效的对策。,1,2
70615,策,cè,动词,谋划;筹划,他们试图策反敌方士兵。,将军正在帐中策谋如何突破敌军的防线。,1,2
70619,策,cè,名词,辅助行走的棍子,老人扶策而行，显得十分吃力。,老先生拄着策杖，慢慢走在乡间的小路上。,2,1
70711,苏,sū,名词,植物名,紫苏是一种常见的调味植物。,春天来了，田野里的紫苏散发出淡淡的清香。,2,1
70712,苏,sū,名词,指须状下垂物,流苏装饰让这件衣服更加华丽。,古代官员的帽子上常装饰着红色的流苏。,2,1
70714,苏,sū,名词,苏州的简称。,苏绣以其精美细腻著称。,苏州的园林艺术是中国传统文化的瑰宝。,2,1
70911,帝,dì,名词,宗教中的最高神,许多人相信上帝的存在。,在古希腊神话中，宙斯是众神之王，掌管雷电。,1,2
71112,医,yī,名词,研究预防、治疗疾病的科学,中医是中国传统医学的重要组成部分。,现代医学的发展使许多曾经的不治之症得以攻克。,2,1
71912,罗,luó,动词,网捕鸟类,门可罗雀。,农夫在田野里罗雀，准备晚餐。,1,2
72011,戏,xì,动词,玩耍；游戏,这件事绝非儿戏，必须认真对待。,孩子们在操场上快乐地嬉戏玩耍。,2,1
72012,戏,xì,动词,开玩笑；嘲弄,不要随意戏弄小动物。,他总爱戏弄同学，但并无恶意。,2,1
72111,善,shàn,形容词,善良；品德高尚（与“恶”相对）,他的善举感动了无数人。,这位老人一生行善，深受村民爱戴。,2,1
72112,善,shàn,名词,善行；好事（与“恶”相对）,行善积德是中华民族的传统美德。,我们要多做善事，帮助那些需要帮助的人。,2,1
72113,善,shàn,形容词,良好；令人满意,政府需要采取善策来解决当前的社会问题。,这位老人心地善良，经常帮助街坊邻居。,2,1
72114,善,shàn,形容词,友好；和睦,他对每个人都表现得十分友善。,两国经过谈判，终于达成了善意的和解协议。,2,1
72116,善,shàn,动词,办好；做好,事故之后，他们积极展开善后工作。,我们要善用每一分钱，把钱花在刀刃上。,2,1
72117,善,shàn,动词,擅长,这支军队勇猛善战，令敌人闻风丧胆。,她善于绘画，尤其擅长水墨山水。,2,1
72118,善,shàn,副词,好好地,你一定要善自保重，照顾好自己。,临行前，母亲再三叮嘱我要善自珍重。,2,1
72211,获,huò,动词,捉住;擒住,警方成功捕获了在逃的犯罪嫌疑人。,经过三天三夜的追踪，警方终于将逃犯擒获。,2,1
72311,待,dāi,动词,停留,待一会儿再走，我们还可以聊聊天。,你在这里待着别动，我马上回来。,2,1
72321,待,dài,动词,对待,这家餐厅对VIP顾客提供优待。,老师对待所有学生都一视同仁，非常公平。,2,1
72322,待,dài,动词,招待,她热情地待客，让每个人都感到宾至如归。,这家酒店的服务员待客热情周到，让人宾至如归。,2,1
72325,待,dài,动词,打算,他待说不说的样子让人很着急。,我待要出门，突然下起了倾盆大雨。,2,1
72411,降,jiàng,动词,从高处落下,飞机即将降落，请系好安全带。,傍晚时分，天边降下了绚丽的晚霞。,2,1
72511,冲,chōng,名词,交通要道或重要地点,这个地区是交通要冲，战略意义重大。,这条主干道是连接城市南北的交通要冲。,2,1
72512,冲,chōng,动词,快速向前突破障碍,那辆车横冲直撞地驶过街道。,洪水冲垮了河堤，淹没了附近的农田。,2,1
72513,冲,chōng,动词,猛烈地撞击(多用于对对方思想感情的抵触方面,两人因为意见不合发生了冲突。,他的言论冲撞了在场所有人的价值观。,2,1
72522,冲,chòng,形容词,气味浓烈刺鼻,这瓶酒味儿很冲，不适合初次饮酒的人。,这瓶香水味道太冲了，闻得我头晕。,2,1
72523,冲,chòng,动词,方言中指严厉责备,他一说话就冲人，让人很难接受。,老板冲了他一顿，因为他连续迟到三天。,2,1
72524,冲,chòng,动词,用开水等浇,闲暇时我喜欢为自己冲茶，享受片刻宁静。,她用开水冲了一杯蜂蜜茶来缓解喉咙痛。,2,1
72527,冲,chòng,动词,朝向或面对,他扭过头来冲我笑了笑。,他冲着门口的方向大声喊叫，希望有人听见。,2,1
72528,冲,chòng,介词,依据或根据,就冲着这几句话，我也不能不答应。,冲他这份诚意，我们决定再给他一次机会。,2,1
72530,冲,chòng,动词,用压力使金属成型,这台冲床设备非常先进，能大幅提高生产效率。,工厂新购置的冲床可以大大提高生产效率。,2,1
72611,父,fù,名词,子女对男性直系长辈的称谓,这对父子的感情非常深厚。,我的父亲是一位严谨的大学教授。,2,1
72612,父,fù,名词,家族中辈分高的男性成员,祖父总是喜欢在院子里晒太阳。,每年春节我们都要拜访叔伯等父辈亲戚。,2,1
72621,父,fǔ,名词,对老年男子的尊称,田父辛勤耕作了一辈子，终于迎来了丰收的季节。,村口的老槐树下常聚集着几位田父闲聊。,2,1
72711,置,zhì,动词,搁;放,政府为灾民提供了临时安置。,请把这份重要文件置放在保险柜里保管。,2,1
72712,置,zhì,动词,设立或布置,这个装置设计得非常巧妙。,公司在市中心置办了一间宽敞的办公室。,2,1
72713,置,zhì,动词,购买,家里添置了一些新家具。,他最近置了一辆新车，准备周末自驾游。,2,1
72811,左,zuǒ,名词,面向南时靠东的一侧（与“右”相对）。,左方的道路通往一片茂密的森林。,请向左转，然后在第一个路口右拐就能看到超市。,2,1
