definition_id,hanzi,pinyin,pos,definition_cn,example_1,example_2,DS,QW
694711,费用,fèi yong,名词,支出款项总称,随着物价上涨，生活费用也在不断增加，这让很多人感到压力很大。,这次出差的费用公司会全额报销。,2,1
694811,分别,fēn bié,动词,与某人分开,暂时分别，不久就能见面，我们不必太过伤感。,毕业典礼后，同学们依依不舍地分别，约定十年后再相聚。,2,1
694812,分别,fēn bié,动词,区分不同事物,分别是非是一项重要的能力，能够帮助我们做出正确的判断。,老师教我们要学会分别是非对错，做个有原则的人。,2,1
694814,分别,fēn bié,副词,各自地，分开地,会议商定，几个人分别去做动员工作，以确保任务顺利完成。,会议结束后，大家分别回到自己的工作岗位。,2,1
694911,分布,fēn bù,动词,在一定区域内散布,这张人口分布图清晰地展示了全国各地区的人口密度差异。,这种珍稀植物主要分布在云南的热带雨林中。,2,1
695011,分配,fēn pèi,动词,按标准或规定分发,学校正在为新生分配宿舍。,老师把实验器材公平地分配给每个小组。,2,1
695012,分配,fēn pèi,动词,安排；分派,他选择服从组织分配的工作岗位。,老师将班级任务公平地分配给每个学生。,2,1
695212,纷纷,fēn fēn,副词,接连不断地,大家纷纷提出问题，希望得到解答。,消息传出后，记者们纷纷赶到现场进行采访报道。,2,1
695311,奋斗,fèn dòu,动词,为实现目标而努力,只有通过艰苦奋斗，才能实现自己的理想。,为了实现自己的梦想，他多年来一直在不懈地奋斗着。,2,1
695411,愤怒,fèn nù,形容词,因极度不满而情绪激动,愤怒的人群聚集在广场上抗议不公。,看到这种不公平的现象，群众们愤怒地举起了抗议的标语。,2,1
695511,风格,fēng gé,名词,个人特质,他的风格高雅，深受人们喜爱。,这位设计师的作品风格独特，在国际上享有很高的声誉。,2,1
695512,风格,fēng gé,名词,艺术表现特色,这幅画展现了独特的艺术风格。,巴洛克风格的建筑以华丽的装饰和复杂的曲线著称。,2,1
695611,风俗,fēng sú,名词,社会长期形成的习惯,这部电影生动地展现了当地的风俗人情。,春节期间贴春联、放鞭炮是中国传统的风俗习惯。,2,1
695711,风险,fēng xiǎn,名词,潜在的危险,创业路上需要有人愿意担风险。,投资股票市场虽然收益高，但也伴随着很大的风险。,2,1
695811,疯狂,fēng kuáng,形容词,发疯。,士兵们成功打退敌人的疯狂进攻。,那个疯狂的艺术家把整个房间都涂成了鲜艳的红色。,2,1
695911,讽刺,fěng cì,动词,用夸张手法批评嘲笑,这幅讽刺画揭示了社会的某些问题。,这部小说通过夸张的手法讽刺了社会上的一些不良现象。,2,1
696011,否定,fǒu dìng,动词,否认真实性,我们不能对别人的努力全盘否定。,我们不能因为遇到困难就否定整个计划的可行性。,2,1
696012,否定,fǒu dìng,形容词,表示否认的,这是一个典型的否定判断。,他对这个提议给出了否定的回答，认为时机还不成熟。,2,1
696111,否认,fǒu rèn,动词,拒绝承认,他矢口否认自己参与了这件事。,尽管证据确凿，犯罪嫌疑人仍然否认自己参与了这起案件。,2,1
696411,服从,fú cóng,动词,指听从或遵守,军人必须无条件服从命令。,作为军人，必须无条件服从上级的命令。,2,1
696511,服装,fú zhuāng,名词,指衣着的总称,这家服装商店提供各种时尚服饰。,这家商场正在举行服装促销活动，许多顾客前来选购。,2,1
696611,辅导,fǔ dǎo,动词,给予帮助和指导,辅导员耐心地解答了学生的问题。,学校安排优秀学生为学弟学妹们提供课后辅导。,2,1
696711,复制,fù zhì,动词,仿制原件或翻印书籍,博物馆里展出了许多珍贵文物的复制品。,为了保护珍贵文物，博物馆禁止游客对展品进行拍照复制。,2,1
696811,妇女,fù nǚ,名词,成年女性,妇女干部在社区建设中发挥了重要作用。,这位妇女在社区活动中表现得非常积极，赢得了大家的尊重。,2,1
696911,改革,gǎi gé,动词,革新旧的不合理部分,技术改革推动了企业的快速发展。,政府正在推进经济体制改革，以适应新的发展需求。,2,1
697011,改进,gǎi jìn,动词,提升原有状况,我们需要不断改进工作，以提高效率。,公司决定改进生产工艺，以提高产品质量和效率。,2,1
697111,改善,gǎi shàn,动词,使情况变得更好,改善生活是每个人追求的目标。,通过改善工作环境，员工的工作满意度显著提升。,2,1
697211,改正,gǎi zhèng,动词,纠正错误,改正缺点能够帮助我们更好地成长。,老师耐心地帮助学生改正作业中的错误，使他们进步很快。,2,1
697411,概括,gài kuò,动词,归纳事物的共同特点,各小组的办法虽然都不一样，但概括起来不外两种。,他的报告概括了当前市场的主要趋势，内容非常全面。,2,1
697412,概括,gài kuò,形容词,简明扼要,他把剧本的故事向大家概括地说了一遍。,请你用几句话概括一下这篇文章的中心思想。,2,1
702811,怪不得,guài bu de,副词,表示明白原因后不再觉得奇怪,天气预报说今晚有雨，怪不得这么闷热。,原来今天是他的生日，怪不得他准备了这么多好吃的。,2,1
703311,观点,guān diǎn,名词,看法,从生物学观点来看，这种现象是可以解释的。,从经济学的观点来看，这个决策存在很大风险。,2,1
704011,光明,guāng míng,名词,光亮,黑暗中的一线光明给了我们希望。,黑暗的隧道尽头终于出现了一丝光明。,2,1
704013,光明,guāng míng,形容词,比喻正义或有前途,只有努力学习，才能走上光明大道。,尽管遇到很多困难，但我们始终对未来充满光明。,2,1
708411,糊涂,hú tu,形容词,思维混乱不清,他越解释，我越糊涂。,喝了三杯烈酒后，他的头脑开始变得糊涂起来。,2,1
713111,假装,jiǎ zhuāng,动词,故意做出某种样子以掩盖真相,他继续干着手里的活儿，假装没听见别人的话。,发现老师走过来，他赶紧假装在认真看书。,1,2
713811,坚强,jiān qiáng,形容词,意志或力量强大，难以摧毁。,在困难面前，他始终意志坚强，从不轻言放弃。,这位运动员在比赛中表现出了坚强的意志力。,1,2
713912,尖锐,jiān ruì,形容词,深刻敏锐,他的眼光尖锐，总能一眼看出问题的关键所在。,这位记者以尖锐的眼光发现了问题的本质。,1,2
714011,艰巨,jiān jù,形容词,困难而繁重的,他们面临艰巨的任务，但依然充满信心地迎接挑战。,完成这项工程需要克服许多艰巨的困难。,1,2
714512,简直,jiǎn zhí,副词,方言，表示索性、干脆,雨下得那么大，你简直别回去了，还是等雨停再说吧。,既然已经迟到了，我们简直不用着急赶路了。,1,2
714912,建议,jiàn yì,名词,提出的主张或意见,他的合理化建议得到了领导的认可，并很快被采纳实施。,董事会认真讨论了关于扩建工厂的建议。,1,2
715011,建筑,jiàn zhù,动词,建造（房屋、道路等工程）,工程师们正在建筑桥梁，以连接河两岸的交通。,这座古老的建筑见证了城市数百年的历史变迁。,2,1
715012,建筑,jiàn zhù,名词,建造的房屋等工程,这座古老的建筑见证了城市几百年的历史变迁。,这座古老的建筑见证了城市几百年的历史变迁。,1,2
716111,角度,jiǎo dù,名词,两条直线相交形成的空间大小（用度或弧度表示）。,"如果光从自己的角度来看问题,意见就难免有些片面。",数学老师正在讲解如何计算三角形的角度。,1,2
716611,接触,jiē chù,动词,碰触,皮肤和物体接触后产生的感觉就是触觉，这是我们感知世界的重要方式之一。,医护人员必须严格做好防护才能接触患者。,1,2
717411,结构,jié gòu,名词,各个组成部分的搭配和排列,这篇文章的结构非常清晰，逻辑也很严密。,这篇文章的结构非常清晰，分为引言、正文和结论三部分。,1,2
717412,结构,jié gòu,名词,建筑物上承担重力或外力的部分的构造,这座老房子采用了传统的砖木结构，具有很高的历史价值。,这座大桥的钢结构设计非常先进，能够承受极大的重量。,1,2
717511,结合,jié hé,动词,人或事物间发生密切联系,理论结合实际是我们学习和工作中必须遵循的重要原则。,理论知识与实践经验相结合，才能更好地解决问题。,2,1
717711,结账,jié zhàng,动词,结算账目,饭后结账，连酒带饭一百多元。,每次用餐后，服务员都会及时过来为我们结账。,2,1
718011,借口,jiè kǒu,名词,以(某事)为理由(非真正的理由),不能借口快速施工而降低工程质量。,他总是以工作忙为借口，推脱朋友的聚会邀请。,2,1
718511,尽量,jìn liàng,动词,达到最大量,喝了半斤白酒，还没尽量。,这个水杯的容量很大，可以尽量多装些水。,1,2
718521,尽量,jǐn liàng,副词,副词：尽可能,把你知道的尽量报告给大家。,明天要考试了，今晚你要尽量早点休息。,2,1
718611,谨慎,jǐn shèn,形容词,言行小心以避免不利,在处理重要事情时，我们必须保持小心谨慎的态度。,投资股票需要谨慎行事，不能盲目跟风。,2,1
718711,进步,jìn bù,名词,向更好方向发展,虚心使人进步，骄傲使人落后。,经过努力学习，他的成绩有了明显的进步。,2,1
718812,进口,jìn kǒu,动词,从国外或外地引入货物,消费者对进口货的需求不断增加。,我们公司主要进口欧洲的高端机械设备。,2,1
719011,尽力,jìn lì,动词,竭尽全力,面对困难，我们应尽力而为。,虽然任务很艰巨，但我们会尽力完成。,2,1
719111,精力,jīng lì,名词,身体与心理的活力,他每天都精力充沛地投入到工作中。,年轻人精力充沛，应该多参与社会活动。,2,1
719211,经典,jīng diǎn,形容词,具有典型性和影响力的,这部电影是一部经典影片。,《红楼梦》是中国文学史上的经典之作。,2,1
719212,经典,jīng diǎn,名词,传统权威著作,博览经典有助于提高文学素养。,儒家经典《论语》影响了中国两千多年。,2,1
719213,经典,jīng diǎn,名词,宗教教义的根本著作,马列主义经典著作对我们理解社会发展规律具有重要意义。,佛教经典《金刚经》阐述了空性的智慧。,2,1
719214,经典,jīng diǎn,形容词,著作具有权威性的,研究马列主义经典著作是理论学习的重要部分。,莎士比亚的戏剧是英语文学的经典作品。,2,1
719311,经营,jīng yíng,动词,筹划并管理(企业等),经营商业需要具备敏锐的市场洞察力。,他经营着一家连锁餐厅，生意非常红火。,2,1
719411,景色,jǐng sè,名词,风景；景观,这里的景色迷人，吸引了无数游客前来观赏。,站在山顶眺望，远处的景色美得令人心旷神怡。,2,1
719511,敬爱,jìng ài,动词,尊敬与爱戴,我们应该敬爱父母，因为他们为我们付出了很多。,我们敬爱的老师总是耐心地解答每一个学生的问题。,2,1
719911,居然,jū rán,副词,出乎意料地,我真没想到他居然会做出这种事来。,他平时很少运动，这次居然跑完了全程马拉松，真是让人惊讶。,2,1
720111,具备,jù bèi,动词,拥有；齐备,要想成功，必须具备条件并付出努力。,要成为一名优秀的医生，必须具备扎实的专业知识和丰富的临床经验。,2,1
720211,具体,jù tǐ,形容词,明确的；不抽象的,将计划具体化是实现目标的重要一步。,请你把这次活动的具体安排详细地告诉大家，以便做好准备。,2,1
720212,具体,jù tǐ,形容词,特定的,我们需要关注具体的人，而不是抽象的概念。,我们需要讨论的是这个项目的具体实施方案，而不是泛泛而谈。,2,1
720311,巨大,jù dà,形容词,规模或数量非常大。,这项工程耗资巨大，需要仔细规划预算。,这项工程的投资金额巨大，需要谨慎评估每一个环节的风险。,2,1
720412,聚会,jù huì,名词,聚会活动,"明天有个聚会,你参加不参加?",这次同学聚会定在下周六，地点就在我们以前常去的那家餐厅。,2,1
720611,据说,jù shuō,动词,根据他人说法,据说今年冬天气温偏高。,据说这座古城有着上千年的历史，每一砖每一瓦都承载着故事。,2,1
721012,决心,jué xīn,动词,"一心一意,坚定不移地",他决心钻研学问，希望将来能成为一名学者。,无论遇到多大的困难，她都决心坚持到底，绝不轻言放弃。,2,1
721111,绝对,jué duì,形容词,无条件的,追求绝对真理是人类永恒的目标之一。,在这个问题上，我们必须坚持绝对的原则，不能有任何妥协的余地。,2,1
721113,绝对,jué duì,副词,完全地,他的答案被认为是绝对正确，无需质疑。,你放心，这件事我绝对会帮你保密，不会告诉任何人。,2,1
721311,军事,jūn shì,名词,与军队或战争相关的事务,军事工作需要高度的责任心和专业技能。,军事演习是为了提高军队的战斗力。,2,1
721411,均匀,jūn yún,形容词,分布或分配在各部分的数量相同;时间的间隔相等,今年的雨水很均匀，使得农作物长势良好。,她把蛋糕上的奶油涂抹得非常均匀。,2,1
721611,开发,kāi fā,动词,"以荒地、矿山、森林、水力等自然资源为对象进行劳动,以达到利用的目的;开拓",为了改善环境，政府决定开发荒山，种植更多的树木。,政府计划开发这片荒芜的土地。,2,1
721612,开发,kāi fā,动词,发掘利用人才技术,这家科技公司一直致力于开发先进技术，以保持市场竞争力。,公司致力于开发新的技术和产品。,2,1
721621,开发,kāi fa,动词,支付款项,在出发前，我们需要开发车钱，确保旅途顺利进行。,老板决定开发奖金以激励员工。,1,2
721711,开放,kāi fàng,动词,花朵绽放,春天来了，百花开放，整个大地充满了生机。,春天来了，公园里的花朵都开放了。,2,1
721712,开放,kāi fàng,动词,解除封锁、禁令或限制,公园每天开放，吸引了许多市民前来散步和锻炼。,政府决定开放更多的市场给外资企业。,2,1
721713,开放,kāi fàng,形容词,性格外向，思想不保守,他性格开放，总是乐于接受新事物和不同的观点。,她性格开放，很容易和陌生人成为朋友。,2,1
721811,开心,kāi xīn,形容词,心情愉悦,同志们住在一起，说说笑笑，十分开心，这种氛围让人感到温暖。,孩子们在游乐园玩得非常开心。,2,1
721812,开心,kāi xīn,动词,取笑他人,别拿他开心，他最近压力很大，需要大家的理解和支持。,他喜欢拿别人的缺点来开心，这种行为很不礼貌。,1,2
722011,看不起,kàn bu qǐ,动词,轻视或不尊重某人或某物。,别看不起这本小字典，它真能帮助我们解决问题，尤其是在学习语言时。,他因为贫穷而被人看不起，这让他很伤心。,2,1
722411,可见,kě jiàn,动词,显而易见,由此可见，这次事故是因为思想麻痹造成的，我们必须引以为戒。,从这些数据可见，公司的业绩正在稳步提升。,2,1
722611,刻苦,kè kǔ,形容词,肯下苦功夫;很能吃苦,只有刻苦钻研，才能在学术领域取得突破性的进展。,他每天刻苦学习到深夜，终于考上了理想的大学。,2,1
722612,刻苦,kè kǔ,形容词,俭朴,他生活一向很刻苦，从不浪费任何资源，令人敬佩。,爷爷一生过着刻苦的生活，从不浪费一分钱。,1,2
722912,克服,kè fú,动词,忍受困难,这儿的生活条件不太好，请诸位克服一下，尽量适应环境。,在艰苦的条件下，他克服了重重困难完成了任务。,2,1
723211,空间,kōng jiān,名词,物质存在的广延性表现,我们生活在一个三维空间中。,宇宙的空间如此浩瀚，人类对它的探索永无止境。,2,1
723412,空闲,kòng xián,名词,空着的时间;闲暇,他一有空闲就练习书法，以提高自己的技艺。,他利用工作的空闲时间学习了一门外语。,2,1
723512,控制,kòng zhì,动词,施加影响或管理,殖民地的经济为宗主国所控制，导致资源大量流失。,这家公司完全控制着当地的市场份额。,2,1
724512,劳动,láo dòng,名词,体力劳动。,通过劳动锻炼，他变得更加健康和强壮。,农民们每天在田地里进行繁重的体力劳动。,2,1
724611,劳驾,láo jià,动词,礼貌用语，用于请求他人帮忙或让路,劳驾，把那本书递给我，我想查阅一下其中的内容。,劳驾，请问去火车站应该坐哪路公交车？,2,1
724911,老实,lǎo shi,形容词,诚实可信的,忠诚老实是一种值得尊敬的品质。,他是个老实人，从来不说谎话欺骗别人。,2,1
724912,老实,lǎo shi,形容词,行为规矩，不惹事,这孩子很老实，从来不跟人吵架，大家都很喜欢他。,这孩子在学校里很老实，从不惹是生非。,2,1
725911,理由,lǐ yóu,名词,做事的依据,理由充足的情况下，我们更容易说服别人接受我们的观点。,他辞职的理由是想有更多时间陪伴家人。,2,1
726311,立刻,lì kè,副词,副词，表示动作或状态紧接着发生,请大家立刻到会议室去。,听到火警铃声，所有人立刻从大楼撤离。,2,1
726413,力量,lì liang,名词,实际效果,这种农药的力量大，能有效杀灭害虫。,这种新药的治疗力量比传统药物强很多。,2,1
726711,利益,lì yì,名词,好处或益处,物质利益是人们追求的目标之一。,保护环境不仅是为了当代人的利益，更是为了子孙后代。,2,1
726811,利用,lì yòng,动词,发挥人或物的效能,废物利用是一种环保的行为。,我们应该充分利用太阳能这种清洁能源。,2,1
726812,利用,lì yòng,动词,为自身利益而使用他人或物,他们之间只是互相利用，并没有真正的友谊。,他被人利用去做了违法的事情，现在非常后悔。,2,1
726911,连忙,lián máng,副词,迅速行动,"老大娘一上车,乘客就连忙让座。",看到老人摔倒，路人连忙上前搀扶。,2,1
727011,连续剧,lián xù jù,名词,分集播出的戏剧,广播连续剧深受听众喜爱。,这部历史题材的电视连续剧获得了很高的收视率。,2,1
727112,联合,lián hé,形容词,结合在一起的;共同,联合收割机大大提高了农业生产的效率。,经过联合治疗，病人的病情有了明显好转。,2,1
727211,恋爱,liàn ài,名词,男女相互爱慕的感情,自由恋爱是现代社会的一种普遍现象。,他们在大学相识并恋爱三年后结婚了。,2,1
727212,恋爱,liàn ài,名词,男女相爱的行为表现,年轻人喜欢在闲暇时谈恋爱。,他们在大学期间相识并开始了一段美好的恋爱。,2,1
727311,良好,liáng hǎo,形容词,令人满意的；好的,手术经过良好，病人正在恢复中。,这家餐厅的服务态度良好，顾客都很满意。,2,1
727511,了不起,liǎo bu qǐ,形容词,非常出色的,他的本事真了不起，大家都对他刮目相看。,他在科研领域取得了了不起的成就，获得了国际认可。,2,1
727512,了不起,liǎo bu qǐ,形容词,程度严重的,没有什么了不起的困难，只要努力就能克服。,这次事故造成了了不起的损失，需要很长时间才能恢复。,2,1
727611,临时,lín shí,副词,在事情发生时,临时抱佛脚虽然有用，但平时的努力更重要。,他平时不复习，总是临时抱佛脚，考试前才熬夜看书。,2,1
727612,临时,lín shí,形容词,短期的；暂时的,公司雇佣了一些临时工来应对旺季的工作量。,公司正在装修，员工们被安排在一个临时的办公室工作。,2,1
727911,零钱,líng qián,名词,小额货币，如角、分,"我不抽烟,也不喝酒,一个月花不了多少零钱。",他掏出一把零钱，数了数刚好够买一瓶矿泉水。,2,1
728011,零食,líng shí,名词,正餐之外的小吃,不吃零食是好习惯，这有助于保持健康的生活方式。,小孩子总喜欢吃各种零食，但家长要注意控制数量。,2,1
728111,灵活,líng huó,形容词,动作敏捷；不呆板,他的手脚灵活，能够轻松完成各种高难度动作。,这只小猫动作非常灵活，能轻松跳到很高的地方。,2,1
729011,陆续,lù xù,副词,接连不断地，一个接一个,来宾陆续地到了，现场气氛逐渐热闹起来。,会议结束后，参会人员陆续离开了会场。,2,1
729311,轮流,lún liú,动词,按照顺序依次进行，循环往复,班级里每天都会安排同学轮流值日，保持教室整洁。,我们小组决定轮流值班，每人负责一天。,2,1
729511,逻辑,luó ji,名词,思维规律,这几句话不合逻辑，让人难以理解其真实含义。,数学老师特别强调解题时要遵循严密的逻辑。,2,1
729611,落后,luò hòu,动词,行进中位置靠后,"我们的船先过了桥洞,他们的船稍微落后一点，但最终也顺利通过了。",马拉松比赛中，他因体力不支逐渐落后于其他选手。,2,1
733911,目录,mù lù,名词,系统排列的名目清单,图书馆里的图书目录非常详细，方便查找。,图书馆的目录系统非常完善，找书很方便。,2,1
734011,目前,mù qián,名词,当前时刻,目前形势对我们很有利，应该抓住机会。,目前我们还没有收到任何关于会议改期的通知。,2,1
734311,难怪,nán guài,副词,表示理解,难怪他今天这么高兴，原来新机器试验成功了。,难怪他今天这么高兴，原来考试得了满分。,2,1
735011,年代,nián dài,名词,时代，时期（多指过去较远的）。,这座古庙的年代久远，具有很高的历史价值。,这座古城的历史可以追溯到几百年前的明朝年代。,2,1
739114,破坏,pò huài,动词,违反（规章、条约等）,单方面撕毁合同是对双方协定的严重破坏。,故意破坏公共设施是违法行为。,1,2
739312,朴素,pǔ sù,形容词,生活节俭不奢侈,艰苦朴素的生活作风是我们应当继承和发扬的优良传统。,尽管收入增加了，他仍然保持着朴素的生活习惯。,2,1
740111,气氛,qì fēn,名词,环境给人的整体感觉,会场上充满了团结友好的气氛，大家都沉浸在欢乐之中。,会议的气氛非常紧张，大家都在等待最终的决定。,1,2
740511,谦虚,qiān xū,形容词,不自满，愿意接受批评,谦虚谨慎是一种优秀的品质，值得每个人学习。,他虽然取得了很大成就，但依然保持着谦虚的态度。,2,1
740512,谦虚,qiān xū,动词,表达谦虚的言辞,他谦虚了一番，终于答应了我的请求，让我感激不已。,面对大家的赞扬，他只是谦虚地说自己还需要继续努力。,2,1
741111,强烈,qiáng liè,形容词,非常强大的,强烈的求知欲驱使着他不断探索未知领域。,地震发生时，我们感受到了强烈的震动，房屋都在摇晃。,2,1
741112,强烈,qiáng liè,形容词,非常明显的,这两幅画放在一起形成了强烈的对比，令人印象深刻。,这幅画的色彩对比非常强烈，给人留下了深刻印象。,1,2
741511,巧妙,qiǎo miào,形容词,方法或技术高超，超出寻常。,这篇小说构思巧妙，情节跌宕起伏，令人拍案叫绝。,他巧妙地解决了这个难题，赢得了大家的赞赏。,1,2
741811,亲切,qīn qiè,形容词,关系亲近，感情深厚,他想起延安，像想起家乡一样亲切，眼中不禁泛起泪光。,回到家乡，听到熟悉的乡音，我感到格外亲切。,1,2
742211,勤劳,qín láo,形容词,"努力劳动,不怕辛苦",勤劳勇敢的人民创造了辉煌的历史。,中国农民以勤劳著称，一年四季都在田间辛勤劳作。,1,2
742511,轻视,qīng shì,动词,不重视或小看,轻视劳动的人是不会得到社会尊重的。,我们不能轻视任何一个小问题，它可能引发大麻烦。,1,2
742612,清淡,qīng dàn,形容词,（食物）油脂少,我这两天感冒了，想吃点清淡的菜。,医生建议术后饮食要清淡，避免油腻食物。,2,1
742613,清淡,qīng dàn,形容词,清新简约,清淡的艺术风格往往更能打动人心。,她的着装风格总是那么清淡优雅，给人舒适的感觉。,2,1
742911,请求,qǐng qiú,动词,提出要求希望被满足,在困难时期，他们请求援助以渡过难关。,他向公司请求延长项目期限，以获得更好的成果。,1,2
743011,庆祝,qìng zhù,动词,为喜事举行活动表示高兴或纪念,全国人民都在热烈庆祝国庆。,全校师生共同庆祝建校一百周年的盛大节日。,1,2
743211,趋势,qū shì,名词,事物发展的方向,历史发展的必然趋势是不可逆转的。,专家分析了当前经济发展的趋势，预测明年会持续增长。,1,2
743812,权力,quán lì,名词,职责范围内的支配力,他行使大会主席的权力，宣布会议正式开始。,作为部门经理，他拥有调配人力和物力的权力。,1,2
745114,人口,rén kǒu,名词,人的口腔部位,这首诗语言优美，内容深刻，堪称脍炙人口的经典之作。,这个新产品刚上市就获得了极好的口碑，人口皆碑。,1,2
