definition_id,hanzi,pinyin,pos,definition_cn,example_1,example_2,DS,QW
235613,冤,yuān,形容词,吃亏,为了这个项目，他花了不少冤钱。,花大价钱买了假古董，真是冤透了。,2,1
235713,瞎,xiā,形容词,（炮弹等）未爆炸。,这次爆破出现了几个瞎炮，需要重新处理。,这次演习中出现了几发瞎火炮弹。,2,1
235716,瞎,xiā,形容词,〈方言〉混乱；无头绪。,线绕得不好，结果线绕瞎了。,他做事没条理，总是瞎忙一气。,2,1
235811,娇,jiāo,形容词,形容女子、小孩或花朵柔美可爱,她的舞姿显得格外娇娆动人。,这个小女孩长得娇嫩可爱，像一朵含苞待放的花。,2,1
236011,倦,juàn,形容词,疲乏,经过一天的忙碌，他感到非常疲倦。,他工作了一整天，感到非常疲倦，只想好好休息。,2,1
236111,愧,kuì,形容词,因过错而感到羞愧,他因自己的错误感到羞愧。,面对老师的表扬，他反而感到有些惭愧，觉得自己做得还不够好。,2,1
236311,柯,kē,名词,草木的枝茎,大树的枝柯在风中摇曳。,秋风扫落叶，枯柯在风中发出沙沙的声响。,2,1
236312,柯,kē,名词,斧子的手柄,这把斧柯已经使用多年，依然锋利无比。,樵夫手握斧柯，熟练地劈开木材。,2,1
236414,聊,liáo,动词,依靠或依赖,生活无趣，百无聊赖。,百姓聊赖天时，期盼风调雨顺的好年景。,1,2
236415,聊,liáo,动词,随意交谈,他们坐在沙发上闲聊了一下午。,几个老朋友围坐在一起，喝茶聊天，十分惬意。,2,1
236511,侨,qiáo,动词,在国外居住,这位侨民在国外生活多年，依然怀念故乡。,他早年侨居海外，如今回国创办了自己的企业。,2,1
236711,惟,wéi,副词,仅仅；只有,惟一无二的东西往往最珍贵。,在这个世界上，惟有你最了解我的心意。,2,1
236714,惟,wéi,名词,思想,思惟是解决问题的重要方式。,他的心中惟有一个念头：一定要完成这个任务。,1,2
236811,谅,liàng,动词,宽恕过错,双方通过沟通达成了谅解。,请你谅我这次的无心之失，下次我一定注意。,2,1
236812,谅,liàng,动词,推测认为,请谅不见怪，我并非有意冒犯。,我谅他也不敢在众人面前说出这样的话。,1,2
236911,瘤,liú,名词,异常生长的组织,腐败就像毒瘤，侵蚀着社会的健康肌体。,医生检查后发现他的手臂上长了一个小瘤。,2,1
237311,溉,gài,动词,灌;浇,农民们正在田间辛勤灌溉。,农民们引水溉田，确保庄稼能够茁壮成长。,2,1
237411,铸,zhù,动词,将金属熔化后倒入模具，冷却成型的过程。,铸工是一项需要高超技艺的工作。,古代的工匠们用青铜铸成了许多精美的礼器。,2,1
237512,髓,suǐ,名词,类似骨髓的物质,经过长时间的思考，他感到自己的脑髓都快被榨干了。,这种植物的髓部含有丰富的营养物质。,2,1
237611,碌,lù,形容词,平凡（指人）,庸碌的生活让他感到无比厌倦。,他一生碌碌无为，从未实现过自己的理想。,2,1
237711,拢,lǒng,动词,合上,他笑得嘴都合不拢了。,她轻轻拢了拢散落的头发，继续专注地工作。,2,1
237712,拢,lǒng,动词,接近或抵达,船员们齐心协力，终于成功地将船拢岸。,小船慢慢拢岸，游客们依次下船欣赏美景。,2,1
237713,拢,lǒng,动词,汇总或合计,拢共算下来，这次旅行花费了不少钱。,她把所有的数据拢在一起，准备进行综合分析。,2,1
237714,拢,lǒng,动词,聚拢或集中,她的歌声清亮动人，能够很好地拢音。,他用绳子把散落的树枝拢好，方便搬运。,2,1
237715,拢,lǒng,动词,梳理（头发）,她用梳子拢了拢头发。,每天早上她都会仔细地拢一拢头发，让自己看起来更精神。,2,1
237913,帅,shuài,形容词,英俊潇洒,这个武打动作干净利落，帅极了。,他穿上那套西装后显得特别帅气，吸引了所有人的目光。,2,1
238011,坟,fén,名词,埋葬死人的地方,祖坟周围的树木郁郁葱葱，显得格外庄严肃穆。,清明节时，人们会去扫墓，祭拜祖先的坟墓。,2,1
238211,吏,lì,名词,古代无品级的小官员,胥吏在古代官府中扮演着重要的角色。,在古代，小吏虽然职位卑微，但工作却非常繁重。,2,1
238212,吏,lì,名词,古代泛指官员,大吏们齐聚一堂，商讨国家大事。,吏治清明是国家长治久安的重要保障。,2,1
238311,峻,jùn,形容词,山势高大,险峻的山路让司机们望而却步。,这座山峻峭挺拔，是登山爱好者们的挑战目标。,2,1
238411,歉,qiàn,形容词,农作物收成不佳,歉年时，农民们的生活变得十分艰难。,今年干旱少雨，农田歉收，农民们都很发愁。,2,1
238412,歉,qiàn,形容词,因过失而感到不安的心情,他感到非常抱歉，因为迟到了会议。,他为自己迟到感到非常歉疚，连连向同事道歉。,2,1
238511,刹,chà,名词,佛教寺院,这座古刹隐藏在深山之中，鲜有人知。,这座古刹已有千年历史，是著名的佛教圣地。,2,1
238611,坝,bà,名词,用于拦水的建筑物,拦河坝的建设改变了河流的流向。,三峡大坝是世界上最大的水利工程之一，具有防洪发电等多种功能。,2,1
238721,栖,qī,动词,鸟类停歇；泛指居住或停留,鸟儿在树枝上栖息，等待黎明的到来。,鸟儿栖息在枝头，欢快地唱着春天的歌谣。,2,1
238811,捐,juān,动词,放弃或抛弃某物,双方决定捐弃前嫌，重新开始合作。,他毅然捐弃了富贵荣华，归隐山林。,2,1
238812,捐,juān,动词,无偿给予财物帮助,他决定捐献出自己的大部分财产用于慈善事业。,社会各界纷纷捐款捐物，支援灾区重建。,2,1
238813,捐,juān,名词,特定类型的税收,车主要按时缴纳车捐，以免产生罚款。,古代官府常向百姓征收苛捐杂税，民不聊生。,2,1
238911,渊,yuān,名词,深水或深潭,他站在深渊边缘，感受到一种莫名的恐惧。,潭水幽深如渊，倒映着四周的青山绿树。,2,1
238912,渊,yuān,形容词,形容程度深,这口渊泉清澈见底，是村民的重要水源。,这位学者学识渊博，在学术界享有盛誉。,2,1
239012,傍,bàng,形容词,时间上接近,傍晚时分，夕阳染红了整个天空。,傍晚时分，夕阳将天空染成了绚丽的橘红色。,2,1
239211,鸽,gē,名词,鸽子的简称,信鸽带着重要的信息飞回了基地。,一群白鸽在广场上空盘旋，象征着和平与希望。,2,1
239311,淘,táo,动词,用水冲洗颗粒物以去除杂质。,她认真地淘米，准备做一顿美味的米饭。,奶奶正在淘米准备做饭，水盆里漂浮着几粒谷壳。,2,1
239313,淘,táo,动词,清除深处的污水或泥沙。,村民们正在淘井，准备清理出干净的水源。,工人们正在淘井，清除淤积多年的污泥。,2,1
239314,淘,táo,动词,消耗精力或资源。,他今天淘神了，把家里弄得一团糟。,这个项目淘尽了公司的人力物力，终于取得了成功。,2,1
239411,轿,jiào,名词,古代人力抬运的交通工具,迎亲队伍抬着花轿，一路吹吹打打地向新娘家走去。,新娘坐着花轿，在锣鼓声中来到了新郎家。,2,1
239611,宰,zǎi,动词,掌管；主持。,命运由自己主宰。,他宰理公司事务多年，经验非常丰富。,2,1
239612,宰,zǎi,名词,古代官职名称。,古时县宰负责管理一县的政务和治安。,在古代，太宰是朝廷中非常重要的官职。,2,1
239613,宰,zǎi,动词,杀(牲畜、家禽等),这个村庄每逢节日都会进行传统的屠宰仪式。,过年时，家家户户都会宰鸡杀鸭准备年夜饭。,2,1
239614,宰,zǎi,动词,比喻向顾客索取高价。,他在市场上买东西时总怕挨宰，因此格外小心。,这家黑心商家专宰外地游客，价格高得离谱。,2,1
239811,玄,xuán,形容词,黑色。,山林间突然窜出一只玄狐。,她穿着一件玄色的旗袍，显得格外端庄。,2,1
239812,玄,xuán,形容词,深奥难懂。,这幅画的意境显得非常玄妙。,这本古籍的内容非常玄奥，需要专家才能解读。,2,1
240011,愣,lèng,形容词,发呆、失神的状态,他坐在那里发愣，似乎在思考什么重要的事情。,听到这个突如其来的消息，他愣在原地半天说不出话。,2,1
240111,朽,xiǔ,形容词,木质材料腐烂,这块朽木已经无法用来制作家具了。,这棵老树的树干已经朽烂，随时可能倒塌。,2,1
240112,朽,xiǔ,形容词,形容衰老的状态,老朽虽年迈，但仍希望能为村里贡献一份力量。,他虽然年迈体朽，但精神依然矍铄。,2,1
240211,跪,guì,动词,屈膝使膝盖着地,他因请求原谅而下跪。,在古代，臣子见到皇帝必须行跪拜之礼。,2,1
240321,券,quàn,名词,凭证或票据,他购买了一些公债券作为长期投资。,我昨天在商场抽奖，幸运地获得了一张优惠券。,2,1
240412,寓,yù,名词,住所,这家客寓环境优雅，适合居住。,他在市中心租了一间公寓，交通非常便利。,2,1
240413,寓,yù,动词,寄托,这幅画寓意深刻。,这幅画中寓含着画家对和平的深切期望。,2,1
240511,捏,niē,动词,用拇指和其他手指夹住,他用力捏住这支笔，仿佛在思考什么。,她小心翼翼地捏起那枚细小的针，生怕掉在地上。,2,1
240512,捏,niē,动词,用手塑造柔软材料,孩子们喜欢捏泥人儿来玩耍。,孩子们用橡皮泥捏出了各种可爱的小动物。,2,1
240513,捏,niē,动词,将不同部分合并,我们需要找到方法将这些碎片捏合在一起。,为了修复这个花瓶，他必须把碎片捏合在一起。,2,1
240514,捏,niē,动词,编造虚假事实,他被指控捏造事实。,他故意捏造事实，企图陷害无辜的同事。,2,1
240611,搅,jiǎo,动词,混合搅拌,茶汤搅匀了，可以喝了。,做蛋糕前，需要把鸡蛋和面粉搅拌均匀。,2,1
240612,搅,jiǎo,动词,打扰；扰乱,请勿搅扰正在工作的同事。,外面的噪音搅得我无法专心工作。,2,1
240711,笨,bèn,形容词,智力或记忆力差,他看起来愚笨，其实非常聪明。,虽然他学习很努力，但成绩总是不理想，显得有些笨。,2,1
240712,笨,bèn,形容词,动作不灵活,他嘴笨，不善于表达自己的想法。,这只大熊猫笨拙地爬上了树，样子非常可爱。,2,1
240713,笨,bèn,形容词,沉重不灵便,这种笨活儿需要耐心才能完成。,搬运这些笨重的家具需要好几个人一起帮忙。,2,1
240811,槽,cáo,名词,盛放牲畜饲料的长形容器,猪槽里装满了饲料。,马厩里的马儿正低头吃着槽里的草料。,2,1
240812,槽,cáo,名词,盛放液体的容器,酒槽中散发出浓郁的香气。,酒吧的吧台上摆满了盛着各种美酒的玻璃槽。,2,1
240814,槽,cáo,量词,门窗或隔断的单位（方言）,两槽隔扇的设计使得空间更加灵活。,这间老房子的门窗共有五槽，都是传统的木质结构。,2,1
240815,槽,cáo,量词,养猪从买入到卖出的一周期（方言）,今年他家喂了两槽猪。,他们家今年已经养了两槽猪，准备年底出售。,2,1
240931,咋,zǎ,代词,方言，表示“怎么”,你今天感觉咋样？,你咋不早点告诉我这个消息呢？,2,1
241021,厦,shà,名词,高大的建筑物。,这座城市有许多广厦，为人们提供了舒适的居住环境。,这座摩天大厦是城市的地标性建筑之一。,2,1
241022,厦,shà,名词,房屋后墙延伸部分（方言）。,这座古建筑前廊后厦，结构十分独特。,我们家的厨房在房子的后厦，采光很好。,2,1
241111,爪,zhǎo,名词,动物脚趾上的角质尖状物,乌龟趾间有蹼，趾端有爪，适应水中生活。,老虎的爪子非常锋利，能够轻易撕开猎物的皮肉。,2,1
241112,爪,zhǎo,名词,鸟兽的脚,小猫用前爪轻轻抓住了玩具。,鹰的爪子强健有力，可以牢牢抓住树枝或猎物。,2,1
241311,榜,bǎng,名词,张贴的名单,选民榜上列出了所有合格的投票人。,学校门口张贴了考试成绩榜，许多学生都围在那里查看。,2,1
241312,榜,bǎng,名词,文告,榜文张贴在城门口，吸引了许多人围观。,古代官府会在城门口张贴榜文，告知百姓最新的政令。,2,1
241313,榜,bǎng,名词,匾额,他因题榜而闻名于乡里。,这座古庙的门楣上悬挂着一块金字榜额，写着“大雄宝殿”。,2,1
241411,屠,tú,动词,宰杀(牲畜),屠狗之人往往以贩卖狗肉为生。,每到春节前夕，村里都会屠猪宰羊，准备丰盛的年夜饭。,2,1
241412,屠,tú,动词,屠杀,敌军攻入城池后进行了惨无人道的屠城。,历史上许多战争都伴随着大规模的屠杀，造成无数平民伤亡。,2,1
241511,耸,sǒng,动词,高高直立,那座山峰高耸入云，令人叹为观止。,这座摩天大楼耸立在城市中心，成为最醒目的地标建筑。,2,1
241512,耸,sǒng,动词,使人震惊或注意,他总是喜欢危言耸听，让人感到不安。,他的言论耸人听闻，立刻引起了媒体和公众的广泛关注。,2,1
241611,驼,tuó,名词,骆驼的简称。,骆驼的驼峰储存着脂肪，帮助它们在沙漠中生存。,骆驼被称为沙漠之舟，它们的驼峰可以储存大量脂肪和水。,2,1
241612,驼,tuó,形容词,背部弯曲。,老爷爷的背都驼了，走起路来十分吃力。,爷爷年纪大了，背有点驼，走路时需要拄着拐杖。,2,1
241711,甩,shuǎi,动词,挥动；抡,每天早晨，他都会甩胳膊活动一下筋骨。,他用力甩动手臂，将渔网远远地抛向湖面。,2,1
241712,甩,shuǎi,动词,向外抛掷,战士们训练时学习如何甩手榴弹。,孩子们在沙滩上比赛甩石子，看谁的石子在水面上跳得最远。,2,1
241713,甩,shuǎi,动词,抛开,我们等他一下吧，别把他一个人甩在后面。,为了轻装前进，探险队不得不甩掉一些不必要的装备。,2,1
241811,逮,dǎi,动词,捉拿,猫逮老鼠是天性使然。,警察在巷子里逮住了那个偷钱包的小偷。,2,1
241821,逮,dài,动词,达到；及,尽管他尽力了，但力还是有未逮之处。,他的学识渊博，在文学和科学领域都颇有建树，实属难逮。,2,1
241921,殷,yǐn,拟声词,雷声,《诗经》中有“殷其雷”的句子，形容雷声隆隆。,远处传来殷殷雷声，预示着暴雨即将来临。,2,1
241932,殷,yīn,形容词,深厚的,父母对他的期望非常殷切。,他对故乡怀着殷切的思念之情，常常梦回故里。,2,1
242013,赚,zhuàn,动词,方言，指挣钱,做一天工，赚十块，这样的收入让他勉强维持生计。,他在外地打工赚的钱都寄回家供弟弟上学。,2,1
242821,兹,zī,代词,指示代词，指代当前事物,兹事体大（这是件大事情），必须慎重处理。,兹事体大，我们需要慎重考虑后再做决定。,2,1
243211,垦,kěn,动词,开垦荒地；翻土耕种。,垦地的工作虽然辛苦，但农民们依然充满干劲。,农民们正在垦荒，准备将这片土地变成肥沃的农田。,2,1
243312,兜,dōu,动词,用兜形物包裹,小女孩儿的衣襟里兜着几个海棠果儿，脸上洋溢着幸福的笑容。,她用围裙兜住刚摘下来的新鲜苹果，防止它们掉到地上。,1,2
243316,兜,dōu,动词,揭露真相,经过一番调查，终于把他的老底全给兜出来了。,你放心去做吧，万一有麻烦，我会给你兜底的。,2,1
243621,吁,xū,动词,叹息,他最近总是长吁短叹，似乎有什么烦心事。,看着满目疮痍的战场，将军不禁长吁短叹。,2,1
243911,惶,huáng,形容词,恐惧,面对突如其来的变故，他显得有些惶恐不安。,听到突如其来的巨响，孩子们都显得很惶恐。,2,1
244713,裹,guǒ,动词,将人或物混入其他群体中,土匪逃跑时裹走了村子里的几个人，村民们十分担心他们的安危。,毒贩试图将毒品裹在衣物中走私，但被海关人员当场查获。,2,1
244714,裹,guǒ,动词,吸（奶）,小孩儿一生下来就会裹奶，这是本能的表现。,婴儿饿得直哭，妈妈赶紧把他抱起来裹奶。,2,1
244811,瞅,chǒu,动词,〈方言〉看。,我往屋里瞅了一眼，没瞅见他，心里顿时感到一阵失落。,他站在门口瞅了半天，终于认出这是小时候住过的老房子。,2,1
244911,卸,xiè,动词,从运输工具上搬下货物。,卡车到达目的地后开始卸货，工人们忙碌了起来。,工人们正忙着从卡车上卸下新到的建筑材料。,2,1
244912,卸,xiè,动词,取下或去除加在人身上的物品。,演出结束后，演员们回到后台开始卸装，准备离开剧场。,演出结束后，演员们回到后台卸下厚重的戏服。,2,1
244913,卸,xiè,动词,解开并取下牲口的套具。,他熟练地卸牲口，准备让它们休息。,老农熟练地卸下驴子身上的犁具，牵它去河边饮水。,2,1
244914,卸,xiè,动词,把零件从机械上拆下来,工人正在拆卸旧的机器设备。,维修师傅正在卸下发动机的故障零件，准备更换新的。,2,1
244915,卸,xiè,动词,解除责任；推卸。,这位官员即将卸任，大家都来送别。,面对责任，他总是找各种借口卸责，从不主动承担。,2,1
245012,兆,zhào,动词,预先显示或暗示,瑞雪兆丰年。,乌鸦在屋顶鸣叫，老人说这是不祥之兆，恐怕要出事。,2,1
245111,咧,lie,助词,方言中用法类似“了”、“啦”、“哩”的助词,好咧，我这就去办。,天都黑咧，咱们赶紧回家吧，不然妈妈该着急咧。,2,1
245121,咧,liě,动词,嘴角向两边伸展的动作,孩子咧着嘴笑，显得非常开心。,听到这个好消息，她高兴得咧开嘴笑了，露出两排洁白的牙齿。,2,1
245122,咧,liě,动词,方言中带有贬义的“说”,你别胡咧，好好说话。,你别听他瞎咧咧，那些话没一句是真的，都是胡编乱造的。,2,1
245211,噢,ō,感叹词,叹词，表示理解,噢，原来是他！,噢，我明白了你的意思，原来是这样啊！,2,1
245311,仆,pū,动词,向前跌倒,战士们前仆后继，英勇冲锋。,他在冰面上不小心滑倒，整个人向前仆倒在地。,2,1
245321,仆,pú,名词,仆人(跟‘主’相对,男仆恭敬地站在门口等候吩咐。,这位富商家里雇了好几个仆人来打理家务。,2,1
245411,膊,bó,名词,手臂,他赤膊上阵，显得干劲十足。,他举起强壮的胳膊，轻松地搬起了那个沉重的箱子。,2,1
245611,饶,ráo,形容词,富足丰盛,这片土地富饶，物产丰富。,这片土地物产丰饶，养育了世世代代的农民。,2,1
245612,饶,ráo,动词,额外添加,小贩给了她一点饶头，让她满心欢喜。,老板很慷慨，不仅给了工资，还饶了一笔奖金。,2,1
245613,饶,ráo,动词,宽恕原谅,饶他这一回，希望他能改过自新。,虽然他犯了错，但老师还是饶恕了他，给了他改过的机会。,2,1
245614,饶,ráo,连词,尽管，虽然,饶这么让着他，他还不满意。,饶是天气这么恶劣，工人们仍然坚持完成了施工任务。,2,1
245721,嗯,en,感叹词,表示疑问的语气词,嗯？你说什么？我没听清楚。,嗯？你说什么？我刚才没听清楚。,2,1
245723,嗯,en,感叹词,表示意外或不满的语气词,嗯！钢笔怎么又不出水啦？真是烦人。,嗯！没想到你竟然能解开这道数学难题。,2,1
245725,嗯,en,感叹词,表示应答的语气词,他嗯了一声，就走了。,嗯，我知道了，明天一定准时参加会议。,2,1
245812,篷,péng,名词,船只的帆。,船夫扯起篷来，准备启航。,渔船扬起白色的篷帆，缓缓驶向远方的海域。,2,1
246311,俯,fǔ,动词,低头，与“仰”相对,他俯首捡起了地上的书本。,他俯身捡起掉在地上的钢笔。,2,1
246312,俯,fǔ,动词,敬辞，用于公文书信,经过再三请求，他终于俯允了我们的提议。,俯允所请，不胜感激。,2,1
246511,蚊,wén,名词,叮咬吸血的昆虫,为了卫生，我们需要消灭蚊蝇。,夏夜蚊虫叮咬让人难以入睡。,2,1
246611,熙,xī,形容词,形容光线明亮，阳光充足的样子。,众人熙熙，热闹非凡。,清晨的阳光熙暖地照在窗台上。,2,1
246612,熙,xī,形容词,形容欢乐祥和的气氛或心情。,众人熙熙，皆为利来。,节日里到处洋溢着熙和欢乐的气氛。,2,1
246613,熙,xī,形容词,形容事业或社会繁荣发展。,历史上，熙朝（兴盛的朝代）往往伴随着文化的繁荣。,这座城市商业繁荣，百业熙盛。,2,1
246711,巷,xiàng,名词,狭窄的街道,深巷中传来阵阵犬吠声。,这条幽深的小巷里藏着许多老字号店铺。,2,1
246811,眨,zhǎ,动词,眼睛快速闭合又睁开。,她忍不住眨眼，试图看清眼前的景象。,她调皮地眨着眼睛向我示意。,2,1
246911,烛,zhú,名词,照明用的蜡制品,夜晚的火烛照亮了整个房间。,生日蛋糕上插着五支彩色蜡烛。,2,1
246912,烛,zhú,动词,用光照亮,远处的火山爆发，火光烛天，景象壮观。,真理的光芒烛照人类前进的道路。,2,1
247011,踩,cǎi,动词,用脚底接触地面或物体,走在田间小路上，当心踩坏了庄稼。,小心别踩到刚浇过水的水泥地。,2,1
247012,踩,cǎi,动词,比喻贬低或侮辱,这种人既会捧人，又会踩人。,这种恶意评价分明是在踩低别人的成就。,2,1
247112,缸,gāng,名词,制作陶器的原料,这座建筑使用了精美的缸砖装饰。,这个花瓶是用上等缸瓦烧制而成的。,2,1
247113,缸,gāng,名词,缸形容器,汽车引擎中的汽缸至关重要。,鱼缸里几条金鲤正在欢快地游动。,2,1
247221,屯,tún,动词,聚集;储存,军队在边境地区屯聚，以备不时之需。,农民们把收获的粮食屯放在谷仓里。,2,1
247222,屯,tún,动词,(军队)驻扎,驻屯部队在当地建立了临时营地。,军队在边境要地屯驻重兵防守。,2,1
247311,顷,qǐng,名词,土地面积单位，1顷等于100亩。现用市顷，1市顷约合6.6667公顷。,这片土地有两顷地那么大。,这片农田面积约有一顷，非常适合机械化耕作。,2,1
247312,顷,qǐng,名词,极短的时间；片刻。,少顷之后，他便离开了房间。,刚才还晴空万里，顷刻间就下起了倾盆大雨。,2,1
247313,顷,qǐng,副词,表示不久前的时间；刚才。,顷闻这个消息，大家都感到十分震惊。,顷闻您升任公司总经理，特此祝贺。,2,1
247411,鼎,dǐng,名词,古代三足两耳的烹煮器具,定鼎天下是历代帝王的梦想。,博物馆里陈列着商周时期的青铜鼎，工艺十分精湛。,2,1
247412,鼎,dǐng,名词,比喻帝位或政权,新王朝的建立标志着定鼎的成功。,在古代，鼎象征着王权和国家的稳定。,2,1
247911,衔,xián,动词,用嘴含着,春天来了，燕子衔泥筑巢，准备迎接新生命的到来。,这只鸟儿衔着一根树枝飞回了巢中。,1,2
247914,衔,xián,动词,相互连接,两段内容需要很好地衔接，才能让文章更加流畅。,这座桥衔接着城市的东西两个区域。,1,2
248412,钓,diào,动词,比喻用手段获取名利。,沽名钓誉的人最终只会失去别人的信任。,他整天想着如何钓取名利，失去了本心。,1,2
248511,侍,shì,动词,服侍；照料。,她细心地服侍生病的母亲，直到母亲康复。,护士们日夜侍候在重症患者的病床前。,1,2
248712,桩,zhuāng,量词,量词，用于事情,这件事成为他心中的一桩心事，始终无法放下。,这是今年公司要处理的重要事项中的第一桩。,1,2
249211,凸,tū,形容词,高出周围表面（与“凹”相对）,岩石凸出地面的部分非常显眼。,这块石头的表面非常凸起，摸起来很粗糙。,1,2
249514,聘,pìn,动词,女子出嫁,她即将出聘，家人正在为她筹备婚礼。,她出嫁时，父母为她准备了丰厚的聘礼。,1,2
249612,哺,bǔ,名词,口中咀嚼的食物,古人云：“一饭三吐哺”，形容贤者求才心切。,他嘴里含着哺，来不及咽下就急着说话。,1,2
250211,窜,cuàn,动词,无序地逃跑或乱跑（多指匪徒、敌军或动物）,那个小偷在多个城市之间流窜作案，给警方的抓捕带来了很大的困难。,战败的敌军四处流窜，企图寻找藏身之处。,1,2
250213,窜,cuàn,动词,对文字进行修改或篡改,历史记录被窜改后，人们很难还原事件的真相。,这篇文章被窜改得面目全非，失去了原意。,1,2
250312,溢,yì,形容词,过度；超出限度。,他总是喜欢用溢美之词来夸奖别人，让人听了很舒服。,他对孩子的溺爱已经溢于言表，不利于孩子的成长。,1,2
250411,舟,zhōu,名词,水上交通工具,一叶轻舟在湖面上缓缓漂荡，仿佛一幅美丽的画卷。,古人常以舟代步，泛舟湖上是一种雅致的享受。,1,2
250812,耍,shuǎ,动词,表演,他在院子里耍刀，动作十分娴熟，引来了不少围观的人。,杂技演员在舞台上耍着各种高难度的动作，观众们看得目瞪口呆。,1,2
250912,饵,ěr,名词,钓鱼时引鱼上钩的食物,钓鱼时用的鱼饵必须新鲜，否则很难吸引到鱼。,钓鱼高手知道用活蚯蚓做饵最容易上鱼。,2,1
251114,骚,sāo,形容词,轻佻；下流,她的舞姿婀娜多姿，尽显风骚，赢得了观众的阵阵掌声。,那个男人举止轻浮，言语中带着明显的骚气。,1,2
251115,骚,sāo,形容词,（方言）雄性的（家畜）,这匹骚马不停地踢踏着地面，显得非常不安分。,村里养的那头骚驴特别有力气，干农活是一把好手。,2,1
