definition_id,example_sn,example_cn,example_en,example_img
670113,1,他对这个决议持保留态度。,He has reservations about this resolution.,
670114,1,"他的藏书大部分都赠给国家图书馆了,自己只保留了一小部分","He has donated most of his book collection to the National Library, keeping only a small part for himself.",
670114,2,"有意见尽量谈出来,不要保留",Please speak frankly without reservation.,
670114,3,老师把宝贵的经验和知识毫无保留地教给学生。,The teacher has passed all of his valuable experience and knowledge on to his students without withholding anything.,
670211,1,这样做可不保险。,It's not safe to do this.,
670212,1,这样做可不保险。,It's not safe to do this.,
670213,1,"你依我的话,保险不会出错。","If you follow my advice, I can assure you nothing will go wrong.",
670311,1,你应当把事情的经过向领导报告,You should report what happened to the higher authorities.,
670311,2,大会主席报告了开会宗旨。,The chairman of the conference spoke about its purpose.,
670312,1,总结报告,summary report,
670312,2,动员报告。,mobilization speech,
670411,1,悲观失望,become pessimistic and lose heart; be disheartened,
670411,2,悲观情绪,pessimism,
670411,3,"虽然试验失败了,但他并不悲观。","Although the experiment was a failure, he did not lose heart.",
670711,1,历史背景,historical background,
670711,2,政治背景。,political background,
670712,1,历史背景,historical background,
670712,2,政治背景。,political background,
670713,1,历史背景,historical background,
670713,2,政治背景。,political background,
670714,1,"听他说话的气势,恐怕是有背景的。","Judging by his tone of voice, it would appear he has a behind-the-scenes backer.",
670911,1,有本领,be capable,
670911,2,本领高强。,excel in one's skill (or ability),
671112,1,教师和学生的比例已经达到要求。,The ratio of teachers to students meets the requirement.,
671113,1,"在所销商品中,国货的比例比较大。",Home-made goods enjoy a higher percentage in the commodities sales.,
671211,1,"有些问题已经做出决定,比如招多少学生,分多少班,等等。","Decisions have been made on some questions, such as the number of students to be enrolled and how many classes there should be.",
671311,1,不分彼此,share everything they have,
671311,2,彼此互助。,help each other,
671312,1,‘您辛苦啦!’‘彼此彼此!’。,‘You must have gone to a lot of trouble over this.’ ‘So must you!’,
671411,1,必然趋势,inexorable trend,
671411,2,胜利必然属于意志坚强的人。,Strong-willed people are bound to succeed.,
671412,1,新事物代替旧事物是历史发展的必然。,The inevitable outcome of historical development is that the new replaces the old.,
671511,1,日用必需品,daily necessities; articles for daily consumption,
671511,2,煤铁等是发展工业所必需的原料。,"Coal, iron, etc. are the fundamental raw materials necessary for industrial development.",
671611,1,开展批评和自我批评是十分必要的,It is essential to make criticisms and self-criticisms.,
671611,2,"为了集体的利益,必要时可以牺牲个人的利益。",Personal gains are to be given up in the interests of the collective when necessary.,
671711,1,"这部书虽然有缺页,毕竟是珍本。","Despite having several pages missing, this book is, when all is said and done, an extremely valuable edition.",
671811,1,避免冲突,avoid conflicts,
671811,2,"看问题要客观、全面,避免主观、片面。","One should take an objective and all-round, rather than subjective and one-sided point of view on issues.",
672011,1,编辑部,editorial department,
672011,2,编辑工作。,editing,
672211,1,辩论会,debate,
672211,2,他们为历史分期问题辩论不休。,They argued time and again over the definition of historical periods.,
672311,1,标点二十四史。,punctuate the Twenty-Four Histories,
672312,1,标点二十四史。,punctuate the Twenty-Four Histories,
672411,1,地图上有各种形式的标志,There are various kinds of marks (or signs) on the map.,
672411,2,标志。,This article signifies the extent to which its author has matured in creative writing.,
672412,1,"这条生产线的建成投产,标志着这个工厂的生产能力提高到了一个新的水平。",The completion and putting into operation of this production line signifies a new level in the productive capacity of the factory.,
672412,2,also标识,biāozhì,
672511,1,地球表面,surface of the earth,
672511,2,桌子表面的油漆锃亮。,"The table has a gleaming, painted surface.",
672512,1,"他表面上很镇静,内心却十分紧张。","He was outwardly calm, but inwardly very nervous.",
672611,1,表明态度,make known one's position; declare one's stand,
672611,2,表明决心。,declare one's determination,
672711,1,表情传意,express one's feelings and ideas,
672711,2,这个演员善于表情。,This actor knows how to perform.,
672712,1,表情严肃,look serious,
672712,2,脸上流露出兴奋的表情。,look excited,
672811,1,"他的优点,表现在许多方面。",His strengths are manifested in many respects.,
672812,1,他在工作中的表现很好。,He is doing very well in his work.,
672813,1,"此人一贯爱表现,好出风头。",This person always shows off and hogs the limelight.,
673111,1,玻璃丝,glass silk; glass fibre,
673111,2,有机玻璃。,polymethyl methacrylate; plexiglass; perspex,
673112,1,玻璃丝,glass silk; glass fibre,
673112,2,有机玻璃。,polymethyl methacrylate; plexiglass; perspex,
673411,1,不必去得太早,do not have to go there too early,
673411,2,"慢慢商议,不必着急",Deliberate on it with patience and don't worry.,
673411,3,"为这点小事苦恼,我以为大可不必。",I don't think there is need to worry about such a trifling matter.,
673511,1,接连不断,in succession,
673511,2,"不断努力,不断进步",make unceasing progress through continuous effort,
673511,3,新生事物不断涌现。,New things are constantly emerging.,
673611,1,这雨不见得下得起来,The rain may not come down.,
673611,2,"看样子,他不见得能来。",It seems that he may not come.,
673711,1,"这病不要紧,吃点ㄦ药就好","Your illness is not serious, and you will feel better after taking some medicine.",
673711,2,"路远也不要紧,我们派车送你回去。","Never mind the long distance, we will arrange for your drive back.",
673712,1,"你这么一叫不要紧,把大伙ㄦ都惊醒了。","You may think your shouting all right, but you've woken everybody up.",
673811,1,补充兵员,replenish (an army unit) to full strength; replace losses,
673811,2,补充枪支弹药,replenish firearms and ammunition,
673811,3,"对他的发言,我再做两点补充。",I have two points to add to his speech.,
673812,1,补充任务,additional tasks,
673812,2,补充教材。,supplementary teaching materials,
673911,1,忐忑不安,restless,
673911,2,坐立不安,uneasy,
673911,3,动荡不安。,in turmoil,
673912,1,"总给您添麻烦,真是不安。",I'm sorry to trouble you so often.,
674011,1,"哎呀,不得了,着火了!","Oh, how awful! Fire! Fire!",
674011,2,"万一出了岔子,那可不得了。","Should any accident happen, that would be terrible.",
674012,1,热得不得了,awfully hot,
674012,2,"她急得不得了,可又没办法。",She is extremely anxious but of no help.,
674111,1,他被大伙ㄦ笑得不好意思了。,He felt embarrassed by the laughter of the people around.,
674112,1,"虽然不大情愿,又不好意思回绝。",find it difficult to refuse though unwilling to do sth.,
674211,1,"旧地重游,不免想起往事。","In revisiting a once familiar place, one would conjure up old memories.",
674311,1,"抄抄写写看起来很容易,其实不然。","Copying a text may seem an easy job, but actually it is not the case.",
674312,1,"不然,事情不像你说的那么简单。","No, it is not as simple as what you said.",
674313,1,"快走吧,不然,就要迟到了","Hurry up, otherwise we'll be late.",
674313,2,"明天我还有点事ㄦ,不然倒可以陪你去一趟","I've got things to do tomorrow, or I might as well go with you.",
674313,3,"他晚上不是读书,就是写点ㄦ什么,再不然就是听听音乐。","In the evening, he either reads or writes, or listens to music.",
674411,1,走路不如骑车快,Walking is not as fast as riding.,
674411,2,"论手巧,大家都不如他。",Few can equal (or compare with) him in dexterity of hand.,
674511,1,先天不足,congenital defect,
674511,2,估计不足,underestimate,
674511,3,不足三千人。,"less than 3,000 people",
674512,1,不足道,not worth mentioning,
674512,2,不足为奇,not at all surprising,
674512,3,不足挂齿。,nothing to speak of,
674513,1,不足为训,not to be taken as an example,
674513,2,非团结不足图存。,(We) cannot survive unless we unite.,
674711,1,有计划、有步骤地开展工作。,Carry on the work step by step in a planned way.,
674811,1,工业部门,industrial sector,
674811,2,文教部门,cultural and educational sector,
674811,3,部门经济学(如工业经济学、农业经济学),"sectoral economics (such as industrial economics, agricultural economics)",
674811,4,"一本书要经过编辑、出版、印刷、发行等部门,然后才能跟读者见面。","Before a book is presented to its readers it must go through the departments of editing, publication, printing and distribution.",
674911,1,国家财产,state property,
674911,2,私人财产。,private property,
675111,1,采访新闻,cover a news item; gather news,
675111,2,加强图书采访工作。,step up acquisition of book titles,
675211,1,采取守势,take a defensive stance,
675211,2,采取紧急措施。,adopt emergency measures,
675212,1,采取指纹。,take or register sb.'s fingerprints,
675411,1,参考书,reference book,
675411,2,"作者写这本书,参考了几十种书刊。","To write this book, the author consulted scores of books and periodicals.",
675412,1,仅供参考。,for reference only,
675511,1,参与其事,have a hand in the matter,
675511,2,他曾参与这个规划的制订工作。,He once participated in formulating this plan.,
675511,3,also参预,cānyù,
675711,1,残疾儿童,handicapped child,
675711,2,"他的左腿没有治好,落下残疾。",His left leg was crippled as a result of medical treatment failure.,
675811,1,深感惭愧,feel deeply ashamed,
675811,2,惭愧万分。,be very much ashamed; be heartily ashamed,
676011,1,为国事操心,put one's heart and soul into state affairs,
676011,2,为儿女的事操碎了心。,go to a lot of trouble for one's children,
676211,1,算术测验,arithmetic test (or quiz),
676211,2,时事测验,current events examination,
676211,3,智力测验。,intelligence test,
676212,1,算术测验,arithmetic test (or quiz),
676212,2,时事测验,current events examination,
676212,3,智力测验。,intelligence test,
676411,1,他曾经说过这件事,He had mentioned that matter before.,
676411,2,这里曾经闹过水灾。,A flood once occurred here.,
676611,1,毫无差别,There is no difference at all.,
676611,2,缩小差别,reduce the difference,
676611,3,两者之间差别很大。,There is a world of difference between the two.,
676911,1,农产品,farm produce,
676911,2,畜产品,livestock products,
676911,3,产品出厂都要经过检验。,All the products shall be examined before they leave the factory.,
677011,1,产生矛盾,conflicts emerge,
677011,2,"在中华民族悠久的历史中,产生了许许多多可歌可泣的英雄人物。",A great multitude of laudable heroes emerged in the long Chinese history.,
677111,1,长途旅行,long trip,
677111,2,长途汽车,long-distance bus,
677111,3,长途电话。,long-distance call,
677211,1,政治常识,general knowledge of politics,
677211,2,科学常识,the ABC of science,
677211,3,生活常识。,common sense in everyday life,
677711,1,拌嘴吵架,have a quarrel,
677711,2,他俩吵了一架。,The two had a quarrel.,
677911,1,彻底改正错误,thoroughly correct one's mistakes,
677911,2,彻底改变旧作风。,make a radical change to one's working style;,
677911,3,also澈底,chèdǐ,
678011,1,沉默寡言。,taciturn,
678012,1,他沉默了一会ㄦ又继续说下去。,He continued (speaking) after a pause.,
678311,1,你说我该怎么称呼她?称呼大婶行吗?,How should I address her? Is it all right to call her aunt?,
678411,1,"他做了好事,受到老师的称赞。",His good deed earned him the teacher's praise.,
678611,1,承担义务,be obliged to do sth.,
678611,2,承担责任。,assume (bear or take) responsibility; answer for sth. one has done,
678711,1,承认错误。,admit one's mistake; acknowledge one's fault,
678811,1,承受考验,stand a test; put up with an ordeal,
678811,2,这块小薄板承受不住一百斤的重量。,This thin board won't bear the weight of 50 kg.,
678812,1,承受遗产。,inherit a legacy,
678911,1,化学成分,chemical composition,
678911,2,营养成分,nutritious ingredients,
678911,3,减轻了心里不安的成分。,alleviate one's restlessness,
678912,1,工人成分,identified as a worker,
678912,2,他的个人成分是学生。,His identity is student.,
678912,3,also成份,chéng·fèn,
679011,1,丰硕成果,great success; substantial achievements,
679011,2,劳动成果。,fruits of labour,
679111,1,成就辉煌,glorious achievement,
679111,2,巨大的成就。,great achievement,
679112,1,成就革命大业。,accomplish a great revolutionary task,
679211,1,"1949年10月1日,中华人民共和国成立。","The People's Republic of China was founded on October 1, 1949.",
679212,1,"这个论点理由很充分,能成立。",The ample arguments contained in this thesis make it tenable.,
679411,1,前年栽的果树还没有成长。,The fruit trees planted the year before last are not yet fully grown.,
679412,1,年轻的一代在茁壮成长。,The young generation is growing up sturdy and strong.,
679413,1,经济成长率,economic growth rate,
679413,2,经济成长减缓。,Economic development has slowed down.,
679511,1,文化程度,level of education; level of literacy,
679511,2,自动化程度。,level of automation,
679512,1,"天气虽冷,还没有到上冻的程度","Although the weather is cold, it is not yet freezing.",
679512,2,他的肝病已恶化到十分严重的程度。,His liver disease has advanced to an extremely serious degree.,
679611,1,工作程序,working procedure,
679611,2,会议程序。,agenda of a meeting,
679711,1,态度诚恳,sincere attitude,
679711,2,"言出肺腑,诚恳感人。","What he said was from the bottom of his heart, sincere and touching.",
679811,1,决不能让群众吃亏,We should never let the masses suffer a loss.,
679811,2,他吃了不老实的亏。,He has come to grief owing to his dishonesty.,
679812,1,"这场球赛,他们吃了经验不足的亏,否则不会输。","Their lack of experience put them at a disadvantage in the match, otherwise they would not have lost the game.",
679911,1,持续的干旱造成粮食大幅度减产,Sustained drought has substantially reduced grain output.,
679911,2,两国经济和文化的交流已经持续了一千多年。,"Economic and cultural exchange between the two countries has been going on for more than 1,000 years.",
680211,1,飞机翅膀。,wings of a plane,
680212,1,飞机翅膀。,wings of a plane,
680411,1,你的理由不充分,Your reasons are insufficient.,
680411,2,准备工作做得很充分。,Sufficient preparations have been made.,
680412,1,充分利用有利条件,make full use of favourable conditions,
680412,2,必须充分发挥群众的智慧和力量。,We must make full use of the wisdom and power of the masses.,
680511,1,眼里充满了泪水,eyes filled with tears,
680511,2,欢呼声充满了会场。,The assembly hall resounded with loud cheers.,
680512,1,充满激情,overflow with passion,
680512,2,歌声里充满着信心和力量。,songs brimming with confidence and strength; songs imbued with confidence and strength,
680611,1,内容重复,repeated content,
680611,2,这一段的意思跟第二段重复了。,This paragraph repeats the meaning of the second paragraph.,
680612,1,他把说过的话又重复了一遍。,He repeated what he had just said.,
680911,1,"看问题要根据具体的事实,不能从抽象的定义出发。",We should look at things from a factual perspective rather than an abstract definition.,
680912,1,"看问题要根据具体的事实,不能从抽象的定义出发。",We should look at things from a factual perspective rather than an abstract definition.,
681211,1,出版社,press; publishing house,
681211,2,出版物,publication,
681211,3,那部书已经出版了,That book has been published.,
681211,4,录音录像制品由音像出版单位出版。,Audio and visual products are published by specialized publishers.,
681311,1,出口伤人,speak bitingly,
681311,2,出口成章。,talk eloquently; make a polished impromptu speech,
681312,1,出口货,export goods,
681312,2,出口税。,export tax,
681313,1,出口货,export goods,
681313,2,出口税。,export tax,
681314,1,车站出口,exit of a railway or bus station,
681314,2,会场的出口。,exit of a meeting place,
681411,1,表演出色,The performance was superb.,
681411,2,他们出色地完成了任务。,They have done an extraordinary job.,
681511,1,出席代表大会,take part in a congress,
681511,2,报告出席人数。,report the number of participants,
681611,1,初级读本,primer,
681611,2,初级形式。,initial form,
681811,1,"若要人不知,除非己莫为",Whatever one does is sure to leave a trace.,
681811,2,"除非修个水库,才能更好地解决灌溉问题。",Only by building a reservoir can we resolve the issue of irrigation.,
681812,1,"上山那条道,除非他没人认识。",No one but him knows the path to the top of the mountain.,
681911,1,除夕之夜,New Year's Eve,
681911,2,除夕联欢会。,New Year's Eve party,
682011,1,处理日常事务。,handle routine work,
682012,1,依法处理,punish in accordance with law,
682012,2,处理了几个带头闹事的人。,Those who first stirred up trouble were punished.,
682013,1,处理品。,goods on sale,
682014,1,热处理。,heat treatment,
682111,1,传播花粉,pollinate,
682111,2,传播消息,propagate news,
682111,3,传播先进经验。,publicize advanced experience,
682211,1,传递消息,transmit news,
682211,2,传递信件,deliver mail,
682211,3,传递火炬。,relay a torch,
682311,1,他的不安情绪迅速传染给了在座的人。,His restlessness soon affected everyone present.,
682312,1,他的不安情绪迅速传染给了在座的人。,His restlessness soon affected everyone present.,
682411,1,"传说他家有人立功了,不知道是他弟兄俩的哪一位。","One of the two brothers of the family is said to have won a merit citation, but we do not know which one.",
682412,1,鲁班的传说,"the legend of Lu Ban, the Sage Carpenter",
682412,2,这种传说并没什么根据。,This story proved unfounded.,
682511,1,发扬艰苦朴素的优良传统,develop the fine tradition of hard work and plain living,
682511,2,传统剧目。,traditional drama or opera,
682811,1,创造性,creativity,
682811,2,创造新记录,chalk up a new record,
682811,3,劳动人民是历史的创造者。,The working people are the creators of history.,
683111,1,辞职书,letter of resignation,
683111,2,要求辞职。,ask for resignation,
683211,1,"院子里种着两棵玉兰和两棵海棠,此外还有几丛月季。",There are a few clusters of Chinese rose in the yard in addition to two magnolia and two crab-apple trees.,
683311,1,刺激食欲,whet one's appetite,
683311,2,刺激生产力的发展。,stimulate the development of productivity,
683312,1,刺激食欲,whet one's appetite,
683312,2,刺激生产力的发展。,stimulate the development of productivity,
683313,1,"多年的收藏毁于一旦,对他刺激很大。",He was terribly upset after his collection of many years was destroyed overnight.,
683411,1,次要地位,position of less importance,
683411,2,"内容是主要的,形式是次要的,形式要服从内容。",Form is subordinate to and must comply with content.,
683511,1,"临行匆忙,没能来看你",I left in such a hurry that I didn't have time to visit you.,
683511,2,"他刚放下饭碗,又匆匆忙忙地回到车间去了。","Immediately after he finished eating, he hurried back to the workshop.",
683611,1,"这条铁路全线通车,从此交通就更方便了。","Ever since the whole railway line was opened to traffic, travel has been much more convenient.",
683711,1,"由于交通事业的迅速发展,从而为城乡物资交流提供了更为有利的条件。","The transportation system has developed rapidly, thus providing better conditions for the exchange of produce between the city and the countryside.",
683811,1,"想想从前悲惨遭遇,更加感到今天生活的幸福美满","Recalling our miserable life in the past, we more keenly feel the happiness we enjoy now.",
683811,2,"从前的事ㄦ,不必再提了。",Let bygones be bygones.,
683911,1,从事革命,devote oneself to revolutionary work,
683911,2,从事文艺创作。,engage in literary and artistic creation,
683912,1,军法从事。,deal with according to military law; court-martial sb.,
684111,1,促进派,progressive; promoter of progress,
684111,2,促进工作,push ahead with the work,
684111,3,促进两国的友好合作。,promote friendship and cooperation between the two countries,
684211,1,促使发生变化,engineer changes,
684211,2,促使生产迅速发展。,press for the rapid development of production,
684511,1,"东西还存在,经检点,完好无损",A careful check shows that the goods are still there and in good condition.,
684511,2,"事情已解决,不存在任何问题。",The matter has been settled and no problem remains.,
684512,1,"存在决定意识,不是意识决定存在。","Social being determines consciousness, not vice versa.",
684611,1,错误思想,wrong thinking; mistaken idea,
684611,2,错误的结论。,wrong conclusion,
684612,1,犯错误,make a mistake; commit an error,
684612,2,改正错误。,correct a mistake,
684711,1,"计划已经订出,措施应该跟上。",The plan is in place and specific measures should be taken immediately.,
684811,1,"喊了好几声,也没有人答应。","I shouted several times, but nobody responded.",
684812,1,"他起初不肯,后来答应了。","He refused at first, but later agreed.",
684911,1,达得到,be reachable; be attainable,
684911,2,达不到,fail to live up to,
684911,3,达到目的,achieve the goal,
684911,4,达到国际水平。,measure up to international standards,
685011,1,打工仔,working man,
685011,2,暑假里打了一个月工。,work for one month during the summer vacation,
685111,1,我没跟他打过交道,I've never had any dealings with him.,
685111,2,"打交道,养牲口的经验很丰富。","He has rich experience in raising animals since he has dealt with them year in, year out.",
685211,1,打听消息,ask for information,
685211,2,打听同伴的下落。,ask about the whereabouts of one's companion,
685311,1,"路上碰见熟人,打了个招呼。",I met an acquaintance on the way and greeted him.,
685312,1,"已经给你们打过招呼,怎么还要这样干?","I already informed you, now why did you still do it in this way?",
685411,1,出手大方,be open-handed,
685411,2,"他很大方,不会计较这几个钱。","A generous man, he would not begrudge this small sum of money.",
685412,1,举止大方,have an easy manner,
685412,2,"可以大大方方的,用不着拘束。",You may relax and make yourself comfortable.,
685413,1,陈设大方,tastefully furnished,
685413,2,这种布的颜色和花样看着很大方。,The pattern and colour of this fabric are in good taste.,
685421,1,大方之家,learned man; scholar,
685421,2,贻笑大方。,incur the ridicule of experts,
685511,1,大型钢材,large steel products,
685511,2,大型歌剧,grand opera; full-length opera,
685511,3,大型比赛,championship; tournament; games,
685511,4,大型展销会。,large fair,
685711,1,还清贷款。,pay off one's loan,
685712,1,向银行贷款五十万元。,"get a bank loan of 500,000 yuan",
685811,1,周到的待遇,considerate reception; excellent service,
685811,2,冷淡的待遇。,cold shoulder,
685812,1,周到的待遇,considerate reception; excellent service,
685812,2,冷淡的待遇。,cold shoulder,
685813,1,政治待遇,political treatment,
685813,2,平等待遇。,equality,
685814,1,生活待遇,material benefits,
685814,2,待遇优厚。,high pay; treat sb. well,
685911,1,担任小组长,be a group leader,
685911,2,担任运输工作。,be responsible for transportation,
686011,1,思想单纯,unsophisticated,
686011,2,情节单纯。,simple plot,
686012,1,单纯技术观点,from a purely technical point of view,
686012,2,单纯追求数量。,put a premium on quantity alone; simply seek quantity,
686111,1,色彩单调,bland colour,
686111,2,样式单调,unvarying style,
686111,3,"只做一种游戏,未免单调。",Playing just one game is tedious.,
686211,1,单独行动,take independent action,
686211,2,"请你抽空到我这里来一下,我要单独跟你谈谈",Please take some time to come over. I want to talk with you alone.,
686211,3,"他已经能够离开师傅,单独操作了。",He is capable of working without his master and operating alone.,
686311,1,直属单位,unit under the direct jurisdiction of a higher authority,
686311,2,下属单位,subordinate unit,
686311,3,事业单位,institution,
686311,4,参加竞赛的有很多单位。,Many units participated in the competition.,
686312,1,直属单位,unit under the direct jurisdiction of a higher authority,
686312,2,下属单位,subordinate unit,
