definition_id,example_sn,example_cn,example_en,example_img
909211,2,"就要离开学校了,大家十分留恋。",We were all reluctant to leave our school.,
909311,1,合影留念,have a group picture taken as a memento,
909311,2,离京时送她一支钢笔留念。,give her a pen as a memento when she leaves Beijing,
909411,1,"留点ㄦ神,可别上当",Watch out and don't let yourself be cheated.,
909411,2,"车辆很多,过马路要留神。",Be careful when you cross a busy street.,
909511,1,流浪者,tramp; fugitive; vagrant; vagabond,
909511,2,流浪街头。,rove or roam the streets,
909611,1,流露出真情,reveal one's true feelings,
909611,2,"他的每一首诗,字里行间都流露出对祖国的热爱。",His love of the motherland is revealed between the lines of each of his poems.,
909711,1,耍流氓。,act indecently; behave like a hooligan; take liberties with women; sexually harass,
909712,1,耍流氓。,act indecently; behave like a hooligan; take liberties with women; sexually harass,
909811,1,空气流通。,air circulation,
909911,1,隆重的典礼。,grand ceremony,
910111,1,晨雾笼罩在湖面上,The lake is shrouded in morning mist.,
910111,2,朦胧的月光笼罩着原野。,The land is bathed in the dim moonlight.,
910311,1,修理炉灶,repair a kitchen range,
910311,2,炉灶。,start sth. anew,
910511,1,他画了一个人体的轮廓,He drew an outline of a human figure.,
910511,2,城楼在月光下面显出朦胧的轮廓。,The gate tower stood in vague silhouette against the moonlight.,
910512,1,"我只知道个轮廓,详情并不清楚。",I've got only a rough idea of the whole situation.,
910711,1,工人论坛,workers' tribune,
910711,2,这是最近论坛上引起激烈争论的问题。,This question has caused heated debate in the public forum recently.,
910811,1,论证会,meeting to assess the feasibility of a project,
910811,2,"经过调查论证,综合研究,确定具体措施。",work out specific measures after investigation and comprehensive analysis,
910812,1,论证会,meeting to assess the feasibility of a project,
910812,2,"经过调查论证,综合研究,确定具体措施。",work out specific measures after investigation and comprehensive analysis,
911011,1,落成典礼,inauguration ceremony,
911011,2,"大桥已经落成,日内即可正式通车。",The bridge has been completed and will be open to traffic in a few days.,
911111,1,生产计划要订得落实。,The production plan should be practicable.,
911112,1,落实政策,implement a policy,
911112,2,"要落实计划,落实措施,并层层落实责任。","It is imperative to carry out the plan, decide on the measures to be taken, and ascertain the responsibilities of each level.",
911113,1,"事情没有把握,心里总是不落实。","I just cannot set my mind at ease, since the matter is still unsettled.",
911211,1,屡次三番,again and again; time and again; over and over again; one after another,
911211,2,他们屡次创造新记录。,They chalked up one record after another.,
911311,1,履行诺言,keep one's word; fulfil (or carry out) one's promise,
911311,2,履行合同,honour a contract,
911311,3,履行手续。,go through formalities; go through a procedure,
911411,1,掠夺财物,rob someone of his property,
911411,2,经济掠夺。,economic plunder,
911511,1,略微歇一会ㄦ,I had a little rest.,
911511,2,"擦破了皮,略微流了点血。",I got a scratch and it bled a little.,
911611,1,麻痹大意。,carelessness; off one's guard,
911611,2,also痳痹,mábì,
911612,1,麻痹大意。,carelessness; off one's guard,
911612,2,also痳痹,mábì,
911711,1,浑身麻木,A numbness electrified itself through the entire body.,
911711,2,手脚麻木。,Both one's hands and feet have gone numb.,
911712,1,思想麻木。,wooden mind,
911911,1,水陆码头。,port city with a well-developed land and water transport network,
911912,1,水陆码头。,port city with a well-developed land and water transport network,
912111,1,中埋伏,fall (or walk) into an ambush,
912111,2,四面埋伏,soldiers lying in ambush in all directions,
912111,3,"把人马分做三路,两路埋伏,一路出击。","The troops were divided into three groups, with two of them lying in ambush, and one launching an attack.",
912112,1,这是一支埋伏在敌占区的别动队。,This was a special detachment hidden in the enemy-occupied area.,
912211,1,耕地被流沙埋没。,The farmland has been obliterated by drifting sand.,
912212,1,埋没人才。,stifle talent,
912311,1,"他死后,埋葬在公墓里。","After he died, his remains were buried in a cemetery.",
912312,1,埋葬旧世界。,Bury the old world.,
912611,1,慢性病,chronic disease,
912611,2,慢性中毒,slow poisoning,
912611,3,慢性痢疾。,chronic dysentery,
912711,1,漫长的岁月,during the long years,
912711,2,漫长的河流。,long river,
912911,1,蔓延滋长,develop,
912911,2,火势蔓延。,The fire is spreading.,
913011,1,忙忙碌碌,as busy as a bee,
913011,2,"为了大家的事情,他从早到晚忙碌着。",He bustles around from morning till night for the good of the public.,
913111,1,茫茫大海,vast sea,
913111,2,前途茫茫,bleak prospects,
913111,3,茫茫一片白雾。,a thick pall of fog,
913211,1,事情发生的原因和经过我都茫然。,I'm really in the dark about the cause and process of what happened.,
913212,1,茫然自失。,feel lost; be lost in a reverie,
913311,1,盲目行动,blind action,
913311,2,盲目崇拜,blind worship,
913311,3,盲目乐观。,be unrealistically optimistic,
913411,1,冒充内行,pass oneself off as an expert,
913411,2,用党参冒充人参。,pass dangshen off as ginseng,
913511,1,庄稼长得很茂盛。,The crops are doing very well.,
913512,1,财源茂盛。,plentiful financial resources,
913711,1,"他不肯去,我也没辙","He refused to go, and there is nothing I can do about it.",
913711,2,这下子可没了辙了。,Now I'm at a loss what to do next.,
913811,1,苍蝇是传染疾病的媒介。,The fly is a vector for diseases.,
913911,1,新闻媒体。,news media,
914011,1,房屋布置得很美观,The room is artistically decorated.,
914011,2,美观大方。,artistic and in good taste,
914111,1,美满姻缘,happy marriage,
914111,2,美满的生活,happy life,
914111,3,小两口ㄦ日子过得美美满满。,The young couple live a happy life.,
914211,1,美妙的歌喉,beautiful singing voice,
914211,2,美妙的诗句。,beautiful verse,
914511,1,萌芽状态。,embryonic stage,
914512,1,新型生产关系的萌芽。,initial forms of new production relations,
914611,1,猛烈的炮火,heavy shellfire,
914611,2,"这里气候寒冷,风势猛烈。",The weather here is bitterly cold with violent gusts of wind.,
914612,1,心脏猛烈地跳动着。,(Her) heart is beating furiously.,
914711,1,他对未来充满梦想。,He is full of illusions about the future.,
914712,1,他小时候梦想着当一名飞行员。,In his childhood he dreamed of being a pilot.,
914911,1,弥补缺陷,remedy a defect,
914911,2,不可弥补的损失。,irreparable loss,
915011,1,烟雾弥漫,be filled with smoke,
915011,2,乌云弥漫了天空。,The sky is covered with dark clouds.,
915011,3,also瀰漫,mímàn,
915111,1,迷惑不解。,feel puzzled; feel perplexed,
915112,1,花言巧语迷惑不了人。,Pretty words will not mislead people.,
915211,1,景色迷人。,enchanting scenery,
915411,1,"破除迷信,解放思想。",Do away with blind faith and emancipate the mind.,
915412,1,"破除迷信,解放思想。",Do away with blind faith and emancipate the mind.,
915511,1,人口密度,population density; density of the population,
915511,2,果树的密度不宜太大。,Fruit trees should not be planted too close together.,
915611,1,"用白蜡密封瓶口,以防药物受潮或挥发。",seal up the mouth of the bottle with white wax to keep the medicine from moisture or evaporation,
915612,1,密封舱,sealed cabin; airtight cabin,
915612,2,一听密封的果汁。,an airtight tin of fruit juice,
915711,1,"多问几句,免得走错路",Make some more enquiries so as not to go the wrong way.,
915711,2,"我再说明一下,免得引起误会。",Let me explain once again to avoid misunderstanding.,
915911,1,互相勉励,encourage each other,
915911,2,老师勉励同学继续努力。,The teacher urged his students to keep working hard.,
916011,1,这项工作我还能勉强坚持下来。,I can manage to go on with this work.,
916012,1,"碍着面子,勉强答应下来了。","For the sake of his face, (he) agreed reluctantly.",
916013,1,"他不去算了,不要勉强他了。",Don't force him to if he is not going.,
916014,1,"这种说法很勉强,怕站不住脚。",The argument is very unconvincing. I'm afraid that it will be untenable.,
916015,1,这点ㄦ草料勉强够牲口吃一天。,The cattle fodder is barely enough for a single day.,
916111,1,社会面貌,social mores,
916111,2,精神面貌。,mentality,
916112,1,社会面貌,social mores,
916112,2,精神面貌。,mentality,
916211,1,被面子,quilt cover,
916211,2,这件袍子的面子很好看。,The outside of the robe looks very nice.,
916212,1,爱面子,be anxious to save face; be very sensitive,
916212,2,要面子,be anxious to save one's face; be concerned about face-saving,
916212,3,你这话伤了他的面子。,What you've said has hurt his self-respect.,
916213,1,给面子,show due respect for a person's feelings,
916213,2,"碍于面子,只好答应了。","Out of consideration for his feelings, I have to agree.",
916214,1,药面子。,medicinal powder,
916311,1,这些作品生动地描绘了我国农村的新气象。,These works vividly depict the new look of the rural areas in our country.,
916511,1,蔑视困难,scorn difficulties,
916511,2,脸上流露出蔑视的神情。,reveal a contemptuous expression on one's face,
916611,1,自取灭亡。,court destruction; bring ruin upon oneself,
916711,1,民间文学,folk literature,
916711,2,民间音乐,folk music,
916711,3,这个故事多少年来一直在民间流传。,For many years the story has circulated among the people.,
916712,1,民间贸易,non-governmental trade,
916712,2,民间往来。,non-governmental contact; people-to-people exchange,
916811,1,民用航空,civil aviation,
916811,2,民用建筑,civil building,
916811,3,民用五金器材。,hardware for civilian use,
916911,1,有些动物对天气的变化非常敏感,Some animals are very sensitive to the changes in the weather.,
916911,2,"他是一个敏感的人,接受新事物很快",He is a sensitive man and accepts new things very quickly.,
916911,3,敏感的问题。,Religion has always been a sensitive issue.,
917011,1,思维敏捷,be quick in thinking; be quick-witted,
917011,2,行动敏捷。,be nimble-limbed,
917111,1,思想敏锐,have an acute mind; have a penetrating mind,
917111,2,目光敏锐,have sharp eyes; be keen-sighted,
917111,3,敏锐的洞察力。,have keen insight,
917211,1,"这话明明是他说的,怎么转眼就不认账了?",This is obviously his remark; how could he have denied it in an instant?,
917311,1,"比赛中他成绩较好,所以名次也靠前。","As he performed well in the competition, he ranked among the best.",
917411,1,"名额有限,报名从速。","Since the number of people allowed is limited, enter your name as soon as possible.",
917611,1,爱惜名誉。,treasure one's reputation,
917612,1,名誉会员,honorary member,
917612,2,名誉主席。,honorary chairman; honorary president,
917711,1,命名典礼。,naming ceremony,
917811,1,他们在暴风雨的黑夜里摸索着前进。,They nosed their way forward in a storm at night.,
917812,1,在工作中初步摸索出一些经验。,gain some experience in the work,
918211,1,模范事迹,exemplary deeds,
918211,2,模范人物。,model,
918212,1,劳动模范,model worker,
918212,2,选模范。,elect a model worker,
918311,1,模式图,ideograph,
918311,2,模式化。,patterning,
918411,1,十大建筑模型。,models of the 10 key buildings,
918711,1,一笔抹杀,be totally blotted out; write off at one stroke,
918711,2,这个事实谁也抹杀不了。,No one can deny this fact.,
918711,3,also抹煞,mǒshā,
918911,1,默默无言。,silently; without saying a word,
919011,1,谋求解决办法。,try to find a solution,
919111,1,这孩子的模样像他爸爸,The child takes after his father. or The child looks like his father.,
919111,2,"看你打扮成这模样,我几乎认不出来了。",You are beyond recognition the way you've been dressed up.,
919112,1,等了大概有半个小时模样,have waited for about half an hour,
919112,2,这个人有三十岁模样。,The man looks (to be) around thirty.,
919113,1,不像要留客人吃饭的模样,It's not likely to ask the guests to stay for the dinner.,
919113,2,"看模样,这家饭馆像是快要关张了。","Judging from its appearance, the restaurant is about to close down.",
919311,1,耳闻目睹。,what one sees and hears,
919411,1,大家的目光都投向发言者。,Everyone cast his eyes on the speaker.,
919412,1,目光炯炯。,bright eyes; flashing eyes; penetrating eyes,
919413,1,目光如豆,vision as narrow as a bean — of narrow vision; short-sighted,
919413,2,目光远大。,far-sighted; far-seeing,
919511,1,"每朵花,每棵树,每根草都沐浴在阳光里。","Every flower, every tree and every weed are bathed in the sunshine.",
919512,1,"每朵花,每棵树,每根草都沐浴在阳光里。","Every flower, every tree and every weed are bathed in the sunshine.",
919513,1,他们沐浴在青春的欢乐里。,They revelled in the joy of youth.,
919611,1,拿手好戏,one's forte,
919611,2,拿手节目,reserved number or programme,
919611,3,画山水画ㄦ他很拿手。,He's at his best in landscape painting.,
919612,1,有拿手,be positive about sth.,
919612,2,没拿手。,not so sure about sth.,
919711,1,搪瓷器具比玻璃器具经久耐用。,Enamelware stands wear and tear better than glassware.,
919811,1,人才难得,Great talents are hard to come by.,
919811,2,灵芝是非常难得的药草,Glossy ganoderma is a rare medicinal herb.,
919811,3,"他在一年之内两次打破世界纪录,这是十分难得的。",It was no mean feat for him to chalk up the world record twice in a year's time.,
919812,1,这样大的雨是很难得遇到的。,This kind of downpour is extremely rare.,
919911,1,难堪的话,annoying remarks,
919911,2,天气闷热难堪。,It was terribly hot and sultry.,
919912,1,予人难堪,out to embarrass sb.,
919912,2,"他感到有点难堪,微微涨红了脸。",His face went faintly red with embarrassment.,
920011,1,"没有经验,就难免要走弯路",Mistakes are unavoidable for someone who is inexperienced.,
920011,2,"搞新工作,困难是难免的。",You are bound to come across difficulties whenever you take on a new job.,
920111,1,"过去草都不长的盐碱地,今天能收这么多粮食,的确难能可贵。",It is admirable of them to have got such a good harvest of grain from a saline-alkali land where even grass could not survive in the past.,
920211,1,大为恼火。,be very angry,
920311,1,他是个内涵很深厚的青年。,He's a profoundly self-cultivated young man.,
920312,1,他是个内涵很深厚的青年。,He's a profoundly self-cultivated young man.,
920411,1,揭开内幕。,uncover an inside story; let the cat out of the bag,
920511,1,内在规律,inherent law,
920511,2,内在因素。,intrinsic factor,
920512,1,感情内在。,be introverted,
920611,1,"别看人不多,能量可不小。","Despite their small numbers, they can really get a lot of things done.",
920612,1,"别看人不多,能量可不小。","Despite their small numbers, they can really get a lot of things done.",
920811,1,拟定远景规划。,draft a long-term plan,
920911,1,会计年度,accounting year,
920911,2,财政年度,fiscal year,
920911,3,年度计划,annual plan,
920911,4,年度预算。,annual budget,
921211,1,蛋白质遇热会凝固。,Protein becomes solid when heated.,
921212,1,思想凝固,stubborn thought,
921212,2,凝固的目光。,fixed eyes,
921311,1,荷叶上凝聚着晶莹的露珠。,Glistening dewdrops have formed on the lotus leaves.,
921312,1,这部作品凝聚着他一生的心血。,This work is a crystallization of his life-long efforts.,
921411,1,凝视谛听。,watch and listen with rapt attention,
921611,1,"宁愿牺牲,也不退却。",Better to die than retreat.,
921711,1,"他扭转身子,向车间走去。",He turned round and headed for the workshop.,
921712,1,扭转局面,turn the tide; change the situation,
921712,2,扭转乾坤,reverse the course of events,
921712,3,必须扭转理论脱离实际的现象。,The discrepancy between theory and practice should be corrected.,
921811,1,浓厚的黑烟。,thick dark smoke,
921812,1,浓厚的地方色彩,pronounced or marked local flavour,
921812,2,浓厚的封建意识。,strong feudal ideology,
921813,1,孩子们对打乒乓球兴趣都很浓厚。,The children take a lively interest in table tennis.,
922211,1,虐待狂,sadism,
922211,2,受虐待,suffer maltreatment,
922211,3,虐待病人。,ill-treat patients,
922411,1,互相殴打,exchange blows,
922411,2,被人殴打。,be beaten,
922711,1,排斥异己,exclude outsiders; reject those who dare to differ,
922711,2,带同种电荷的物体相排斥,Two objects with the same electric charge repel each other.,
922711,3,现实主义的创作方法并不排斥艺术上的夸张。,Realism in literary creation is not necessarily at odds with artistic exaggeration.,
922811,1,排除积水,drain the excessive water,
922811,2,排除险情,get rid of a potential danger,
922811,3,"排除万难,奋勇直前。","surmount every difficulty, conquer all obstacles, and forge ahead courageously",
922911,1,排放污水,discharge sewage,
922911,2,排放瓦斯。,discharge inflammable gas from a mine,
923111,1,派遣代表团出国访问。,dispatch a delegation to visit a foreign country,
923311,1,飞机在天空盘旋,An aircraft was circling in the sky.,
923311,2,"山路曲折,游人盘旋而上",Travellers trudged up the mountain along a looping path.,
923311,3,盘旋了好久。,I've been mulling over this matter for a long time.,
923312,1,他在花房里盘旋了半天才离开。,He had dawdled in the greenhouse for a long time before he left.,
923511,1,判决书。,court verdict; court decision; court ruling,
923512,1,比赛中队员要服从裁判的判决。,In sports competition the athletes should obey the referee's decisions.,
923611,1,体积庞大,of enormous size,
923611,2,开支庞大,enormous expenditure,
923611,3,机构庞大。,cumbersome organization,
923711,1,抛弃家园,desert one's home and property,
923711,2,抛弃旧观念。,eschew outdated concepts,
923911,1,培训班,training class,
923911,2,培训业务骨干。,train core members of a business,
924011,1,培育树苗,bred tree saplings,
924011,2,"选择优良品种,进行培育","select fine strains of plants, or fine breeds of animals, for breeding",
924011,3,培育一代新人。,bring up a new generation of successors,
924111,1,配备骨干力量,staff an organization with backbone elements,
924111,2,配备三辆吉普车。,"equip (a factory, etc.) with three jeeps",
924112,1,按地形配备火力。,deploy firearms according to the terrain of a place,
924113,1,现代化的配备。,complete set of modern equipment,
924311,1,配套工程,projects that come in a complete package,
924311,2,"大中小厂,配套成龙,分工协作,提高生产水平。",Factories of all sizes are streamlined in a division of labour in order to raise productivity.,
924511,1,烹饪法,culinary art,
924511,2,擅长烹饪。,be good at cooking,
924811,1,批发部,wholesale department,
924811,2,批发价格。,wholesale price,
924911,1,批判虚无主义。,critique of nihilism,
924912,1,自我批判。,self-criticism,
925011,1,疲惫不堪。,be in a state of utter exhaustion,
925012,1,疲惫敌军。,tire out the enemy,
925311,1,胡蜂的屁股上有刺。,There is a sting in the rump of the wasp.,
925312,1,胡蜂的屁股上有刺。,There is a sting in the rump of the wasp.,
925313,1,香烟屁股,cigarette butt,
925313,2,汽车屁股冒烟了,The car is emitting fumes from its rear.,
925313,3,紧紧咬住敌人屁股不放。,closely follow the enemy's trail,
925511,1,"第一发炮弹打歪了,修正了偏差后,第二发便击中了目标。","The first cannonball was misfired, but after the deviation had been rectified, the second attempt was successful.",
925611,1,消除偏见。,eliminate bias,
925711,1,偏僻的山区,remote mountainous area,
925711,2,地点偏僻。,at an out-of-the-way location,
925811,1,"经过大家讨论,问题都解决了,他偏偏还要钻牛角尖。","The problem was solved after discussion, but he nevertheless went to the unnecessary trouble of looking further into it.",
925812,1,"星期天他来找我,偏偏我不在家。","He called on me last Sunday, but I happened to be out.",
925813,1,"别的小组都完成了定额,为什么偏偏咱们没完成?","All the other groups have achieved their production quota, why have we yet to finish?",
925911,1,片断经验,fragments of one's experiences,
925911,2,片断的社会现象。,slices of social phenomena,
925912,1,片断经验,fragments of one's experiences,
925912,2,片断的社会现象。,slices of social phenomena,
926011,1,片刻不离,not leave even for an instant,
926011,2,稍等片刻。,wait a moment,
926111,1,彩旗迎风飘扬。,Colourful flags fluttered in the wind.,
926111,2,also飘飏,piāoyáng,
926211,1,水上漂浮着几只小船,A few boats are floating on the water.,
926211,2,漂浮在我的脑海里。,"After I left the kindergarten, the children's smiles still hovered in my mind.",
926212,1,作风漂浮。,showy style of work,
926212,2,also飘浮,piāofú,
926311,1,顽强拼搏,struggle hard,
926311,2,拼搏精神,the spirit of hard struggle,
926311,3,"日夜奋战,与洪水拼搏。",battle against floods day and night,
926411,1,跟歹徒拼命。,struggle with a villain at the risk of one's life,
926412,1,拼命地工作,work with all one's might,
926412,2,拼命往山顶爬。,climb indomitably to the summit,
926511,1,交往频繁,frequent contacts,
926511,2,活动频繁。,occur frequently,
926711,1,家境贫乏。,poor family,
926712,1,内容贫乏,deficient in content,
926712,2,知识贫乏,poor in knowledge,
926712,3,生活经验贫乏。,lack life experience,
926811,1,贫困潦倒,be down and out,
926811,2,贫困的山区改变了面貌。,The previously impoverished mountain area has taken on a new look.,
926911,1,品尝鲜桃,taste a fresh peach,
926911,2,品尝名酒。,sample liquor of famous brand,
927011,1,品德高尚。,lofty moral character,
927111,1,品行端正。,be well behaved,
927211,1,道德品质。,moral character,
927212,1,江西瓷品质优良。,Chinaware made in Jiangxi is of the best quality.,
927311,1,他们在平凡的工作中做出了不平凡的成绩。,They have made extraordinary achievements in ordinary work.,
927511,1,宽阔平坦的马路。,broad and smooth road,
927611,1,平行机关。,government departments of equal rank,
927612,1,平行作业,simultaneous operation,
927612,2,平行发展。,simultaneous development,
927613,1,平行作业,simultaneous operation,
927613,2,平行发展。,simultaneous development,
927811,1,对入股资金的经济效益进行评估,assess the economic benefits of the shareholders' capital,
927811,2,定期对学校的办学水平进行评估。,make regular assessments of the educational level of the school,
927911,1,评论好坏。,comment on the good and the bad,
927912,1,发表评论。,publish a commentary,
928011,1,燕山山地和西山山地是北京天然的屏障。,The Yanshan and Xishan mountains provide natural barriers for Beijing.,
928012,1,屏障中原。,provide a protective screen for the Central Plains,
928411,1,破例放行,break a rule to let sb. pass,
928411,2,"制度要严格遵守,不能破例。",The regulations should be followed to the letter and no exceptions shall be made.,
928611,1,遭受迫害,suffer persecution; be subjected to persecution,
928611,2,迫害致死。,hound sb. to death,
929011,1,这本书已普及全国。,This book has reached every part of the country.,
929012,1,普及卫生常识,spread the elementary knowledge of health and medicine,
929012,2,在普及的基础上提高。,raise standards on the basis of popularization,
929111,1,他穿得很朴实,He was plainly dressed.,
929111,2,客厅布置得朴实而雅致。,The sitting room is decorated in a simple and elegant manner.,
929112,1,言行朴实,sincere and honest in words and deeds,
929112,2,性格朴实。,have a guileless disposition,
929113,1,演唱风格朴实,sing in an earnest style,
929113,2,作品朴实地描写了山区人民的生活。,It made a down-to-earth depiction of life in the mountain area.,
929311,1,期望这条铁路早日建成通车,It is our ardent hope that this railway will be completed and open to traffic at an early date.,
929311,2,决不辜负大家的期望。,I will never let all of you down.,
929411,1,期限很短,The time limit is rather short.,
929411,2,期限三个月,The term is three months.,
929411,3,限你五天期限,(I)'ll give you five days to get the job done,
929411,4,期限快到了。,The deadline is drawing near.,
929511,1,欺负人,bully,
929511,2,受尽欺负。,have one's fill of humiliation,
929711,1,"残垣断壁,一片凄凉。",There was something utterly dreary about these crumbling walls.,
929712,1,身世凄凉,life experience steeped in misery,
929712,2,凄凉的岁月。,years of poverty and misery,
929811,1,构思奇妙,one-of-a-kind conception,
929811,2,奇妙世界。,the wonderful world,
