rank,cihui,pinyin,ref_hanzi,ref_pinyin,pos,definition,example
56106,智残,zhìcán,,,动,智力残缺（多由大脑生理缺陷或伤残造成）,先天 智残
56106,智残,zhìcán,,,动,智力残缺（多由大脑生理缺陷或伤残造成）,为 智残 儿童献爱心 。
56107,阐扬,chǎnyáng,,,动,说明并加以宣扬,阐扬 我国政府的原则立场 。
56110,请赏,qǐngshǎng,,,动,请求给予奖赏,为立功人员 请赏
56111,存户,cúnhù,,,名,储户,
56116,溜圆,liūyuán,,,形,非常圆,眼睛瞪得 溜圆
56118,泅水,qiúshuǐ,,,动,游泳；凫水,不善 泅水
56120,山顶洞人,shāndǐngdòngrén,,,名,旧石器时代晚期的古人类，生活年代距今约一万八千年，体质特征已和现代人非常接近。其化石于1933年在北京周口店龙骨山的山顶洞穴里发现,
56122,日夕,rìxī,,,名,朝夕；日夜,日夕 相伴
56124,干打垒,gāndǎlěi,,,动,把黏土或拌匀的土、沙、石灰等填在夹板内夯实，是一种简易的筑墙方法,
56124,干打垒,gāndǎlěi,,,名,用干打垒方法筑成的墙体；也指用这种方法盖成的简易房屋,
56125,广域网,guǎngyùwǎng,,,名,由若干局域网相互连接而成的电子计算机通信网络，可分布在数十乃至数千平方公里的区域范围内,
56127,民望,mínwàng,,,名,民众的愿望,民望 所归
56128,提职,tízhí,,,动,提升职务,
56129,保甲,bǎojiǎ,,,名,旧时一种户籍编制制度。若干户编成一甲，若干甲编成一保。甲设甲长，保设保长，实行层层管制,
56130,聚赌,jùdǔ,,,动,聚在一起赌博,捣毁 聚赌 窝点
56133,失节,shījié,,,动,丧失操守、气节,失节 投敌
56133,失节,shījié,,,动,旧指妇女失去贞操,
56135,滑爽,huáshuǎng,,,形,光滑清爽,滑爽 的面料
56138,壮文,zhuàngwén,,,名,"我国壮族的文字。原为方块字,1980年进行修订，全部使用拉丁字母",
56139,启奏,qǐzòu,,,动,指向皇帝进言,启奏 皇上
56141,竹排,zhúpái,,,名,编结成排放入江河中顺流运往各地的竹材,
56141,竹排,zhúpái,,,名,竹筏,
56142,奸杀,jiānshā,,,动,奸污并杀害,
56143,洋泾浜,yángjīngbāng,,,名,洋泾浜语的简称。洋泾浜原是旧中国上海租界里的一条河名，那一带华人洋人杂处，语言混杂，流行着夹有汉语成分的英语，被称为洋泾浜语。后来语言学中也用来泛指混合语,
56144,戏路,xìlù,,,名,演员能扮演的角色类型,他的 戏路 很宽，扮演过多种角色 。
56145,保健操,bǎojiàncāo,,,名,运用中医推拿、按摩等方法编制的健身体操。如眼保健操等,
56146,套购,tàogòu,,,动,为牟取暴利，以非法手段购买国家计划控制的商品或大量购买市场上紧缺商品以及紧俏的车船票、影剧票等,
56148,七巧板,qīqiǎobǎn,,,名,一种拼板玩具。把一块正方形薄板或厚纸分割成形状不同的七小块，可以拼成各种图形,
56149,茶庄,cházhuāng,,,名,较大的茶叶商店,
56153,秉烛,bǐngzhú,,,动,拿着点燃的蜡烛（照明）；常借指夜以继日,秉烛 夜读
56153,秉烛,bǐngzhú,,,动,拿着点燃的蜡烛（照明）；常借指夜以继日,秉烛 再战
56154,寡廉鲜耻,guǎlián-xiǎnchǐ,,,,既不廉洁，又不知羞耻（鲜：少）,
56156,螺母,luómǔ,,,名,跟螺栓配套使用的有孔零件。孔内有阴螺纹，与螺栓上的阳螺纹相啮合，使被连接的两个零件或构件固定在一起,
56156,螺母,luómǔ,,,名,在工件上制作的带有内螺纹的孔,
56157,机加工,jījiāgōng,,,动,指对金属材料或非金属材料进行切削加工或压力加工,
56159,生态文明,shēngtài wénmíng,,,,人类在社会实践中创造的、体现社会发展进步的环境保护成果，包括节约能源资源和保护生态环境的产业结构、增长方式、消费模式等,
56160,公人,gōngrén,,,名,旧指官府衙门里的差役（多见于近代汉语）,
56161,丙丁,bǐngdīng,,,名,火的代称。古代以天干配五行，丙丁属火，故称,付之 丙丁
56164,网具,wǎngjù,,,名,渔网和附在网上的浮子、沉子等各种用具,
56165,雾腾腾,wùténgténg,,,形,形容烟雾或水蒸气等升腾的样子,锅炉房里 雾腾腾 的 。
56166,行李车,xínglichē,,,名,旅客列车中专门装载托运行李的车厢,
56166,行李车,xínglichē,,,名,旅行时随身携带的用以拖拉行李的折叠小车,
56169,出梅,chūméi,,,动,指梅雨季节结束,
56170,进献,jìnxiàn,,,动,向长辈或上级奉献,进献 厚礼
56171,屡败屡战,lǚbài-lǚzhàn,,,,虽然连遭失败，但仍坚持战斗。形容不怕挫折，顽强不屈,
56172,妄语,wàngyǔ,,,名,轻率的话；胡乱说的话,
56173,管控,guǎnkòng,,,动,管理并控制；管制①,利用电视监视系统实行交通 管控
56173,管控,guǎnkòng,,,动,管理并控制；管制①,严加 管控
56174,朱漆,zhūqī,,,名,红色的漆,大门上涂着 朱漆
56177,人海战术,rénhǎi zhànshù,,,,指单纯依靠大量兵力作战的战术；泛指不讲科学，一味依靠人多去干的工作方法,
56179,剃度,tìdù,,,动,佛教指给要出家的人剃去头发，使成为僧尼,
56182,铁索桥,tiěsuǒqiáo,,,名,在若干条承重钢绳或铁链上铺设桥面的桥梁,
56184,人行横道,rénxíng héngdào,,,,供行人安全穿过马路的横道。一般用白色斑马线作标记,
56185,尘缘,chényuán,,,名,佛教、道教指人跟世俗社会的因缘,尘缘 未了
56185,尘缘,chényuán,,,名,佛教、道教指人跟世俗社会的因缘,斩断 尘缘
56186,实木,shímù,,,区别,用木头制成的,实木 书柜
56188,活钱,huóqián,,,名,现钱；流动资金,手里总得有些 活钱 ，花起来方便
56188,活钱,huóqián,,,名,现钱；流动资金,做买卖哪能没有一点 儿 活钱 。
56188,活钱,huóqián,,,名,固定收入以外的收入,除正常上班外，他还要去挣点 儿 活钱 贴补家用 。
56190,悬吊,xuándiào,,,动,悬挂,门前 悬吊 着宫灯
56193,夜明珠,yèmíngzhū,,,名,传说在黑暗中能放光的宝珠,
56194,饴糖,yítáng,,,名,以含有淀粉的物质为原料，经糖化和加工制成的糖。含有麦芽糖、葡萄糖等，味甜爽口，用于制作糖果等,
56195,好人家,hǎorénjiā,,,名,清白、正经的人家,他是 好人家 的孩子，有教养 。
56195,好人家,hǎorénjiā,,,名,生活条件好的人家,嫁个 好人家 ，好好过日子 。
56196,鸣炮,míngpào,,,动,放礼炮,
56197,显摆,xiǎnbai,,,动,炫耀,刚学了几句英语，就 显摆 起来了!
56201,入列,rùliè,,,动,（迟到者或出列者）进入队列,
56202,贴钱,tiēqián,,,动,贴补钱款,他每月都靠父母 贴钱 过日子 。
56202,贴钱,tiēqián,,,动,赔本,贴钱 买卖
56206,违拗,wéi'ào,,,动,故意不依从，闹别扭,他对妈妈的话不敢 违拗 。
56208,贴标签,tiēbiāoqiān,,,,比喻评论人或事时不作具体分析，而生硬地套用现成的概念或作简单归类,具体情况要具体分析，不能 贴标签 。
56209,湘绣,xiāngxiù,,,名,我国四大名绣之一，以湖南长沙、宁乡等地为中心产地的刺绣,
56210,瘟病,wēnbìng,,,名,中医对各种急性发热疾病的统称,
56211,作死,zuòsǐ,,,动,自己找死,大冷天你穿这么点 儿 衣服， 作死 啊?
56212,合子,hézi,,,名,北方流行的一种在面片 儿 中夹馅 儿 烙成的饼 猪肉韭菜馅 儿 合子 ,
56213,斧凿,fǔzáo,,,名,斧子和凿子；泛指工具,今凭 斧凿 度余年
56213,斧凿,fǔzáo,,,动,用斧子和凿子雕琢加工；比喻对文学艺术作品过分雕琢,刻意 斧凿
56213,斧凿,fǔzáo,,,动,用斧子和凿子雕琢加工；比喻对文学艺术作品过分雕琢,毫无 斧凿 痕迹
56214,制动器,zhìdòngqì,,,名,使运行中的机器减速或停止运行的装置,
56215,雄蕊,xióngruǐ,,,名,被子植物的花的重要组成部分。一般由花丝和花药组成。花药膨大，呈囊状，位于花丝顶端，花药囊内产生花粉,
56218,油香,yóuxiang,,,名,我国伊斯兰教的一种食品。温水和面，加少量盐，制成饼状，用油炸熟,
56219,序数,xùshù,,,名,表示次序的数。汉语序数通常由数词前加“第”构成，如“第一” “第七” “第十三”。序数后边直接跟量词或名词时，可以省去“第”，如“二层” “三组” “四号”等。还有习惯表示法，如“末一节” “头一天” “老大” “老二”等,
56220,品头论足,pǐntóu-lùnzú,,,,评头品足,
56221,奢谈,shētán,,,动,侈谈①,
56222,相夫教子,xiàngfū-jiàozǐ,,,,帮助丈夫，教育子女,
56223,稀里哗啦,xīlihuālā,,,拟声,模拟雨声或物体倒塌的声音,大雨 稀里哗啦 地下了整整一夜 。
56223,稀里哗啦,xīlihuālā,,,形,形容零落、四散的样子,敌军被打得 稀里哗啦 。
56225,脑电波,nǎodiànbō,,,名,脑内活动所产生的电效应。用电子仪器放大后，可在纸带上画出波状条纹，也可用示波器加以显示。据以诊断脑部疾病，或进行有关思维活动的研究,
56226,叠放,diéfàng,,,动,一层压一层地放置,
56228,雌雄异株,cíxióngyìzhū,,,,具有单性花的植物，雌花和雄花分别生在不同植株上。如柳树、银杏树等,
56230,委任状,wěirènzhuàng,,,名,正式委任职务时发给的证书,
56232,吹风机,chuīfēngjī,,,名,鼓风机；特指用于把头发吹干定型的小型吹风电器,
56233,丰歉,fēngqiàn,,,名,丰收和歉收；丰年和歉年,关心农业的 丰歉
56233,丰歉,fēngqiàn,,,名,丰收和歉收；丰年和歉年,合理储存粮食，以调剂 丰歉 。
56234,醒酒,xǐngjiǔ,,,动,解酒，使由醉而醒,
56237,声强,shēngqiáng,,,名,声音的强弱。指单位时间内通过垂直于声波传播方向的单位面积的能量。单位为瓦/米2。旧称音强,
56238,垛子,duǒzi,,,名,墙上向外或向上凸出的部分,墙 垛子
56239,兼课,jiānkè,,,动,本职之外兼任授课工作,
56240,外来户,wàiláihù,,,名,从外地搬迁到本地的住户,
56241,修竹,xiūzhú,,,名,长长的竹子,茂林 修竹
56242,阴平,yīnpíng,,,名,"汉语调类。普通话阴平读高平调，调值是55,调号是“-”",
56243,器量,qìliàng,,,,现在一般写作“气量”,
56244,千分点,qiānfēndiǎn,,,名,统计学用来计量两个千分数之差的单位。每个千分之一为一个千分点,去年营业额比前年增长72‰；今年比去年增长75‰，提高了3个 千分点 。
56245,风钻,fēngzuàn,,,名,凿岩机,
56246,汲汲,jíjí,,,形,形容心情迫切,汲汲 以求
56246,汲汲,jíjí,,,动,急切追求,不 汲汲 于名利
56247,歌吟,gēyín,,,动,歌唱和吟咏,
56248,茶桌,cházhuō,,,名,供饮茶时摆放茶具的桌子,
56251,援用,yuányòng,,,动,引用,援用 成例
56253,茫然若失,mángrán-ruòshī,,,,精神恍惚，好像失掉了什么的样子,
56254,装蒜,zhuāngsuàn,,,动,装糊涂；故意装出某种腔调和姿态,不懂就别 装蒜 !
56256,飞絮,fēixù,,,名,飘飞的柳絮、花絮等,飞絮 满天
56258,僻远,pìyuǎn,,,形,偏僻边远,僻远 的山区
56259,吃斋,chīzhāi,,,动,吃素,
56259,吃斋,chīzhāi,,,动,僧尼吃饭,
56260,电钻,diànzuàn,,,名,用电驱动的钻孔机具,
56261,外脑,wàinǎo,,,名,比喻可以借助的外部人才,何不聘用几个 外脑 一起来攻关?
56262,贫油,pínyóu,,,动,指缺乏石油资源,贫油 国家
56263,瀛海,yínghǎi,,,名,大海,
56265,初民,chūmín,,,名,原始社会的人,远古 初民 的岩画显示出他们对美的追求 。
56266,催眠曲,cuīmiánqǔ,,,名,促使婴儿入睡的歌曲或乐曲,
56268,高糖,gāotáng,,,区别,含糖分较高的,高糖 食物
56269,怠惰,dàiduò,,,形,懒惰,怠惰 成性
56274,拨转,bōzhuǎn,,,动,掉转,拨转 船头
56276,风卷残云,fēngjuǎn-cányún,,,,大风吹走残留的云片。比喻在极短的时间内消灭干净,我军以 风卷残云 之势全歼敌军 。
56277,福尔马林,fú'ěrmǎlín,,,名,英语 formalin 音译 含40%甲醛的水溶液，用作消毒或防腐剂,
56279,画舫,huàfǎng,,,名,装饰华丽的游船,
56281,普天同庆,pǔtiān-tóngqìng,,,,全国或全世界的人共同庆祝,新春佳节， 普天同庆 。
56282,血印,xuèyìn,,,名,血的印迹,手上有一道 血印
56283,腹稿,fùgǎo,,,名,动笔写作前，心里构思的草稿（古人认为心是思维的器官，用腹指心）,先打好 腹稿 ，然后一气呵成 。
56284,卡口,qiǎkǒu,,,名,用来卡住另一物体以起连接作用的构件,卡口 灯头
56286,守敌,shǒudí,,,名,据守的敌人,全歼 守敌
56287,咂摸,zāmo,,,动,仔细品味；琢磨,咂摸 滋味
56288,频次,píncì,,,名,指在一定时间、一定范围内某种事物、情况反复出现的次数,
56289,灯油,dēngyóu,,,名,点油灯用的油,
56292,跑光,pǎoguāng,,,动,感光纸、胶片等感光材料因封闭不严而感光,
56294,劳而无功,láo'érwúgōng,,,,付出辛劳，却没成效,
56297,被头,bèitóu,,,名,被子上缝在盖上半身那一端的布,把 被头 拆下来洗洗 。
56299,概观,gàiguān,,,动,大略地观察,概观 事件发生的前前后后 。
56299,概观,gàiguān,,,名,概况（多用于书名）,《非洲 概观 》
56299,概观,gàiguān,,,名,概况（多用于书名）,《中国画 概观 》
56303,红装,hóngzhuāng,,,名,女子的盛装,红装 素裹
56303,红装,hóngzhuāng,,,名,女子的盛装,不爱 红装 爱武装
56303,红装,hóngzhuāng,,,名,借指年轻女性,
56305,奠基石,diànjīshí,,,名,奠定建筑物基础的石头；特指大型建筑物开工典礼时埋在地下作为奠基标志的石头，上面记载着奠基的年、月、日等,
56305,奠基石,diànjīshí,,,名,比喻使事物产生、发展的稳固根基,鲁迅的《狂人日记》是中国现代小说的 奠基石 。
56306,从征,cóngzhēng,,,动,应征,从征 入伍
56306,从征,cóngzhēng,,,动,随军出征,从征 十数载
56307,果胶,guǒjiāo,,,名,存在于植物果实细胞间质中的无定形胶状物质。溶于水，可用以制果酱、果冻 儿 等食品,
56312,统招,tǒngzhāo,,,动,统一招收（学生、工人等）,
56313,肥皂剧,féizàojù,,,名,指一种题材轻松活泼、每集篇幅短小的电视连续剧。因早期在播放这类电视剧时常插播肥皂商的广告，故称,
56314,软件包,ruǎnjiànbāo,,,名,具有相互联系和特定功能的程序集合。是计算机厂家为满足用户需要而提供的程序系统。包括操作系统、汇编系统、编译系统等的各种子程序和应用程序,
56319,噤若寒蝉,jìnruòhánchán,,,,像深秋的蝉一样不再鸣叫。形容因害怕而不敢说话,
56320,火炭,huǒtàn,,,名,烧得通红的木炭,
56323,烟幕弹,yānmùdàn,,,名,爆炸后能造成烟雾的炮弹或炸弹,
56323,烟幕弹,yānmùdàn,,,名,比喻掩饰真相或某种企图的言行,政治 烟幕弹
56324,内陷,nèixiàn,,,动,向内凹陷,自得病后，他脸部肌肉 内陷 ，消瘦了许多 。
56324,内陷,nèixiàn,,,名,中医学上指邪盛正虚，正不胜邪而导致邪气内侵的病变。症状是高烧、烦躁、惊厥等,
56327,既而,jì'ér,,,连,表示前文所说的情况过去不久,开始老师独唱， 既而 学生跟着合唱 。
56330,馊主意,sōuzhǔyi,,,名,无用的、不高明的主意,
56331,打通关,dǎtōngguān,,,,原指宴席上一个人跟在座的人逐一划拳喝酒；比喻在系统性工作中对每一项都很熟练,教高中数学他能 打通关 了 。
56332,大黄鱼,dàhuángyú,,,名,黄鱼的一种。鳞小，背部灰黄色，鳍黄色。是我国重要的经济鱼类，现多为人工养殖,
56333,骑术,qíshù,,,名,骑马的技术,精通 骑术
56335,宴饮,yànyǐn,,,动,设酒宴聚饮,宴饮 宾客
56338,蜂鸟,fēngniǎo,,,名,鸟，大的像燕子，小的像黄蜂，羽毛艳丽，嘴细长。取食花蜜和花上的昆虫。主要产于南美洲和中美洲,
56343,船龄,chuánlíng,,,名,船只已使用的年数,这艘船的 船龄 已有10年 。
56344,名讳,mínghuì,,,名,旧指尊长或所尊敬的人的名字。因不宜直呼，故称,敢问先生 名讳 ?
56345,面片儿,miànpiànr,,,名,用面粉加水制成的片状食品，煮熟后连汤吃,
56346,咸蛋,xiándàn,,,名,用盐腌制的蛋,
56347,喜糖,xǐtáng,,,名,结婚时请人吃的糖果,
56348,倒错,dàocuò,,,形,颠倒错乱,精神分裂导致行为 倒错 。
56351,招录,zhāolù,,,动,招收录用,严格考核，公正 招录 。
56352,行频,hángpín,,,名,指电视系统中，每秒钟在水平方向来回扫描的次数,
56355,闺阁,guīgé,,,名,闺房,
56358,到了儿,dàoliǎor,,,副,到最后,这件事， 到了儿 他也没说清楚 。
56359,肠断,chángduàn,,,动,断肠,
56360,肝肠寸断,gāncháng-cùnduàn,,,,形容悲痛到了极点,
56362,整点,zhěngdiǎn,,,动,整理清点,整点 人马
56362,整点,zhěngdiǎn,,,名,标准时钟上分针指向“12”时的时间,整点 新闻
56363,立方体,lìfāngtǐ,,,名,各面均为正方形的平行六面体,
56365,海碗,hǎiwǎn,,,名,特别大的碗,
56366,劳军,láojūn,,,动,慰劳军队官兵,
56367,主词,zhǔcí,,,名,逻辑学上指判断的对象。如“太阳是恒星”这个命题中的“太阳”是主词,
56368,风门,fēngmén,,,名,为挡风在原有的房门外加设的一道门,
56368,风门,fēngmén,,,名,矿井中为挡风在巷道中安设的门,
56368,风门,fēngmén,,,名,牢房门上的通风口,
56371,乘隙,chéngxì,,,副,利用空子；抓住机会,乘隙 潜逃
56371,乘隙,chéngxì,,,副,利用空子；抓住机会,乘隙 攻入一球
56375,幅面,fúmiàn,,,名,布帛等纺织品的宽度,
56377,孔道,kǒngdào,,,名,两地来往必须经过的道路；通道,新建的大桥是沟通南北的 孔道
56377,孔道,kǒngdào,,,名,两地来往必须经过的道路；通道,开辟两国文化交流的 孔道 。
56377,孔道,kǒngdào,,,名,物体内部的管状空隙,蛀虫的侵蚀使木柱形成许多 孔道 。
56378,月宫,yuègōng,,,名,神话指月中宫殿，是嫦娥居住的地方；借指月亮,
56379,望楼,wànglóu,,,名,用于瞭望的楼,临江建一 望楼
56380,工读学校,gōngdú xuéxiào,,,,对有较轻违法犯罪行为的未成年人进行改造、挽救和教育的学校,
56381,香艳,xiāngyàn,,,形,（花草）芳香艳丽,香艳 的玫瑰
56381,香艳,xiāngyàn,,,形,形容女子妖媚,香艳 女郎
56381,香艳,xiāngyàn,,,形,形容词藻艳丽、内容涉及闺阁或色情的诗文,香艳 诗
56383,休止符,xiūzhǐfú,,,名,乐谱中表示乐音停顿时间长短的符号,
56384,赏罚分明,shǎngfá-fēnmíng,,,,该赏的就赏，该罚的就罚，态度鲜明,
56385,马蹄形,mǎtíxíng,,,名,像马蹄的形状，即U字形或三面构成U字形、另一面为直线的形状（ᗜ）,
56386,内阁制,nèigézhì,,,名,内阁（中央政府）由议会产生并对议会负责的政权组织形式。18世纪初始于英国，后逐步为某些国家采用,
56387,腮腺炎,sāixiànyán,,,名,腮腺急性发炎，症状为发热，一侧或两侧腮腺肿大、疼痛。多发生于儿童,
56388,比丘尼,bǐqiūní,,,名,梵语 Bhikṣuṇī 音译 佛教指尼姑,
56389,内陆湖,nèilùhú,,,名,大陆内部不通海洋的湖，湖水含盐分较多。如我国的青海湖,
56390,供应点,gōngyìngdiǎn,,,名,提供所需某种物资的网点，一般规模较小,液化气 供应点
56391,死亡证,sǐwángzhèng,,,名,医疗部门开具的证明某人已死亡的证书,
56392,母畜,mǔchù,,,名,雌性牲畜。畜牧业上通常指有生殖能力的雌性牲畜,
56393,偏斜,piānxié,,,形,倾斜不正,塔身 偏斜
56397,解套,jiětào,,,动,解开绳套；比喻识破圈套,
56397,解套,jiětào,,,动,指在股市行情上涨时，抛售被套牢的股票,
56399,火炽,huǒchì,,,形,像火一样炽烈。比喻旺盛、热烈,火炽 的场面
56400,过街天桥,guòjiē tiānqiáo,,,,在城市交通要道上空架设的供行人横穿马路的桥,
56402,撒种,sǎzhǒng,,,动,把种子撒在田地里,
56403,肉汁,ròuzhī,,,名,用肉类煮成的汤汁,
56405,落地签证,luòdì qiānzhèng,,,,给持有护照的外国人在其入境前几天或入境当时办理签证手续。是一种特殊的签证办理方式,
56406,养廉,yǎnglián,,,动,培养或保持廉洁的品格,勤政 养廉
56407,积少成多,jīshǎo-chéngduō,,,,一点一滴地长时间积累，就能由少变多,
56409,死胎,sǐtāi,,,名,死在母腹中的胎儿,
56410,若何,ruòhé,,,代,如何；怎样,前景 若何 ，尚难预料 。
56411,傍黑儿,bànghēir,,,名,黄昏；傍晚,他 傍黑儿 就来了，当时路灯还没亮 。
56412,涡流,wōliú,,,名,形成漩涡流动的流体,
56412,涡流,wōliú,,,名,实心的导体在交变磁场中由于电磁感应所产生的涡旋形电流。涡流能消耗电能、使导体发热,
56413,床榻,chuángtà,,,名,床①,
56415,不谓,bùwèi,,,动,不能说（用在表示否定的语词之前）,照料 不谓 不周
56415,不谓,bùwèi,,,动,没有料想到,不谓 亲友亦不知情
56415,不谓,bùwèi,,,动,没有料想到,不谓 又有相见之期 。
56417,酒兴,jiǔxìng,,,名,喝酒的兴致,行令以助 酒兴
56419,罚酒,fájiǔ,,,动,酒宴上让违约的人喝酒,罚酒 三杯
56419,罚酒,fájiǔ,,,名,所罚的酒,敬酒不吃吃 罚酒
56421,辅修,fǔxiū,,,动,指大学生在主修本专业以外，利用课余时间学习另一专业，所得学分达到要求，即可获得辅修专业学位,
56422,生僻,shēngpì,,,形,生疏的；少见的（词语、文字等）,生僻 字词
56422,生僻,shēngpì,,,形,生疏的；少见的（词语、文字等）,用典 生僻
56423,地线,dìxiàn,,,名,各种电器和地相接并利用地作电流回路的导线,接好 地线 ，预防触电 。
56425,创业板市场,chuàngyèbǎn shìchǎng,,,,指专为暂时无法上市的中小型高科技新兴企业提供融资途径和成长空间的证券交易市场,
56427,货殖,huòzhí,,,动,古代指经营货物生产和交换以营利,
56427,货殖,huòzhí,,,名,古代指经商的人。如《史记》中有《货殖列传》,
56428,诚招,chéngzhāo,,,动,诚聘；诚恳地招租、招工,
56429,马快,mǎkuài,,,名,旧时衙门里骑马侦查、追捕罪犯的差役,
56431,征发,zhēngfā,,,动,旧指官府征集民间的人力、物力,
56435,春荒,chūnhuāng,,,名,春天青黄不接时出现的饥荒,闹 春荒
56435,春荒,chūnhuāng,,,名,春天青黄不接时出现的饥荒,春荒 时借下的债
56437,抽风,chōufēng,,,动,中枢神经系统受刺激，引起肌肉痉挛、口眼歪斜等,
56437,抽风,chōufēng,,,动,比喻做事不近情理（常用于骂人或表示不满）,大冬天只穿件衬衣，你抽什么风?
56437,抽风,chōufēng,,,动,用一定装置把空气抽出去或吸进来,抽风 机
56439,尿酸,niàosuān,,,名,有机酸，白色结晶，呈弱酸性。人和某些动物的尿、粪中含有少量的尿酸。可用来制造药品和其他化学制品,
56441,尊号,zūnhào,,,名,对皇帝、皇后尊崇的称号。如唐明皇的尊号是开元神武皇帝,
56441,尊号,zūnhào,,,名,敬词，用于称对方的名字或店铺名,请问先生 尊号
56441,尊号,zūnhào,,,名,敬词，用于称对方的名字或店铺名,尊号 生意不错呀
56442,长话短说,chánghuà-duǎnshuō,,,,用简短的话来叙说本来需用很多话才能说清的事,
56443,相术,xiàngshù,,,名,通过观察相貌、体态、气色、手纹等推测人的吉凶祸福，据以预言命运的方术，带迷信色彩,
56444,玄乎,xuánhu,,,形,虚幻不实；捉摸不透,他越说越 玄乎 ，没人信 。
56445,苋菜,xiàncài,,,名,一年生草本植物，茎细长，叶子椭圆形，茎叶暗紫色或绿色。可以食用,
56446,泡子,pāozi,,,名,某些地区指小型湖泊,
56450,染坊,rǎnfáng,,,名,给丝绸、布匹、衣服等染色的作坊,
56452,冠盖,guāngài,,,名,古指官员的冠服和车盖,冠盖 如云
56452,冠盖,guāngài,,,名,〈文〉借指官吏,冠盖 满京华
56453,黄雀,huángquè,,,名,鸟，体长约12厘米，雄鸟上体浅黄绿色，有黑色羽冠；雌鸟上体微黄，有暗褐色条纹，无黑色羽冠。以植物种子、幼芽和昆虫等为食。鸣声清脆悦耳，可供观赏,
56454,稳如泰山,wěnrútàishān,,,,像泰山一样稳固。形容情势或地位不可动摇,
56457,史评,shǐpíng,,,名,评述历史或史书的著作,
56459,响雷,xiǎngléi,,,名,声音响亮的雷,
56460,遗墨,yímò,,,名,死者遗留下来的文稿、字画、书札等,
56463,译述,yìshù,,,动,用一种语言把另一种语言某段话的意思叙述出来,译述 歌词大意
56465,空竹,kōngzhú,,,名,一种玩具。用竹木或塑料制成，中间为短轴，两端或一端装有带小孔的轮形盒子。用绳子转动短轴，使其迅速旋转，发出嗡嗡的响声,
56466,晋剧,jìnjù,,,名,地方戏曲剧种，流行于山西、内蒙古和冀北、陕北等地,
56467,巡防,xúnfáng,,,动,巡逻防卫；巡查防范,加强 巡防
56467,巡防,xúnfáng,,,动,巡逻防卫；巡查防范,巡防 江堤
56467,巡防,xúnfáng,,,动,巡视边防,连夜 巡防
56469,灰浆,huījiāng,,,名,用来粉刷墙壁的浆，由石灰、水泥或青灰等加水搅拌而成,
56469,灰浆,huījiāng,,,名,砂浆,
56473,布帛,bùbó,,,名,棉、麻、丝等纺织品的统称,
56474,测检,cèjiǎn,,,动,检测,
56475,雄花,xiónghuā,,,名,只有雄蕊的单性花,
56480,囫囵吞枣,húlún-tūnzǎo,,,,比喻不经过分析辨别，照原样笼统地接受,
56482,两肋插刀,liǎnglèi-chādāo,,,,形容重情义，为朋友敢于承担风险或作出牺牲,
56483,钦慕,qīnmù,,,动,钦佩敬慕,令人 钦慕
