rank,cihui,pinyin,ref_hanzi,ref_pinyin,pos,definition,example
57234,清凉油,qīngliángyóu,,,名,一种膏状外用药物，用薄荷油、樟脑、桂皮油、桉叶油等加石蜡制成。对暑热头昏、伤风头痛、蚊虫叮咬、轻微烫伤等都有一定的缓解作用。俗称万金油,
57235,学生装,xuéshengzhuāng,,,名,一种服装样式，上身有三个没有盖 儿 的口袋 儿 ，直领，下身是西式长裤，旧时多为学生的制服。现时各校可自行设计式样,
57236,灌溉渠,guàngàiqú,,,名,引水灌溉农田的较大的人工渠道,
57238,忠顺,zhōngshùn,,,形,忠实顺从,表面 忠顺 ，暗怀鬼胎 。
57240,箱笼,xiānglǒng,,,名,盛衣物的箱状器具,
57241,孤峰,gūfēng,,,名,独立高耸的山峰,孤峰 独秀
57244,化学键,huàxuéjiàn,,,名,分子或晶体中两个或多个原子之间强烈的相互吸引作用。在化学结构式中用横线（—）表示,
57245,打比方,dǎbǐfang,,,,用比喻的方法说明事物,你的话我明白，用不着 打比方 了 。
57247,丝绵,sīmián,,,名,用蚕茧表面的浮丝为原料整理而成的像棉絮的东西。轻柔，保暖性好，可以絮衣服、被子等,
57248,话里有话,huàli-yǒuhuà,,,,话语中隐含有另外的意思,
57249,塞翁失马,sàiwēng-shīmǎ,,,,《淮南子·人间训》中说：住在边塞的一位老人丢了一匹马，人们都来安慰他，他说：“怎么知道就不是福呢?”后来，这匹马果然带着一匹好马回来了。后用“塞翁失马”比喻坏事也可能变为好事,
57250,洗三,xǐsān,,,动,给出生三天的婴儿洗澡,
57251,牵引力,qiānyǐnlì,,,名,机车、拖拉机、机动船只等运输工具的动力部分所产生的拖动能力,
57252,荧光粉,yíngguāngfěn,,,名,一种受光或受其他射线照射时能发出可见光的粉状物质,
57253,调虎离山,diàohǔ-líshān,,,,诱使老虎离开自己在山中的巢穴。比喻运用计策，使对方离开所在地，以便己方乘机行事,
57258,二进宫,èrjìngōng,,,名,京剧传统剧目之一；谑指第二次被拘留或进监狱,
57259,尾追,wěizhuī,,,动,跟在后面追赶,尾追 不放
57261,软磁盘,ruǎncípán,,,名,以聚脂塑料为基底材料的磁盘。不固定在电子计算机内，可以随时存取。简称软盘,
57262,权欲,quányù,,,名,对权力的欲望（含贬义）,别让 权欲 吞噬了良心 。
57267,晒台,shàitái,,,名,建造在屋顶上供乘凉、晒衣物等用的露天小平台,
57270,赤化,chìhuà,,,动,共产党以红色为象征，解放前统治者称受共产党的影响为赤化,
57271,中辍,zhōngchuò,,,动,中途停止,突发的变故使他不得不 中辍 研究 。
57272,雄起,xióngqǐ,,,动,强有力地崛起,振奋国威， 雄起 民魂 。
57273,爽气,shuǎngqì,,,名,凉爽的天气,
57273,爽气,shuǎngqì,,,形,爽快②,办事不 爽气
57274,咫尺天涯,zhǐchǐ-tiānyá,,,,虽然近在咫尺，却如同远在天边。多形容相隔很近却难以相见,
57275,吃眼前亏,chīyǎnqiánkuī,,,,当时就受到损失、伤害,好汉不 吃眼前亏
57278,发僵,fājiāng,,,动,变得僵硬,两手冻得 发僵
57279,引港,yǐngǎng,,,动,领港①,
57279,引港,yǐngǎng,,,名,领港②,
57280,外强中干,wàiqiáng-zhōnggān,,,,从外表看似乎很强大，其实内里很空虚（干：空虚）,
57281,敌害,díhài,,,名,能造成危害的事物（多用于动植物）,稻田养殖要严防蛇、鼠等 敌害 。
57283,熟门熟路,shúmén-shúlù,,,,指对某地很熟悉；也指对某事物非常了解,
57285,明日黄花,míngrì-huánghuā,,,,宋·苏轼《九日次韵王巩》：“相逢不用忙归去，明日黄花蝶也愁。”意思是过了重阳节的菊花即将枯萎，没有什么观赏价值了。后用“明日黄花”比喻过时的事物 ,
57286,故交,gùjiāo,,,名,老朋友,多年 故交
57289,名誉扫地,míngyù-sǎodì,,,,名誉完全丧失（扫地：比喻声誉、威信等完全丧失）,
57291,白班,báibān,,,名,白天工作的班次,
57295,夭亡,yāowáng,,,动,夭折①,
57297,遗毒,yídú,,,名,历史遗留下来的有害的思想、风气等,消除封建迷信的 遗毒 。
57299,党规,dǎngguī,,,名,政党的规章制度,
57302,审察,shěnchá,,,动,仔细观察,审察 作案现场
57303,辟邪,bìxié,,,名,古代传说中能降妖除邪的神兽，像鹿而有长尾,
57303,辟邪,bìxié,,,动,避免或驱除邪祟,据说，重阳节是万物 辟邪 求吉祥的日子 。
57304,补液,bǔyè,,,动,输液,
57304,补液,bǔyè,,,名,对身体有滋补作用的饮料,参茸 补液
57306,勾通,gōutōng,,,动,勾结串通,恶势力相互 勾通 ，扰乱社会治安 。
57307,脱色,tuōsè,,,动,褪色（shǎi）；掉色（shǎi）,
57307,脱色,tuōsè,,,动,用化学药品去掉物品原来的颜色,脱色 剂
57309,火柱,huǒzhù,,,名,像柱子一样的火焰,
57310,反目成仇,fǎnmù-chéngchóu,,,,翻脸成为仇人,何必为这么点 儿 小事 反目成仇 呢?
57312,秋凉,qiūliáng,,,名,秋季凉爽的天气,一到 秋凉 ，他的腿就开始疼痛 。
57313,立账,lìzhàng,,,动,设立账册以记载钱物收支等事项,
57314,立姿,lìzī,,,名,站立的姿势,用 立姿 射击
57316,倒运,dǎoyùn,,,动,把货物从甲地转运到乙地,
57316,倒运,dǎoyùn,,,动,把货物从甲地运到乙地出卖，又从乙地往甲地贩运其他货物,在两省之间 倒运 土特产 。
57316,倒运,dǎoyùn,,,形,〈口〉运气不好；倒霉,我这几年真 倒运 ，卖什么都赔本 儿 。
57321,释读,shìdú,,,动,解读；考证并解释（古文字等）,甲骨文 释读
57323,电椅,diànyǐ,,,名,某些国家使用的一种执行死刑的刑具，装有高压电极，形状像椅子,
57326,气逆,qìnì,,,动,中医指脏腑之气上冲而不顺,胸闷 气逆
57328,断口,duànkǒu,,,名,金属加工中指金属断裂后的破断面。观察断口可以分析出破断原因，确定防止断裂的措施,
57328,断口,duànkǒu,,,名,矿物学上指矿物单晶体或集合体在外力打击下不依一定结晶方向破裂而形成的断开面,
57329,鸟粪,niǎofèn,,,名,鸟的粪便；特指成群海鸟长期栖息地所堆积的鸟类粪便。是良好的肥料,
57330,滞缓,zhìhuǎn,,,形,停滞不前；缓慢,上游洪水迅猛，下游泄洪 滞缓 。
57330,滞缓,zhìhuǎn,,,动,延缓,滞缓 了发展速度
57331,燧石,suìshí,,,名,一种硅质沉积岩。呈暗灰色或褐黑色，产于石灰岩中，坚硬致密。用两块燧石擦击，可以取火。俗称火石,
57332,土墩,tǔdūn,,,名,小土堆,坐在 土墩 上
57333,衬裤,chènkù,,,名,穿在里面的贴身单裤,
57336,沉雄,chénxióng,,,形,深沉而雄浑（多指诗文或书法的风格、气势）,文章气韵 沉雄
57338,泡馍,pàomó,,,名,我国西北地区的一种饭食。先将面饼掰碎，放入调料，再用滚开的羊肉汤或牛肉汤来泡,
57339,圆滚滚,yuángǔngǔn,,,形,形容球状物很圆的样子,圆滚滚 的大西瓜
57341,蠢笨,chǔnbèn,,,形,愚蠢,头脑 蠢笨
57341,蠢笨,chǔnbèn,,,形,不灵便；笨拙,这辆车样子 蠢笨
57341,蠢笨,chǔnbèn,,,形,不灵便；笨拙,蠢笨 的双手
57342,漫道,màndào,,,连,连接分句，表示让步关系，相当于“不要说”,漫道 是长江，就是大海，我们也能跨越过去 。
57347,假死,jiǎsǐ,,,动,生命功能极度衰微，外表上好像已经死亡。表现为四肢冰冷，脸色苍白，呼吸、脉搏、心跳不易测到等。多由溺水、中毒、脑出血、电击、脑震荡等引起。婴儿初生，有的由于肺未张开，也有假死现象。如能及时抢救，大多可以复苏,
57347,假死,jiǎsǐ,,,动,某些动物遇到危险时，为了保护自己，装作死的样子,
57348,阑干,lángān,,,形,〈文〉纵横交错；参差错落,涕泗 阑干
57348,阑干,lángān,,,形,〈文〉纵横交错；参差错落,星斗 阑干
57349,金瓯,jīn'ōu,,,名,盛酒的金属器皿。《南史·朱异传》：“我国家犹若金瓯，无一伤缺。”后用“金瓯”比喻完整的国土；泛指国土 金瓯 无缺,
57350,东郭,dōngguō,,,名,复姓,
57351,回门,huímén,,,动,女子出嫁不久，在规定的时日内，偕同丈夫一起回娘家探亲,
57352,反义词,fǎnyìcí,,,名,意义相反或相对的词。如“生”和“死”、“左”和“右”,
57353,核讹诈,hé'ézhà,,,动,倚仗核武器的优势对别国进行威胁恫吓（hè）,
57355,自然段,zìránduàn,,,名,文章中由一定书面形式反映出的段落,
57356,西葫芦,xīhúlu,,,名,一年生草本植物，茎蔓生，叶子略呈三角形。果实也叫西葫芦，长圆筒形，深绿色间黄褐色，是常见蔬菜,
57358,硅藻,guīzǎo,,,名,藻类植物，藻体一般为单细胞，有时集成群体。分布在淡水、海水和湿土中，是鱼类和无脊椎动物的食物,
57359,令亲,lìngqīn,,,名,敬词，用于称对方的亲属,
57360,劳什子,láoshízi,,,名,指令人讨厌的东西,快把这些 劳什子 扔掉!
57361,等份,děngfèn,,,名,数量或大小相同的若干份 儿 把东西分成五个 等份,
57362,孤雁,gūyàn,,,名,离群而孤单的大雁,孤雁 哀鸣
57364,知法犯法,zhīfǎ-fànfǎ,,,,明知应遵守有关法律、规章，却故意违犯,他身为法官，竟然 知法犯法 。
57366,热门货,rèménhuò,,,名,畅销的货物,
57367,满堂彩,mǎntángcǎi,,,,全场一致的喝彩声,
57370,压痛,yātòng,,,名,医学上指身体的某一部位在手轻按时产生疼痛或异常感觉的症状。有压痛感的部位常是病变所在,
57371,死力,sǐlì,,,名,死劲 儿 ① 死劲 儿 ②,
57372,美术片,měishùpiàn,,,名,用动画、木偶、剪纸等美术手段表现故事情节的影视片,
57377,花饰,huāshì,,,名,用于装饰的花纹或物品,古朴的 花饰
57377,花饰,huāshì,,,名,用于装饰的花纹或物品,头戴 花饰 ，下穿羽裙 。
57378,常备军,chángbèijūn,,,名,国家平时保持的现役正规军队,
57379,勃朗宁,bólǎngníng,,,名,英语 Browning 音译 由美国人勃朗宁设计的手枪。能单发，也能连发,
57380,壁灯,bìdēng,,,名,安装在墙壁上的灯,
57381,喜雨,xǐyǔ,,,名,久旱时下的雨；及时雨,
57382,死牢,sǐláo,,,名,关押死囚的牢房,打入 死牢
57383,电子眼,diànzǐyǎn,,,名,电视自动监控摄像器的通称。现已在交通、治安、环境保护、工业生产等方面广泛应用,
57385,旱魔,hànmó,,,名,指严重的旱灾,
57386,见礼,jiànlǐ,,,动,相见行礼（多见于近代汉语）,大嫂请来 见礼
57387,斜井,xiéjǐng,,,名,连接地面和地下巷道的倾斜的井筒。用于运输、通风、排水等,
57388,油膏,yóugāo,,,名,油质的黏稠糊状物,
57389,亲故,qīngù,,,名,亲戚和老朋友,怀念 亲故
57390,储层,chǔcéng,,,名,储藏石油或天然气的岩层,探测到有开采价值的油气 储层 。
57391,边寨,biānzhài,,,名,边疆地区的村寨,
57392,反作用力,fǎnzuòyònglì,,,名,承受作用力的物体对施力物体的作用力。反作用力与作用力大小相等，方向相反,
57393,黄毛丫头,huángmáo yātou,,,,年少幼稚的女孩 儿 （含轻视或谐谑意）,
57395,穹窿,qiónglóng,,,,现在一般写作“穹隆”,
57397,耳提面命,ěrtí-miànmìng,,,,不仅当面指点，而且提着耳朵叮咛。形容对人教诲殷切（多用于长辈对晚辈）,
57398,移动电视,yídòng diànshì,,,,可以在移动状态下接收音像信号并播放音像的电视，多安装在交通工具上,
57399,抓耳挠腮,zhuā'ěr-náosāi,,,,形容焦急无奈的样子,
57399,抓耳挠腮,zhuā'ěr-náosāi,,,,形容高兴得不知所措的样子,
57400,技穷,jìqióng,,,动,技能用尽或本领使完（再也无能为力）,黔驴 技穷
57400,技穷,jìqióng,,,动,技能用尽或本领使完（再也无能为力）,自感 技穷
57401,山盟海誓,shānméng-hǎishì,,,,海誓山盟,
57402,不足挂齿,bùzú-guàchǐ,,,,不值得挂在嘴边。形容不值一提,
57403,网上书店,wǎngshàng shūdiàn,,,,通过电子计算机网络销售图书的虚拟书店,
57404,伶人,língrén,,,名,古代指演奏音乐的人；也指戏曲演员,
57405,文绉绉,wénzhòuzhòu,,,形,形容人言语、行动斯文的样子,他说话慢条斯理， 文绉绉 的 。
57406,怒潮,nùcháo,,,名,涌潮②,
57406,怒潮,nùcháo,,,名,比喻大规模的群众反抗运动,抗日 怒潮 席卷全国 。
57409,赌具,dǔjù,,,名,赌博用具。如赌博时使用的纸牌、麻将牌、色（shǎi）子等,
57410,冰柱,bīngzhù,,,名,屋檐或水的出口处滴水冻结成的柱状冰,
57413,拱卫,gǒngwèi,,,动,围绕在四周护卫着,绿水环绕，群峰 拱卫
57413,拱卫,gǒngwèi,,,动,围绕在四周护卫着,众星 拱卫 北辰
57414,枯骨,kūgǔ,,,名,干枯的死人骨头,古墓 枯骨
57415,火烧火燎,huǒshāo-huǒliǎo,,,,形容身上热得难受或心中非常焦急,
57418,万人坑,wànrénkēng,,,名,指（敌人或统治者大规模屠杀百姓后）胡乱掩埋尸体的大坑,
57423,劝止,quànzhǐ,,,动,通过劝说使人停止（某种活动）,这种愚蠢的行为终于被 劝止 了 。
57425,岁暮,suìmù,,,名,一年将尽时；比喻年老,年终 岁暮
57425,岁暮,suìmù,,,名,一年将尽时；比喻年老,已届 岁暮 之年
57427,汽灯,qìdēng,,,名,一种利用特定装置的白热照明灯。把煤油变为蒸气，喷射到浸有硝酸钍溶液的纱罩上燃烧发光,
57428,眼眉,yǎnméi,,,名,眉毛,
57429,为虎作伥,wèihǔ-zuòchāng,,,,比喻自愿充当坏人的爪牙，帮助做坏事（伥：传说中帮助老虎吃人的鬼）,
57432,遥指,yáozhǐ,,,动,向远处指点,牧童 遥指 杏花村
57434,劝勉,quànmiǎn,,,动,劝说并勉励,老师 劝勉 大家努力学习 。
57435,上半夜,shàngbànyè,,,名,前半夜,
57436,设岗,shègǎng,,,动,布置岗哨,机场周围已经 设岗 。
57436,设岗,shègǎng,,,动,设置工作岗位,不能因人 设岗
57439,振振有辞,zhènzhèn-yǒucí,,,,现在一般写作“振振有词”,
57440,马掌,mǎzhǎng,,,名,马蹄下部的角质皮,
57440,马掌,mǎzhǎng,,,名,马蹄铁①的通称,
57441,评头品足,píngtóu-pǐnzú,,,,本指对妇女的容貌体态说长道短。现泛指对人对事说长道短，责难挑剔,
57442,衣帽间,yīmàojiān,,,名,公共活动场所专设的存放衣帽的房间,
57445,钓竿,diàogān,,,名,钓鱼虾等用的竿子,
57446,包青天,bāoqīngtiān,,,名,包公,
57451,愚忠,yúzhōng,,,名,不问是非的盲目的效忠思想,为臣只有一片 愚忠 。
57451,愚忠,yúzhōng,,,动,不问是非盲目地效忠,愚忠 于皇权
57454,机织,jīzhī,,,区别,用机器编织的,机织 毛衣
57455,口出狂言,kǒuchū-kuángyán,,,,说出狂妄的话,
57456,踏歌,tàgē,,,动,我国古代的一种歌舞，以脚踏地形成节拍，边歌边舞。现在苗、瑶等民族仍有这种歌舞,纵情 踏歌
57457,乳牛,rǔniú,,,名,奶牛,
57460,丁宁,dīngníng,,,,现在规范词形写作“ 叮咛 ”,
57461,保护色,bǎohùsè,,,名,某些动物身上具有的跟周围环境相似的颜色。它能使自身不容易被发觉，起到自我保护作用,
57461,保护色,bǎohùsè,,,名,比喻一种伪装,他假装积极，给自己涂上一层 保护色 。
57463,奖售,jiǎngshòu,,,动,作为奖励而售给某种紧缺物资,过去对超额完成粮食征购任务的农户 奖售 平价化肥 。
57464,怀春,huáichūn,,,动,（少女）春心萌动，爱恋异性,情窦初开，少女 怀春 。
57465,怪才,guàicái,,,名,性情、思想古怪却很有才干的人,他被称为文坛 怪才 。
57466,鼓槌,gǔchuí,,,名,打鼓用的棒。接触鼓面的一头较粗或为球形,
57467,混交林,hùnjiāolín,,,名,两种或两种以上的树木混生在一起的森林,
57468,马口铁,mǎkǒutiě,,,名,镀锡的薄铁，不易生锈，多用于制作罐头盒等。最初从西藏阿里马口地区输入内地，故称,
57469,裹脚,guǒjiǎo,,,动,缠足,
57469,裹脚,guǒjiǎo,,,名,裹脚布,
57470,禀明,bǐngmíng,,,动,向上级或长辈说明情况,禀明 事情原委
57471,台步,táibù,,,名,戏曲演员、时装模特等在舞台上表演时所走的带有艺术性的步法,
57472,愣怔,lèngzheng,,,动,神情发呆,听到一声凄厉的叫声，他猛一 愣怔 ，停下了脚步 。
57474,整饰,zhěngshì,,,动,整理修饰,校园 整饰 一新
57475,大礼拜,dàlǐbài,,,名,每两周休息一天，休息的那天叫大礼拜,
57475,大礼拜,dàlǐbài,,,名,在普遍实行每周五个工作日制度之前，有的单位单周休息一天，双周休息两天。休息两天的那周叫大礼拜,
57476,重檐,chóngyán,,,名,双层的屋檐,
57477,榜眼,bǎngyǎn,,,名,明清两代科举殿试考取的一甲（第一等）第二名,
57478,送风,sòngfēng,,,动,输送新鲜空气或暖风、凉风,送风 机
57478,送风,sòngfēng,,,动,输送新鲜空气或暖风、凉风,空调器开始 送风 了 。
57480,诱奸,yòujiān,,,动,诱使某人与自己发生性关系（尤指比自己年龄小的）,
57481,谬种,miùzhǒng,,,名,荒谬错误的言论观点,谬种 流传
57481,谬种,miùzhǒng,,,名,不吉利的人或事物；坏东西,
57482,归政,guīzhèng,,,动,交还权力,维新派要求慈禧太后 归政 于光绪皇帝 。
57483,表记,biǎojì,,,名,赠给别人的信物或纪念品,
57484,土性,tǔxìng,,,名,土壤给植物提供生长环境的性能。如湿度、黏度、酸碱度等,
57485,旱路,hànlù,,,名,陆路,
57486,略图,lüètú,,,名,简略的图形,针灸穴位 略图
57488,秋景,qiūjǐng,,,名,秋天大自然的风光景色,欣赏美丽的 秋景
57488,秋景,qiūjǐng,,,名,秋天农作物的收成,
57492,抛射,pāoshè,,,动,向着目标射出或掷出,左手 抛射 进篮
57493,獐子,zhāngzi,,,名,哺乳动物，像鹿而小，没有角，雄的犬齿发达，形成獠牙。行动灵敏，善跳跃，能游泳。属国家保护动物,
57494,天崩地裂,tiānbēng-dìliè,,,,天崩塌，地开裂。比喻巨大的灾难或强烈的声响,
57495,天葬,tiānzàng,,,动,一种丧葬方式。某些民族或宗教信徒处理死人遗体时，把尸体抬到葬场或旷野，让鹰鹫、乌鸦等啄食，以食尽为吉祥,
57497,晒场,shàicháng,,,名,晒谷物的场地,
57498,浮油,fúyóu,,,名,漂浮在水、汤上面的食用油,这碗羊肉汤 浮油 太多 。
57498,浮油,fúyóu,,,名,漂浮在海上的石油,清除海洋上的 浮油 。
57499,观风,guānfēng,,,动,〈文〉观察民俗风情,观风 问俗
57499,观风,guānfēng,,,动,观察动静以便相机行事,两个战士在门外 观风 ，其余的人冲了进去 。
57501,抽咽,chōuyè,,,动,抽搭,
57502,行方便,xíngfāngbian,,,,为别人提供便利,多给人家 行方便 ，少给人家添麻烦 。
57503,文不对题,wénbùduìtí,,,,文章或话语的内容与题目或主旨不相符合；也指答非所问,
57504,无机可乘,wújī-kěchéng,,,,没有机会可以利用或没有空子可钻,
57505,平头百姓,píngtóu bǎixìng,,,,指没有担任官职的普通老百姓,
57506,唾沫星子,tuòmo xīngzi,,,,细小的唾液珠子,
57507,奇趣,qíqù,,,名,奇妙的情趣,奇趣 万端
57508,甜润,tiánrùn,,,形,（声音）甜美圆润；（空气）新鲜湿润,歌声 甜润
57508,甜润,tiánrùn,,,形,（声音）甜美圆润；（空气）新鲜湿润,空气清新而 甜润
57509,蝉蜕,chántuì,,,名,蝉的幼虫变为成虫时蜕下的外皮，可以做药材,
57509,蝉蜕,chántuì,,,动,〈文〉比喻脱身,
57514,俨如,yǎnrú,,,动,十分像,远眺普陀山， 俨如 仙境 。
57515,谷草,gǔcǎo,,,名,谷子去穗后的秸秆，可做饲料,
57516,官帽,guānmào,,,名,旧时官吏戴的可以表明身份的帽子,
57516,官帽,guānmào,,,名,借指官职,宁可不要 官帽 ，也不能丧失人格 。
57518,倾国倾城,qīngguó-qīngchéng,,,,倾城倾国,
57519,语病,yǔbìng,,,名,语言运用中的毛病。常见的如词性误用、语序不当、词语搭配不当、句式杂糅、成分多余或残缺等,
57520,派款,pàikuǎn,,,动,上级强制性地让下属单位或个人分担钱款,
57521,浸没,jìnmò,,,动,淹没,附近五个村庄都 浸没 在洪水中 。
57521,浸没,jìnmò,,,动,沉浸②,山村 浸没 在丰收的喜悦之中 。
57522,板鸭,bǎnyā,,,名,屠宰后，经盐渍并压成扁平形状再风干的鸭子,
57523,卑污,bēiwū,,,形,（品行、思想）卑劣肮脏,卑污 的灵魂
57524,挟制,xiézhì,,,动,倚仗势力或抓住对方的弱点，强迫对方服从自己,他总想 挟制 别人
57525,日心说,rìxīnshuō,,,名,古代天文学上的一种学说，认为太阳是宇宙的中心，地球和其他行星都围绕太阳运转。古希腊天文学家阿里斯塔克在公元前3世纪首先提出，波兰天文学家哥白尼在16世纪作了系统的理论论述（跟“地心说”相区别）,
57526,内在美,nèizàiměi,,,名,指心灵美，即高尚的思想、道德修养和美好的气质等,
57527,移行,yíháng,,,动,移动行列；特指用拼音文字或汉语拼音字母书写或排版时，一个词在上行末安排不下，按一定规则分拆一部分字母移至下行之首,
57528,争宠,zhēngchǒng,,,动,争着取得某人的宠爱,
57530,搜剿,sōujiǎo,,,动,搜寻剿灭,搜剿 残匪
57532,此路不通,cǐlù-bùtōng,,,,这条路走不通。比喻事情行不通,
57533,鸭绒,yāróng,,,名,加工过的鸭𣭲（rǒng）毛，保温性能强 鸭绒 大衣,
57534,上颚,shàng'è,,,名,某些节肢动物摄取食物的第一对器官，由头部的一对附肢变成，为咀嚼的利器,
57534,上颚,shàng'è,,,名,腭,
57535,整纪,zhěngjì,,,动,整顿纪律,
57536,抽水站,chōushuǐzhàn,,,名,扬水站,
57536,抽水站,chōushuǐzhàn,,,名,管理扬水设施的单位,
57538,司售人员,sī-shòu rényuán,,,,司机和售票员,
57542,伶牙俐齿,língyá-lìchǐ,,,,口齿灵活乖巧。形容口才好,
57544,国际私法,guójì sīfǎ,,,,调整涉外民事法律关系的法规的统称,
57545,例假,lìjià,,,名,按常规放的假，如五一劳动节、国庆节等,
57545,例假,lìjià,,,名,婉词，指月经或月经期,
57546,城市病,chéngshìbìng,,,名,指因城市规模急剧膨胀、人口激增而引起的供水不足、环境污染、交通阻塞、住房紧张等一系列弊病,
57549,愚顽,yúwán,,,形,愚昧而顽固,愚顽 不灵
57549,愚顽,yúwán,,,名,愚昧顽固的人,化导 愚顽
57550,仰靠,yǎngkào,,,动,仰面背靠着（某物）,仰靠 在沙发上休息一会 儿 。
57550,仰靠,yǎngkào,,,动,仰仗依靠,要自立自强，不要一味 仰靠 别人 。
57552,卵生,luǎnshēng,,,区别,动物的受精卵在母体外吸取卵中营养，经孵化发育而成新个体。绝大多数鱼类、两栖类、爬行类、鸟类都是卵生（跟“胎生” “卵胎生”相区别）,
57556,奖旗,jiǎngqí,,,名,为奖励而发给的锦旗,
57558,签单,qiāndān,,,动,购物、用餐等消费后在账单上签字，表示承认这笔费用,饭费由我 签单
57558,签单,qiāndān,,,名,用来签字的单据,在 签单 上签名
57559,缓兵之计,huǎnbīngzhījì,,,,延缓对方进攻的计策；也指设法拖延时间，使紧急态势缓和，以便设法对付的策略,
57560,箭楼,jiànlóu,,,名,城门上的楼，有瞭望孔和射箭孔,
57561,如胶似漆,rújiāo-sìqī,,,,像胶和漆那样粘在一起，难以分开。形容感情深厚，不能分离（多用于恋人及夫妻之间）,
57562,虫情,chóngqíng,,,名,农作物、林木等害虫潜伏、发生和为害的情况,今年的 虫情 比较严重 。
57563,不倒翁,bùdǎowēng,,,名,玩具，外形像老头 儿 ，上轻下重，扳倒后能自己立起来；比喻处世圆滑，在任何情况下都能站住脚的人,
57564,有头有尾,yǒutóu-yǒuwěi,,,,有开头也有结尾。表示做事坚持到底或事物完整无缺,
57565,重出江湖,chóngchū-jiānghú,,,,指某些有一定知名度的公众人物（如政坛、文艺界、体育界人士等）在其工作的领域里隐退了一段时期后，又重新出现（含谐谑意）,他因病停赛两年后，今年夏季又 重出江湖 。
57566,打入冷宫,dǎrù-lěnggōng,,,,旧小说、戏剧中指帝王把不喜欢的后妃软禁起来。比喻把不喜欢的人或东西闲置起来不予理睬,
57570,孔孟之道,kǒngmèngzhīdào,,,,以孔子、孟子为代表的儒家思想和理论体系,
57572,掩耳盗铃,yǎn'ěr-dàolíng,,,,捂住耳朵去偷铃。比喻自己欺骗自己,
57575,藕断丝连,ǒuduàn-sīlián,,,,藕折断后丝还连着。比喻断绝了关系后，感情上还有牵连,
57576,遣词造句,qiǎncí-zàojù,,,,在作文或讲话时选择和运用词语组成句子,
57577,楚河汉界,chǔhé-hànjiè,,,,楚王项羽、汉王刘邦争战中双方控制区域的界河（即鸿沟）。比喻界限分明、关系对立或不相来往；也借指象棋,拆除人为设定的 楚河汉界 ，促进商品流通
57577,楚河汉界,chǔhé-hànjiè,,,,楚王项羽、汉王刘邦争战中双方控制区域的界河（即鸿沟）。比喻界限分明、关系对立或不相来往；也借指象棋,不到10岁的他，已在 楚河汉界 里拼杀5年了 。
57578,岬角,jiǎjiǎo,,,名,伸向海中的陆地尖角。如非洲南端的好望角、山东半岛的成山角等,
57579,私吞,sītūn,,,动,私下占有；私自侵吞,私吞 公款
57580,婚娶,hūnqǔ,,,动,指男女结婚,
57581,下款,xiàkuǎn,,,名,书画作品的作者、信件或礼物等发送者的署名和标出的时间等,
57586,判词,pàncí,,,名,旧指判决书,
57586,判词,pàncí,,,名,对是非、优劣等所作的判定性结论,不敢妄下 判词
